gameId,fname,scene,row,engChrName,engSearchText,engHtmlText,jpnChrName,jpnSearchText,jpnHtmlText,opName,pcIconHtml,evoIconHtml
11,c0800,1,1,,,,オスロ,ある程度他の街区などの状況も警察やＭＫ社の方に 教えてもらえましたが……,ある程度他の街区などの状況も警察やＭＫ社の方に<br/>教えてもらえましたが……,,,
11,c0800,1,2,,,,オスロ,やはり弊社も顧客もほとんどが止まっていて…… 組織だって対応は出来なさそうですね。,やはり弊社も顧客もほとんどが止まっていて……<br/>組織だって対応は出来なさそうですね。,,,
11,c0800,1,3,,,,オスロ,とはいえ、私が動ける以上は私に責任が あるのだという捉え方もできます。,とはいえ、私が動ける以上は私に責任が<br/>あるのだという捉え方もできます。,,,
11,c0800,1,4,,,,オスロ,終息後に円滑に対応できるよう……今のうちに 最低限、損害を見積もっておかないと……,終息後に円滑に対応できるよう……今のうちに<br/>最低限、損害を見積もっておかないと……,,,
11,c0800,1,5,,,,オスロ,ある程度外が落ち着いたのは 助かりましたが……,ある程度外が落ち着いたのは<br/>助かりましたが……,,,
11,c0800,1,6,,,,オスロ,会社や、顧客企業の方は 大丈夫でしょうか……？,会社や、顧客企業の方は<br/>大丈夫でしょうか……？,,,
11,c0800,1,7,,,,オスロ,一刻も早く安否を確認して、 事後の損害対策をしないといけないのに……,一刻も早く安否を確認して、<br/>事後の損害対策をしないといけないのに……,,,
11,c0800,1,8,,,,オスロ,記念祭は、経済的な影響や今後の商業施設の 事業展開が参考になるものですが……,記念祭は、経済的な影響や今後の商業施設の<br/>事業展開が参考になるものですが……,,,
11,c0800,1,9,,,,オスロ,まあ、私も今日くらいは息抜きをしましょうか。 客の立場でこそ見えるものもあるでしょうし。,まあ、私も今日くらいは息抜きをしましょうか。<br/>客の立場でこそ見えるものもあるでしょうし。,,,
11,c0800,1,10,,,,オスロ,もっとも、息抜きと思って酷い目に 遭った事もありますし……,もっとも、息抜きと思って酷い目に<br/>遭った事もありますし……,,,
11,c0800,1,11,,,,オスロ,羽目は外し過ぎないようにしないとですがね。,羽目は外し過ぎないようにしないとですがね。,,,
11,c0800,1,12,,,,オスロ,おや貴方は……！　先程はどうも。,おや貴方は……！　先程はどうも。,,,
11,c0800,1,13,,,,オスロ,導力ネットの件でお世話になった あの少年にも、よろしくお伝え下さいね。,導力ネットの件でお世話になった<br/>あの少年にも、よろしくお伝え下さいね。,,,
11,c0800,1,14,,,,オスロ,そういえば聞くところによると……私が 学校を出てから音楽文化も随分変わったとか。,そういえば聞くところによると……私が<br/>学校を出てから音楽文化も随分変わったとか。,,,
11,c0800,1,15,,,,オスロ,アイドルにロックにシンガーソングライター。 どれも私の時は聞いた事のないものです。,アイドルにロックにシンガーソングライター。<br/>どれも私の時は聞いた事のないものです。,,,
11,c0800,1,16,,,,オスロ,やや気後れしますが、青春の広範をことごとく 勉学と仕事に費やしてきましたし……,やや気後れしますが、青春の広範をことごとく<br/>勉学と仕事に費やしてきましたし……,,,
11,c0800,1,17,,,,オスロ,今になって若者の音楽に触れてみるのも 刺激にはなるかもしれませんね。,今になって若者の音楽に触れてみるのも<br/>刺激にはなるかもしれませんね。,,,
11,c0800,1,18,,,,オスロ,ゴッチ監督の映画は……まあ、セクシーなのが かえって嫌な記憶を思い出させるので……,ゴッチ監督の映画は……まあ、セクシーなのが<br/>かえって嫌な記憶を思い出させるので……,,,
11,c0800,1,19,,,,オスロ,非常事態宣言が解除され、記念祭も迎えられると なると経済活動も活発化するでしょう。,非常事態宣言が解除され、記念祭も迎えられると<br/>なると経済活動も活発化するでしょう。,,,
11,c0800,1,20,,,,オスロ,それを受けて事業を拡大する業者もいます、 ここがコンサルタントの頑張りどころです。,それを受けて事業を拡大する業者もいます、<br/>ここがコンサルタントの頑張りどころです。,,,
11,c0800,1,21,,,,オスロ,記念祭もマーケティング調査のためには これ以上に無い舞台と言えますしね。,記念祭もマーケティング調査のためには<br/>これ以上に無い舞台と言えますしね。,,,
11,c0800,1,22,,,,オスロ,当分は前向きな仕事も増えて忙しく なるとは思いますが……,当分は前向きな仕事も増えて忙しく<br/>なるとは思いますが……,,,
11,c0800,1,23,,,,オスロ,ふう……やっぱり娯楽は欲しいですね。 あの手のサイトは懲りましたが……,ふう……やっぱり娯楽は欲しいですね。<br/>あの手のサイトは懲りましたが……,,,
11,c0800,1,24,,,,オスロ,何か他に良い物は無いものか……,何か他に良い物は無いものか……,,,
11,c0800,1,25,,,,オスロ,やはりこの状況だと例のプロジェクトは…… いえ、投資が冷え込むのも無理ないですよ。,やはりこの状況だと例のプロジェクトは……<br/>いえ、投資が冷え込むのも無理ないですよ。,,,
11,c0800,1,26,,,,オスロ,私どもとしても心が痛む限りですが…… 何か御社のお力になれる事が他にもあれば。,私どもとしても心が痛む限りですが……<br/>何か御社のお力になれる事が他にもあれば。,,,
11,c0800,1,27,,,,オスロ,今後の投資の消極化を見据えての事業進行など、 私どもが提示できることはまだございますので……,今後の投資の消極化を見据えての事業進行など、<br/>私どもが提示できることはまだございますので……,,,
11,c0800,1,28,,,,オスロ,会社の端末であんなサイトを見た挙句、詐欺に かかったと知れたら信用問題になりますからね……,会社の端末であんなサイトを見た挙句、詐欺に<br/>かかったと知れたら信用問題になりますからね……,,,
11,c0800,1,29,,,,オスロ,コンサルタントという仕事上、信用問題は かなり重いので……本当に助かりましたよ。,コンサルタントという仕事上、信用問題は<br/>かなり重いので……本当に助かりましたよ。,,,
11,c0800,1,30,,,,オスロ,まあ、今後はあの手のサイトは触れないように するとして……何か代わりの娯楽は欲しいですが。,まあ、今後はあの手のサイトは触れないように<br/>するとして……何か代わりの娯楽は欲しいですが。,,,
11,c0800,1,31,,,,オスロ,はぁ……まさか導力ネット詐欺に遭うとは…… 一応警察には相談したがどうなるやら……,はぁ……まさか導力ネット詐欺に遭うとは……<br/>一応警察には相談したがどうなるやら……,,,
11,c0800,1,32,,,,オスロ,特に会社の端末であんな事をしていた事は…… 何とかして履歴を抹消しないと……,特に会社の端末であんな事をしていた事は……<br/>何とかして履歴を抹消しないと……,,,
11,c0800,1,33,,,,オスロ,便利な時代になったぶんだけ 恐ろしい世の中になりましたよ……,便利な時代になったぶんだけ<br/>恐ろしい世の中になりましたよ……,,,
11,c0800,1,34,,,,オスロ,これからは気になるサイトがあっても 慎重にならなくてはいけませんね……,これからは気になるサイトがあっても<br/>慎重にならなくてはいけませんね……,,,
11,c0800,1,35,,,,オスロ,ふぅ……全ては私の意識の甘さが 招いたという事ですね。,ふぅ……全ては私の意識の甘さが<br/>招いたという事ですね。,,,
11,c0800,1,36,,,,オスロ,同じ過ちを繰り返さない為にも 導力ネットについて勉強する必要がありそうです……,同じ過ちを繰り返さない為にも<br/>導力ネットについて勉強する必要がありそうです……,,,
11,c0800,1,37,,,,オスロ,とにかく、私は待機していますので。 皆さんからの連絡をお待ちしていますよ……！,とにかく、私は待機していますので。<br/>皆さんからの連絡をお待ちしていますよ……！,,,
11,c0800,1,38,,,,オスロ,はぁ……まさかあれが 詐欺だっただなんて……,はぁ……まさかあれが<br/>詐欺だっただなんて……,,,
11,c0800,1,39,,,,オスロ,恥を忍んで依頼を出したものの、 本当に来てくれるんだろうか……？,恥を忍んで依頼を出したものの、<br/>本当に来てくれるんだろうか……？,,,
11,c0800,1,40,,,,カトル,（……？ 　この人、誰かに依頼を出してるみたいだけど……）,（……？<br/>　この人、誰かに依頼を出してるみたいだけど……）,,"<img class=""itp-kuro"" src=""itp/11/avfc0004_out.webp""/>",
11,c0800,1,41,,,,オスロ,ふう……ヴェルヌ関連企業の案件は やはり神経を使いますね……,ふう……ヴェルヌ関連企業の案件は<br/>やはり神経を使いますね……,,,
11,c0800,1,42,,,,オスロ,ただでさえレッドスターとエトワスの特許訴訟で 上層部が神経を尖らせているうえ……,ただでさえレッドスターとエトワスの特許訴訟で<br/>上層部が神経を尖らせているうえ……,,,
11,c0800,1,43,,,,オスロ,関連企業間のパワーバランスや、外国企業との 関係も考慮せねば相当なリスクがある。,関連企業間のパワーバランスや、外国企業との<br/>関係も考慮せねば相当なリスクがある。,,,
11,c0800,1,44,,,,オスロ,尤も、それに見合うだけのリターンがある であろう事も間違いない訳ですがね。,尤も、それに見合うだけのリターンがある<br/>であろう事も間違いない訳ですがね。,,,
11,c0800,1,45,,,,オスロ,……とはいえ、やはり他の案件に比べて一つ一つの 壁が高いのも事実……乗り越えたいですが……,……とはいえ、やはり他の案件に比べて一つ一つの<br/>壁が高いのも事実……乗り越えたいですが……,,,
11,c0800,1,46,,,,オスロ,流石に……ここらでリフレッシュをした方が より能率的になりそうですね……,流石に……ここらでリフレッシュをした方が<br/>より能率的になりそうですね……,,,
11,c0800,1,47,,,,オスロ,ＢＯＥ系列企業の話を聞く限り、やはり賠償金の 終了を境に投資を見直すところも多いようで。,ＢＯＥ系列企業の話を聞く限り、やはり賠償金の<br/>終了を境に投資を見直すところも多いようで。,,,
11,c0800,1,48,,,,オスロ,となると、中小企業やベンチャーにも、 それに応じた経営戦略が求められる。,となると、中小企業やベンチャーにも、<br/>それに応じた経営戦略が求められる。,,,
11,c0800,1,49,,,,オスロ,その意味でも、我々コンサルタントの 活躍が増える事は想像に難くない。,その意味でも、我々コンサルタントの<br/>活躍が増える事は想像に難くない。,,,
11,c0800,1,50,,,,オスロ,やはり既存の形態に捉われず、ゼロベースで 柔軟に考える力が求められるわけですからね。,やはり既存の形態に捉われず、ゼロベースで<br/>柔軟に考える力が求められるわけですからね。,,,
11,c0800,1,51,,,,オスロ,ふむ、次の案件はＭ＆Ａに伴う 人事登用制度の刷新の相談か……,ふむ、次の案件はＭ＆Ａに伴う<br/>人事登用制度の刷新の相談か……,,,
11,c0800,1,52,,,,オスロ,うちの専門のコンサルタントも忙しいし、 まずは私が現状の把握からしておきますかね。,うちの専門のコンサルタントも忙しいし、<br/>まずは私が現状の把握からしておきますかね。,,,
11,c0800,1,53,,,,オスロ,この二年の好景気でＭ＆Ａ戦略や 経営形態の見直しも盛んです。,この二年の好景気でＭ＆Ａ戦略や<br/>経営形態の見直しも盛んです。,,,
11,c0800,1,54,,,,オスロ,まあ、コンサルティングが経済に及ぼしている 影響も責任も大きいと言えるでしょうねぇ。,まあ、コンサルティングが経済に及ぼしている<br/>影響も責任も大きいと言えるでしょうねぇ。,,,
11,c0800,2,55,,,,サイモン,ハッ、カークも相変わらず生意気な口を 叩ける余裕があるなら心配はいらねぇな。,ハッ、カークも相変わらず生意気な口を<br/>叩ける余裕があるなら心配はいらねぇな。,,,
11,c0800,2,56,,,,サイモン,しかしまあ、俺達には理解の及ばない状況に なっちまったが……,しかしまあ、俺達には理解の及ばない状況に<br/>なっちまったが……,,,
11,c0800,2,57,,,,サイモン,せいぜい、どこかの避難所の手伝いくらいはするか。 寄せ集め連中を纏めんのは慣れたモンだしな。,せいぜい、どこかの避難所の手伝いくらいはするか。<br/>寄せ集め連中を纏めんのは慣れたモンだしな。,,,
11,c0800,2,58,,,,サイモン,さて、チームの連中も楽しめてるようだし 俺達もせいぜい下町に顔出す頃合いか。,さて、チームの連中も楽しめてるようだし<br/>俺達もせいぜい下町に顔出す頃合いか。,,,
11,c0800,2,59,,,,サイモン,ま、ボロアパートばっかとはいえ こういう時には流石に皆弾けるしな。,ま、ボロアパートばっかとはいえ<br/>こういう時には流石に皆弾けるしな。,,,
11,c0800,2,60,,,,サイモン,せいぜい近所連中に付き合ってやりに行くんだ、 夜にはこっちに戻ってると思うぜ。,せいぜい近所連中に付き合ってやりに行くんだ、<br/>夜にはこっちに戻ってると思うぜ。,,,
11,c0800,2,61,,,,サイモン,ま、今の俺達のチームには訳アリの奴も居りゃ、 そうでもない奴もいるけどよ。,ま、今の俺達のチームには訳アリの奴も居りゃ、<br/>そうでもない奴もいるけどよ。,,,
11,c0800,2,62,,,,サイモン,この通り、今じゃあ皆落ち着いてる、寄り合い所帯 だけあって互いに個性は活かせてな。,この通り、今じゃあ皆落ち着いてる、寄り合い所帯<br/>だけあって互いに個性は活かせてな。,,,
11,c0800,2,63,,,,サイモン,あの非常事態宣言の中でも各々で情報は共有できたし、 皆自分の庭でもやる事やったようだしな。,あの非常事態宣言の中でも各々で情報は共有できたし、<br/>皆自分の庭でもやる事やったようだしな。,,,
11,c0800,2,64,,,,サイモン,……ハハ、これだから色んな奴らを 集めるのは面白いのなんのってな。,……ハハ、これだから色んな奴らを<br/>集めるのは面白いのなんのってな。,,,
11,c0800,2,65,,,,サイモン,記念祭もこいつらは楽しみにしてたしな。 無事迎えられて良かったぜ。,記念祭もこいつらは楽しみにしてたしな。<br/>無事迎えられて良かったぜ。,,,
11,c0800,2,66,,,,サイモン,元気を持て余してんのがまあ、唯一の共通点 みたいなところだしな、ウチも。,元気を持て余してんのがまあ、唯一の共通点<br/>みたいなところだしな、ウチも。,,,
11,c0800,2,67,,,,サイモン,こういうイベントの時は各々で好きなように 思い切り弾けるが良いさ。,こういうイベントの時は各々で好きなように<br/>思い切り弾けるが良いさ。,,,
11,c0800,2,68,,,,サイモン,まったく……洒落にならない事に なっちまったな。,まったく……洒落にならない事に<br/>なっちまったな。,,,
11,c0800,2,69,,,,サイモン,俺もチームの連中一通り見届けたら、 こんな時くらい下町のために働かねぇと。,俺もチームの連中一通り見届けたら、<br/>こんな時くらい下町のために働かねぇと。,,,
11,c0800,2,70,,,,サイモン,非常事態宣言ってのは堅苦しくて好かねぇが…… ま、一応生意気な連中の面倒見てきた自負はある。,非常事態宣言ってのは堅苦しくて好かねぇが……<br/>ま、一応生意気な連中の面倒見てきた自負はある。,,,
11,c0800,2,71,,,,サイモン,せいぜい、俺の見てる範囲では変な気を起こす 奴は出ないようにさせてもらうさ。,せいぜい、俺の見てる範囲では変な気を起こす<br/>奴は出ないようにさせてもらうさ。,,,
11,c0800,2,72,,,,サイモン,あのジェイムスとか言う奴……結局、 無様なほどにコテンパンにされてたな。,あのジェイムスとか言う奴……結局、<br/>無様なほどにコテンパンにされてたな。,,,
11,c0800,2,73,,,,サイモン,まあ、それでも妙にスカッとしたツラだった辺り、 アイツにも色々あるんだろうがな……,まあ、それでも妙にスカッとしたツラだった辺り、<br/>アイツにも色々あるんだろうがな……,,,
11,c0800,2,74,,,,サイモン,──ちなみにその後、サーシャも物足りなさそう だったから、勝負を受けてやってよ。,──ちなみにその後、サーシャも物足りなさそう<br/>だったから、勝負を受けてやってよ。,,,
11,c0800,2,75,,,,サイモン,結果はまあ、ギリで何とか勝てたが…… アイツ、相変わらずのキレだったよ。,結果はまあ、ギリで何とか勝てたが……<br/>アイツ、相変わらずのキレだったよ。,,,
11,c0800,2,76,,,,サイモン,ちなみに……カークのヤツも勝負を挑んで、 結構食い下がったが結局負けちまってな。,ちなみに……カークのヤツも勝負を挑んで、<br/>結構食い下がったが結局負けちまってな。,,,
11,c0800,2,77,,,,サイモン,女だからってナメて挑んだようだが……まあ、 アイツは最近慢心し過ぎてた事だしな。,女だからってナメて挑んだようだが……まあ、<br/>アイツは最近慢心し過ぎてた事だしな。,,,
11,c0800,2,78,,,,サイモン,カークもあれ以上調子に乗ると危なっかしいし、 丁度いいお灸になったんじゃねぇか？,カークもあれ以上調子に乗ると危なっかしいし、<br/>丁度いいお灸になったんじゃねぇか？,,,
11,c0800,2,79,,,,サイモン,その証拠に、遅くまで練習してやがる。 ま、俺も最後まで見ててやるぜ。,その証拠に、遅くまで練習してやがる。<br/>ま、俺も最後まで見ててやるぜ。,,,
11,c0800,2,80,,,,サイモン,サーシャっていやぁ、今やアラミスのエースにして、 数年前にここで猛威を見せてくれた女じゃないか！,サーシャっていやぁ、今やアラミスのエースにして、<br/>数年前にここで猛威を見せてくれた女じゃないか！,,,
11,c0800,2,81,,,,サイモン,クク、一緒に連れてる奴は何なのか知らんが、 久しぶりに面白いモノを見せてくれそうだ。,クク、一緒に連れてる奴は何なのか知らんが、<br/>久しぶりに面白いモノを見せてくれそうだ。,,,
11,c0800,2,82,,,,サイモン,俺も最近は不完全燃焼気味だったし…… 何年ぶりか判らんが、後で勝負させてもらうか！,俺も最近は不完全燃焼気味だったし……<br/>何年ぶりか判らんが、後で勝負させてもらうか！,,,
11,c0800,2,83,,,,サイモン,サーシャ、見たのは久しいが随分と 制服も様になってるじゃないか。,サーシャ、見たのは久しいが随分と<br/>制服も様になってるじゃないか。,,,
11,c0800,2,84,,,,サイモン,そっちの男子がどういう災難で この熱血娘にしごかれてるのか知らねぇが。,そっちの男子がどういう災難で<br/>この熱血娘にしごかれてるのか知らねぇが。,,,
11,c0800,2,85,,,,サイモン,ま、たまには俺達も見る側に回ってみるか。 カークにも良い刺激になるだろ。,ま、たまには俺達も見る側に回ってみるか。<br/>カークにも良い刺激になるだろ。,,,
11,c0800,2,86,,,,サイモン,……あんた達か。 この前はマルクの件で世話になったな。,……あんた達か。<br/>この前はマルクの件で世話になったな。,,,
11,c0800,2,87,,,,サイモン,マルクがいたあの半グレチーム、 まだ凝りてねぇって話だが聞いてるか？,マルクがいたあの半グレチーム、<br/>まだ凝りてねぇって話だが聞いてるか？,,,
11,c0800,2,88,,,,サイモン,仲間一人捨て駒にしておいてのうのうと…… 虫唾が走るったらありゃしねぇ。,仲間一人捨て駒にしておいてのうのうと……<br/>虫唾が走るったらありゃしねぇ。,,,
11,c0800,2,89,,,,サイモン,でも、そんな奴らにも憧れて入っちまう 馬鹿がいるっていうからよ……,でも、そんな奴らにも憧れて入っちまう<br/>馬鹿がいるっていうからよ……,,,
11,c0800,2,90,,,,サイモン,ハッ、それにしてもここ最近は半グレになって 堕ちるところまで堕ちる奴が多いよなァ……,ハッ、それにしてもここ最近は半グレになって<br/>堕ちるところまで堕ちる奴が多いよなァ……,,,
11,c0800,2,91,,,,サイモン,ったく、各々抱え込んでるのは判るが…… いつまでもそんなんで良いはずねぇだろうが。,ったく、各々抱え込んでるのは判るが……<br/>いつまでもそんなんで良いはずねぇだろうが。,,,
11,c0800,2,92,,,,サイモン,俺達のバスケもそうだが、不良だろうとてめぇの道を 探せる場なんて、探せばあるモンだってのに。,俺達のバスケもそうだが、不良だろうとてめぇの道を<br/>探せる場なんて、探せばあるモンだってのに。,,,
11,c0800,2,93,,,,サイモン,ここにいる連中にもヤンチャやってた奴はいるが、 全力でぶつかってみりゃ筋の通った連中だ。,ここにいる連中にもヤンチャやってた奴はいるが、<br/>全力でぶつかってみりゃ筋の通った連中だ。,,,
11,c0800,2,94,,,,サイモン,色々あっても、とりあえず吐き出せるだけ 吐き出せば分かり合える事もあるんだろうが……,色々あっても、とりあえず吐き出せるだけ<br/>吐き出せば分かり合える事もあるんだろうが……,,,
11,c0800,2,95,,,,サイモン,最近の半グレ共は、道に迷ってるヤツを 後戻りできない闇に引き込みやがるからな。,最近の半グレ共は、道に迷ってるヤツを<br/>後戻りできない闇に引き込みやがるからな。,,,
11,c0800,2,96,,,,サイモン,ったく……居場所を見つけた奴らを 見てきた身としちゃ胸糞悪ぃな。,ったく……居場所を見つけた奴らを<br/>見てきた身としちゃ胸糞悪ぃな。,,,
11,c0800,2,97,,,,ヴァン,（コイツには依頼の顛末を 伝えといた方がいいかもな……）,（コイツには依頼の顛末を<br/>伝えといた方がいいかもな……）,,"<img class=""itp-kuro"" src=""itp/11/avfc0000_out.webp""/>",
11,c0800,2,98,,,,ヴァン,よう、エイミーに会って話をして来たぜ。,よう、エイミーに会って話をして来たぜ。,,"<img class=""itp-kuro"" src=""itp/11/avfc0000_out.webp""/>",
11,c0800,2,99,,,,サイモン,……！ 結局、彼女にはどう伝えたんだ？,……！<br/>結局、彼女にはどう伝えたんだ？,,,
11,c0800,2,100,,,,ヴァン,本当の事を伝えてやったさ。,本当の事を伝えてやったさ。,,"<img class=""itp-kuro"" src=""itp/11/avfc0000_out.webp""/>",
11,c0800,2,101,,,,ヴァン,ひと悶着ありはしたが、 事実を受け止めてくれた様子だったぜ。,ひと悶着ありはしたが、<br/>事実を受け止めてくれた様子だったぜ。,,"<img class=""itp-kuro"" src=""itp/11/avfc0000_out.webp""/>",
11,c0800,2,102,,,,サイモン,そうか…… それならマルクも安心してくれるだろ。,そうか……<br/>それならマルクも安心してくれるだろ。,,,
11,c0800,2,103,,,,サイモン,ありがとな……俺からも礼を言わせてくれ。,ありがとな……俺からも礼を言わせてくれ。,,,
