gameId,fname,scene,row,engChrName,engSearchText,engHtmlText,jpnChrName,jpnSearchText,jpnHtmlText,opName,pcIconHtml,evoIconHtml
11,c0800,113,2511,,,,アニエス,テ、テロ事件ですか……！？ 初めて聞きました……,テ、テロ事件ですか……！？<br/>初めて聞きました……,,"<img class=""itp-kuro"" src=""itp/11/avfc5001_out.webp""/>",
11,c0800,113,2512,,,,フェリ,ええっ！？ 首都でもそういう事はあるんですね……,ええっ！？<br/>首都でもそういう事はあるんですね……,,"<img class=""itp-kuro"" src=""itp/11/avfc5003_out.webp""/>",
11,c0800,113,2513,,,,アーロン,へぇ、首都も物騒なもんだな。,へぇ、首都も物騒なもんだな。,,"<img class=""itp-kuro"" src=""itp/11/avfc0002_out.webp""/>",
11,c0800,113,2514,,,,クレモナ,しかも亡くなったのは テイラー議員という政治家の一家でしてね。,しかも亡くなったのは<br/>テイラー議員という政治家の一家でしてね。,,,
11,c0800,113,2515,,,,クレモナ,当時従業員の間では何かの陰謀ではないかと 色々と噂になっていましたよ。,当時従業員の間では何かの陰謀ではないかと<br/>色々と噂になっていましたよ。,,,
11,c0800,113,2516,,,,ヴァン,ふむ……その事件で 一家全員が亡くなったのか？,ふむ……その事件で<br/>一家全員が亡くなったのか？,,"<img class=""itp-kuro"" src=""itp/11/avfc0000_out.webp""/>",
11,c0800,113,2517,,,,クレモナ,いえ……それが結局、世間には 詳しい事は何も公表されなかったんですよ。,いえ……それが結局、世間には<br/>詳しい事は何も公表されなかったんですよ。,,,
11,c0800,113,2518,,,,クレモナ,なので生き残りがいるかどうかは何とも……,なので生き残りがいるかどうかは何とも……,,,
11,c0800,113,2519,,,,クレモナ,ああでも、あそこにいらっしゃる ポランスキー議員なら詳しいかもしれませんね。,ああでも、あそこにいらっしゃる<br/>ポランスキー議員なら詳しいかもしれませんね。,,,
11,c0800,113,2520,,,,ヴァン,分かった、それじゃ話を聞いてみるか。,分かった、それじゃ話を聞いてみるか。,,"<img class=""itp-kuro"" src=""itp/11/avfc0000_out.webp""/>",
11,c0800,113,2521,,,,アニエス,（ブルーノさんはロケットを   盗んだと言っていましたけど……）,（ブルーノさんはロケットを<br/>  盗んだと言っていましたけど……）,,"<img class=""itp-kuro"" src=""itp/11/avfc5001_out.webp""/>",
11,c0800,113,2522,,,,アニエス,（もしかしてテロ事件と   なにか関係があるんでしょうか……？）,（もしかしてテロ事件と<br/>  なにか関係があるんでしょうか……？）,,"<img class=""itp-kuro"" src=""itp/11/avfc5001_out.webp""/>",
11,c0800,113,2523,,,,フェリ,（ブルーノさんはロケットを   盗んだと言っていましたけど……）,（ブルーノさんはロケットを<br/>  盗んだと言っていましたけど……）,,"<img class=""itp-kuro"" src=""itp/11/avfc5003_out.webp""/>",
11,c0800,113,2524,,,,フェリ,（もしかしてテロ事件と   なにか関係があるんでしょうか……？）,（もしかしてテロ事件と<br/>  なにか関係があるんでしょうか……？）,,"<img class=""itp-kuro"" src=""itp/11/avfc5003_out.webp""/>",
11,c0800,113,2525,,,,アーロン,（あの爺さんはロケットを   盗んだとか言ってやがったが……）,（あの爺さんはロケットを<br/>  盗んだとか言ってやがったが……）,,"<img class=""itp-kuro"" src=""itp/11/avfc0002_out.webp""/>",
11,c0800,113,2526,,,,アーロン,（実はこのテロ事件と   関係があったりすんのかねぇ。）,（実はこのテロ事件と<br/>  関係があったりすんのかねぇ。）,,"<img class=""itp-kuro"" src=""itp/11/avfc0002_out.webp""/>",
11,c0800,113,2527,,,,ヴァン,（そうだな……怪しくはあるが、   まずは調べてみねえと何ともな。）,（そうだな……怪しくはあるが、<br/>  まずは調べてみねえと何ともな。）,,"<img class=""itp-kuro"" src=""itp/11/avfc0000_out.webp""/>",
11,c0800,114,2528,,,,ヴァン,取り込み中に悪いな。,取り込み中に悪いな。,,"<img class=""itp-kuro"" src=""itp/11/avfc0000_out.webp""/>",
11,c0800,114,2529,,,,ヴァン,《アークライド解決事務所》のモンなんだが 依頼を受けてある事件を調べてんだが。,《アークライド解決事務所》のモンなんだが<br/>依頼を受けてある事件を調べてんだが。,,"<img class=""itp-kuro"" src=""itp/11/avfc0000_out.webp""/>",
11,c0800,114,2530,,,,ヴァン,少し席を外してもらう事は出来るか？,少し席を外してもらう事は出来るか？,,"<img class=""itp-kuro"" src=""itp/11/avfc0000_out.webp""/>",
11,c0800,114,2531,,,,ポランスキー議員,ふむ……話だけでも聞かせてもらうか。,ふむ……話だけでも聞かせてもらうか。,,,
11,c0800,114,2532,,,,ポランスキー議員,いいかなジェニファー君？,いいかなジェニファー君？,,,
11,c0800,114,2533,,,,ジェニファー社長,ええ、私は紅茶でも飲んで待たせてもらいましょう。,ええ、私は紅茶でも飲んで待たせてもらいましょう。,,,
11,c0800,114,2534,,,,ポランスキー議員,事件を追っているという事だったが。 一体私に何を聞きたいのかね？,事件を追っているという事だったが。<br/>一体私に何を聞きたいのかね？,,,
11,c0800,114,2535,,,,ヴァン,聞きてえのは２０年前このホテルで テロに遭ったテイラー議員についてだ。,聞きてえのは２０年前このホテルで<br/>テロに遭ったテイラー議員についてだ。,,"<img class=""itp-kuro"" src=""itp/11/avfc0000_out.webp""/>",
11,c0800,114,2536,,,,ポランスキー議員,なぜ君がその事を……,なぜ君がその事を……,,,
11,c0800,114,2537,,,,ヴァン,とあるスジからちょいとな。,とあるスジからちょいとな。,,"<img class=""itp-kuro"" src=""itp/11/avfc0000_out.webp""/>",
11,c0800,114,2538,,,,ヴァン,もし生き残ってるヤツがいるなら、 届けてやりたい遺品があるんだ。,もし生き残ってるヤツがいるなら、<br/>届けてやりたい遺品があるんだ。,,"<img class=""itp-kuro"" src=""itp/11/avfc0000_out.webp""/>",
11,c0800,114,2539,,,,ヴァン,コイツなんだが……まず、 この写真の男はテイラー議員で合ってるか？,コイツなんだが……まず、<br/>この写真の男はテイラー議員で合ってるか？,,"<img class=""itp-kuro"" src=""itp/11/avfc0000_out.webp""/>",
11,c0800,114,2540,,,,ポランスキー議員,……確かにこんな顔をしていたな。,……確かにこんな顔をしていたな。,,,
11,c0800,114,2541,,,,ポランスキー議員,ああ、テイラー君で間違いない。,ああ、テイラー君で間違いない。,,,
11,c0800,114,2542,,,,アニエス,（という事はやっぱり……）,（という事はやっぱり……）,,"<img class=""itp-kuro"" src=""itp/11/avfc5001_out.webp""/>",
11,c0800,114,2543,,,,アニエス,（ブルーノさんは、ホテル荒らしではなくて   テロ事件と関わりがあったという事ですか……）,（ブルーノさんは、ホテル荒らしではなくて<br/>  テロ事件と関わりがあったという事ですか……）,,"<img class=""itp-kuro"" src=""itp/11/avfc5001_out.webp""/>",
11,c0800,114,2544,,,,フェリ,（という事はやっぱり……）,（という事はやっぱり……）,,"<img class=""itp-kuro"" src=""itp/11/avfc5003_out.webp""/>",
11,c0800,114,2545,,,,フェリ,（ブルーノさんは、ホテル荒らしではなくて   テロリストだったんでしょうか……？）,（ブルーノさんは、ホテル荒らしではなくて<br/>  テロリストだったんでしょうか……？）,,"<img class=""itp-kuro"" src=""itp/11/avfc5003_out.webp""/>",
11,c0800,114,2546,,,,アーロン,（つう事はやっぱり……）,（つう事はやっぱり……）,,"<img class=""itp-kuro"" src=""itp/11/avfc0002_out.webp""/>",
11,c0800,114,2547,,,,アーロン,（あの爺さんは、ホテル荒らしじゃねえ。   テロ事件の関係者だったっつう事か。）,（あの爺さんは、ホテル荒らしじゃねえ。<br/>  テロ事件の関係者だったっつう事か。）,,"<img class=""itp-kuro"" src=""itp/11/avfc0002_out.webp""/>",
11,c0800,114,2548,,,,ヴァン,それじゃ、例の事件について 詳しい事を教えてもらえねえか？,それじゃ、例の事件について<br/>詳しい事を教えてもらえねえか？,,"<img class=""itp-kuro"" src=""itp/11/avfc0000_out.webp""/>",
11,c0800,114,2549,,,,ポランスキー議員,……分かった、そういう事なら協力しよう。,……分かった、そういう事なら協力しよう。,,,
11,c0800,114,2550,,,,ポランスキー議員,テイラー君は私と同じ共和党の人間でな。 個人的な付き合いこそ無かったが信頼していた。,テイラー君は私と同じ共和党の人間でな。<br/>個人的な付き合いこそ無かったが信頼していた。,,,
11,c0800,114,2551,,,,ポランスキー議員,特に民族融和に向けた運動に力を注いでいてね。 国会でも彼の発言に注目が集まっていたよ。,特に民族融和に向けた運動に力を注いでいてね。<br/>国会でも彼の発言に注目が集まっていたよ。,,,
11,c0800,114,2552,,,,アニエス,民族融和ですか……,民族融和ですか……,,"<img class=""itp-kuro"" src=""itp/11/avfc5001_out.webp""/>",
11,c0800,114,2553,,,,アニエス,２０年前というと、移民問題が激化していた 時代だったと本で読みました。,２０年前というと、移民問題が激化していた<br/>時代だったと本で読みました。,,"<img class=""itp-kuro"" src=""itp/11/avfc5001_out.webp""/>",
11,c0800,114,2554,,,,アニエス,のちにロックスミス前大統領が 混乱を抑えたという事でしたけど……,のちにロックスミス前大統領が<br/>混乱を抑えたという事でしたけど……,,"<img class=""itp-kuro"" src=""itp/11/avfc5001_out.webp""/>",
11,c0800,114,2555,,,,フェリ,へぇ、やり手の議員さんだったんですね。,へぇ、やり手の議員さんだったんですね。,,"<img class=""itp-kuro"" src=""itp/11/avfc5003_out.webp""/>",
11,c0800,114,2556,,,,アーロン,へぇ、随分とやり手の議員だった訳だな。,へぇ、随分とやり手の議員だった訳だな。,,"<img class=""itp-kuro"" src=""itp/11/avfc0002_out.webp""/>",
11,c0800,114,2557,,,,ヴァン,だが、その矢先にあの事件が起きた訳だ。,だが、その矢先にあの事件が起きた訳だ。,,"<img class=""itp-kuro"" src=""itp/11/avfc0000_out.webp""/>",
11,c0800,114,2558,,,,ポランスキー議員,ああ……あの凄惨な事件は忘れもしまい……,ああ……あの凄惨な事件は忘れもしまい……,,,
11,c0800,114,2559,,,,ポランスキー議員,小旅行のためホテルに宿泊していた テイラー一家は寝込みを襲われたのだ。,小旅行のためホテルに宿泊していた<br/>テイラー一家は寝込みを襲われたのだ。,,,
11,c0800,114,2560,,,,ポランスキー議員,テイラー君とその妻は亡くなり…… 子供は奇跡的に助かったと聞いている。,テイラー君とその妻は亡くなり……<br/>子供は奇跡的に助かったと聞いている。,,,
11,c0800,114,2561,,,,ヴァン,そんな事件があったとはな……,そんな事件があったとはな……,,"<img class=""itp-kuro"" src=""itp/11/avfc0000_out.webp""/>",
11,c0800,114,2562,,,,アニエス,………………,………………,,"<img class=""itp-kuro"" src=""itp/11/avfc5001_out.webp""/>",
11,c0800,114,2563,,,,フェリ,汚いやり方ですね……そういう依頼が 猟兵に来る事もありますけど……,汚いやり方ですね……そういう依頼が<br/>猟兵に来る事もありますけど……,,"<img class=""itp-kuro"" src=""itp/11/avfc5003_out.webp""/>",
11,c0800,114,2564,,,,アーロン,汚ねえやり方だな……口じゃ勝てねえから 力ずくで黙らせようってか。,汚ねえやり方だな……口じゃ勝てねえから<br/>力ずくで黙らせようってか。,,"<img class=""itp-kuro"" src=""itp/11/avfc0002_out.webp""/>",
11,c0800,114,2565,,,,ヴァン,で、その生き残った子供は今どこにいるんだ？,で、その生き残った子供は今どこにいるんだ？,,"<img class=""itp-kuro"" src=""itp/11/avfc0000_out.webp""/>",
11,c0800,114,2566,,,,ポランスキー議員,残念ながら、私はそこまで詳しくないのだが……,残念ながら、私はそこまで詳しくないのだが……,,,
11,c0800,114,2567,,,,ポランスキー議員,確か彼と親しくしていた “ハック”という者がいたはずだ。,確か彼と親しくしていた<br/>“ハック”という者がいたはずだ。,,,
11,c0800,114,2568,,,,ポランスキー議員,前と住所が変わらないのであれば、 旧市街に住んでいると聞いた気がするな。,前と住所が変わらないのであれば、<br/>旧市街に住んでいると聞いた気がするな。,,,
11,c0800,114,2569,,,,アニエス,旧市街のハックさんというと、まさか……？,旧市街のハックさんというと、まさか……？,,"<img class=""itp-kuro"" src=""itp/11/avfc5001_out.webp""/>",
11,c0800,114,2570,,,,フェリ,それって、もしかして……？,それって、もしかして……？,,"<img class=""itp-kuro"" src=""itp/11/avfc5003_out.webp""/>",
11,c0800,114,2571,,,,アーロン,そういやどっかで聞いた気もするが……,そういやどっかで聞いた気もするが……,,"<img class=""itp-kuro"" src=""itp/11/avfc0002_out.webp""/>",
11,c0800,114,2572,,,,ヴァン,ああ、公衆浴場に入り浸ってる ハック爺さんの事だろうな。,ああ、公衆浴場に入り浸ってる<br/>ハック爺さんの事だろうな。,,"<img class=""itp-kuro"" src=""itp/11/avfc0000_out.webp""/>",
11,c0800,114,2573,,,,ヴァン,今の時間も、ロウリュに行ってるかもしれねえ。,今の時間も、ロウリュに行ってるかもしれねえ。,,"<img class=""itp-kuro"" src=""itp/11/avfc0000_out.webp""/>",
11,c0800,114,2574,,,,ポランスキー議員,おお、顔見知りだったなら話が早いな。,おお、顔見知りだったなら話が早いな。,,,
11,c0800,114,2575,,,,ポランスキー議員,どうか……テイラー君の為にも 息子さんの力になってあげてくれ。,どうか……テイラー君の為にも<br/>息子さんの力になってあげてくれ。,,,
11,c0800,115,2576,,,,ヴァン,アンタが依頼をくれた ラムズフェルドで合ってるか？,アンタが依頼をくれた<br/>ラムズフェルドで合ってるか？,,"<img class=""itp-kuro"" src=""itp/11/avfc0000_out.webp""/>",
11,c0800,115,2577,,,,ヴァン,《アークライド解決事務所》── 《裏解決屋》のモンなんだが。,《アークライド解決事務所》──<br/>《裏解決屋》のモンなんだが。,,"<img class=""itp-kuro"" src=""itp/11/avfc0000_out.webp""/>",
11,c0800,115,2578,,,,ラムズフェルド,おや、貴方がたが噂の……！ お会いできて光栄ですよ。,おや、貴方がたが噂の……！<br/>お会いできて光栄ですよ。,,,
11,c0800,115,2579,,,,リゼット,依頼内容には、さるご令嬢の救出を 手伝って欲しいと書いてありましたが……,依頼内容には、さるご令嬢の救出を<br/>手伝って欲しいと書いてありましたが……,,"<img class=""itp-kuro"" src=""itp/11/avfc5005_out.webp""/>",
11,c0800,115,2580,,,,ラムズフェルド,ええ──それでは早速説明させて頂きましょう。,ええ──それでは早速説明させて頂きましょう。,,,
11,c0800,115,2581,,,,ラムズフェルド,ご令嬢というのは《バンク・オブ・イーディス》の 頭取のご令嬢──バーゼリアお嬢様の事です。,ご令嬢というのは《バンク・オブ・イーディス》の<br/>頭取のご令嬢──バーゼリアお嬢様の事です。,,,
11,c0800,115,2582,,,,ラムズフェルド,そして私は、お嬢様の護衛と執事を 兼ねているラムズフェルドと申します。,そして私は、お嬢様の護衛と執事を<br/>兼ねているラムズフェルドと申します。,,,
11,c0800,115,2583,,,,アニエス,《バンク・オブ・イーディス》ですか！？ 国内最大手の金融機関ですよね……,《バンク・オブ・イーディス》ですか！？<br/>国内最大手の金融機関ですよね……,,"<img class=""itp-kuro"" src=""itp/11/avfc5001_out.webp""/>",
11,c0800,115,2584,,,,アニエス,謹厳実直（きんげんじっちょく）な業務方針で、 悪い噂は滅多に聞かない銀行です。,謹厳実直（きんげんじっちょく）な業務方針で、<br/>悪い噂は滅多に聞かない銀行です。,,"<img class=""itp-kuro"" src=""itp/11/avfc5001_out.webp""/>",
11,c0800,115,2585,,,,フェリ,へぇ～、なんだかすごいですね。 お金持ちのお嬢様って事ですか。,へぇ～、なんだかすごいですね。<br/>お金持ちのお嬢様って事ですか。,,"<img class=""itp-kuro"" src=""itp/11/avfc5003_out.webp""/>",
11,c0800,115,2586,,,,アーロン,なるほど、アイツ（アシェン）とは違う意味で 正真正銘のお嬢様っつう訳か。,なるほど、アイツ（アシェン）とは違う意味で<br/>正真正銘のお嬢様っつう訳か。,,"<img class=""itp-kuro"" src=""itp/11/avfc0002_out.webp""/>",
11,c0800,115,2587,,,,ヴァン,で、そのお嬢様がどうしたっていうんだ？,で、そのお嬢様がどうしたっていうんだ？,,"<img class=""itp-kuro"" src=""itp/11/avfc0000_out.webp""/>",
11,c0800,115,2588,,,,ラムズフェルド,ええ──護衛を任されている身として 不甲斐ないばかりなのですが……,ええ──護衛を任されている身として<br/>不甲斐ないばかりなのですが……,,,
11,c0800,115,2589,,,,ラムズフェルド,昨日の夜、お嬢様が何者かに 誘拐されてしまったようなのです。,昨日の夜、お嬢様が何者かに<br/>誘拐されてしまったようなのです。,,,
11,c0800,115,2590,,,,アニエス,誘拐、ですか……,誘拐、ですか……,,"<img class=""itp-kuro"" src=""itp/11/avfc5001_out.webp""/>",
11,c0800,115,2591,,,,ヴァン,もしかしてとは思ったが…… そいつは穏やかじゃねえな。,もしかしてとは思ったが……<br/>そいつは穏やかじゃねえな。,,"<img class=""itp-kuro"" src=""itp/11/avfc0000_out.webp""/>",
11,c0800,115,2592,,,,リゼット,犯人からの要求は何かあるのでしょうか。 状況などの詳細を教えて頂けますか。,犯人からの要求は何かあるのでしょうか。<br/>状況などの詳細を教えて頂けますか。,,"<img class=""itp-kuro"" src=""itp/11/avfc5005_out.webp""/>",
11,c0800,115,2593,,,,ラムズフェルド,ええ……まずお嬢様は《マセラティ・ホテル》の 最上階で長期滞在していらっしゃるのです。,ええ……まずお嬢様は《マセラティ・ホテル》の<br/>最上階で長期滞在していらっしゃるのです。,,,
11,c0800,115,2594,,,,ラムズフェルド,家で暮らすより安全かつ不自由ない生活が 出来るだろうという旦那様の計らいでして。,家で暮らすより安全かつ不自由ない生活が<br/>出来るだろうという旦那様の計らいでして。,,,
11,c0800,115,2595,,,,ラムズフェルド,しかし……昨晩、護衛の目を盗んで遊びに出かけた お嬢様がホテルに戻られなかったのです。,しかし……昨晩、護衛の目を盗んで遊びに出かけた<br/>お嬢様がホテルに戻られなかったのです。,,,
11,c0800,115,2596,,,,ラムズフェルド,すると、今朝脅迫文がホテル宛てに届いていました。,すると、今朝脅迫文がホテル宛てに届いていました。,,,
11,c0800,115,2597,,,,ラムズフェルド,『お前の娘は預かった、   返してほしければ１０００万ミラ用意しろ。』,『お前の娘は預かった、<br/>  返してほしければ１０００万ミラ用意しろ。』,,,
11,c0800,115,2598,,,,ラムズフェルド,『警察や遊撃士に相談したら娘は殺す。   受け渡しの場には父親本人が来い。』と……,『警察や遊撃士に相談したら娘は殺す。<br/>  受け渡しの場には父親本人が来い。』と……,,,
11,c0800,115,2599,,,,リゼット,ふむ……身代金の要求という点では 典型的な事例のようですが……,ふむ……身代金の要求という点では<br/>典型的な事例のようですが……,,"<img class=""itp-kuro"" src=""itp/11/avfc5005_out.webp""/>",
11,c0800,115,2600,,,,ラムズフェルド,加えて、普段バーゼリアお嬢様が 使っている携帯端末も送られてきました。,加えて、普段バーゼリアお嬢様が<br/>使っている携帯端末も送られてきました。,,,
11,c0800,115,2601,,,,ラムズフェルド,犯人は恐ろしく用意周到です。 そこで皆様には、我々の代わりに犯人の調査を──,犯人は恐ろしく用意周到です。<br/>そこで皆様には、我々の代わりに犯人の調査を──,,,
11,c0800,115,2602,,,,ラムズフェルド,そして、身代金の受け渡しの現場に 同行して頂きたいのです。,そして、身代金の受け渡しの現場に<br/>同行して頂きたいのです。,,,
11,c0800,115,2603,,,,ヴァン,ま、警察や遊撃士に相談出来ねえって事なら ウチで請け負うのもアリだろう。,ま、警察や遊撃士に相談出来ねえって事なら<br/>ウチで請け負うのもアリだろう。,,"<img class=""itp-kuro"" src=""itp/11/avfc0000_out.webp""/>",
11,c0800,115,2604,,,,ヴァン,（さてと、今すぐ引き受けちまって   構わなかったか……？）,（さてと、今すぐ引き受けちまって<br/>  構わなかったか……？）,,"<img class=""itp-kuro"" src=""itp/11/avfc0000_out.webp""/>",
11,c0800,115,2605,,,,ラムズフェルド,バーゼリアお嬢様の救出にあたって 皆様に依頼したい内容は二つあります。,バーゼリアお嬢様の救出にあたって<br/>皆様に依頼したい内容は二つあります。,,,
11,c0800,115,2606,,,,ラムズフェルド,ひとつは、我々の代わりに犯人の調査を──,ひとつは、我々の代わりに犯人の調査を──,,,
11,c0800,115,2607,,,,ラムズフェルド,そして、お嬢様の身代金の受け渡しの現場に 同行して頂きたいのです。,そして、お嬢様の身代金の受け渡しの現場に<br/>同行して頂きたいのです。,,,
11,c0800,115,2608,,,,ラムズフェルド,ご検討いただけますでしょうか……？,ご検討いただけますでしょうか……？,,,
11,c0800,115,2609,,,,ヴァン,ああ、警察や遊撃士に相談出来ねえって事なら ウチで請け負うのもアリだろう。,ああ、警察や遊撃士に相談出来ねえって事なら<br/>ウチで請け負うのもアリだろう。,,"<img class=""itp-kuro"" src=""itp/11/avfc0000_out.webp""/>",
11,c0800,115,2610,,,,ヴァン,（さてと、今すぐ引き受けちまって   構わなかったか……？）,（さてと、今すぐ引き受けちまって<br/>  構わなかったか……？）,,"<img class=""itp-kuro"" src=""itp/11/avfc0000_out.webp""/>",
11,c0800,115,2611,,,,ヴァン,だが……悪いな、今は少し間が悪い。,だが……悪いな、今は少し間が悪い。,,"<img class=""itp-kuro"" src=""itp/11/avfc0000_out.webp""/>",
11,c0800,115,2612,,,,ヴァン,少しだけ待っててもらえるか？,少しだけ待っててもらえるか？,,"<img class=""itp-kuro"" src=""itp/11/avfc0000_out.webp""/>",
11,c0800,115,2613,,,,ラムズフェルド,ええ、急を要する用事とはいえ 無理強いをするつもりはございません。,ええ、急を要する用事とはいえ<br/>無理強いをするつもりはございません。,,,
11,c0800,115,2614,,,,ラムズフェルド,お待ちしておりますので ご検討の程よろしくお願い致します。,お待ちしておりますので<br/>ご検討の程よろしくお願い致します。,,,
11,c0800,115,2615,,,,ヴァン,この依頼、引き受けさせてもらうぜ。,この依頼、引き受けさせてもらうぜ。,,"<img class=""itp-kuro"" src=""itp/11/avfc0000_out.webp""/>",
11,c0800,115,2616,,,,ラムズフェルド,ありがとうございます。 頼もしい限りですな。,ありがとうございます。<br/>頼もしい限りですな。,,,
11,c0800,115,2617,,,,ヴァン,で、その肝心の親父さんは 今どこで何をしてるんだ？,で、その肝心の親父さんは<br/>今どこで何をしてるんだ？,,"<img class=""itp-kuro"" src=""itp/11/avfc0000_out.webp""/>",
11,c0800,115,2618,,,,ラムズフェルド,それが、頭取──旦那様は 常に多忙を極めておいででしてな。,それが、頭取──旦那様は<br/>常に多忙を極めておいででしてな。,,,
