gameId,fname,scene,row,engChrName,engSearchText,engHtmlText,jpnChrName,jpnSearchText,jpnHtmlText,opName,pcIconHtml,evoIconHtml
e0700,1,109,Aaron,Damn. He's fighting a losing battle if even a schoolgirl can see through his act now.,Damn. He's fighting a losing battle if even a<br/>schoolgirl can see through his act now.,アーロン,クク、こんな小娘に 見透かされてるくらいだからなァ。,"<audio id=""v03_60021""><source src=""talk/11/v03_60021.opus"" type=""audio/ogg; codecs=opus""></audio><a href=""javascript:void(0)"" onclick=""document.getElementById('v03_60021').play()"">クク、こんな小娘に<br/>見透かされてるくらいだからなァ。</a>",,"<img class=""itp-kuro"" src=""itp/11/avfc0002_out.webp""/>"
e0700,1,110,Aaron,"Feels like he's putting a pointlessly long abeyance on the inevitable while he tries to find himself to me, if I'm being real with you.","Feels like he's putting a pointlessly long abeyance on<br/>the inevitable while he tries to find himself to me, if<br/>I'm being real with you.",アーロン,つーか自分捜しのモラトリアムを 続けてるようにしか見えねえぜ。,"<audio id=""v03_60022""><source src=""talk/11/v03_60022.opus"" type=""audio/ogg; codecs=opus""></audio><a href=""javascript:void(0)"" onclick=""document.getElementById('v03_60022').play()"">つーか自分捜しのモラトリアムを<br/>続けてるようにしか見えねえぜ。</a>",,"<img class=""itp-kuro"" src=""itp/11/avfc0002_out.webp""/>"
e0700,1,111,Ferry,"Hmm... I could see the 'finding himself' angle, yeah.","Hmm... I could see the 'finding himself' angle, yeah.",フェリ,自分捜し……ああ、 確かにそんな所はありますよね。,"<audio id=""v02_60024""><source src=""talk/11/v02_60024.opus"" type=""audio/ogg; codecs=opus""></audio><a href=""javascript:void(0)"" onclick=""document.getElementById('v02_60024').play()"">自分捜し……ああ、<br/>確かにそんな所はありますよね。</a>",,"<img class=""itp-kuro"" src=""itp/11/avfc5003_out.webp""/>"
e0700,1,112,Ferry,"No idea what an 'abeyance' is, though...","No idea what an 'abeyance' is, though...",フェリ,もらとりあむっていうのが 何なのかは分かりませんけど。,"<audio id=""v02_60025""><source src=""talk/11/v02_60025.opus"" type=""audio/ogg; codecs=opus""></audio><a href=""javascript:void(0)"" onclick=""document.getElementById('v02_60025').play()"">もらとりあむっていうのが<br/>何なのかは分かりませんけど。</a>",,"<img class=""itp-kuro"" src=""itp/11/avfc5003_out.webp""/>"
e0700,1,113,Agnes,Ahaha... I'm not sure it's quite that simple.,Ahaha... I'm not sure it's quite that simple.,アニエス,あはは……流石にもうちょっと 色々あるんだと思いますけど。,"<audio id=""v01_60038""><source src=""talk/11/v01_60038.opus"" type=""audio/ogg; codecs=opus""></audio><a href=""javascript:void(0)"" onclick=""document.getElementById('v01_60038').play()"">あはは……流石にもうちょっと<br/>色々あるんだと思いますけど。</a>",,"<img class=""itp-kuro"" src=""itp/11/avfc5001_out.webp""/>"
e0700,1,114,Agnes,"Still, I believe in him. I know he'll stop averting his eyes one day.","Still, I believe in him. I know he'll stop averting his<br/>eyes one day.",アニエス,でも──信じています。 ちゃんと向き合ってくれるって。,"<audio id=""v01_60039""><source src=""talk/11/v01_60039.opus"" type=""audio/ogg; codecs=opus""></audio><a href=""javascript:void(0)"" onclick=""document.getElementById('v01_60039').play()"">でも──信じています。<br/>ちゃんと向き合ってくれるって。</a>",,"<img class=""itp-kuro"" src=""itp/11/avfc5001_out.webp""/>"
e0700,1,115,Agnes,Not from us so much as from himself.,Not from us so much as from himself.,アニエス,私たちに対してというより、 他ならぬ、ヴァンさん自身に対して。,"<audio id=""v01_60040""><source src=""talk/11/v01_60040.opus"" type=""audio/ogg; codecs=opus""></audio><a href=""javascript:void(0)"" onclick=""document.getElementById('v01_60040').play()"">私たちに対してというより、<br/>他ならぬ、ヴァンさん自身に対して。</a>",,"<img class=""itp-kuro"" src=""itp/11/avfc5001_out.webp""/>"
e0700,1,116,Ferry,Agnès...,Agnès...,フェリ,アニエスさん……,"<audio id=""v02_60026""><source src=""talk/11/v02_60026.opus"" type=""audio/ogg; codecs=opus""></audio><a href=""javascript:void(0)"" onclick=""document.getElementById('v02_60026').play()"">アニエスさん……</a>",,"<img class=""itp-kuro"" src=""itp/11/avfc5003_out.webp""/>"
e0700,1,117,Aaron,Ha! Listen to this girl.,Ha! Listen to this girl.,アーロン,ハッ…… 小娘がナマ言いやがって。,"<audio id=""v03_60023""><source src=""talk/11/v03_60023.opus"" type=""audio/ogg; codecs=opus""></audio><a href=""javascript:void(0)"" onclick=""document.getElementById('v03_60023').play()"">ハッ……<br/>小娘がナマ言いやがって。</a>",,"<img class=""itp-kuro"" src=""itp/11/avfc0002_out.webp""/>"
e0700,1,118,Kincaid,"It's that kind of straightforward honesty that has the greatest effect on him, I think.","It's that kind of straightforward honesty that has the<br/>greatest effect on him, I think.",キンケイド,フフ、だがヤツには 何より効く言葉かもしれんな。,"<audio id=""v10_60025""><source src=""talk/11/v10_60025.opus"" type=""audio/ogg; codecs=opus""></audio><a href=""javascript:void(0)"" onclick=""document.getElementById('v10_60025').play()"">フフ、だがヤツには<br/>何より効く言葉かもしれんな。</a>",,"<img class=""itp-kuro"" src=""itp/11/avfc0112_out.webp""/>"
e0700,1,119,Kincaid,(Perhaps if I'd been able to say the same to him seven years ago... No. There's no use in dwelling on the past.),(Perhaps if I'd been able to say the same to him seven<br/>years ago... No. There's no use in dwelling on<br/>the past.),キンケイド,（……７年前に同じことが   言えていたら──いや、繰言か。）,"<audio id=""v10_60026""><source src=""talk/11/v10_60026.opus"" type=""audio/ogg; codecs=opus""></audio><a href=""javascript:void(0)"" onclick=""document.getElementById('v10_60026').play()"">（……７年前に同じことが<br/>  言えていたら──いや、繰言か。）</a>",,"<img class=""itp-kuro"" src=""itp/11/avfc0112_out.webp""/>"
e0700,1,120,Kincaid,"We're almost at the end of the corridor. Get ready, team.","We're almost at the end of the corridor. Get<br/>ready, team.",キンケイド,連絡通路も終わりだ── そろそろ引き締めるとしよう。,連絡通路も終わりだ──<br/>そろそろ引き締めるとしよう。,,"<img class=""itp-kuro"" src=""itp/11/avfc0112_out.webp""/>"
e0700,1,121,Kincaid,"Now that we've come this far, I'm determined to make it to the end before he does.","Now that we've come this far, I'm determined to<br/>make it to the end before he does.",キンケイド,ここまで来たら何としても ヤツより先に辿り着かなくてはな。,ここまで来たら何としても<br/>ヤツより先に辿り着かなくてはな。,,"<img class=""itp-kuro"" src=""itp/11/avfc0112_out.webp""/>"
e0700,1,122,Aaron,Then let's get a move on!,Then let's get a move on!,アーロン,乗ったぜ！,乗ったぜ！,,"<img class=""itp-kuro"" src=""itp/11/avfc0002_out.webp""/>"
e0700,1,123,Ferry,Right!,Right!,フェリ,了解（ウーラ）っ！,了解（ウーラ）っ！,,"<img class=""itp-kuro"" src=""itp/11/avfc5003_out.webp""/>"
e0700,1,124,Agnes,"*sigh* This isn't a race, you know...","*sigh* This isn't a race, you know...",アニエス,もう…… 別に勝負じゃないんですから。,もう……<br/>別に勝負じゃないんですから。,,"<img class=""itp-kuro"" src=""itp/11/avfc5001_out.webp""/>"
e0700,1,125,Agnes,(...Even if I admittedly do want to see everyone's faces again as soon as possible.),(...Even if I admittedly do want to see everyone's<br/>faces again as soon as possible.),アニエス,（でも会いたいな……   早くヴァンさんたちに。）,（でも会いたいな……<br/>  早くヴァンさんたちに。）,,"<img class=""itp-kuro"" src=""itp/11/avfc5001_out.webp""/>"
