gameId,fname,scene,row,engChrName,engSearchText,engHtmlText,jpnChrName,jpnSearchText,jpnHtmlText,opName,pcIconHtml,evoIconHtml
e0710,1,1,Agnes,Renne! Renne!,Renne! Renne!,アニエス,先輩……！　レン先輩……！,"<audio id=""v01_60053""><source src=""talk/11/v01_60053.opus"" type=""audio/ogg; codecs=opus""></audio><a href=""javascript:void(0)"" onclick=""document.getElementById('v01_60053').play()"">先輩……！　レン先輩……！</a>",,"<img class=""itp-kuro"" src=""itp/11/avfc5001_out.webp""/>"
e0710,1,2,Ren,"Cross... Help me, Cross...","Cross... Help me, Cross...",レン,……クロス、助けてよクロス……,"<audio id=""v13_60015""><source src=""talk/11/v13_60015.opus"" type=""audio/ogg; codecs=opus""></audio><a href=""javascript:void(0)"" onclick=""document.getElementById('v13_60015').play()"">……クロス、助けてよクロス……</a>",,
e0710,1,3,Ren,Thank you very much I'm very happy I hope you enjoyed yourself please come again.,Thank you very much I'm very happy I hope you<br/>enjoyed yourself please come again.,レン,ありがとうございますウレシイですタノしんで もらえましたかマタいらしてください……,"<audio id=""v13_60016""><source src=""talk/11/v13_60016.opus"" type=""audio/ogg; codecs=opus""></audio><a href=""javascript:void(0)"" onclick=""document.getElementById('v13_60016').play()"">ありがとうございますウレシイですタノしんで<br/>もらえましたかマタいらしてください……</a>",,
e0710,1,4,Ren,Mama... Papa... Where are you...?,Mama... Papa... Where are you...?,レン,どこ……パパ……ママ……,"<audio id=""v13_60017""><source src=""talk/11/v13_60017.opus"" type=""audio/ogg; codecs=opus""></audio><a href=""javascript:void(0)"" onclick=""document.getElementById('v13_60017').play()"">どこ……パパ……ママ……</a>",,
e0710,1,5,Ren,Lo... Josh... Est... Ti...,Lo... Josh... Est... Ti...,レン,レー………ヨシュ……… ………エス………ティ…………,"<audio id=""v13_60018""><source src=""talk/11/v13_60018.opus"" type=""audio/ogg; codecs=opus""></audio><a href=""javascript:void(0)"" onclick=""document.getElementById('v13_60018').play()"">レー………ヨシュ………<br/>………エス………ティ…………</a>",,
e0710,1,6,Ren,Why? Why can't I remember...?,Why? Why can't I remember...?,レン,ドウして……ナンデ思い出せ………,"<audio id=""v13_60019""><source src=""talk/11/v13_60019.opus"" type=""audio/ogg; codecs=opus""></audio><a href=""javascript:void(0)"" onclick=""document.getElementById('v13_60019').play()"">ドウして……ナンデ思い出せ………</a>",,
e0710,1,7,Agnes,...,...,アニエス,っ……,"<audio id=""v01_60054""><source src=""talk/11/v01_60054.opus"" type=""audio/ogg; codecs=opus""></audio><a href=""javascript:void(0)"" onclick=""document.getElementById('v01_60054').play()"">っ……</a>",,"<img class=""itp-kuro"" src=""itp/11/avfc5001_out.webp""/>"
e0710,1,8,Agnes,"Their names are Estelle, Joshua, Tita, and Loewe!","Their names are Estelle, Joshua, Tita, and Loewe!",アニエス,──エステルさんにヨシュアさん、 ティータさんにレーヴェさんでしょう！？,"<audio id=""v01_60055""><source src=""talk/11/v01_60055.opus"" type=""audio/ogg; codecs=opus""></audio><a href=""javascript:void(0)"" onclick=""document.getElementById('v01_60055').play()"">──エステルさんにヨシュアさん、<br/>ティータさんにレーヴェさんでしょう！？</a>",,"<img class=""itp-kuro"" src=""itp/11/avfc5001_out.webp""/>"
e0710,1,9,Agnes,"You have to come back to us, Renne! Please—we're here for you!","You have to come back to us, Renne!<br/>Please—we're here for you!",アニエス,戻ってきてくださいレン先輩！ まずは私たちのところに──！！,"<audio id=""v01_60056""><source src=""talk/11/v01_60056.opus"" type=""audio/ogg; codecs=opus""></audio><a href=""javascript:void(0)"" onclick=""document.getElementById('v01_60056').play()"">戻ってきてくださいレン先輩！<br/>まずは私たちのところに──！！</a>",,"<img class=""itp-kuro"" src=""itp/11/avfc5001_out.webp""/>"
e0710,1,10,Ren,...,...,レン,………ぁ……………,"<audio id=""v13_60020""><source src=""talk/11/v13_60020.opus"" type=""audio/ogg; codecs=opus""></audio><a href=""javascript:void(0)"" onclick=""document.getElementById('v13_60020').play()"">………ぁ……………</a>",,
e0710,1,11,Ren,"Oh, how foolish... I let it get the better of me.","Oh, how foolish... I let it get the better of me.",レン,いけないいけない…… ……つい持ってかれてたわ……,"<audio id=""v13_60021""><source src=""talk/11/v13_60021.opus"" type=""audio/ogg; codecs=opus""></audio><a href=""javascript:void(0)"" onclick=""document.getElementById('v13_60021').play()"">いけないいけない……<br/>……つい持ってかれてたわ……</a>",,
e0710,1,12,Ren,I wonder...if these spheres...,I wonder...if these spheres...,レン,なるほど……この魔球はもしかして……,"<audio id=""v13_60022""><source src=""talk/11/v13_60022.opus"" type=""audio/ogg; codecs=opus""></audio><a href=""javascript:void(0)"" onclick=""document.getElementById('v13_60022').play()"">なるほど……この魔球はもしかして……</a>",,
e0710,1,13,Agnes,Renne!,Renne!,アニエス,レン先輩……！,"<audio id=""v01_60057""><source src=""talk/11/v01_60057.opus"" type=""audio/ogg; codecs=opus""></audio><a href=""javascript:void(0)"" onclick=""document.getElementById('v01_60057').play()"">レン先輩……！</a>",,"<img class=""itp-kuro"" src=""itp/11/avfc5001_out.webp""/>"
e0710,1,14,Ren,"Agnès, no! Get back!","Agnès, no! Get back!",レン,いけないアニエス── 下がりなさい……！,"<audio id=""v13_60023""><source src=""talk/11/v13_60023.opus"" type=""audio/ogg; codecs=opus""></audio><a href=""javascript:void(0)"" onclick=""document.getElementById('v13_60023').play()"">いけないアニエス──<br/>下がりなさい……！</a>",,
e0710,1,15,Ren,Argh!,Argh!,レン,あうっ……,"<audio id=""v13_60024""><source src=""talk/11/v13_60024.opus"" type=""audio/ogg; codecs=opus""></audio><a href=""javascript:void(0)"" onclick=""document.getElementById('v13_60024').play()"">あうっ……</a>",,
e0710,1,16,Agnes,Aaah!,Aaah!,アニエス,きゃああっ……,"<audio id=""v01_60058""><source src=""talk/11/v01_60058.opus"" type=""audio/ogg; codecs=opus""></audio><a href=""javascript:void(0)"" onclick=""document.getElementById('v01_60058').play()"">きゃああっ……</a>",,"<img class=""itp-kuro"" src=""itp/11/avfc5001_out.webp""/>"
e0710,1,17,Ren,"You have to stay away, Agnès! Right now it's focused on me!","You have to stay away, Agnès! Right now it's focused<br/>on me!",レン,は、離れなさいアニエス…… こいつの興味は私に移った……,"<audio id=""v13_60025""><source src=""talk/11/v13_60025.opus"" type=""audio/ogg; codecs=opus""></audio><a href=""javascript:void(0)"" onclick=""document.getElementById('v13_60025').play()"">は、離れなさいアニエス……<br/>こいつの興味は私に移った……</a>",,
e0710,1,18,Ren,I'll try and hold out until help comes!,I'll try and hold out until help comes!,レン,何とか凌げばそのうち助けが……,"<audio id=""v13_60026""><source src=""talk/11/v13_60026.opus"" type=""audio/ogg; codecs=opus""></audio><a href=""javascript:void(0)"" onclick=""document.getElementById('v13_60026').play()"">何とか凌げばそのうち助けが……</a>",,
e0710,1,19,Agnes,I... I won't! I want to keep those I care about safe by my own hand!,I... I won't! I want to keep those I care about safe by<br/>my own hand!,アニエス,で、できませんっ……！ 大切な人はこの手で守りたいんです！,"<audio id=""v01_60059""><source src=""talk/11/v01_60059.opus"" type=""audio/ogg; codecs=opus""></audio><a href=""javascript:void(0)"" onclick=""document.getElementById('v01_60059').play()"">で、できませんっ……！<br/>大切な人はこの手で守りたいんです！</a>",,"<img class=""itp-kuro"" src=""itp/11/avfc5001_out.webp""/>"
e0710,1,20,Agnes,Just like you and Van always have!,Just like you and Van always have!,アニエス,先輩やヴァンさんたちみたいに……！,"<audio id=""v01_60060""><source src=""talk/11/v01_60060.opus"" type=""audio/ogg; codecs=opus""></audio><a href=""javascript:void(0)"" onclick=""document.getElementById('v01_60060').play()"">先輩やヴァンさんたちみたいに……！</a>",,"<img class=""itp-kuro"" src=""itp/11/avfc5001_out.webp""/>"
e0710,1,21,Ren,...,...,レン,……ぁ…………,"<audio id=""v13_60027""><source src=""talk/11/v13_60027.opus"" type=""audio/ogg; codecs=opus""></audio><a href=""javascript:void(0)"" onclick=""document.getElementById('v13_60027').play()"">……ぁ…………</a>",,
e0710,1,22,Van,Heh. Growin' up right before my eyes!,Heh. Growin' up right before my eyes!,ヴァン,ハッ…… 言うようになったじゃねえか！,"<audio id=""v00_60042""><source src=""talk/11/v00_60042.opus"" type=""audio/ogg; codecs=opus""></audio><a href=""javascript:void(0)"" onclick=""document.getElementById('v00_60042').play()"">ハッ……<br/>言うようになったじゃねえか！</a>",,"<img class=""itp-kuro"" src=""itp/11/avfc0000_out.webp""/>"
e0710,1,23,Agnes,Ah...,Ah...,アニエス,あ──……,あ──……,,"<img class=""itp-kuro"" src=""itp/11/avfc5001_out.webp""/>"
e0710,1,24,Ren,"Heehee. You took your time, my prince... Zin's here, too?","Heehee. You took your time, my prince... Zin's<br/>here, too?",レン,ふふ……遅いじゃない王子様…… ……ってジンさんまで………,"<audio id=""v13_60028""><source src=""talk/11/v13_60028.opus"" type=""audio/ogg; codecs=opus""></audio><a href=""javascript:void(0)"" onclick=""document.getElementById('v13_60028').play()"">ふふ……遅いじゃない王子様……<br/>……ってジンさんまで………</a>",,
e0710,1,25,Ren,"Heehee. You took your time, my prince... Walter's here, too?","Heehee. You took your time, my prince...<br/>Walter's here, too?",レン,ふふ……遅いじゃない王子様…… ……ってヴァルターまで………,"<audio id=""v13_60029""><source src=""talk/11/v13_60029.opus"" type=""audio/ogg; codecs=opus""></audio><a href=""javascript:void(0)"" onclick=""document.getElementById('v13_60029').play()"">ふふ……遅いじゃない王子様……<br/>……ってヴァルターまで………</a>",,
e0710,1,26,Ferry,"Sorry for the wait, Agnès!","Sorry for the wait, Agnès!",フェリ,アニエスさん、お待たせしました！,"<audio id=""v02_60044""><source src=""talk/11/v02_60044.opus"" type=""audio/ogg; codecs=opus""></audio><a href=""javascript:void(0)"" onclick=""document.getElementById('v02_60044').play()"">アニエスさん、お待たせしました！</a>",,"<img class=""itp-kuro"" src=""itp/11/avfc5003_out.webp""/>"
e0710,1,27,Aaron,Wow. Not often we get to see YOU in a bind!,Wow. Not often we get to see YOU in a bind!,アーロン,ハッ、チート娘も 珍しくピンチみてぇだな！,"<audio id=""v03_60040""><source src=""talk/11/v03_60040.opus"" type=""audio/ogg; codecs=opus""></audio><a href=""javascript:void(0)"" onclick=""document.getElementById('v03_60040').play()"">ハッ、チート娘も<br/>珍しくピンチみてぇだな！</a>",,"<img class=""itp-kuro"" src=""itp/11/avfc0002_out.webp""/>"
e0710,1,28,Immovable Jin,"You did great, Renne! Now leave the rest to us!","You did great, Renne! Now leave the rest to us!",不動のジン,よく凌いだレン、後は任せろ！,"<audio id=""v11_60008""><source src=""talk/11/v11_60008.opus"" type=""audio/ogg; codecs=opus""></audio><a href=""javascript:void(0)"" onclick=""document.getElementById('v11_60008').play()"">よく凌いだレン、後は任せろ！</a>",,"<img class=""itp-kuro"" src=""itp/11/avfc0111_out.webp""/>"
e0710,1,29,Walter the Skinny Wolf,"Hahaha! C'mon! This ain't like you one bit, Renne!","Hahaha! C'mon! This ain't like you one bit, Renne!",痩せ狼ヴァルター,クカカ！ らしくねえじゃねえか、レン！,"<audio id=""v25_60004""><source src=""talk/11/v25_60004.opus"" type=""audio/ogg; codecs=opus""></audio><a href=""javascript:void(0)"" onclick=""document.getElementById('v25_60004').play()"">クカカ！<br/>らしくねえじゃねえか、レン！</a>",,"<img class=""itp-kuro"" src=""itp/11/avfc0113_out.webp""/>"
e0710,1,30,Bellegarde,Here we go!,Here we go!,ベルガルド,来るぞ──！,"<audio id=""v07_60037""><source src=""talk/11/v07_60037.opus"" type=""audio/ogg; codecs=opus""></audio><a href=""javascript:void(0)"" onclick=""document.getElementById('v07_60037').play()"">来るぞ──！</a>",,"<img class=""itp-kuro"" src=""itp/11/avfc0006_out.webp""/>"
e0710,1,31,Lisette,One large and four medium-sized foes!,One large and four medium-sized foes!,リゼット,大型１、中型４です！,"<audio id=""v04_60055""><source src=""talk/11/v04_60055.opus"" type=""audio/ogg; codecs=opus""></audio><a href=""javascript:void(0)"" onclick=""document.getElementById('v04_60055').play()"">大型１、中型４です！</a>",,"<img class=""itp-kuro"" src=""itp/11/avfc5005_out.webp""/>"
e0710,1,32,Van,You sure you're up to this?,You sure you're up to this?,ヴァン,おい、大丈夫なのか……！？,"<audio id=""v00_60043""><source src=""talk/11/v00_60043.opus"" type=""audio/ogg; codecs=opus""></audio><a href=""javascript:void(0)"" onclick=""document.getElementById('v00_60043').play()"">おい、大丈夫なのか……！？</a>",,"<img class=""itp-kuro"" src=""itp/11/avfc0000_out.webp""/>"
e0710,1,33,Agnes,"I'm a little tired, but I'm fine. Please, let me fight with you!","I'm a little tired, but I'm fine. Please, let me fight<br/>with you!",アニエス,少し疲れただけです…… どうか私も戦わせてください！,"<audio id=""v01_60062""><source src=""talk/11/v01_60062.opus"" type=""audio/ogg; codecs=opus""></audio><a href=""javascript:void(0)"" onclick=""document.getElementById('v01_60062').play()"">少し疲れただけです……<br/>どうか私も戦わせてください！</a>",,"<img class=""itp-kuro"" src=""itp/11/avfc5001_out.webp""/>"
e0710,1,34,Agnes,I want to protect what I hold dear—as a proud part-timer at Arkride Solutions!,I want to protect what I hold dear—as a proud<br/>part-timer at Arkride Solutions!,アニエス,解決事務所の一員として── 大切なものをこの手で守るために！,"<audio id=""v01_60063""><source src=""talk/11/v01_60063.opus"" type=""audio/ogg; codecs=opus""></audio><a href=""javascript:void(0)"" onclick=""document.getElementById('v01_60063').play()"">解決事務所の一員として──<br/>大切なものをこの手で守るために！</a>",,"<img class=""itp-kuro"" src=""itp/11/avfc5001_out.webp""/>"
e0710,1,35,Ferry,Agnès!,Agnès!,フェリ,アニエスさん……！,"<audio id=""v02_60045""><source src=""talk/11/v02_60045.opus"" type=""audio/ogg; codecs=opus""></audio><a href=""javascript:void(0)"" onclick=""document.getElementById('v02_60045').play()"">アニエスさん……！</a>",,"<img class=""itp-kuro"" src=""itp/11/avfc5003_out.webp""/>"
e0710,1,36,Ren,Unbelievable...,Unbelievable...,レン,……まったく………,"<audio id=""v13_60030""><source src=""talk/11/v13_60030.opus"" type=""audio/ogg; codecs=opus""></audio><a href=""javascript:void(0)"" onclick=""document.getElementById('v13_60030').play()"">……まったく………</a>",,
e0710,1,37,Van,"Got'cha. Then go ahead and show off, Agnès!","Got'cha. Then go ahead and show off, Agnès!",ヴァン,上等だ── 気合を入れろよアニエス！,"<audio id=""v00_60044""><source src=""talk/11/v00_60044.opus"" type=""audio/ogg; codecs=opus""></audio><a href=""javascript:void(0)"" onclick=""document.getElementById('v00_60044').play()"">上等だ──<br/>気合を入れろよアニエス！</a>",,"<img class=""itp-kuro"" src=""itp/11/avfc0000_out.webp""/>"
e0710,1,38,Agnes,Right!,Right!,アニエス,はいっ……！,"<audio id=""v01_60064""><source src=""talk/11/v01_60064.opus"" type=""audio/ogg; codecs=opus""></audio><a href=""javascript:void(0)"" onclick=""document.getElementById('v01_60064').play()"">はいっ……！</a>",,"<img class=""itp-kuro"" src=""itp/11/avfc5001_out.webp""/>"
e0710,2,39,Agnes,Oh!,Oh!,アニエス,あ……,あ……,,"<img class=""itp-kuro"" src=""itp/11/avfc5001_out.webp""/>"
e0710,2,40,Immovable Jin,"Nice. We did it, huh?","Nice. We did it, huh?",不動のジン,フッ、やったか。,フッ、やったか。,,"<img class=""itp-kuro"" src=""itp/11/avfc0111_out.webp""/>"
e0710,2,41,Walter the Skinny Wolf,"Get outta our faces, ya damn ball.","Get outta our faces, ya damn ball.",痩せ狼ヴァルター,ハッ、逝けやクソ球。,ハッ、逝けやクソ球。,,"<img class=""itp-kuro"" src=""itp/11/avfc0113_out.webp""/>"
e0710,2,42,Ren,Phew... We can finally get out of here.,Phew... We can finally get out of here.,レン,フフ…… ……やっと戻れるわね……,フフ……<br/>……やっと戻れるわね……,,
e0710,2,43,Van,Yeah. I've got you.,Yeah. I've got you.,ヴァン,ああ……掴まってろ。,ああ……掴まってろ。,,"<img class=""itp-kuro"" src=""itp/11/avfc0000_out.webp""/>"
e0710,3,44,Quatre,"Why, Mom...? Why, Dad...?","Why, Mom...? Why, Dad...?",カトル,どうして……… ……パパ……ママ………,"<audio id=""v05_60031""><source src=""talk/11/v05_60031.opus"" type=""audio/ogg; codecs=opus""></audio><a href=""javascript:void(0)"" onclick=""document.getElementById('v05_60031').play()"">どうして………<br/>……パパ……ママ………</a>",,"<img class=""itp-kuro"" src=""itp/11/avfc0004_out.webp""/>"
e0710,3,45,Quatre,I don't...want this... I don't want to be...,I don't...want this... I don't want to be...,カトル,………わたし………ぼく………… ……──しになんかになりたく………,"<audio id=""v05_60032""><source src=""talk/11/v05_60032.opus"" type=""audio/ogg; codecs=opus""></audio><a href=""javascript:void(0)"" onclick=""document.getElementById('v05_60032').play()"">………わたし………ぼく…………<br/>……──しになんかになりたく………</a>",,"<img class=""itp-kuro"" src=""itp/11/avfc0004_out.webp""/>"
e0710,3,46,Paulette,"Quatre! Hang in there, Quatre!","Quatre! Hang in there, Quatre!",ポーレット,カトル君……！？ 大丈夫、しっかりして……！,"<audio id=""v16_60003""><source src=""talk/11/v16_60003.opus"" type=""audio/ogg; codecs=opus""></audio><a href=""javascript:void(0)"" onclick=""document.getElementById('v16_60003').play()"">カトル君……！？<br/>大丈夫、しっかりして……！</a>",,
e0710,3,47,Dream,Please don't cry! We're here for you!,Please don't cry! We're here for you!,ユメ,カトルー、なかないでー！ ユメたちがついてるから～！,"<audio id=""v41_60003""><source src=""talk/11/v41_60003.opus"" type=""audio/ogg; codecs=opus""></audio><a href=""javascript:void(0)"" onclick=""document.getElementById('v41_60003').play()"">カトルー、なかないでー！<br/>ユメたちがついてるから～！</a>",,
e0710,3,48,Van,"Sorry for the wait, you three!","Sorry for the wait, you three!",ヴァン,待たせたな──３人とも！,"<audio id=""v00_60045""><source src=""talk/11/v00_60045.opus"" type=""audio/ogg; codecs=opus""></audio><a href=""javascript:void(0)"" onclick=""document.getElementById('v00_60045').play()"">待たせたな──３人とも！</a>",,"<img class=""itp-kuro"" src=""itp/11/avfc0000_out.webp""/>"
e0710,3,49,Paulette,Y-You're here!,Y-You're here!,ポーレット,み、みんな……！,"<audio id=""v16_60004""><source src=""talk/11/v16_60004.opus"" type=""audio/ogg; codecs=opus""></audio><a href=""javascript:void(0)"" onclick=""document.getElementById('v16_60004').play()"">み、みんな……！</a>",,
e0710,3,50,Dream,Oh! Everybody's here!,Oh! Everybody's here!,ユメ,あー、ヴァンたちだー！,"<audio id=""v41_60004""><source src=""talk/11/v41_60004.opus"" type=""audio/ogg; codecs=opus""></audio><a href=""javascript:void(0)"" onclick=""document.getElementById('v41_60004').play()"">あー、ヴァンたちだー！</a>",,
e0710,3,51,Ferry,Yumé! Thank goodness you're okay!,Yumé! Thank goodness you're okay!,フェリ,ユメちゃん、よかった……！,ユメちゃん、よかった……！,,"<img class=""itp-kuro"" src=""itp/11/avfc5003_out.webp""/>"
e0710,3,52,Agnes,Quatre! Paulette!,Quatre! Paulette!,アニエス,カトル君にポーレットさんも……！,カトル君にポーレットさんも……！,,"<img class=""itp-kuro"" src=""itp/11/avfc5001_out.webp""/>"
e0710,3,53,Judith,The heroes of justice are here to save the day!,The heroes of justice are here to save the day!,ジュディス,ふふっ…… 正義のミカタが助けにきたわよ！,ふふっ……<br/>正義のミカタが助けにきたわよ！,,"<img class=""itp-kuro"" src=""itp/11/avfc5007_out.webp""/>"
e0710,3,54,Van,"Can you handle this, Master?","Can you handle this, Master?",ヴァン,師父（せんせい）、頼みます！,師父（せんせい）、頼みます！,,"<img class=""itp-kuro"" src=""itp/11/avfc0000_out.webp""/>"
e0710,3,55,Bellegarde,Gladly!,Gladly!,ベルガルド,承知──！,承知──！,,"<img class=""itp-kuro"" src=""itp/11/avfc0006_out.webp""/>"
e0710,3,56,Bellegarde,Return!,Return!,ベルガルド,──活！,<S5>──活！,,"<img class=""itp-kuro"" src=""itp/11/avfc0006_out.webp""/>"
e0710,3,57,Quatre,...?!,...?!,カトル,っ……！？,"<audio id=""v05_60033""><source src=""talk/11/v05_60033.opus"" type=""audio/ogg; codecs=opus""></audio><a href=""javascript:void(0)"" onclick=""document.getElementById('v05_60033').play()"">っ……！？</a>",,"<img class=""itp-kuro"" src=""itp/11/avfc0004_out.webp""/>"
e0710,3,58,Quatre,"Where am I...? Right... That giant sphere absorbed us, then...","Where am I...? Right... That giant sphere absorbed<br/>us, then...",カトル,ここって── そうだ、魔球に呑み込まれて……！,"<audio id=""v05_60034""><source src=""talk/11/v05_60034.opus"" type=""audio/ogg; codecs=opus""></audio><a href=""javascript:void(0)"" onclick=""document.getElementById('v05_60034').play()"">ここって──<br/>そうだ、魔球に呑み込まれて……！</a>",,"<img class=""itp-kuro"" src=""itp/11/avfc0004_out.webp""/>"
e0710,3,59,Quatre,Bergard! Van! You all came for me!,Bergard! Van! You all came for me!,カトル,ベルガルドさん……ヴァンさんたち！,"<audio id=""v05_60035""><source src=""talk/11/v05_60035.opus"" type=""audio/ogg; codecs=opus""></audio><a href=""javascript:void(0)"" onclick=""document.getElementById('v05_60035').play()"">ベルガルドさん……ヴァンさんたち！</a>",,"<img class=""itp-kuro"" src=""itp/11/avfc0004_out.webp""/>"
e0710,3,60,Agnes,Of course we did.,Of course we did.,アニエス,カトル君、よかった……！,カトル君、よかった……！,,"<img class=""itp-kuro"" src=""itp/11/avfc5001_out.webp""/>"
e0710,3,61,Aaron,"Yep. Time to wake up, sleepyhead!","Yep. Time to wake up, sleepyhead!",アーロン,ハッ、盛大に寝ぼけてたみてーだな！,ハッ、盛大に寝ぼけてたみてーだな！,,"<img class=""itp-kuro"" src=""itp/11/avfc0002_out.webp""/>"
e0710,3,62,FIO,Quatre is back!,Quatre is back!,ＦＩＯ,カトル、戻ッタ……！,"<audio id=""v73_60005""><source src=""talk/11/v73_60005.opus"" type=""audio/ogg; codecs=opus""></audio><a href=""javascript:void(0)"" onclick=""document.getElementById('v73_60005').play()"">カトル、戻ッタ……！</a>",,
e0710,3,63,XEROS,RUFF!,RUFF!,ＸＥＲＯＳ,ＢＯＷＷＯＷ！,"<audio id=""se_k10511""><source src=""talk/11/se_k10511.opus"" type=""audio/ogg; codecs=opus""></audio><a href=""javascript:void(0)"" onclick=""document.getElementById('se_k10511').play()"">ＢＯＷＷＯＷ！</a>",,
e0710,3,64,Quatre,"Was it you two who led everyone here, then? Thank you... It looks like we're not out of the woods yet, huh?","Was it you two who led everyone here, then?<br/>Thank you... It looks like we're not out of the<br/>woods yet, huh?",カトル,そうか、お前たちがヴァンさんを…… ……ここが踏ん張り所みたいだね！,"<audio id=""v05_60036""><source src=""talk/11/v05_60036.opus"" type=""audio/ogg; codecs=opus""></audio><a href=""javascript:void(0)"" onclick=""document.getElementById('v05_60036').play()"">そうか、お前たちがヴァンさんを……<br/>……ここが踏ん張り所みたいだね！</a>",,"<img class=""itp-kuro"" src=""itp/11/avfc0004_out.webp""/>"
e0710,3,65,Lesha,On your guard! They're about to strike!,On your guard! They're about to strike!,リーシャ,気をつけて──来ます！,気をつけて──来ます！,,"<img class=""itp-kuro"" src=""itp/11/avfc5113_out.webp""/>"
e0710,3,66,Van,We'll see about that!,We'll see about that!,ヴァン,ああ、ケリを付けるぞ！,ああ、ケリを付けるぞ！,,"<img class=""itp-kuro"" src=""itp/11/avfc0000_out.webp""/>"
e0710,3,67,Ferry,Are you sure you're up for this?,Are you sure you're up for this?,フェリ,だ、大丈夫なんですかっ？,だ、大丈夫なんですかっ？,,"<img class=""itp-kuro"" src=""itp/11/avfc5003_out.webp""/>"
