gameId,fname,scene,row,engChrName,engSearchText,engHtmlText,jpnChrName,jpnSearchText,jpnHtmlText,opName,pcIconHtml,evoIconHtml
l1000,13,370,Kirika,"Heheh. Oh, and incidentally, he asked me to deliver a message to you.","Heheh. Oh, and incidentally, he asked me to deliver a<br/>message to you.",キリカ,フフ、彼から伝言を預かっているわ。,"<audio id=""v12_60007""><source src=""talk/11/v12_60007.opus"" type=""audio/ogg; codecs=opus""></audio><a href=""javascript:void(0)"" onclick=""document.getElementById('v12_60007').play()"">フフ、彼から伝言を預かっているわ。</a>",,
l1000,13,371,Kirika,'I expect that you'll repay me for all this help at a later date. I'll settle for a drink at Bermotti's.','I expect that you'll repay me for all this help at a<br/>later date. I'll settle for a drink at Bermotti's.',キリカ,『手を貸した分、ケリが付いたら返せ。   ベルモッティさんの所で一杯でいい。』,"<audio id=""v12_60008""><source src=""talk/11/v12_60008.opus"" type=""audio/ogg; codecs=opus""></audio><a href=""javascript:void(0)"" onclick=""document.getElementById('v12_60008').play()"">『手を貸した分、ケリが付いたら返せ。<br/>  ベルモッティさんの所で一杯でいい。』</a>",,
l1000,13,372,Kirika,"'You will be buying one for Elaine, too, of course.'","'You will be buying one for Elaine, too, of course.'",キリカ,『もちろんエレインの分もな』だそうよ。,"<audio id=""v12_60009""><source src=""talk/11/v12_60009.opus"" type=""audio/ogg; codecs=opus""></audio><a href=""javascript:void(0)"" onclick=""document.getElementById('v12_60009').play()"">『もちろんエレインの分もな』だそうよ。</a>",,
l1000,13,373,Van,That son of a...,That son of a...,ヴァン,あの野郎……,"<audio id=""v00_60058""><source src=""talk/11/v00_60058.opus"" type=""audio/ogg; codecs=opus""></audio><a href=""javascript:void(0)"" onclick=""document.getElementById('v00_60058').play()"">あの野郎……</a>",,"<img class=""itp-kuro"" src=""itp/11/avfc0000_out.webp""/>"
l1000,13,374,Agnes,Heehee. I don't think you'll be getting out of that one.,Heehee. I don't think you'll be getting out of<br/>that one.,アニエス,ふふっ……ちゃんと 約束は果たさないとですね。,"<audio id=""v01_60068""><source src=""talk/11/v01_60068.opus"" type=""audio/ogg; codecs=opus""></audio><a href=""javascript:void(0)"" onclick=""document.getElementById('v01_60068').play()"">ふふっ……ちゃんと<br/>約束は果たさないとですね。</a>",,"<img class=""itp-kuro"" src=""itp/11/avfc5001_out.webp""/>"
l1000,13,375,Giscard Chief Technology Officer,Preparations are complete. We're good to go whenever!,Preparations are complete. We're good to<br/>go whenever!,ジスカール技術長,準備完了だ──いつでも行けるぜ！,"<audio id=""v70_60001""><source src=""talk/11/v70_60001.opus"" type=""audio/ogg; codecs=opus""></audio><a href=""javascript:void(0)"" onclick=""document.getElementById('v70_60001').play()"">準備完了だ──いつでも行けるぜ！</a>",,
l1000,13,376,Associate Professor Esmere,The orbal network's remaining processing power has been transferred to the buster lance.,The orbal network's remaining processing power has<br/>been transferred to the buster lance.,エスメレー准教授,仮想導力ネットの全リソース、 バスターランサーに接続済みです～！,"<audio id=""v48_60002""><source src=""talk/11/v48_60002.opus"" type=""audio/ogg; codecs=opus""></audio><a href=""javascript:void(0)"" onclick=""document.getElementById('v48_60002').play()"">仮想導力ネットの全リソース、<br/>バスターランサーに接続済みです～！</a>",,
l1000,13,377,Dr. Hamilton,Thank you both for your assistance.,Thank you both for your assistance.,ハミルトン博士,ありがとう技術長、エスメレーも。,"<audio id=""v23_60013""><source src=""talk/11/v23_60013.opus"" type=""audio/ogg; codecs=opus""></audio><a href=""javascript:void(0)"" onclick=""document.getElementById('v23_60013').play()"">ありがとう技術長、エスメレーも。</a>",,
l1000,13,378,Professor Cronkite,Well? Are you ready to go?,Well? Are you ready to go?,クロンカイト教授,さて── そちらの覚悟は完了か？,"<audio id=""v49_60006""><source src=""talk/11/v49_60006.opus"" type=""audio/ogg; codecs=opus""></audio><a href=""javascript:void(0)"" onclick=""document.getElementById('v49_60006').play()"">さて──<br/>そちらの覚悟は完了か？</a>",,
l1000,13,379,Van,"Damn right, we are!","Damn right, we are!",ヴァン,当たり前だ──！,"<audio id=""v00_60059""><source src=""talk/11/v00_60059.opus"" type=""audio/ogg; codecs=opus""></audio><a href=""javascript:void(0)"" onclick=""document.getElementById('v00_60059').play()"">当たり前だ──！</a>",,"<img class=""itp-kuro"" src=""itp/11/avfc0000_out.webp""/>"
l1000,13,380,Agnes,"Thank you, everyone!","Thank you, everyone!",アニエス,よろしくお願いします！,"<audio id=""v01_60069""><source src=""talk/11/v01_60069.opus"" type=""audio/ogg; codecs=opus""></audio><a href=""javascript:void(0)"" onclick=""document.getElementById('v01_60069').play()"">よろしくお願いします！</a>",,"<img class=""itp-kuro"" src=""itp/11/avfc5001_out.webp""/>"
l1000,13,381,Dr. Hamilton,"First, we must charge the buster lance to just below critical levels. If you would, good sir?","First, we must charge the buster lance to just below<br/>critical levels. If you would, good sir?",ハミルトン博士,まずは臨界手前まで充填します。 カシム主任、始めてください。,"<audio id=""v23_60014""><source src=""talk/11/v23_60014.opus"" type=""audio/ogg; codecs=opus""></audio><a href=""javascript:void(0)"" onclick=""document.getElementById('v23_60014').play()"">まずは臨界手前まで充填します。<br/>カシム主任、始めてください。</a>",,
l1000,13,382,Security Chief Qasim,Understood. Charging now.,Understood. Charging now.,カシム警備主任,承知した──充填開始する。,"<audio id=""v26_60008""><source src=""talk/11/v26_60008.opus"" type=""audio/ogg; codecs=opus""></audio><a href=""javascript:void(0)"" onclick=""document.getElementById('v26_60008').play()"">承知した──充填開始する。</a>",,
l1000,13,383,Security Chief Qasim,3%... 5%... 10%... 15%... 20%...,3%... 5%... 10%... 15%... 20%...,カシム警備主任,……３％……５％…… ……１０……１５……２０……,"<audio id=""v26_60009""><source src=""talk/11/v26_60009.opus"" type=""audio/ogg; codecs=opus""></audio><a href=""javascript:void(0)"" onclick=""document.getElementById('v26_60009').play()"">……３％……５％……<br/>……１０……１５……２０……</a>",,
l1000,13,384,Guardian Knight Cecil,Damn. Guess they don't call him the strongest warrior for nothing. He's earned that rep.,Damn. Guess they don't call him the strongest<br/>warrior for nothing. He's earned that rep.,守護騎士セリス,チッ……史上最強クラスって 触れ込みも伊達じゃなさそうだな。,"<audio id=""v24_60021""><source src=""talk/11/v24_60021.opus"" type=""audio/ogg; codecs=opus""></audio><a href=""javascript:void(0)"" onclick=""document.getElementById('v24_60021').play()"">チッ……史上最強クラスって<br/>触れ込みも伊達じゃなさそうだな。</a>",,
l1000,13,385,Guardian Knight Cecil,Leon! We can't let that jackass show us up!,Leon! We can't let that jackass show us up!,守護騎士セリス,──リオン！ アタシらも負けてらんねえぞ！,"<audio id=""v24_60022""><source src=""talk/11/v24_60022.opus"" type=""audio/ogg; codecs=opus""></audio><a href=""javascript:void(0)"" onclick=""document.getElementById('v24_60022').play()"">──リオン！<br/>アタシらも負けてらんねえぞ！</a>",,
l1000,13,386,Guardian Knight Lion,"Oh, I couldn't agree more!","Oh, I couldn't agree more!",守護騎士リオン,ええ──勿論ですセリスさん！,"<audio id=""v17_60020""><source src=""talk/11/v17_60020.opus"" type=""audio/ogg; codecs=opus""></audio><a href=""javascript:void(0)"" onclick=""document.getElementById('v17_60020').play()"">ええ──勿論ですセリスさん！</a>",,
l1000,13,387,Guardian Knight Cecil,"Searing seal of mine, shining from the abyss...","Searing seal of mine, shining from the abyss...",守護騎士セリス,『我が深淵にて震えし赫灼（かくしゃく）の刻印よ──』,"<audio id=""v24_60014""><source src=""talk/11/v24_60014.opus"" type=""audio/ogg; codecs=opus""></audio><a href=""javascript:void(0)"" onclick=""document.getElementById('v24_60014').play()"">『我が深淵にて震えし赫灼（かくしゃく）の刻印よ──』</a>",,
l1000,13,388,Guardian Knight Lion,"Glacial seal of mine, shining from the abyss...","Glacial seal of mine, shining from the abyss...",守護騎士リオン,『我が深淵にて凍えし氷焱（ひょうえん）の刻印よ──』,"<audio id=""v17_60021""><source src=""talk/11/v17_60021.opus"" type=""audio/ogg; codecs=opus""></audio><a href=""javascript:void(0)"" onclick=""document.getElementById('v17_60021').play()"">『我が深淵にて凍えし氷焱（ひょうえん）の刻印よ──』</a>",,
l1000,13,389,Ren,"I can handle the fusion process myself, chief! You just say the word, and I'll get it done.","I can handle the fusion process myself, chief!<br/>You just say the word, and I'll get it done.",レン,“合わせる”処理は任せて──！ 室長さん、タイミングは任せるわ！,"<audio id=""v13_60044""><source src=""talk/11/v13_60044.opus"" type=""audio/ogg; codecs=opus""></audio><a href=""javascript:void(0)"" onclick=""document.getElementById('v13_60044').play()"">“合わせる”処理は任せて──！<br/>室長さん、タイミングは任せるわ！</a>",,
l1000,13,390,Kirika,Understood.,Understood.,キリカ,ええ──,"<audio id=""v12_60010""><source src=""talk/11/v12_60010.opus"" type=""audio/ogg; codecs=opus""></audio><a href=""javascript:void(0)"" onclick=""document.getElementById('v12_60010').play()"">ええ──</a>",,
l1000,13,391,Kirika,Three... Two... One... FIRE!,Three... Two... One... FIRE!,キリカ,３、２、１──てえええっ！,"<audio id=""v12_60011""><source src=""talk/11/v12_60011.opus"" type=""audio/ogg; codecs=opus""></audio><a href=""javascript:void(0)"" onclick=""document.getElementById('v12_60011').play()"">３、２、１──てえええっ！</a>",,
l1000,13,392,Guardian Knight Cecil / Guardian Knight Lion,Pulverize it! Solar Prominence! Perforate it! Murgleys' Torment!,Pulverize it! Solar Prominence!<br/>Perforate it! Murgleys' Torment!,守護騎士セリス／守護騎士リオン,『砕け──プロミネンス・アギオン！』 『貫け──ミュルグレス・ペイン！』,"<audio id=""v999_60004""><source src=""talk/11/v999_60004.opus"" type=""audio/ogg; codecs=opus""></audio><a href=""javascript:void(0)"" onclick=""document.getElementById('v999_60004').play()"">『砕け──プロミネンス・アギオン！』<br/>『貫け──ミュルグレス・ペイン！』</a>",,
l1000,13,393,Security Chief Qasim,Charge complete. Shahmat Strike!,Charge complete. Shahmat Strike!,カシム警備主任,轟け──シャーガード・ストライク！,"<audio id=""v26_60010""><source src=""talk/11/v26_60010.opus"" type=""audio/ogg; codecs=opus""></audio><a href=""javascript:void(0)"" onclick=""document.getElementById('v26_60010').play()"">轟け──シャーガード・ストライク！</a>",,
l1000,13,394,Ren,(Now to convert their Stigmas' data and encode it as shards... There!),(Now to convert their Stigmas' data and encode it<br/>as shards... There!),レン,（聖痕の霊子情報を変換──   シャード状態にエンコード……！）,"<audio id=""v13_60045""><source src=""talk/11/v13_60045.opus"" type=""audio/ogg; codecs=opus""></audio><a href=""javascript:void(0)"" onclick=""document.getElementById('v13_60045').play()"">（聖痕の霊子情報を変換──<br/>  シャード状態にエンコード……！）</a>",,
l1000,13,395,Security Chief Qasim,"Arkride, Ferida! Finish this!","Arkride, Ferida! Finish this!",カシム警備主任,征くがいい──！ アークライドにフェリーダ！,"<audio id=""v26_60011""><source src=""talk/11/v26_60011.opus"" type=""audio/ogg; codecs=opus""></audio><a href=""javascript:void(0)"" onclick=""document.getElementById('v26_60011').play()"">征くがいい──！<br/>アークライドにフェリーダ！</a>",,
l1000,13,396,Ren,"You've got this, Agnès! Come back safely, everyone!","You've got this, Agnès! Come back safely, everyone!",レン,アニエスも── 必ず無事で戻ってくるのよ！,"<audio id=""v13_60046""><source src=""talk/11/v13_60046.opus"" type=""audio/ogg; codecs=opus""></audio><a href=""javascript:void(0)"" onclick=""document.getElementById('v13_60046').play()"">アニエスも──<br/>必ず無事で戻ってくるのよ！</a>",,
l1000,13,397,Ferry,"I won't let you down, Kasim!","I won't let you down, Kasim!",フェリ,うんっ、お兄ちゃん……！,"<audio id=""v02_60049""><source src=""talk/11/v02_60049.opus"" type=""audio/ogg; codecs=opus""></audio><a href=""javascript:void(0)"" onclick=""document.getElementById('v02_60049').play()"">うんっ、お兄ちゃん……！</a>",,"<img class=""itp-kuro"" src=""itp/11/avfc5003_out.webp""/>"
l1000,13,398,Agnes,All right. It's time we end this nightmare!,All right. It's time we end this nightmare!,アニエス,分かりました……！ ヴァンさんたちと一緒に！,"<audio id=""v01_60070""><source src=""talk/11/v01_60070.opus"" type=""audio/ogg; codecs=opus""></audio><a href=""javascript:void(0)"" onclick=""document.getElementById('v01_60070').play()"">分かりました……！<br/>ヴァンさんたちと一緒に！</a>",,"<img class=""itp-kuro"" src=""itp/11/avfc5001_out.webp""/>"
l1000,13,399,Van,I hear you there!,I hear you there!,ヴァン,一気に抜けるぞ──！！,"<audio id=""v00_60060""><source src=""talk/11/v00_60060.opus"" type=""audio/ogg; codecs=opus""></audio><a href=""javascript:void(0)"" onclick=""document.getElementById('v00_60060').play()"">一気に抜けるぞ──！！</a>",,"<img class=""itp-kuro"" src=""itp/11/avfc0000_out.webp""/>"
l1000,14,400,Van,"It's on the outskirts of the 10th District, yeah? We're about ten minutes from there.","It's on the outskirts of the 10th District, yeah?<br/>We're about ten minutes from there.",ヴァン,十区の外れだったか…… あと１０分くらいで着くな。,"<audio id=""v00_60254""><source src=""talk/11/v00_60254.opus"" type=""audio/ogg; codecs=opus""></audio><a href=""javascript:void(0)"" onclick=""document.getElementById('v00_60254').play()"">十区の外れだったか……<br/>あと１０分くらいで着くな。</a>",,"<img class=""itp-kuro"" src=""itp/11/avfc0000_out.webp""/>"
l1000,14,401,Van,Guessin' it's a pretty big place?,Guessin' it's a pretty big place?,ヴァン,やっぱり結構デカイ家なのかよ？,"<audio id=""v00_60255""><source src=""talk/11/v00_60255.opus"" type=""audio/ogg; codecs=opus""></audio><a href=""javascript:void(0)"" onclick=""document.getElementById('v00_60255').play()"">やっぱり結構デカイ家なのかよ？</a>",,"<img class=""itp-kuro"" src=""itp/11/avfc0000_out.webp""/>"
l1000,14,402,Agnes,"No, not at all. It's just your average suburban detached home.","No, not at all. It's just your average suburban<br/>detached home.",アニエス,ふふっ、郊外の普通の一戸建てです。,"<audio id=""v01_60173""><source src=""talk/11/v01_60173.opus"" type=""audio/ogg; codecs=opus""></audio><a href=""javascript:void(0)"" onclick=""document.getElementById('v01_60173').play()"">ふふっ、郊外の普通の一戸建てです。</a>",,"<img class=""itp-kuro"" src=""itp/11/avfc5001_out.webp""/>"
l1000,14,403,Agnes,We have a modest garden that Mom used to grow flowers and herbs in. She had quite the green thumb.,We have a modest garden that Mom used to grow<br/>flowers and herbs in. She had quite the green thumb.,アニエス,小さな庭付きで、昔はお母さんが 花とハーブを育てていて……,"<audio id=""v01_60174""><source src=""talk/11/v01_60174.opus"" type=""audio/ogg; codecs=opus""></audio><a href=""javascript:void(0)"" onclick=""document.getElementById('v01_60174').play()"">小さな庭付きで、昔はお母さんが<br/>花とハーブを育てていて……</a>",,"<img class=""itp-kuro"" src=""itp/11/avfc5001_out.webp""/>"
l1000,14,404,Agnes,"Oh, and we've got our sweet little dog, too. His name's Alphonse, and he's a good boy.","Oh, and we've got our sweet little dog, too.<br/>His name's Alphonse, and he's a good boy.",アニエス,あ、今も犬を飼っているんですよ？ アルフォンスっていう男の子で。,"<audio id=""v01_60175""><source src=""talk/11/v01_60175.opus"" type=""audio/ogg; codecs=opus""></audio><a href=""javascript:void(0)"" onclick=""document.getElementById('v01_60175').play()"">あ、今も犬を飼っているんですよ？<br/>アルフォンスっていう男の子で。</a>",,"<img class=""itp-kuro"" src=""itp/11/avfc5001_out.webp""/>"
l1000,14,405,Agnes,"He mostly stays at our official residence these days. I haven't seen him in ages, so I've missed him very much.","He mostly stays at our official residence these days.<br/>I haven't seen him in ages, so I've missed him<br/>very much.",アニエス,今は公邸で飼われていますけど…… ふふっ、久しぶりだなぁ。,"<audio id=""v01_60176""><source src=""talk/11/v01_60176.opus"" type=""audio/ogg; codecs=opus""></audio><a href=""javascript:void(0)"" onclick=""document.getElementById('v01_60176').play()"">今は公邸で飼われていますけど……<br/>ふふっ、久しぶりだなぁ。</a>",,"<img class=""itp-kuro"" src=""itp/11/avfc5001_out.webp""/>"
l1000,14,406,Agnes,I'll have to introduce you to him! The two of them should be back home by now.,I'll have to introduce you to him! The two of them<br/>should be back home by now.,アニエス,あ、ヴァンさんにも紹介しますね！ もう戻っている筈ですし。,"<audio id=""v01_60177""><source src=""talk/11/v01_60177.opus"" type=""audio/ogg; codecs=opus""></audio><a href=""javascript:void(0)"" onclick=""document.getElementById('v01_60177').play()"">あ、ヴァンさんにも紹介しますね！<br/>もう戻っている筈ですし。</a>",,"<img class=""itp-kuro"" src=""itp/11/avfc5001_out.webp""/>"
l1000,14,407,Van,"Actually, I wasn't planning to stay. I'm just gonna drop you off and—","Actually, I wasn't planning to stay. I'm just gonna<br/>drop you off and—",ヴァン,いや、お前を送ったら すぐに失礼するつもりだったが。,"<audio id=""v00_60256""><source src=""talk/11/v00_60256.opus"" type=""audio/ogg; codecs=opus""></audio><a href=""javascript:void(0)"" onclick=""document.getElementById('v00_60256').play()"">いや、お前を送ったら<br/>すぐに失礼するつもりだったが。</a>",,"<img class=""itp-kuro"" src=""itp/11/avfc0000_out.webp""/>"
l1000,14,408,Van,"Wait, what do you mean by 'two of them'? You aren't talkin' about your dad, are you?","Wait, what do you mean by 'two of them'? You aren't<br/>talkin' about your dad, are you?",ヴァン,つーか戻ってるって……… まさか、親父さんもってことか？,"<audio id=""v00_60257""><source src=""talk/11/v00_60257.opus"" type=""audio/ogg; codecs=opus""></audio><a href=""javascript:void(0)"" onclick=""document.getElementById('v00_60257').play()"">つーか戻ってるって………<br/>まさか、親父さんもってことか？</a>",,"<img class=""itp-kuro"" src=""itp/11/avfc0000_out.webp""/>"
l1000,14,409,Agnes,Hmm? Of course I am. He was up to the neck in work until just yesterday.,Hmm? Of course I am. He was up to the neck in<br/>work until just yesterday.,アニエス,？　はい、昨日まで議会で 忙しくしていたらしいですけど……,"<audio id=""v01_60178""><source src=""talk/11/v01_60178.opus"" type=""audio/ogg; codecs=opus""></audio><a href=""javascript:void(0)"" onclick=""document.getElementById('v01_60178').play()"">？　はい、昨日まで議会で<br/>忙しくしていたらしいですけど……</a>",,"<img class=""itp-kuro"" src=""itp/11/avfc5001_out.webp""/>"
l1000,14,410,Agnes,"But today is the start of his end-of-year vacation, so we're finally going to spend some time together.","But today is the start of his end-of-year vacation, so<br/>we're finally going to spend some time together.",アニエス,今日から同じく年末年始の休暇で 数日くらいは親子で過ごそうって。,"<audio id=""v01_60179""><source src=""talk/11/v01_60179.opus"" type=""audio/ogg; codecs=opus""></audio><a href=""javascript:void(0)"" onclick=""document.getElementById('v01_60179').play()"">今日から同じく年末年始の休暇で<br/>数日くらいは親子で過ごそうって。</a>",,"<img class=""itp-kuro"" src=""itp/11/avfc5001_out.webp""/>"
l1000,14,411,Agnes,I believe he wants to have a talk with you—about your compensation and a few other things.,I believe he wants to have a talk with you—about<br/>your compensation and a few other things.,アニエス,“依頼”の報酬の件もありますし ヴァンさんと話したいそうですけど……,"<audio id=""v01_60180""><source src=""talk/11/v01_60180.opus"" type=""audio/ogg; codecs=opus""></audio><a href=""javascript:void(0)"" onclick=""document.getElementById('v01_60180').play()"">“依頼”の報酬の件もありますし<br/>ヴァンさんと話したいそうですけど……</a>",,"<img class=""itp-kuro"" src=""itp/11/avfc5001_out.webp""/>"
l1000,14,412,Van,"Oh, c'mon. There's no way he was serious about the pay.","Oh, c'mon. There's no way he was serious about<br/>the pay.",ヴァン,いやいや！ あんなのその場のノリだろうが！？,"<audio id=""v00_60258""><source src=""talk/11/v00_60258.opus"" type=""audio/ogg; codecs=opus""></audio><a href=""javascript:void(0)"" onclick=""document.getElementById('v00_60258').play()"">いやいや！<br/>あんなのその場のノリだろうが！？</a>",,"<img class=""itp-kuro"" src=""itp/11/avfc0000_out.webp""/>"
l1000,14,413,Van,"That place'll be crawlin' with security, so sorry, but I ain't gonna—","That place'll be crawlin' with security, so sorry, but I<br/>ain't gonna—",ヴァン,ＳＰとかもいるんだろうし 家の前で失礼させて──,"<audio id=""v00_60259""><source src=""talk/11/v00_60259.opus"" type=""audio/ogg; codecs=opus""></audio><a href=""javascript:void(0)"" onclick=""document.getElementById('v00_60259').play()"">ＳＰとかもいるんだろうし<br/>家の前で失礼させて──</a>",,"<img class=""itp-kuro"" src=""itp/11/avfc0000_out.webp""/>"
l1000,14,414,Agnes,"Heehee. Don't worry about that. They only guard the outside of the house, so they'll leave us alone.","Heehee. Don't worry about that. They only guard the<br/>outside of the house, so they'll leave us alone.",アニエス,ふふっ、大丈夫ですよ。 外をさり気なく守ってくれてるだけですし。,"<audio id=""v01_60181""><source src=""talk/11/v01_60181.opus"" type=""audio/ogg; codecs=opus""></audio><a href=""javascript:void(0)"" onclick=""document.getElementById('v01_60181').play()"">ふふっ、大丈夫ですよ。<br/>外をさり気なく守ってくれてるだけですし。</a>",,"<img class=""itp-kuro"" src=""itp/11/avfc5001_out.webp""/>"
l1000,14,415,Agnes,Also...I've got a delicious Andalucía winter tart. Limited edition.,Also...I've got a delicious Andalucía winter tart.<br/>Limited edition.,アニエス,──それに《アンダルシア》の 冬季限定ケーキが無事買えたんです。,"<audio id=""v01_60182""><source src=""talk/11/v01_60182.opus"" type=""audio/ogg; codecs=opus""></audio><a href=""javascript:void(0)"" onclick=""document.getElementById('v01_60182').play()"">──それに《アンダルシア》の<br/>冬季限定ケーキが無事買えたんです。</a>",,"<img class=""itp-kuro"" src=""itp/11/avfc5001_out.webp""/>"
l1000,14,416,Agnes,You can share it with Dad. I'll brew your coffee while you chat away.,You can share it with Dad. I'll brew your coffee while<br/>you chat away.,アニエス,コーヒーを淹れますから お父さんと召し上がってください。,"<audio id=""v01_60183""><source src=""talk/11/v01_60183.opus"" type=""audio/ogg; codecs=opus""></audio><a href=""javascript:void(0)"" onclick=""document.getElementById('v01_60183').play()"">コーヒーを淹れますから<br/>お父さんと召し上がってください。</a>",,"<img class=""itp-kuro"" src=""itp/11/avfc5001_out.webp""/>"
l1000,14,417,Van,You gotta be shittin' me... When the hell'd you kids get so damn sly?!,You gotta be shittin' me...<br/>When the hell'd you kids get so damn sly?!,ヴァン,ったく── ホント喰えなくなりやがったな！？,"<audio id=""v00_60260""><source src=""talk/11/v00_60260.opus"" type=""audio/ogg; codecs=opus""></audio><a href=""javascript:void(0)"" onclick=""document.getElementById('v00_60260').play()"">ったく──<br/>ホント喰えなくなりやがったな！？</a>",,"<img class=""itp-kuro"" src=""itp/11/avfc0000_out.webp""/>"
l1000,15,418,　,"With the matchups decided, everyone got in their cars—and they were off to the races.","With the matchups decided, everyone got in their<br/>cars—and they were off to the races.",　,こうして始まった、ハイブラッズとの 首都高を舞台としたカーレース。,<C1>こうして始まった、ハイブラッズとの<br/>首都高を舞台としたカーレース。,,
