gameId,fname,scene,row,engChrName,engSearchText,engHtmlText,jpnChrName,jpnSearchText,jpnHtmlText,opName,pcIconHtml,evoIconHtml
l1000,8,263,Van,I think you're overestimating me. Haven't got anything more than a vague idea.,I think you're overestimating me. Haven't got<br/>anything more than a vague idea.,ヴァン,買い被んな……当たりを付けてるだけさ。,買い被んな……当たりを付けてるだけさ。,,"<img class=""itp-kuro"" src=""itp/11/avfc0000_out.webp""/>"
l1000,8,264,Van,"I do know about your disciple friend, though. Never met the guy myself, but we share a few acquaintances.","I do know about your disciple friend, though.<br/>Never met the guy myself, but we share a<br/>few acquaintances.",ヴァン,お前さんの弟弟子と面識はないが 共通の知人は何人かいてな。,お前さんの弟弟子と面識はないが<br/>共通の知人は何人かいてな。,,"<img class=""itp-kuro"" src=""itp/11/avfc0000_out.webp""/>"
l1000,8,265,Van,"I also know what the Sword Hermit's up to and what Marduk's plotting. Wish I didn't, but I've got a nasty habit of pickin' up info I don't even want.","I also know what the Sword Hermit's up to and what<br/>Marduk's plotting. Wish I didn't, but I've got a nasty<br/>habit of pickin' up info I don't even want.",ヴァン,《剣仙》だのマルドゥックの動きだの、 知りたくもない情報も入ってきやがる。,《剣仙》だのマルドゥックの動きだの、<br/>知りたくもない情報も入ってきやがる。,,"<img class=""itp-kuro"" src=""itp/11/avfc0000_out.webp""/>"
l1000,8,266,Shizuna,"Well, like it or not, you've gathered a lot of the pieces, but it doesn't sound like you've figured out how they fit together.","Well, like it or not, you've gathered a lot of the<br/>pieces, but it doesn't sound like you've figured out<br/>how they fit together.",シズナ,なるほど、そこまで掴んでおきながら 何が進んでいるのかまでは掴めていない……,なるほど、そこまで掴んでおきながら<br/>何が進んでいるのかまでは掴めていない……,,"<img class=""itp-kuro"" src=""itp/11/avfc5117_out.webp""/>"
l1000,8,267,Shizuna,Maybe the CID can help you along? I bet someone there would let slip a detail or two around you.,Maybe the CID can help you along? I bet someone<br/>there would let slip a detail or two around you.,シズナ,この国の諜報機関（ＣＩＤ）は随分優秀みたいだね。,この国の諜報機関（ＣＩＤ）は随分優秀みたいだね。,,"<img class=""itp-kuro"" src=""itp/11/avfc5117_out.webp""/>"
l1000,8,268,Shizuna,"...On second thought, that may not happen while the Flying Swallow and that old friend of yours are at the helm. They run a tight ship.","...On second thought, that may not happen while the<br/>Flying Swallow and that old friend of yours are at<br/>the helm. They run a tight ship.",シズナ,《飛燕紅児》──それと 君の幼馴染みの手際だろうけど。,《飛燕紅児》──それと<br/>君の幼馴染みの手際だろうけど。,,"<img class=""itp-kuro"" src=""itp/11/avfc5117_out.webp""/>"
l1000,8,269,Van,You seem to know a lot about that place...,You seem to know a lot about that place...,ヴァン,ハッ…… やっぱりそう繋がんのか。,ハッ……<br/>やっぱりそう繋がんのか。,,"<img class=""itp-kuro"" src=""itp/11/avfc0000_out.webp""/>"
l1000,8,270,Van,...,...,ヴァン,……………………………………,……………………………………,,"<img class=""itp-kuro"" src=""itp/11/avfc0000_out.webp""/>"
l1000,8,271,Shizuna,I know what you're thinking. It's not directly connected to what you're worrying about right now.,I know what you're thinking. It's not directly<br/>connected to what you're worrying about right now.,シズナ,心配しなくても、今の君の懸念</B>には 直接は関係していないと思う。,"<audio id=""v35_60018""><source src=""talk/11/v35_60018.opus"" type=""audio/ogg; codecs=opus""></audio><a href=""javascript:void(0)"" onclick=""document.getElementById('v35_60018').play()"">心配しなくても、今の君の懸念</B>には<br/>直接は関係していないと思う。</a>",,"<img class=""itp-kuro"" src=""itp/11/avfc5117_out.webp""/>"
l1000,8,272,Shizuna,So let that train of thought go for now and focus on what's in front of you.,So let that train of thought go for now and focus on<br/>what's in front of you.,シズナ,まずは目の前のことに 集中してもいいんじゃないかな？,"<audio id=""v35_60019""><source src=""talk/11/v35_60019.opus"" type=""audio/ogg; codecs=opus""></audio><a href=""javascript:void(0)"" onclick=""document.getElementById('v35_60019').play()"">まずは目の前のことに<br/>集中してもいいんじゃないかな？</a>",,"<img class=""itp-kuro"" src=""itp/11/avfc5117_out.webp""/>"
l1000,8,273,Van,Are you...reading my mind?,Are you...reading my mind?,ヴァン,お前……,"<audio id=""v00_60270""><source src=""talk/11/v00_60270.opus"" type=""audio/ogg; codecs=opus""></audio><a href=""javascript:void(0)"" onclick=""document.getElementById('v00_60270').play()"">お前……</a>",,"<img class=""itp-kuro"" src=""itp/11/avfc0000_out.webp""/>"
l1000,8,274,Shizuna,"Of course not, silly. You're just an open book—and I've already pored over its contents.","Of course not, silly. You're just an open book—and<br/>I've already pored over its contents.",シズナ,ふふ、勘違いしないで。 何となく分かるっていうだけだから。,"<audio id=""v35_60020""><source src=""talk/11/v35_60020.opus"" type=""audio/ogg; codecs=opus""></audio><a href=""javascript:void(0)"" onclick=""document.getElementById('v35_60020').play()"">ふふ、勘違いしないで。<br/>何となく分かるっていうだけだから。</a>",,"<img class=""itp-kuro"" src=""itp/11/avfc5117_out.webp""/>"
l1000,8,275,Shizuna,It's how I know the reason behind your fixation on debts...and that you are—and have been—living in fear of something.,It's how I know the reason behind your fixation on<br/>debts...and that you are—and have been—living in<br/>fear of something.,シズナ,君が貸し借りに拘っている理由も 何かを畏れている</B>っていうこともね。,"<audio id=""v35_60021""><source src=""talk/11/v35_60021.opus"" type=""audio/ogg; codecs=opus""></audio><a href=""javascript:void(0)"" onclick=""document.getElementById('v35_60021').play()"">君が貸し借りに拘っている理由も<br/>何かを畏れている</B>っていうこともね。</a>",,"<img class=""itp-kuro"" src=""itp/11/avfc5117_out.webp""/>"
l1000,8,276,Van,...!,...!,ヴァン,！！,"<audio id=""v00_60271""><source src=""talk/11/v00_60271.opus"" type=""audio/ogg; codecs=opus""></audio><a href=""javascript:void(0)"" onclick=""document.getElementById('v00_60271').play()"">！！</a>",,"<img class=""itp-kuro"" src=""itp/11/avfc0000_out.webp""/>"
l1000,8,277,Van,Ah...,Ah...,ヴァン,あ……,あ……,,"<img class=""itp-kuro"" src=""itp/11/avfc0000_out.webp""/>"
l1000,8,278,Shizuna,"Mine's going off, too.","Mine's going off, too.",シズナ,あれ、私にもか。,"<audio id=""v35_60011""><source src=""talk/11/v35_60011.opus"" type=""audio/ogg; codecs=opus""></audio><a href=""javascript:void(0)"" onclick=""document.getElementById('v35_60011').play()"">あれ、私にもか。</a>",,"<img class=""itp-kuro"" src=""itp/11/avfc5117_out.webp""/>"
l1000,8,279,Shizuna,Heck of a coincidence. Or maybe it isn't one?,Heck of a coincidence. Or maybe it isn't one?,シズナ,これは偶然── それとも必然なのかな？,"<audio id=""v35_60012""><source src=""talk/11/v35_60012.opus"" type=""audio/ogg; codecs=opus""></audio><a href=""javascript:void(0)"" onclick=""document.getElementById('v35_60012').play()"">これは偶然──<br/>それとも必然なのかな？</a>",,"<img class=""itp-kuro"" src=""itp/11/avfc5117_out.webp""/>"
l1000,8,280,Van,"I don't have a free hand, so you pick it up.","I don't have a free hand, so you pick it up.",ヴァン,とりあえず俺は塞がってるから あんたが出ちゃどうだ？,"<audio id=""v00_60039""><source src=""talk/11/v00_60039.opus"" type=""audio/ogg; codecs=opus""></audio><a href=""javascript:void(0)"" onclick=""document.getElementById('v00_60039').play()"">とりあえず俺は塞がってるから<br/>あんたが出ちゃどうだ？</a>",,"<img class=""itp-kuro"" src=""itp/11/avfc0000_out.webp""/>"
l1000,8,281,Shizuna,"Just when we were finally starting to break the ice... Oh, well.","Just when we were finally starting to break the ice...<br/>Oh, well.",シズナ,“あんた”に戻っちゃったか。 ──うん、でもいいよ。,"<audio id=""v35_60013""><source src=""talk/11/v35_60013.opus"" type=""audio/ogg; codecs=opus""></audio><a href=""javascript:void(0)"" onclick=""document.getElementById('v35_60013').play()"">“あんた”に戻っちゃったか。<br/>──うん、でもいいよ。</a>",,"<img class=""itp-kuro"" src=""itp/11/avfc5117_out.webp""/>"
l1000,8,282,Shizuna,"Wait, why's my phone...? Ohh. I think it's been hacked.","Wait, why's my phone...? Ohh. I think it's<br/>been hacked.",シズナ,画面が勝手に……えっと、 “はっきんぐ”って言うんだっけ？,"<audio id=""v35_60014""><source src=""talk/11/v35_60014.opus"" type=""audio/ogg; codecs=opus""></audio><a href=""javascript:void(0)"" onclick=""document.getElementById('v35_60014').play()"">画面が勝手に……えっと、<br/>“はっきんぐ”って言うんだっけ？</a>",,"<img class=""itp-kuro"" src=""itp/11/avfc5117_out.webp""/>"
l1000,8,283,Van,"The hell? Oh, no. It's Oración all over again—and that can only mean...!","The hell? Oh, no. It's Oración all over again—and<br/>that can only mean...!",ヴァン,まさか── オラシオンと同じパターンか！,"<audio id=""v00_60040""><source src=""talk/11/v00_60040.opus"" type=""audio/ogg; codecs=opus""></audio><a href=""javascript:void(0)"" onclick=""document.getElementById('v00_60040').play()"">まさか──<br/>オラシオンと同じパターンか！</a>",,"<img class=""itp-kuro"" src=""itp/11/avfc0000_out.webp""/>"
l1000,8,284,A dripping voice,"Why, hello, dear victors and losers of the death game. Hope you missed me, because I missed you.","Why, hello, dear victors and losers of the death game.<br/>Hope you missed me, because I missed you.",滴るような声,やあ──前回のデスゲームの勝利者、 ならびに参加者と、何の関係もない人たち。,"<audio id=""v38_60000""><source src=""talk/11/v38_60000.opus"" type=""audio/ogg; codecs=opus""></audio><a href=""javascript:void(0)"" onclick=""document.getElementById('v38_60000').play()"">やあ──前回のデスゲームの勝利者、<br/>ならびに参加者と、何の関係もない人たち。</a>",,
l1000,8,285,Melchior,"And greetings to those uninvolved with the game. My name is Melchior, and I am—or was—an executive of Almata, a mafia that met an untimely demise.","And greetings to those uninvolved with the game.<br/>My name is Melchior, and I am—or was—an executive<br/>of Almata, a mafia that met an untimely demise.",メルキオル,僕はメルキオル──先日壊滅したマフィア、 《アルマータ》の若頭を務めていた者さ。,"<audio id=""v38_60001""><source src=""talk/11/v38_60001.opus"" type=""audio/ogg; codecs=opus""></audio><a href=""javascript:void(0)"" onclick=""document.getElementById('v38_60001').play()"">僕はメルキオル──先日壊滅したマフィア、<br/>《アルマータ》の若頭を務めていた者さ。</a>",,
l1000,8,286,Melchior,"Enough about me, though. Congratulations on the anniversary of the revolution! Glory to Calvard. Hurrah. Three cheers and all that.","Enough about me, though. Congratulations on the<br/>anniversary of the revolution! Glory to Calvard.<br/>Hurrah. Three cheers and all that.",メルキオル,革命記念祭おめでとう！ いやぁ、カルバードの未来は明るそうだ。,"<audio id=""v38_60002""><source src=""talk/11/v38_60002.opus"" type=""audio/ogg; codecs=opus""></audio><a href=""javascript:void(0)"" onclick=""document.getElementById('v38_60002').play()"">革命記念祭おめでとう！<br/>いやぁ、カルバードの未来は明るそうだ。</a>",,
l1000,8,287,Melchior,"In honor of this momentous occasion, I have come bearing a most wonderful gift. ❤","In honor of this momentous occasion, I have come<br/>bearing a most wonderful gift. ❤",メルキオル,つきましてはアルマータからもとっておきの “お祝い”をさせてもらおうと思ってね❤,"<audio id=""v38_60003""><source src=""talk/11/v38_60003.opus"" type=""audio/ogg; codecs=opus""></audio><a href=""javascript:void(0)"" onclick=""document.getElementById('v38_60003').play()"">つきましてはアルマータからもとっておきの<br/>“お祝い”をさせてもらおうと思ってね❤</a>",,
l1000,9,288,Shizuna,"I had a feeling something bad was going to happen, but wow, things REALLY took a turn for the worse.","I had a feeling something bad was going to happen,<br/>but wow, things REALLY took a turn for the worse.",シズナ,フフ……何か起きる気配はあったけど ここまでとは思わなかった。,フフ……何か起きる気配はあったけど<br/>ここまでとは思わなかった。,,"<img class=""itp-kuro"" src=""itp/11/avfc5117_out.webp""/>"
l1000,9,289,Shizuna,That looked like the kid I saw back in Longlai.,That looked like the kid I saw back in Longlai.,シズナ,あれはあの時のおチビちゃんだっけ？ それと最後に映っていたのは──,あれはあの時のおチビちゃんだっけ？<br/>それと最後に映っていたのは──,,"<img class=""itp-kuro"" src=""itp/11/avfc5117_out.webp""/>"
l1000,9,290,Van,"And those goons are back, too. Wish my eyes were playin' tricks on me...","And those goons are back, too. Wish my eyes were<br/>playin' tricks on me...",ヴァン,ああ、どういうカラクリかは 分からねぇが……,ああ、どういうカラクリかは<br/>分からねぇが……,,"<img class=""itp-kuro"" src=""itp/11/avfc0000_out.webp""/>"
l1000,9,291,Van,"We'll worry about that later, though. We've got more pressing problems to deal with.","We'll worry about that later, though. We've got more<br/>pressing problems to deal with.",ヴァン,──とりあえず この場を凌ぐ必要がありそうだ。,──とりあえず<br/>この場を凌ぐ必要がありそうだ。,,"<img class=""itp-kuro"" src=""itp/11/avfc0000_out.webp""/>"
l1000,9,292,Shizuna,So we do.,So we do.,シズナ,ああ……,ああ……,,"<img class=""itp-kuro"" src=""itp/11/avfc5117_out.webp""/>"
l1000,9,293,Shizuna,"Got some denizens of the underworld on our hands. You call them devils here in the West, yeah?","Got some denizens of the underworld on our hands.<br/>You call them devils here in the West, yeah?",シズナ,黄泉の住人── 西方風に言うと“悪魔”かな？,黄泉の住人──<br/>西方風に言うと“悪魔”かな？,,"<img class=""itp-kuro"" src=""itp/11/avfc5117_out.webp""/>"
l1000,9,294,Van,Uh-huh. Looks like they're out to hunt down anyone who isn't frozen.,Uh-huh. Looks like they're out to hunt down anyone<br/>who isn't frozen.,ヴァン,ああ…… “停まってない”者を狙ってやがる。,ああ……<br/>“停まってない”者を狙ってやがる。,,"<img class=""itp-kuro"" src=""itp/11/avfc0000_out.webp""/>"
l1000,9,295,Van,Ready to team up again?,Ready to team up again?,ヴァン,あんたとの共闘は先日ぶりだが、 ──迎え撃つぞ！,あんたとの共闘は先日ぶりだが、<br/>──迎え撃つぞ！,,"<img class=""itp-kuro"" src=""itp/11/avfc0000_out.webp""/>"
l1000,9,296,Van,Wanna team up?,Wanna team up?,ヴァン,オラシオンではやり合ったが、 ──この場は手を貸せ！,オラシオンではやり合ったが、<br/>──この場は手を貸せ！,,"<img class=""itp-kuro"" src=""itp/11/avfc0000_out.webp""/>"
l1000,9,297,Shizuna,Heck yeah!,Heck yeah!,シズナ,ふふ──承知！,ふふ──承知！,,"<img class=""itp-kuro"" src=""itp/11/avfc5117_out.webp""/>"
l1000,10,298,Shizuna,Easy peasy. Those were probably low-ranking devils.,Easy peasy. Those were probably low-ranking devils.,シズナ,悪魔とやらの眷族…… それなりだが小者クラスかな？,悪魔とやらの眷族……<br/>それなりだが小者クラスかな？,,"<img class=""itp-kuro"" src=""itp/11/avfc5117_out.webp""/>"
l1000,10,299,Van,Wonder if they're in all the other districts.,Wonder if they're in all the other districts.,ヴァン,まあな──だがこの調子じゃ 他のエリアがどうなっているか。,まあな──だがこの調子じゃ<br/>他のエリアがどうなっているか。,,"<img class=""itp-kuro"" src=""itp/11/avfc0000_out.webp""/>"
l1000,10,300,Van,But more importantly...,But more importantly...,ヴァン,それに……,それに……,,"<img class=""itp-kuro"" src=""itp/11/avfc0000_out.webp""/>"
l1000,10,301,Shizuna,Everyone around us has been frozen in time.,Everyone around us has been frozen in time.,シズナ,ふむ──君の言うとおり 確かに“停まっている”みたいだ。,ふむ──君の言うとおり<br/>確かに“停まっている”みたいだ。,,"<img class=""itp-kuro"" src=""itp/11/avfc5117_out.webp""/>"
l1000,10,302,Shizuna,"Well, except you, me, Almata's leaders, and those other people we saw on stream.","Well, except you, me, Almata's leaders, and those<br/>other people we saw on stream.",シズナ,君と私、アルマータの面々と おチビちゃんたちは動けていたけど。,君と私、アルマータの面々と<br/>おチビちゃんたちは動けていたけど。,,"<img class=""itp-kuro"" src=""itp/11/avfc5117_out.webp""/>"
l1000,10,303,Van,Yeah.,Yeah.,ヴァン,ああ……,ああ……,,"<img class=""itp-kuro"" src=""itp/11/avfc0000_out.webp""/>"
l1000,10,304,Van,"Bah. I can't make any calls, and the orbal net's down, too.","Bah. I can't make any calls, and the orbal net's<br/>down, too.",ヴァン,……チッ。 通信もネットも死んでるか。,……チッ。<br/>通信もネットも死んでるか。,,"<img class=""itp-kuro"" src=""itp/11/avfc0000_out.webp""/>"
l1000,10,305,Van,"Ah, good. My girl never lets me down.","Ah, good. My girl never lets me down.",ヴァン,よし──車自体は動かせそうだな。,よし──車自体は動かせそうだな。,,"<img class=""itp-kuro"" src=""itp/11/avfc0000_out.webp""/>"
l1000,10,306,Van,"(Not sure why the other cars around here aren't working, though...)","(Not sure why the other cars around here aren't<br/>working, though...)",ヴァン,（他の車が停止しているのに   何で動かせるのかは分からんが……）,（他の車が停止しているのに<br/>  何で動かせるのかは分からんが……）,,"<img class=""itp-kuro"" src=""itp/11/avfc0000_out.webp""/>"
l1000,10,307,Van,"Anyway, we're not gonna learn anything if we stay out here.","Anyway, we're not gonna learn anything if we stay<br/>out here.",ヴァン,──とにかく まずは動き始めるしかねぇ。,──とにかく<br/>まずは動き始めるしかねぇ。,,"<img class=""itp-kuro"" src=""itp/11/avfc0000_out.webp""/>"
l1000,10,308,Van,I'm gonna hit all the districts and gather up my employees. What're you plannin' on doing?,I'm gonna hit all the districts and gather up<br/>my employees. What're you plannin' on doing?,ヴァン,俺はとりあえず助手たちがいた 街区に向かうが、お前さんはどうする？,俺はとりあえず助手たちがいた<br/>街区に向かうが、お前さんはどうする？,,"<img class=""itp-kuro"" src=""itp/11/avfc0000_out.webp""/>"
l1000,10,309,Shizuna,I'll stick with you. I might get a better idea as to what's going on that way.,I'll stick with you. I might get a better idea as to<br/>what's going on that way.,シズナ,まずは状況を掴みたいし しばらくは付き合わせてもらうよ。,まずは状況を掴みたいし<br/>しばらくは付き合わせてもらうよ。,,"<img class=""itp-kuro"" src=""itp/11/avfc5117_out.webp""/>"
l1000,10,310,Shizuna,"This area is in the south part of the city, isn't it? Where are you going to go first?","This area is in the south part of the city, isn't it?<br/>Where are you going to go first?",シズナ,ここは首都の南側なんだっけ。 ──まずはどこに向かうのかな？,ここは首都の南側なんだっけ。<br/>──まずはどこに向かうのかな？,,"<img class=""itp-kuro"" src=""itp/11/avfc5117_out.webp""/>"
l1000,10,311,Van,Let me see where we are exactly.,Let me see where we are exactly.,ヴァン,そうだな…… 多分マップではこのあたりか。,そうだな……<br/>多分マップではこのあたりか。,,"<img class=""itp-kuro"" src=""itp/11/avfc0000_out.webp""/>"
l1000,10,312,Van,"Closest districts from here are Old Town, Riverside, and Central Station.","Closest districts from here are Old Town, Riverside,<br/>and Central Station.",ヴァン,ここからだと旧市街、リバーサイド、 中央駅前あたりが近そうだ。,ここからだと旧市街、リバーサイド、<br/>中央駅前あたりが近そうだ。,,"<img class=""itp-kuro"" src=""itp/11/avfc0000_out.webp""/>"
l1000,10,313,Van,We can leave as soon as we decide where to go first. I'll be countin' on you.,We can leave as soon as we decide where to go first.<br/>I'll be countin' on you.,ヴァン,準備が整いしだい車で出発する。 ──せいぜいアテにさせてもらうぜ。,準備が整いしだい車で出発する。<br/>──せいぜいアテにさせてもらうぜ。,,"<img class=""itp-kuro"" src=""itp/11/avfc0000_out.webp""/>"
l1000,10,314,Shizuna,"Right. As long as I'm here, you won't have to worry about a thing.","Right. As long as I'm here, you won't have to worry<br/>about a thing.",シズナ,ふふ、こちらこそ。 それじゃあ短い道連れと行こうか。,ふふ、こちらこそ。<br/>それじゃあ短い道連れと行こうか。,,"<img class=""itp-kuro"" src=""itp/11/avfc5117_out.webp""/>"
l1000,11,315,,Shizuna has temporarily joined the party as a guest.,Shizuna has temporarily joined the party as a guest.,,シズナがゲストとして一時的に加入しました。,<C1>シズナがゲストとして一時的に加入しました。,,
l1000,11,316,,"Due to the spread of Pandemonium, you are unable to use the orbal network.","Due to the spread of Pandemonium, you are unable<br/>to use the orbal network.",,なお現在、首都の汎魔（パンデモニウム）化により、 導力ネット等のサービスが使えなくなっています。,<C1>なお現在、首都の汎魔（パンデモニウム）化により、<br/>導力ネット等のサービスが使えなくなっています。,,
l1000,11,317,,"Furthermore, since you cannot contact Quatre, the Custom menu from Orbment in the main menu is inaccessible.","Furthermore, since you cannot contact Quatre, the<br/>Custom menu from Orbment in the main menu<br/>is inaccessible.",,カトルと連絡がつかないため、 メインメニューのオーブメント画面からの、 「オーブメント改造」が使用できなくなりました。,<C1>カトルと連絡がつかないため、<br/>メインメニューのオーブメント画面からの、<br/>「オーブメント改造」が使用できなくなりました。,,
l1000,11,318,,"To advance the main story, inspect the car and select a destination.","To advance the main story, inspect the car and select<br/>a destination.",,ストーリーを進める場合、 車を調べて新たな行き先を選んで下さい。,<C1>ストーリーを進める場合、<br/>車を調べて新たな行き先を選んで下さい。,,
l1000,12,319,Van,(Hmm... Now where should we go first?),(Hmm... Now where should we go first?),ヴァン,（さて、どこに向かうか……）,（さて、どこに向かうか……）,,"<img class=""itp-kuro"" src=""itp/11/avfc0000_out.webp""/>"
l1000,12,320,,"Once a district has been selected, the others will be temporarily unavailable.","Once a district has been selected, the others will be<br/>temporarily unavailable.",,一度行き先を選択するとしばらくの間、 他のエリアに行くことは出来ません。,<C1>一度行き先を選択するとしばらくの間、<br/>他のエリアに行くことは出来ません。,,
l1000,12,321,Van,"(Ferida was the one stationed in this district. I'm guessin' she's still there, too.)","(Ferida was the one stationed in this district.<br/>I'm guessin' she's still there, too.)",ヴァン,（ここの担当はフェリだったか……   多分持ち場は離れていない筈だ。）,（ここの担当はフェリだったか……<br/>  多分持ち場は離れていない筈だ。）,,"<img class=""itp-kuro"" src=""itp/11/avfc0000_out.webp""/>"
l1000,12,322,Van,"(Odds are she hasn't been frozen, but I've still gotta find her—and fast!)","(Odds are she hasn't been frozen, but I've still gotta<br/>find her—and fast!)",ヴァン,（停まってない可能性も高い……   何としても見つけて合流するぞ！）,（停まってない可能性も高い……<br/>  何としても見つけて合流するぞ！）,,"<img class=""itp-kuro"" src=""itp/11/avfc0000_out.webp""/>"
