gameId,fname,scene,row,engChrName,engSearchText,engHtmlText,jpnChrName,jpnSearchText,jpnHtmlText,opName,pcIconHtml,evoIconHtml
l1000,4,134,Aaron,"This all sounds fishy as hell, but whatever. Get on with it.","This all sounds fishy as hell, but whatever. Get on<br/>with it.",アーロン,ハン……？　胡散臭ぇが 話が進まねえから続けろや。,ハン……？　胡散臭ぇが<br/>話が進まねえから続けろや。,,"<img class=""itp-kuro"" src=""itp/11/avfc0002_out.webp""/>"
l1000,4,135,Kincaid,As you wish. The issue of the Xipha standard's funding source also needs to be addressed.,As you wish. The issue of the Xipha standard's<br/>funding source also needs to be addressed.,キンケイド,ああ──話を戻すが《ザイファ規格》には プロジェクト出資状況という事情もあってね。,ああ──話を戻すが《ザイファ規格》には<br/>プロジェクト出資状況という事情もあってね。,,"<img class=""itp-kuro"" src=""itp/11/avfc0112_out.webp""/>"
l1000,4,136,Kincaid,And I will delegate that task to your group's chief and concierge.,And I will delegate that task to your group's chief<br/>and concierge.,キンケイド,それについては、そちらの所長や ＳＣ殿に説明してもらうとしようか？,それについては、そちらの所長や<br/>ＳＣ殿に説明してもらうとしようか？,,"<img class=""itp-kuro"" src=""itp/11/avfc0112_out.webp""/>"
l1000,4,137,Ferry,Huh?,Huh?,フェリ,え……,え……,,"<img class=""itp-kuro"" src=""itp/11/avfc5003_out.webp""/>"
l1000,4,138,Agnes,What do you mean?,What do you mean?,アニエス,と、いいますと……？,と、いいますと……？,,"<img class=""itp-kuro"" src=""itp/11/avfc5001_out.webp""/>"
l1000,4,139,Van,"Since when did you become my boss? ...*sigh* Fine, I'll explain.","Since when did you become my boss? ...*sigh* Fine,<br/>I'll explain.",ヴァン,ふう、こっちに振るんじゃねーよ。,ふう、こっちに振るんじゃねーよ。,,"<img class=""itp-kuro"" src=""itp/11/avfc0000_out.webp""/>"
l1000,4,140,Van,Xipha being Verne's sixth-generation combat orbment is common knowledge at this point.,Xipha being Verne's sixth-generation combat<br/>orbment is common knowledge at this point.,ヴァン,──《ザイファ規格》はヴェルヌ社が独自に 開発した第六世代として知られてるが……,──《ザイファ規格》はヴェルヌ社が独自に<br/>開発した第六世代として知られてるが……,,"<img class=""itp-kuro"" src=""itp/11/avfc0000_out.webp""/>"
l1000,4,141,Van,But there's a little known fact about the project's humble beginnings: it got a massive capital injection from an interested party.,But there's a little known fact about the project's<br/>humble beginnings: it got a massive capital injection<br/>from an interested party.,ヴァン,立ち上げ時に、とある“出資元”が 莫大な投資をしたのがその筋じゃ有名でな。,立ち上げ時に、とある“出資元”が<br/>莫大な投資をしたのがその筋じゃ有名でな。,,"<img class=""itp-kuro"" src=""itp/11/avfc0000_out.webp""/>"
l1000,4,142,Van,And that party just so happens to be...,And that party just so happens to be...,ヴァン,その出資元っつーのが──,その出資元っつーのが──,,"<img class=""itp-kuro"" src=""itp/11/avfc0000_out.webp""/>"
l1000,4,143,Lisette,...the Valis Investment Bank.,...the Valis Investment Bank.,リゼット,──《ヴァリス投資銀行》。,──《ヴァリス投資銀行》。,,"<img class=""itp-kuro"" src=""itp/11/avfc5005_out.webp""/>"
l1000,4,144,Lisette,"Which, as it so happens, is also the largest shareholder of Marduk—my employer.","Which, as it so happens, is also the largest<br/>shareholder of Marduk—my employer.",リゼット,わたくしの“出向元”である マルドゥック社の筆頭株主でもありますね。,わたくしの“出向元”である<br/>マルドゥック社の筆頭株主でもありますね。,,"<img class=""itp-kuro"" src=""itp/11/avfc5005_out.webp""/>"
l1000,4,145,Agnes,I-I see...,I-I see...,アニエス,そ、そうだったんですか……,そ、そうだったんですか……,,"<img class=""itp-kuro"" src=""itp/11/avfc5001_out.webp""/>"
l1000,4,146,Aaron,Sure feels like I'm hearing the name Valis a lot lately.,Sure feels like I'm hearing the name Valis a lot lately.,アーロン,ヴァリス…… 最近ちょくちょく聞くが……,ヴァリス……<br/>最近ちょくちょく聞くが……,,"<img class=""itp-kuro"" src=""itp/11/avfc0002_out.webp""/>"
l1000,4,147,Ferry,"Valis? Oh, as in the city state?","Valis? Oh, as in the city state?",フェリ,ヴァリスって……え、 あの《ヴァリス市国》ですか……？,ヴァリスって……え、<br/>あの《ヴァリス市国》ですか……？,,"<img class=""itp-kuro"" src=""itp/11/avfc5003_out.webp""/>"
l1000,4,148,Prince Sheridan,Correct. It's a giant port city in the Central East.,Correct. It's a giant port city in the Central East.,シェリド公太子,ああ、ゼムリア大陸中東部の 沿岸部に位置する巨大海港都市。,ああ、ゼムリア大陸中東部の<br/>沿岸部に位置する巨大海港都市。,,
l1000,4,149,Prince Sheridan,"It may not have much land, but through trade in the south sea, its people amassed a great fortune, which they are investing all over the continent.","It may not have much land, but through trade in<br/>the south sea, its people amassed a great fortune,<br/>which they are investing all over the continent.",シェリド公太子,国土は小さいながらも南洋貿易で築いた 莫大な富を大陸全土への投資に回している──,国土は小さいながらも南洋貿易で築いた<br/>莫大な富を大陸全土への投資に回している──,,
l1000,4,150,Prince Sheridan,They're both our allies and our competitors. The Valis Investment Bank is owned by them.,They're both our allies and our competitors.<br/>The Valis Investment Bank is owned by them.,シェリド公太子,我がエルザイムの友好国にして競合相手たる かの都市国家が擁する投資銀行というわけだ。,我がエルザイムの友好国にして競合相手たる<br/>かの都市国家が擁する投資銀行というわけだ。,,
l1000,4,151,Ferry,...,...,フェリ,…………………………,…………………………,,"<img class=""itp-kuro"" src=""itp/11/avfc5003_out.webp""/>"
l1000,4,152,Aaron,So you're trying to drag our asses into a Central Eastern turf war—all so we can be your eyes and ears.,So you're trying to drag our asses into a Central<br/>Eastern turf war—all so we can be your eyes and ears.,アーロン,ハン……つまり 中東勢の縄張り争いもあるわけだ。,ハン……つまり<br/>中東勢の縄張り争いもあるわけだ。,,"<img class=""itp-kuro"" src=""itp/11/avfc0002_out.webp""/>"
l1000,4,153,Aaron,"Well, I guess they could be sending in their own spies, especially with state-level secrets up for grabs.","Well, I guess they could be sending in their own<br/>spies, especially with state-level secrets up for grabs.",アーロン,加えて国家機密レベルの技術を狙う スパイが入り込んでもおかしくねぇ。,加えて国家機密レベルの技術を狙う<br/>スパイが入り込んでもおかしくねぇ。,,"<img class=""itp-kuro"" src=""itp/11/avfc0002_out.webp""/>"
l1000,4,154,Agnes,"In short, you want us to investigate a highly complex situation from a neutral standpoint and get to the bottom of what's happening there.","In short, you want us to investigate a highly complex<br/>situation from a neutral standpoint and get to the<br/>bottom of what's happening there.",アニエス,今回の件は、そんな複雑な状況で あくまで“中立”の立場で動きながら……,今回の件は、そんな複雑な状況で<br/>あくまで“中立”の立場で動きながら……,,"<img class=""itp-kuro"" src=""itp/11/avfc5001_out.webp""/>"
l1000,4,155,Agnes,Does that about sum it up?,Does that about sum it up?,アニエス,何が起きているのかを正確に見極める、 いえ──嗅ぎ分ける必要があるわけですか。,何が起きているのかを正確に見極める、<br/>いえ──嗅ぎ分ける必要があるわけですか。,,"<img class=""itp-kuro"" src=""itp/11/avfc5001_out.webp""/>"
l1000,4,156,Kincaid,I'll give you an 85 for that answer.,I'll give you an 85 for that answer.,キンケイド,８５点あげよう、助手諸君。,８５点あげよう、助手諸君。,,"<img class=""itp-kuro"" src=""itp/11/avfc0112_out.webp""/>"
l1000,4,157,Kincaid,"In the event that Valis attempts to interfere, we would also like you to act as a mediator.","In the event that Valis attempts to interfere, we<br/>would also like you to act as a mediator.",キンケイド,加えてヴァリス側の干渉があった場合の 窓口としても期待させてもらいたい。,加えてヴァリス側の干渉があった場合の<br/>窓口としても期待させてもらいたい。,,"<img class=""itp-kuro"" src=""itp/11/avfc0112_out.webp""/>"
l1000,4,158,Van,You've got this all mapped out.,You've got this all mapped out.,ヴァン,……そこまで見越してやがるとはな。,……そこまで見越してやがるとはな。,,"<img class=""itp-kuro"" src=""itp/11/avfc0000_out.webp""/>"
l1000,4,159,Lisette,"Mediation is not one of our specialties, unfortunately, so I'm not certain if we are your best option for that.","Mediation is not one of our specialties, unfortunately,<br/>so I'm not certain if we are your best option for that.",リゼット,“そちら”とは業務が異なりますので 期待には添えない可能性もありますが……,“そちら”とは業務が異なりますので<br/>期待には添えない可能性もありますが……,,"<img class=""itp-kuro"" src=""itp/11/avfc5005_out.webp""/>"
l1000,4,160,Prince Sheridan,"On the contrary, I think you all are our safest bet on that front.","On the contrary, I think you all are our safest bet on<br/>that front.",シェリド公太子,それでもあらゆる意味で君たちに 期待してしまう状況が整っているわけだ。,それでもあらゆる意味で君たちに<br/>期待してしまう状況が整っているわけだ。,,
l1000,4,161,Prince Sheridan,"Should you take our request, you will stay in Basel for three days. I'm sure there will be other 4SPGs you can juggle at the same time.","Should you take our request, you will stay in Basel for<br/>three days. I'm sure there will be other 4SPGs you<br/>can juggle at the same time.",シェリド公太子,期間は３日間──サルバッド同様、 “４ｓｐｇ”をやりながらで構わない。,期間は３日間──サルバッド同様、<br/>“４ｓｐｇ”をやりながらで構わない。,,
l1000,4,162,Prince Sheridan,"We can't expect you to leave at once, but it would be best if you departed within the next few days.","We can't expect you to leave at once, but it would be<br/>best if you departed within the next few days.",シェリド公太子,すぐにとは言わないが 数日中には出発して欲しいと思っている。,すぐにとは言わないが<br/>数日中には出発して欲しいと思っている。,,
l1000,4,163,Agnes,(Wait...),(Wait...),アニエス,（あ……）,（あ……）,,"<img class=""itp-kuro"" src=""itp/11/avfc5001_out.webp""/>"
l1000,4,164,Van,All right. We'll give it some thought when we get back.,All right. We'll give it some thought when we<br/>get back.,ヴァン,──お話は分かりましたよ。 だがこの場での即答は難しいですね。,──お話は分かりましたよ。<br/>だがこの場での即答は難しいですね。,,"<img class=""itp-kuro"" src=""itp/11/avfc0000_out.webp""/>"
l1000,4,165,Van,Can't make any promises.,Can't make any promises.,ヴァン,一度持ち帰って返事をさせてください。,一度持ち帰って返事をさせてください。,,"<img class=""itp-kuro"" src=""itp/11/avfc0000_out.webp""/>"
l1000,4,166,Prince Sheridan,I understand.,I understand.,シェリド公太子,フフ、無論それで構わないさ。,フフ、無論それで構わないさ。,,
l1000,4,167,Prince Sheridan,We won't be out of options if you refuse. The CID never puts all its eggs in one basket.,We won't be out of options if you refuse. The CID<br/>never puts all its eggs in one basket.,シェリド公太子,さすがに君たちに 一点張りというわけでもないからね。,さすがに君たちに<br/>一点張りというわけでもないからね。,,
l1000,4,168,Kincaid,"Regardless, everything we've told you is strictly confidential.","Regardless, everything we've told you is<br/>strictly confidential.",キンケイド,引き受けない場合、当然だが今の情報は 機密案件として漏洩を禁じさせてもらう。,引き受けない場合、当然だが今の情報は<br/>機密案件として漏洩を禁じさせてもらう。,,"<img class=""itp-kuro"" src=""itp/11/avfc0112_out.webp""/>"
l1000,4,169,Kincaid,Though I think a rather unexpected issue might work in our favor here.,Though I think a rather unexpected issue might work<br/>in our favor here.,キンケイド,まあ── 今回は思わぬ決め手があるかもしれんが。,まあ──<br/>今回は思わぬ決め手があるかもしれんが。,,"<img class=""itp-kuro"" src=""itp/11/avfc0112_out.webp""/>"
l1000,4,170,Agnes,(...),(...),アニエス,（っ……）,（っ……）,,"<img class=""itp-kuro"" src=""itp/11/avfc5001_out.webp""/>"
l1000,4,171,Ferry,...?,...?,フェリ,………？,………？,,"<img class=""itp-kuro"" src=""itp/11/avfc5003_out.webp""/>"
l1000,4,172,Van,...,...,ヴァン,……………………………,……………………………,,"<img class=""itp-kuro"" src=""itp/11/avfc0000_out.webp""/>"
l1000,5,173,Ferry,This is so exciting. It feels like we're in that spy movie we saw last month!,This is so exciting. It feels like we're in that spy movie<br/>we saw last month!,フェリ,なんだかワクワクしますね。 先月のスパイ映画みたいで……！,なんだかワクワクしますね。<br/>先月のスパイ映画みたいで……！,,"<img class=""itp-kuro"" src=""itp/11/avfc5003_out.webp""/>"
l1000,5,174,Agnes,"You really liked that one, didn't you?","You really liked that one, didn't you?",アニエス,ふふ、フェリちゃん、 よっぽど気に入ったみたいですね。,ふふ、フェリちゃん、<br/>よっぽど気に入ったみたいですね。,,"<img class=""itp-kuro"" src=""itp/11/avfc5001_out.webp""/>"
l1000,5,175,Aaron,"I'd make fun of you for being a kid about it, but this whole thing's got my interest, too.","I'd make fun of you for being a kid about it, but this<br/>whole thing's got my interest, too.",アーロン,お子ちゃまが……と言いたい所だが 面白そうっつーのは同意だぜ。,お子ちゃまが……と言いたい所だが<br/>面白そうっつーのは同意だぜ。,,"<img class=""itp-kuro"" src=""itp/11/avfc0002_out.webp""/>"
l1000,5,176,Quatre,But just how do they plan to establish contact with us?,But just how do they plan to establish contact<br/>with us?,カトル,興味深いけど、コンタクトは どういう風にするつもりだろう？,興味深いけど、コンタクトは<br/>どういう風にするつもりだろう？,,"<img class=""itp-kuro"" src=""itp/11/avfc0004_out.webp""/>"
l1000,5,177,Lisette,My thoughts exactly. I assume it will involve the in-vehicle Xipha—,My thoughts exactly. I assume it will involve the<br/>in-vehicle Xipha—,リゼット,そうですね、可能性があるとしたら 車載されているザイファ規格の──,そうですね、可能性があるとしたら<br/>車載されているザイファ規格の──,,"<img class=""itp-kuro"" src=""itp/11/avfc5005_out.webp""/>"
l1000,5,178,Van,There they are. ...Wait. Ain't that...?,There they are. ...Wait. Ain't that...?,ヴァン,お出でなすったようだな。 ──って、あれは……,お出でなすったようだな。<br/>──って、あれは……,,"<img class=""itp-kuro"" src=""itp/11/avfc0000_out.webp""/>"
l1000,5,179,Agnes,Umm...,Umm...,アニエス,えっと……,えっと……,,"<img class=""itp-kuro"" src=""itp/11/avfc5001_out.webp""/>"
l1000,5,180,Quatre,I feel like I've seen him somewhere before...,I feel like I've seen him somewhere before...,カトル,？　どこかで見たような……,？　どこかで見たような……,,"<img class=""itp-kuro"" src=""itp/11/avfc0004_out.webp""/>"
l1000,5,181,Aaron,"Oh, it's that smug-ass racer from a while back.","Oh, it's that smug-ass racer from a while back.",アーロン,アアン、いつぞやの スカシレーサーじゃねえか？,アアン、いつぞやの<br/>スカシレーサーじゃねえか？,,"<img class=""itp-kuro"" src=""itp/11/avfc0002_out.webp""/>"
l1000,5,182,Lisette,"Maxim Lugan, the top Z1 racecar driver?","Maxim Lugan, the top Z1 racecar driver?",リゼット,Ｚ１のトップレーサー、 マクシム・ルーガン氏ですか。,Ｚ１のトップレーサー、<br/>マクシム・ルーガン氏ですか。,,"<img class=""itp-kuro"" src=""itp/11/avfc5005_out.webp""/>"
l1000,5,183,Ferry,Yeah! That guy who always seems to be shooting himself in the foot.,Yeah! That guy who always seems to be shooting<br/>himself in the foot.,フェリ,はい、なんだかいつも 自爆してるって感じの人です。,はい、なんだかいつも<br/>自爆してるって感じの人です。,,"<img class=""itp-kuro"" src=""itp/11/avfc5003_out.webp""/>"
l1000,5,184,Agnes,F-Feri...,F-Feri...,アニエス,フェ、フェリちゃん……,フェ、フェリちゃん……,,"<img class=""itp-kuro"" src=""itp/11/avfc5001_out.webp""/>"
l1000,5,185,Van,We're Arkride Solutions. You the guy Bermotti wanted us to meet?,We're Arkride Solutions. You the guy Bermotti<br/>wanted us to meet?,ヴァン,こちらアークライド解決事務所。 ベルモッティの紹介だそうだな？,こちらアークライド解決事務所。<br/>ベルモッティの紹介だそうだな？,,"<img class=""itp-kuro"" src=""itp/11/avfc0000_out.webp""/>"
l1000,5,186,Maxim's voice,"That's right. Maxim Lugan here. It's been a while, spriggan.","That's right. Maxim Lugan here. It's been a<br/>while, spriggan.",マクシムの声,ああ、マクシム・ルーガンだ。 久しぶりだね、裏解決屋の諸君。,"<audio id=""v19_45014""><source src=""talk/11/v19_45014.opus"" type=""audio/ogg; codecs=opus""></audio><a href=""javascript:void(0)"" onclick=""document.getElementById('v19_45014').play()"">ああ、マクシム・ルーガンだ。<br/>久しぶりだね、裏解決屋の諸君。</a>",,
l1000,5,187,Maxim's voice,"I'd like to ask you to do a job for me—or a 4SPG, as I believe you call them.","I'd like to ask you to do a job for me—or a 4SPG,<br/>as I believe you call them.",マクシムの声,４ｓｐｇだったか──ベルモッティさんの 紹介で改めて君たちに依頼を頼みたい。,"<audio id=""v19_45015""><source src=""talk/11/v19_45015.opus"" type=""audio/ogg; codecs=opus""></audio><a href=""javascript:void(0)"" onclick=""document.getElementById('v19_45015').play()"">４ｓｐｇだったか──ベルモッティさんの<br/>紹介で改めて君たちに依頼を頼みたい。</a>",,
l1000,5,188,Maxim's voice,"Now, would it be a problem if we kept this conversation completely off the record?","Now, would it be a problem if we kept this<br/>conversation completely off the record?",マクシムの声,オフレコで話を聞いて貰えないかな？,"<audio id=""v19_45016""><source src=""talk/11/v19_45016.opus"" type=""audio/ogg; codecs=opus""></audio><a href=""javascript:void(0)"" onclick=""document.getElementById('v19_45016').play()"">オフレコで話を聞いて貰えないかな？</a>",,
l1000,6,189,Dream,Wheeeeee! VROOOM! VROOOOOOM! This car's the bestest!,Wheeeeee! VROOOM! VROOOOOOM! This car's<br/>the bestest!,ユメ,うわあああっ……！ ぎゅーんってする、ぎゅーんって！！,うわあああっ……！<br/>ぎゅーんってする、ぎゅーんって！！,,
l1000,6,190,Ferry,Isn't it?!,Isn't it?!,フェリ,うんうんっ！ なんだか嬉しくなっちゃうよね。,うんうんっ！<br/>なんだか嬉しくなっちゃうよね。,,"<img class=""itp-kuro"" src=""itp/11/avfc5003_out.webp""/>"
l1000,6,191,Aaron,Little kids are so easy to please.,Little kids are so easy to please.,アーロン,ハッ、ガキんちょ丸出しだな。,ハッ、ガキんちょ丸出しだな。,,"<img class=""itp-kuro"" src=""itp/11/avfc0002_out.webp""/>"
l1000,6,192,Quatre,And what's wrong with that? It's good to enjoy the little things in life.,And what's wrong with that? It's good to enjoy the<br/>little things in life.,カトル,いいんじゃない？ 楽しんだもの勝ちってことで。,いいんじゃない？<br/>楽しんだもの勝ちってことで。,,"<img class=""itp-kuro"" src=""itp/11/avfc0004_out.webp""/>"
l1000,6,193,Agnes,I'm glad the inn was understanding about her coming with us.,I'm glad the inn was understanding about her coming<br/>with us.,アニエス,ふふっ、宿の方が快く 認めてくれて良かったですね。,ふふっ、宿の方が快く<br/>認めてくれて良かったですね。,,"<img class=""itp-kuro"" src=""itp/11/avfc5001_out.webp""/>"
l1000,6,194,Van,Yeah. I was hoping we wouldn't have any issues since she's so young.,Yeah. I was hoping we wouldn't have any issues since<br/>she's so young.,ヴァン,ユメの年齢なら ついで</B>も利きそうだったしな。,ユメの年齢なら<br/><B>ついで</B>も利きそうだったしな。,,"<img class=""itp-kuro"" src=""itp/11/avfc0000_out.webp""/>"
l1000,6,195,Van,"And sure enough, we didn't. The best inn in Longlai knows how to do right by its customers.","And sure enough, we didn't. The best inn in Longlai<br/>knows how to do right by its customers.",ヴァン,さすが龍來きっての名旅館、 対応もソツが無かったぜ。,さすが龍來きっての名旅館、<br/>対応もソツが無かったぜ。,,"<img class=""itp-kuro"" src=""itp/11/avfc0000_out.webp""/>"
l1000,6,196,Lisette,It was considerate of you to propose that we look after her.,It was considerate of you to propose that we look<br/>after her.,リゼット,ユメ様をお預かりするというのも 良いご配慮でしたね。,ユメ様をお預かりするというのも<br/>良いご配慮でしたね。,,"<img class=""itp-kuro"" src=""itp/11/avfc5005_out.webp""/>"
l1000,6,197,Lisette,"Her guardians have much to discuss, after all.","Her guardians have much to discuss, after all.",リゼット,ポーレット様にビクトル様共々、 積もる話も色々ありそうでしたし。,ポーレット様にビクトル様共々、<br/>積もる話も色々ありそうでしたし。,,"<img class=""itp-kuro"" src=""itp/11/avfc5005_out.webp""/>"
l1000,6,198,Agnes,I imagine they got right into it as soon as we left.,I imagine they got right into it as soon as we left.,アニエス,はい……今ごろ 昔の話をしているんでしょうか？,はい……今ごろ<br/>昔の話をしているんでしょうか？,,"<img class=""itp-kuro"" src=""itp/11/avfc5001_out.webp""/>"
l1000,6,199,Agnes,"Maxim may end up having to talk with Victor, too.","Maxim may end up having to talk with Victor, too.",アニエス,場合によってはマクシムさんが ビクトルさんと話すようなことも……,場合によってはマクシムさんが<br/>ビクトルさんと話すようなことも……,,"<img class=""itp-kuro"" src=""itp/11/avfc5001_out.webp""/>"
l1000,6,200,Van,There's no shortage of things he's gotta answer for.,There's no shortage of things he's gotta answer for.,ヴァン,ハン、自業自得だろ。,ハン、自業自得だろ。,,"<img class=""itp-kuro"" src=""itp/11/avfc0000_out.webp""/>"
l1000,6,201,Van,"If he wants to be a part of their family, he's gotta rebuild those burned bridges—brick by brick.","If he wants to be a part of their family, he's gotta<br/>rebuild those burned bridges—brick by brick.",ヴァン,家族としてあの一家に関われるか、 正念場になるのは間違いねえだろうな。,家族としてあの一家に関われるか、<br/>正念場になるのは間違いねえだろうな。,,"<img class=""itp-kuro"" src=""itp/11/avfc0000_out.webp""/>"
l1000,6,202,Aaron,"And if he screws up and gets himself burned, I'll point and laugh my ass off.","And if he screws up and gets himself burned, I'll<br/>point and laugh my ass off.",アーロン,ま、駄目だった場合は 思いっきり笑い飛ばしてやるぜ。,ま、駄目だった場合は<br/>思いっきり笑い飛ばしてやるぜ。,,"<img class=""itp-kuro"" src=""itp/11/avfc0002_out.webp""/>"
l1000,6,203,Quatre,(Family...),(Family...),カトル,（……家族として、か………）,（……家族として、か………）,,"<img class=""itp-kuro"" src=""itp/11/avfc0004_out.webp""/>"
l1000,7,204,,"November 16th, 5:30PM","November 16th, 5:30PM",,１１月１６日　１７：３０,１１月１６日　１７：３０,,
l1000,7,205,Dream,I've never seen so many cars in my whole life!,I've never seen so many cars in my whole life!,ユメ,クルマいっぱーい。,"<audio id=""v41_45076""><source src=""talk/11/v41_45076.opus"" type=""audio/ogg; codecs=opus""></audio><a href=""javascript:void(0)"" onclick=""document.getElementById('v41_45076').play()"">クルマいっぱーい。</a>",,
