gameId,fname,scene,row,engChrName,engSearchText,engHtmlText,jpnChrName,jpnSearchText,jpnHtmlText,opName,pcIconHtml,evoIconHtml
l1000,1,1,Ferry,Whoa! It's so fast!,Whoa! It's so fast!,フェリ,わああっ……！ やっぱり速いですね……！,"<audio id=""v02_10060""><source src=""talk/11/v02_10060.opus"" type=""audio/ogg; codecs=opus""></audio><a href=""javascript:void(0)"" onclick=""document.getElementById('v02_10060').play()"">わああっ……！<br/>やっぱり速いですね……！</a>",,"<img class=""itp-kuro"" src=""itp/11/avfc5003_out.webp""/>"
l1000,1,2,Agnes,"And it still manages to be such a smooth ride, too.","And it still manages to be such a smooth ride, too.",アニエス,ふふっ、それなのに あんまり揺れていませんし……,"<audio id=""v01_10014""><source src=""talk/11/v01_10014.opus"" type=""audio/ogg; codecs=opus""></audio><a href=""javascript:void(0)"" onclick=""document.getElementById('v01_10014').play()"">ふふっ、それなのに<br/>あんまり揺れていませんし……</a>",,"<img class=""itp-kuro"" src=""itp/11/avfc5001_out.webp""/>"
l1000,1,3,Agnes,"I think I can see a little of why you're so proud of it, Van.","I think I can see a little of why you're so proud of<br/>it, Van.",アニエス,ヴァンさんが自慢するのも 分かる気がします。,"<audio id=""v01_10015""><source src=""talk/11/v01_10015.opus"" type=""audio/ogg; codecs=opus""></audio><a href=""javascript:void(0)"" onclick=""document.getElementById('v01_10015').play()"">ヴァンさんが自慢するのも<br/>分かる気がします。</a>",,"<img class=""itp-kuro"" src=""itp/11/avfc5001_out.webp""/>"
l1000,1,4,Van,I'd really start to cry if you couldn't.,I'd really start to cry if you couldn't.,ヴァン,ヘッ、そうだろそうだろ。,"<audio id=""v00_10034""><source src=""talk/11/v00_10034.opus"" type=""audio/ogg; codecs=opus""></audio><a href=""javascript:void(0)"" onclick=""document.getElementById('v00_10034').play()"">ヘッ、そうだろそうだろ。</a>",,"<img class=""itp-kuro"" src=""itp/11/avfc0000_out.webp""/>"
l1000,1,5,Van,We'll be outta the capital and on the northern highway in ten or so.,We'll be outta the capital and on the northern<br/>highway in ten or so.,ヴァン,あと１０分くらいで 首都高を抜けて北の国道へ出る。,"<audio id=""v00_10035""><source src=""talk/11/v00_10035.opus"" type=""audio/ogg; codecs=opus""></audio><a href=""javascript:void(0)"" onclick=""document.getElementById('v00_10035').play()"">あと１０分くらいで<br/>首都高を抜けて北の国道へ出る。</a>",,"<img class=""itp-kuro"" src=""itp/11/avfc0000_out.webp""/>"
l1000,1,6,Van,Then I'll show you how fast and smooth my baby can REALLY be.,Then I'll show you how fast and smooth my baby can<br/>REALLY be.,ヴァン,そしたらコイツの速さと安定性を もう少し味わわせてやるよ。,"<audio id=""v00_10036""><source src=""talk/11/v00_10036.opus"" type=""audio/ogg; codecs=opus""></audio><a href=""javascript:void(0)"" onclick=""document.getElementById('v00_10036').play()"">そしたらコイツの速さと安定性を<br/>もう少し味わわせてやるよ。</a>",,"<img class=""itp-kuro"" src=""itp/11/avfc0000_out.webp""/>"
l1000,1,7,Ferry,It can go even faster?!,It can go even faster?!,フェリ,凄い……！ もっとスピードが出るんですねっ？,"<audio id=""v02_10061""><source src=""talk/11/v02_10061.opus"" type=""audio/ogg; codecs=opus""></audio><a href=""javascript:void(0)"" onclick=""document.getElementById('v02_10061').play()"">凄い……！<br/>もっとスピードが出るんですねっ？</a>",,"<img class=""itp-kuro"" src=""itp/11/avfc5003_out.webp""/>"
l1000,1,8,Agnes,"J-Just try to keep it safe, please...","J-Just try to keep it safe, please...",アニエス,あ、安全運転でお願いします……,"<audio id=""v01_10016""><source src=""talk/11/v01_10016.opus"" type=""audio/ogg; codecs=opus""></audio><a href=""javascript:void(0)"" onclick=""document.getElementById('v01_10016').play()"">あ、安全運転でお願いします……</a>",,"<img class=""itp-kuro"" src=""itp/11/avfc5001_out.webp""/>"
l1000,2,9,Aaron,"You sure know how to stay busy while on the job, don'tcha?","You sure know how to stay busy while on the<br/>job, don'tcha?",アーロン,──しっかし、 なかなか盛り沢山だったな。,──しっかし、<br/>なかなか盛り沢山だったな。,,"<img class=""itp-kuro"" src=""itp/11/avfc0002_out.webp""/>"
l1000,2,10,Aaron,"We ran up, down, and all around the city—and we even headed to its outskirts.","We ran up, down, and all around the city—and we<br/>even headed to its outskirts.",アーロン,４ｓｐｇとやらのチェックに街巡り、 挙句の果てに郊外まで遠征かよ。,４ｓｐｇとやらのチェックに街巡り、<br/>挙句の果てに郊外まで遠征かよ。,,"<img class=""itp-kuro"" src=""itp/11/avfc0002_out.webp""/>"
l1000,2,11,Aaron,Is this what every day's gonna be like?,Is this what every day's gonna be like?,アーロン,毎度毎度、こんな事をやってんのか？,毎度毎度、こんな事をやってんのか？,,"<img class=""itp-kuro"" src=""itp/11/avfc0002_out.webp""/>"
l1000,2,12,Van,"Nah. We usually have more free time, but we'll have busy days like this every now and then.","Nah. We usually have more free time, but we'll have<br/>busy days like this every now and then.",ヴァン,大抵はもう少し暇だが、 溜まるとこれくらいはザラだな。,大抵はもう少し暇だが、<br/>溜まるとこれくらいはザラだな。,,"<img class=""itp-kuro"" src=""itp/11/avfc0000_out.webp""/>"
l1000,2,13,Van,Why? You afraid of a little elbow grease?,Why? You afraid of a little elbow grease?,ヴァン,なんだ、早くも腰が引けたかよ？,なんだ、早くも腰が引けたかよ？,,"<img class=""itp-kuro"" src=""itp/11/avfc0000_out.webp""/>"
l1000,2,14,Aaron,Pfft. As if.,Pfft. As if.,アーロン,ハッ、抜かしやがれ。,ハッ、抜かしやがれ。,,"<img class=""itp-kuro"" src=""itp/11/avfc0002_out.webp""/>"
l1000,2,15,Aaron,I'm never opposed to getting my hands dirty as long as the work's not boring—and today's jobs definitely weren't that.,I'm never opposed to getting my hands dirty as long<br/>as the work's not boring—and today's jobs definitely<br/>weren't that.,アーロン,少なくとも退屈はしなさそうだ。 やるからには精々楽しませてもらうぜ。,少なくとも退屈はしなさそうだ。<br/>やるからには精々楽しませてもらうぜ。,,"<img class=""itp-kuro"" src=""itp/11/avfc0002_out.webp""/>"
l1000,2,16,Van,"Good, 'cause there's plenty more where that came from.","Good, 'cause there's plenty more where that<br/>came from.",ヴァン,結構結構。 若いモンはそうでなくちゃな。,結構結構。<br/>若いモンはそうでなくちゃな。,,"<img class=""itp-kuro"" src=""itp/11/avfc0000_out.webp""/>"
l1000,2,17,Ferry,Heehee.,Heehee.,フェリ,ふふっ……,ふふっ……,,"<img class=""itp-kuro"" src=""itp/11/avfc5003_out.webp""/>"
l1000,2,18,Ferry,Oh! I almost forgot. Do you mind if we drop by the roastery in the 9th District?,Oh! I almost forgot. Do you mind if we drop by the<br/>roastery in the 9th District?,フェリ,あ──そうだヴァンさん。 “九区”に寄ってもいいですか？,あ──そうだヴァンさん。<br/>“九区”に寄ってもいいですか？,,"<img class=""itp-kuro"" src=""itp/11/avfc5003_out.webp""/>"
l1000,2,19,Ferry,Paulette asked if I could get some coffee beans while we were out.,Paulette asked if I could get some coffee beans while<br/>we were out.,フェリ,実はポーレットさんから コーヒー豆を頼まれてまして。,実はポーレットさんから<br/>コーヒー豆を頼まれてまして。,,"<img class=""itp-kuro"" src=""itp/11/avfc5003_out.webp""/>"
l1000,2,20,Van,Got it. We can make a quick stop.,Got it. We can make a quick stop.,ヴァン,ああ、いいぜ。 九区の焙煎所だったか。,ああ、いいぜ。<br/>九区の焙煎所だったか。,,"<img class=""itp-kuro"" src=""itp/11/avfc0000_out.webp""/>"
l1000,2,21,Aaron,"Damn it, small fry. Way to make this trip longer than it needs to be.","Damn it, small fry. Way to make this trip longer than<br/>it needs to be.",アーロン,メンドくせぇな…… 別にいいけどよ。,メンドくせぇな……<br/>別にいいけどよ。,,"<img class=""itp-kuro"" src=""itp/11/avfc0002_out.webp""/>"
l1000,2,22,Aaron,...Hmm?,...Hmm?,アーロン,あん……？,あん……？,,"<img class=""itp-kuro"" src=""itp/11/avfc0002_out.webp""/>"
l1000,2,23,Ferry,It's raining.,It's raining.,フェリ,あ……,あ……,,"<img class=""itp-kuro"" src=""itp/11/avfc5003_out.webp""/>"
l1000,2,24,Van,And there goes the paint job.,And there goes the paint job.,ヴァン,降ってきやがったな。,降ってきやがったな。,,"<img class=""itp-kuro"" src=""itp/11/avfc0000_out.webp""/>"
l1000,3,25,Agnes,I never thought Aaron would be such a great driver.,I never thought Aaron would be such a great driver.,アニエス,ふふ、アーロンさんも 確かに慣れている感じですね。,ふふ、アーロンさんも<br/>確かに慣れている感じですね。,,"<img class=""itp-kuro"" src=""itp/11/avfc5001_out.webp""/>"
l1000,3,26,Ferry,His smooth driving skills are off the charts! He's really giving Van a run for his money.,His smooth driving skills are off the charts!<br/>He's really giving Van a run for his money.,フェリ,えへへ、揺れませんし快適です。 ヴァンさんと比べても遜色ないかと。,えへへ、揺れませんし快適です。<br/>ヴァンさんと比べても遜色ないかと。,,"<img class=""itp-kuro"" src=""itp/11/avfc5003_out.webp""/>"
l1000,3,27,Aaron,See? Told you I kick ass behind the wheel.,See? Told you I kick ass behind the wheel.,アーロン,そうだろそうだろ。,そうだろそうだろ。,,"<img class=""itp-kuro"" src=""itp/11/avfc0002_out.webp""/>"
l1000,3,28,Van,Ugh. Only thing I hate more than a smug little shit is a smug little shit with talent.,Ugh. Only thing I hate more than a smug little shit is<br/>a smug little shit with talent.,ヴァン,……チッ。 まあ悪くはねぇな。,……チッ。<br/>まあ悪くはねぇな。,,"<img class=""itp-kuro"" src=""itp/11/avfc0000_out.webp""/>"
l1000,3,29,Aaron,"I'll admit, this isn't a bad ride. I can see why you're always raving about her.","I'll admit, this isn't a bad ride. I can see why you're<br/>always raving about her.",アーロン,いや、てめぇの車も言うだけあるぜ？,いや、てめぇの車も言うだけあるぜ？,,"<img class=""itp-kuro"" src=""itp/11/avfc0002_out.webp""/>"
l1000,3,30,Aaron,"She's smooth, customizable, and comfy. I can also make sharp turns without a hitch.","She's smooth, customizable, and comfy. I can also<br/>make sharp turns without a hitch.",アーロン,乗り心地は上質、拡張性も高くて パワーと小回りをギリ両立させている。,乗り心地は上質、拡張性も高くて<br/>パワーと小回りをギリ両立させている。,,"<img class=""itp-kuro"" src=""itp/11/avfc0002_out.webp""/>"
l1000,3,31,Aaron,"I've always been a Red Star kind of guy, but I'm coming around to Ingert.","I've always been a Red Star kind of guy, but I'm<br/>coming around to Ingert.",アーロン,オレは断然、紅星（レッドスター）派だったが インゲルトもなかなか悪くねぇな。,オレは断然、紅星（レッドスター）派だったが<br/>インゲルトもなかなか悪くねぇな。,,"<img class=""itp-kuro"" src=""itp/11/avfc0002_out.webp""/>"
l1000,3,32,Van,"Heh. I'll make a convert out of you yet. Of the four main brands, they're the best of the bun—","Heh. I'll make a convert out of you yet. Of the four<br/>main brands, they're the best of the bun—",ヴァン,ヘッ、分かってんじゃねーか。 四大メーカーじゃ個人的には──,ヘッ、分かってんじゃねーか。<br/>四大メーカーじゃ個人的には──,,"<img class=""itp-kuro"" src=""itp/11/avfc0000_out.webp""/>"
l1000,3,33,Aaron,"I think I'll take her for a spin from time to time. If I pretend she's mine, every girl in town will want a piece of me. ❤","I think I'll take her for a spin from time to time. If I<br/>pretend she's mine, every girl in town will want a<br/>piece of me. ❤",アーロン,つーわけでたまに貸せや。 ナンパにも使えそうだしな❤,つーわけでたまに貸せや。<br/>ナンパにも使えそうだしな❤,,"<img class=""itp-kuro"" src=""itp/11/avfc0002_out.webp""/>"
l1000,3,34,Van,Burn. In. Hell.,Burn. In. Hell.,ヴァン,絶 対 に 断 る。,<S5>絶 対 に 断 る。,,"<img class=""itp-kuro"" src=""itp/11/avfc0000_out.webp""/>"
l1000,3,35,Van,"Anyway, I'll let you stay on the wheel for a while.","Anyway, I'll let you stay on the wheel for a while.",ヴァン,……ま、しばらく運転は任せた。,……ま、しばらく運転は任せた。,,"<img class=""itp-kuro"" src=""itp/11/avfc0000_out.webp""/>"
l1000,3,36,Van,"If you and I keep takin' turns, we'll be at Tharbad by sunrise.","If you and I keep takin' turns, we'll be at Tharbad<br/>by sunrise.",ヴァン,休憩と交代を繰り返しながら進めば 朝までにはサルバッドに着くだろう。,休憩と交代を繰り返しながら進めば<br/>朝までにはサルバッドに着くだろう。,,"<img class=""itp-kuro"" src=""itp/11/avfc0000_out.webp""/>"
l1000,3,37,Van,Then we can meet up with Nina. Curious to find out what we signed up for.,Then we can meet up with Nina. Curious to find out<br/>what we signed up for.,ヴァン,あのニナ・フェンリィの 依頼自体ももちろん気になるが──,あのニナ・フェンリィの<br/>依頼自体ももちろん気になるが──,,"<img class=""itp-kuro"" src=""itp/11/avfc0000_out.webp""/>"
l1000,3,38,Agnes,"Me, too. It must involve the Geneses somehow, but that's about all we know for sure.","Me, too. It must involve the Geneses somehow, but<br/>that's about all we know for sure.",アニエス,はい──ゲネシスが光った以上、 “何か”があるのは間違いありません。,はい──ゲネシスが光った以上、<br/>“何か”があるのは間違いありません。,,"<img class=""itp-kuro"" src=""itp/11/avfc5001_out.webp""/>"
l1000,3,39,Agnes,It's times like these when I wish I could glean more insight from them when they're glowing...,It's times like these when I wish I could glean more<br/>insight from them when they're glowing...,アニエス,その……毎回“それが何か”まで 分からないのが申し訳ないですけど……,その……毎回“それが何か”まで<br/>分からないのが申し訳ないですけど……,,"<img class=""itp-kuro"" src=""itp/11/avfc5001_out.webp""/>"
l1000,3,40,Ferry,"Hey, don't go beating yourself up.","Hey, don't go beating yourself up.",フェリ,そんな、アニエスさんが 謝ることじゃないですよっ。,そんな、アニエスさんが<br/>謝ることじゃないですよっ。,,"<img class=""itp-kuro"" src=""itp/11/avfc5003_out.webp""/>"
l1000,3,41,Ferry,"I've been wondering, though. How does the glowing thing even work?","I've been wondering, though. How does the glowing<br/>thing even work?",フェリ,でも、本当に不思議ですよね…… どういう仕組みなんでしょう？,でも、本当に不思議ですよね……<br/>どういう仕組みなんでしょう？,,"<img class=""itp-kuro"" src=""itp/11/avfc5003_out.webp""/>"
l1000,3,42,Van,"Goddess only knows. Those things might not be indecipherable enigmas like artifacts, but we still know next to nothing about 'em.","Goddess only knows. Those things might not be<br/>indecipherable enigmas like artifacts, but we still<br/>know next to nothing about 'em.",ヴァン,ああ、仕組みが解明できない 古代遺物（アーティファクト）とは違う筈だが……,ああ、仕組みが解明できない<br/>古代遺物（アーティファクト）とは違う筈だが……,,"<img class=""itp-kuro"" src=""itp/11/avfc0000_out.webp""/>"
l1000,3,43,Aaron,Maybe there's a pattern for when they light up.,Maybe there's a pattern for when they light up.,アーロン,ハン…… 俺は煌都の時しか知らねえが。,ハン……<br/>俺は煌都の時しか知らねえが。,,"<img class=""itp-kuro"" src=""itp/11/avfc0002_out.webp""/>"
l1000,3,44,Aaron,Don't they go off when Almata's pulling shit? Could they be in Tharbad?,Don't they go off when Almata's pulling shit?<br/>Could they be in Tharbad?,アーロン,今までに共通しているパターン── たとえばアルマータは関係してんのか？,今までに共通しているパターン──<br/>たとえばアルマータは関係してんのか？,,"<img class=""itp-kuro"" src=""itp/11/avfc0002_out.webp""/>"
l1000,3,45,Ferry,...!,...!,フェリ,……！,……！,,"<img class=""itp-kuro"" src=""itp/11/avfc5003_out.webp""/>"
l1000,3,46,Van,"I had my contacts look into that, but they haven't found a trace of 'em there.","I had my contacts look into that, but they haven't<br/>found a trace of 'em there.",ヴァン,分からん……ツテで色々調べたが 今のところそれらしい連中はいねぇ。,分からん……ツテで色々調べたが<br/>今のところそれらしい連中はいねぇ。,,"<img class=""itp-kuro"" src=""itp/11/avfc0000_out.webp""/>"
l1000,3,47,Van,"Still, they could've been the ones who sent those threat letters out.","Still, they could've been the ones who sent those<br/>threat letters out.",ヴァン,それこそ各方面に届いたっつう “脅迫状”がそうかもしれねえが。,それこそ各方面に届いたっつう<br/>“脅迫状”がそうかもしれねえが。,,"<img class=""itp-kuro"" src=""itp/11/avfc0000_out.webp""/>"
l1000,3,48,Ferry,Fingers crossed that isn't the case.,Fingers crossed that isn't the case.,フェリ,ニナさんの“まねーじゃー”のヒトが 届けてくれたっていう……,ニナさんの“まねーじゃー”のヒトが<br/>届けてくれたっていう……,,"<img class=""itp-kuro"" src=""itp/11/avfc5003_out.webp""/>"
l1000,3,49,Aaron,I'll bet it isn't. The approach is too soft and roundabout for them.,I'll bet it isn't. The approach is too soft and<br/>roundabout for them.,アーロン,……連中（アルマータ）のやり方にしちゃあ、 ぬるいっつうか回りくどい感じだが。,……連中（アルマータ）のやり方にしちゃあ、<br/>ぬるいっつうか回りくどい感じだが。,,"<img class=""itp-kuro"" src=""itp/11/avfc0002_out.webp""/>"
l1000,3,50,Agnes,"Not to mention, they don't have anything to gain by obstructing the festival.","Not to mention, they don't have anything to gain by<br/>obstructing the festival.",アニエス,そうですね、映画祭を 邪魔する意味も分かりませんし……,そうですね、映画祭を<br/>邪魔する意味も分かりませんし……,,"<img class=""itp-kuro"" src=""itp/11/avfc5001_out.webp""/>"
l1000,3,51,Agnes,"At least, not the one in Tharbad. Maybe they had reason to stop the one in Messeldam since they're headquartered there.","At least, not the one in Tharbad. Maybe they had<br/>reason to stop the one in Messeldam since they're<br/>headquartered there.",アニエス,中止した映画祭のメッセルダムは まさに彼らの本拠地らしいですけど。,中止した映画祭のメッセルダムは<br/>まさに彼らの本拠地らしいですけど。,,"<img class=""itp-kuro"" src=""itp/11/avfc5001_out.webp""/>"
l1000,3,52,Van,"Nah. Last I heard, they moved outta Messeldam a long time ago.","Nah. Last I heard, they moved outta Messeldam a<br/>long time ago.",ヴァン,いや……本拠はとっくに そこから移しているらしくてな。,いや……本拠はとっくに<br/>そこから移しているらしくてな。,,"<img class=""itp-kuro"" src=""itp/11/avfc0000_out.webp""/>"
l1000,3,53,Van,The people responsible for stoppin' the last festival were a bunch of racial terrorists.,The people responsible for stoppin' the last festival<br/>were a bunch of racial terrorists.,ヴァン,そっちの映画祭が狙われたのは 民族テロ関連の仕業らしい。,そっちの映画祭が狙われたのは<br/>民族テロ関連の仕業らしい。,,"<img class=""itp-kuro"" src=""itp/11/avfc0000_out.webp""/>"
l1000,3,54,Van,They threatened it and started a fire. Whole thing was canceled as a precaution.,They threatened it and started a fire. Whole thing<br/>was canceled as a precaution.,ヴァン,まあ予告状とボヤくらいで 念のため大事を取っただけらしいが。,まあ予告状とボヤくらいで<br/>念のため大事を取っただけらしいが。,,"<img class=""itp-kuro"" src=""itp/11/avfc0000_out.webp""/>"
l1000,3,55,Ferry,What? For real?,What? For real?,フェリ,民族テロ……ですか。,民族テロ……ですか。,,"<img class=""itp-kuro"" src=""itp/11/avfc5003_out.webp""/>"
l1000,3,56,Aaron,And here I thought those racist bastards were a dying breed. I'd love to wipe the floor with those shitstains.,And here I thought those racist bastards were a<br/>dying breed. I'd love to wipe the floor with<br/>those shitstains.,アーロン,クズだな、クズ。 一時期イキってたみてぇだが。,クズだな、クズ。<br/>一時期イキってたみてぇだが。,,"<img class=""itp-kuro"" src=""itp/11/avfc0002_out.webp""/>"
l1000,4,57,Ferry,It's so spacious in here!,It's so spacious in here!,フェリ,わあっ……！ すっごく広いですねぇ！,わあっ……！<br/>すっごく広いですねぇ！,,"<img class=""itp-kuro"" src=""itp/11/avfc5003_out.webp""/>"
l1000,4,58,Aaron,"This here's an ETWS stretch limo, right? Hell of a luxury.","This here's an ETWS stretch limo, right? Hell of<br/>a luxury.",アーロン,エトワスのストレッチリムジンか。 まさに贅沢の極みってヤツだな。,エトワスのストレッチリムジンか。<br/>まさに贅沢の極みってヤツだな。,,"<img class=""itp-kuro"" src=""itp/11/avfc0002_out.webp""/>"
l1000,4,59,Aaron,"Ride's smooth as a baby's ass, too. Still room to move up in the world, huh?","Ride's smooth as a baby's ass, too. Still room to move<br/>up in the world, huh?",アーロン,さっきから揺れ一つしねぇし、 上には上ってのがあるもんだよなァ？,さっきから揺れ一つしねぇし、<br/>上には上ってのがあるもんだよなァ？,,"<img class=""itp-kuro"" src=""itp/11/avfc0002_out.webp""/>"
l1000,4,60,Van,Hmph. The suspension systems in a luxury vehicle like this versus my pickup are built for totally different things.,Hmph. The suspension systems in a luxury vehicle<br/>like this versus my pickup are built for totally<br/>different things.,ヴァン,フン、ＰＵ（ピックアップ）とこの手の高級車じゃ 足回りの思想がそもそもだなぁ……,フン、ＰＵ（ピックアップ）とこの手の高級車じゃ<br/>足回りの思想がそもそもだなぁ……,,"<img class=""itp-kuro"" src=""itp/11/avfc0000_out.webp""/>"
l1000,4,61,Prince Sheridan,"Haha. Speaking of, I take it you liked the part I sent you?","Haha. Speaking of, I take it you liked the part I<br/>sent you?",シェリド公太子,フフ、そういえば“例のパーツ”は 気に入ってくれたかな？,フフ、そういえば“例のパーツ”は<br/>気に入ってくれたかな？,,
l1000,4,62,Prince Sheridan,I got it on special order to ensure it didn't clash with the aesthetic of your truck.,I got it on special order to ensure it didn't clash with<br/>the aesthetic of your truck.,シェリド公太子,君の愛車のデザインを損なわないよう 特注させてもらったんだが。,君の愛車のデザインを損なわないよう<br/>特注させてもらったんだが。,,
l1000,4,63,Van,"Oh, 'like' undersells it. It's a thing of beauty.","Oh, 'like' undersells it. It's a thing of beauty.",ヴァン,あー、それについては感謝してますよ。,あー、それについては感謝してますよ。,,"<img class=""itp-kuro"" src=""itp/11/avfc0000_out.webp""/>"
l1000,4,64,Van,Even if that ulterior motive behind sending it wasn't just in my head.,Even if that ulterior motive behind sending it wasn't<br/>just in my head.,ヴァン,微妙に透けて見えた“意図”は 気のせいじゃなかったみたいですが。,微妙に透けて見えた“意図”は<br/>気のせいじゃなかったみたいですが。,,"<img class=""itp-kuro"" src=""itp/11/avfc0000_out.webp""/>"
l1000,4,65,Agnes,"Hmm? ...Still, I'm glad you're both looking well.","Hmm? ...Still, I'm glad you're both looking well.",アニエス,？　でも殿下もナージェさんも お元気そうで本当に良かったです。,？　でも殿下もナージェさんも<br/>お元気そうで本当に良かったです。,,"<img class=""itp-kuro"" src=""itp/11/avfc5001_out.webp""/>"
l1000,4,66,Nager,Thank you. My apologies again for all the trouble we caused you.,Thank you. My apologies again for all the trouble we<br/>caused you.,ナージェ,ええ……その節は 本当にご迷惑をおかけしました。,ええ……その節は<br/>本当にご迷惑をおかけしました。,,
