gameId,fname,scene,row,engChrName,engSearchText,engHtmlText,jpnChrName,jpnSearchText,jpnHtmlText,opName,pcIconHtml,evoIconHtml
m2310,9,306,Agnes,He...did it.,He...did it.,アニエス,……戻っ、た…………,"<audio id=""v01_20059""><source src=""talk/11/v01_20059.opus"" type=""audio/ogg; codecs=opus""></audio><a href=""javascript:void(0)"" onclick=""document.getElementById('v01_20059').play()"">……戻っ、た…………</a>",,"<img class=""itp-kuro"" src=""itp/11/avfc5001_out.webp""/>"
m2310,9,307,Ferry,The evil spirit has vanished.,The evil spirit has vanished.,フェリ,悪しき息吹も…… ……治まりました……,"<audio id=""v02_20054""><source src=""talk/11/v02_20054.opus"" type=""audio/ogg; codecs=opus""></audio><a href=""javascript:void(0)"" onclick=""document.getElementById('v02_20054').play()"">悪しき息吹も……<br/>……治まりました……</a>",,"<img class=""itp-kuro"" src=""itp/11/avfc5003_out.webp""/>"
m2310,9,308,Van,"Heh. Nice work, kid.","Heh. Nice work, kid.",ヴァン,ああ…… ヤバイ気配も完全に消えている。,"<audio id=""v00_20110""><source src=""talk/11/v00_20110.opus"" type=""audio/ogg; codecs=opus""></audio><a href=""javascript:void(0)"" onclick=""document.getElementById('v00_20110').play()"">ああ……<br/>ヤバイ気配も完全に消えている。</a>",,"<img class=""itp-kuro"" src=""itp/11/avfc0000_out.webp""/>"
m2310,9,309,Van,Teach that thing who's runnin' the show.,Teach that thing who's runnin' the show.,ヴァン,“乗り越えやがった”みてぇだな。,"<audio id=""v00_20111""><source src=""talk/11/v00_20111.opus"" type=""audio/ogg; codecs=opus""></audio><a href=""javascript:void(0)"" onclick=""document.getElementById('v00_20111').play()"">“乗り越えやがった”みてぇだな。</a>",,"<img class=""itp-kuro"" src=""itp/11/avfc0000_out.webp""/>"
m2310,9,310,Agnes,"Oh, thank goodness...","Oh, thank goodness...",アニエス,アーロンさん…… ……よかった…………,"<audio id=""v01_20060""><source src=""talk/11/v01_20060.opus"" type=""audio/ogg; codecs=opus""></audio><a href=""javascript:void(0)"" onclick=""document.getElementById('v01_20060').play()"">アーロンさん……<br/>……よかった…………</a>",,"<img class=""itp-kuro"" src=""itp/11/avfc5001_out.webp""/>"
m2310,9,311,Ferry,I could sense two souls within him.,I could sense two souls within him.,フェリ,……“彼”の中で 二つの息吹を感じました。,"<audio id=""v02_20055""><source src=""talk/11/v02_20055.opus"" type=""audio/ogg; codecs=opus""></audio><a href=""javascript:void(0)"" onclick=""document.getElementById('v02_20055').play()"">……“彼”の中で<br/>二つの息吹を感じました。</a>",,"<img class=""itp-kuro"" src=""itp/11/avfc5003_out.webp""/>"
m2310,9,312,Ferry,He must have defeated the demon.,He must have defeated the demon.,フェリ,多分、それに打ち克って……,"<audio id=""v02_20056""><source src=""talk/11/v02_20056.opus"" type=""audio/ogg; codecs=opus""></audio><a href=""javascript:void(0)"" onclick=""document.getElementById('v02_20056').play()"">多分、それに打ち克って……</a>",,"<img class=""itp-kuro"" src=""itp/11/avfc5003_out.webp""/>"
m2310,9,313,Aaron,*cough* *cough*,*cough* *cough*,アーロン,ゲホッ……ケホ……クッ………,"<audio id=""v03_20147""><source src=""talk/11/v03_20147.opus"" type=""audio/ogg; codecs=opus""></audio><a href=""javascript:void(0)"" onclick=""document.getElementById('v03_20147').play()"">ゲホッ……ケホ……クッ………</a>",,"<img class=""itp-kuro"" src=""itp/11/avfc0002_out.webp""/>"
m2310,9,314,Ferry,Aaron!,Aaron!,フェリ,アーロンさんっ！,"<audio id=""v02_20057""><source src=""talk/11/v02_20057.opus"" type=""audio/ogg; codecs=opus""></audio><a href=""javascript:void(0)"" onclick=""document.getElementById('v02_20057').play()"">アーロンさんっ！</a>",,"<img class=""itp-kuro"" src=""itp/11/avfc5003_out.webp""/>"
m2310,9,315,Agnes,Are you all right?!,Are you all right?!,アニエス,大丈夫ですか……！？,"<audio id=""v01_20061""><source src=""talk/11/v01_20061.opus"" type=""audio/ogg; codecs=opus""></audio><a href=""javascript:void(0)"" onclick=""document.getElementById('v01_20061').play()"">大丈夫ですか……！？</a>",,"<img class=""itp-kuro"" src=""itp/11/avfc5001_out.webp""/>"
m2310,9,316,Aaron,Yeah... I think so...,Yeah... I think so...,アーロン,ああ……… ……それより……俺は……,"<audio id=""v03_20148""><source src=""talk/11/v03_20148.opus"" type=""audio/ogg; codecs=opus""></audio><a href=""javascript:void(0)"" onclick=""document.getElementById('v03_20148').play()"">ああ………<br/>……それより……俺は……</a>",,"<img class=""itp-kuro"" src=""itp/11/avfc0002_out.webp""/>"
m2310,9,317,Aaron,What happened to the Tyrant?,What happened to the Tyrant?,アーロン,大君………あの野郎は………？,"<audio id=""v03_20149""><source src=""talk/11/v03_20149.opus"" type=""audio/ogg; codecs=opus""></audio><a href=""javascript:void(0)"" onclick=""document.getElementById('v03_20149').play()"">大君………あの野郎は………？</a>",,"<img class=""itp-kuro"" src=""itp/11/avfc0002_out.webp""/>"
m2310,9,318,Van,Got his ass beat. Now you can go back to being a brat.,Got his ass beat. Now you can go back to being<br/>a brat.,ヴァン,綺麗さっぱり消えちまった。 元のクソガキに完全に戻ってるぞ。,"<audio id=""v00_20112""><source src=""talk/11/v00_20112.opus"" type=""audio/ogg; codecs=opus""></audio><a href=""javascript:void(0)"" onclick=""document.getElementById('v00_20112').play()"">綺麗さっぱり消えちまった。<br/>元のクソガキに完全に戻ってるぞ。</a>",,"<img class=""itp-kuro"" src=""itp/11/avfc0000_out.webp""/>"
m2310,9,319,Van,But a brat that managed to save this town.,But a brat that managed to save this town.,ヴァン,ちゃんと──守れたじゃねえか？,"<audio id=""v00_20113""><source src=""talk/11/v00_20113.opus"" type=""audio/ogg; codecs=opus""></audio><a href=""javascript:void(0)"" onclick=""document.getElementById('v00_20113').play()"">ちゃんと──守れたじゃねえか？</a>",,"<img class=""itp-kuro"" src=""itp/11/avfc0000_out.webp""/>"
m2310,9,320,Aaron,"Haha... I did, huh?","Haha... I did, huh?",アーロン,ハハッ……そう、かよ。,"<audio id=""v03_20150""><source src=""talk/11/v03_20150.opus"" type=""audio/ogg; codecs=opus""></audio><a href=""javascript:void(0)"" onclick=""document.getElementById('v03_20150').play()"">ハハッ……そう、かよ。</a>",,"<img class=""itp-kuro"" src=""itp/11/avfc0002_out.webp""/>"
m2310,9,321,Aaron,...,...,アーロン,…………………………………,"<audio id=""v03_20151""><source src=""talk/11/v03_20151.opus"" type=""audio/ogg; codecs=opus""></audio><a href=""javascript:void(0)"" onclick=""document.getElementById('v03_20151').play()"">…………………………………</a>",,"<img class=""itp-kuro"" src=""itp/11/avfc0002_out.webp""/>"
m2310,9,322,Agnes,It's finally over...,It's finally over...,アニエス,ようやく終わったんですね…… ……今回の一連の事件が………,"<audio id=""v01_20062""><source src=""talk/11/v01_20062.opus"" type=""audio/ogg; codecs=opus""></audio><a href=""javascript:void(0)"" onclick=""document.getElementById('v01_20062').play()"">ようやく終わったんですね……<br/>……今回の一連の事件が………</a>",,"<img class=""itp-kuro"" src=""itp/11/avfc5001_out.webp""/>"
m2310,9,323,Ferry,"Without the Tyrant's help, Almata doesn't stand a chance of beating Heiyue.","Without the Tyrant's help, Almata doesn't stand a<br/>chance of beating Heiyue.",フェリ,はい……陽動も失敗ですし。,"<audio id=""v02_20058""><source src=""talk/11/v02_20058.opus"" type=""audio/ogg; codecs=opus""></audio><a href=""javascript:void(0)"" onclick=""document.getElementById('v02_20058').play()"">はい……陽動も失敗ですし。</a>",,"<img class=""itp-kuro"" src=""itp/11/avfc5003_out.webp""/>"
m2310,9,324,Ferry,They should be pulling out of the city soon.,They should be pulling out of the city soon.,フェリ,今ごろアルマータたちも 撤退していると思います……,"<audio id=""v02_20059""><source src=""talk/11/v02_20059.opus"" type=""audio/ogg; codecs=opus""></audio><a href=""javascript:void(0)"" onclick=""document.getElementById('v02_20059').play()"">今ごろアルマータたちも<br/>撤退していると思います……</a>",,"<img class=""itp-kuro"" src=""itp/11/avfc5003_out.webp""/>"
m2310,9,325,Old man's voice,You all fought admirably.,You all fought admirably.,老人の声,──大義であったな。 裏解決屋にアーロンよ。,"<audio id=""v66_20021""><source src=""talk/11/v66_20021.opus"" type=""audio/ogg; codecs=opus""></audio><a href=""javascript:void(0)"" onclick=""document.getElementById('v66_20021').play()"">──大義であったな。<br/>裏解決屋にアーロンよ。</a>",,
m2310,9,326,Aaron,Lǎo Yéye...?!,Lǎo Yéye...?!,アーロン,ギエン、爺さん……！？,"<audio id=""v03_20152""><source src=""talk/11/v03_20152.opus"" type=""audio/ogg; codecs=opus""></audio><a href=""javascript:void(0)"" onclick=""document.getElementById('v03_20152').play()"">ギエン、爺さん……！？</a>",,"<img class=""itp-kuro"" src=""itp/11/avfc0002_out.webp""/>"
m2310,9,327,Ferry,Wh-What are you doing here?,Wh-What are you doing here?,フェリ,ど、どうしてこの城砦に？,"<audio id=""v02_20060""><source src=""talk/11/v02_20060.opus"" type=""audio/ogg; codecs=opus""></audio><a href=""javascript:void(0)"" onclick=""document.getElementById('v02_20060').play()"">ど、どうしてこの城砦に？</a>",,"<img class=""itp-kuro"" src=""itp/11/avfc5003_out.webp""/>"
m2310,9,328,Agnes,Oh! He must have brought reinforcements.,Oh! He must have brought reinforcements.,アニエス,あ……ひょっとして 加勢に来て下さっていたとか……,"<audio id=""v01_20063""><source src=""talk/11/v01_20063.opus"" type=""audio/ogg; codecs=opus""></audio><a href=""javascript:void(0)"" onclick=""document.getElementById('v01_20063').play()"">あ……ひょっとして<br/>加勢に来て下さっていたとか……</a>",,"<img class=""itp-kuro"" src=""itp/11/avfc5001_out.webp""/>"
m2310,9,329,Van,...,...,ヴァン,……………………………,"<audio id=""v00_20114""><source src=""talk/11/v00_20114.opus"" type=""audio/ogg; codecs=opus""></audio><a href=""javascript:void(0)"" onclick=""document.getElementById('v00_20114').play()"">……………………………</a>",,"<img class=""itp-kuro"" src=""itp/11/avfc0000_out.webp""/>"
m2310,9,330,Old Guillen,Indeed. We only just arrived.,Indeed. We only just arrived.,ギエン老,うむ、先ほど到着したばかりでな。,"<audio id=""v66_20022""><source src=""talk/11/v66_20022.opus"" type=""audio/ogg; codecs=opus""></audio><a href=""javascript:void(0)"" onclick=""document.getElementById('v66_20022').play()"">うむ、先ほど到着したばかりでな。</a>",,
m2310,9,331,Old Guillen,I had to be sure we had a sufficient force in the event that you might fail.,I had to be sure we had a sufficient force in the event<br/>that you might fail.,ギエン老,ヌシらが解決できなかった時に備え、 密かに戦力を整えていたわけだ。,"<audio id=""v66_20023""><source src=""talk/11/v66_20023.opus"" type=""audio/ogg; codecs=opus""></audio><a href=""javascript:void(0)"" onclick=""document.getElementById('v66_20023').play()"">ヌシらが解決できなかった時に備え、<br/>密かに戦力を整えていたわけだ。</a>",,
m2310,9,332,Old Guillen,"However, I see my fears were unfounded.","However, I see my fears were unfounded.",ギエン老,だが無用の備えだったようだ──,"<audio id=""v66_20024""><source src=""talk/11/v66_20024.opus"" type=""audio/ogg; codecs=opus""></audio><a href=""javascript:void(0)"" onclick=""document.getElementById('v66_20024').play()"">だが無用の備えだったようだ──</a>",,
m2310,9,333,Old Guillen,"Rest assured, you will be suitably compensated for what you have done this day.","Rest assured, you will be suitably compensated for<br/>what you have done this day.",ギエン老,今回の件、その働きに相応しい 報酬を取らせることを約束しよう。,"<audio id=""v66_20025""><source src=""talk/11/v66_20025.opus"" type=""audio/ogg; codecs=opus""></audio><a href=""javascript:void(0)"" onclick=""document.getElementById('v66_20025').play()"">今回の件、その働きに相応しい<br/>報酬を取らせることを約束しよう。</a>",,
m2310,9,334,Old Guillen,"Now then, a boat is waiting down below to return you to the city. Allow us to handle the remaining business here.","Now then, a boat is waiting down below to return you<br/>to the city. Allow us to handle the remaining<br/>business here.",ギエン老,下に船も呼んだ──後のことは儂に任せ、 煌都に戻って休むといい。,"<audio id=""v66_20026""><source src=""talk/11/v66_20026.opus"" type=""audio/ogg; codecs=opus""></audio><a href=""javascript:void(0)"" onclick=""document.getElementById('v66_20026').play()"">下に船も呼んだ──後のことは儂に任せ、<br/>煌都に戻って休むといい。</a>",,
m2310,9,335,Old Guillen,"As for you, Aaron, come with me. Your wounds are deep, and we have much to discuss.","As for you, Aaron, come with me. Your wounds are<br/>deep, and we have much to discuss.",ギエン老,アーロンは儂と共に来るがいい。 傷も深いようだし、後始末の話もある。,"<audio id=""v66_20027""><source src=""talk/11/v66_20027.opus"" type=""audio/ogg; codecs=opus""></audio><a href=""javascript:void(0)"" onclick=""document.getElementById('v66_20027').play()"">アーロンは儂と共に来るがいい。<br/>傷も深いようだし、後始末の話もある。</a>",,
m2310,9,336,Aaron,"Hah. And for a second there I was happy to see you, too.","Hah. And for a second there I was happy to see<br/>you, too.",アーロン,チッ、久々に会ったと思ったら…… 相変わらず抜け目ねぇ爺さんだぜ。,"<audio id=""v03_20153""><source src=""talk/11/v03_20153.opus"" type=""audio/ogg; codecs=opus""></audio><a href=""javascript:void(0)"" onclick=""document.getElementById('v03_20153').play()"">チッ、久々に会ったと思ったら……<br/>相変わらず抜け目ねぇ爺さんだぜ。</a>",,"<img class=""itp-kuro"" src=""itp/11/avfc0002_out.webp""/>"
m2310,9,337,Aaron,"Fine, fine. Let's get this over with.","Fine, fine. Let's get this over with.",アーロン,だがまあ、確かに ここからは黒月の出番か……,"<audio id=""v03_20154""><source src=""talk/11/v03_20154.opus"" type=""audio/ogg; codecs=opus""></audio><a href=""javascript:void(0)"" onclick=""document.getElementById('v03_20154').play()"">だがまあ、確かに<br/>ここからは黒月の出番か……</a>",,"<img class=""itp-kuro"" src=""itp/11/avfc0002_out.webp""/>"
m2310,9,338,Agnes,"(Heehee. All's well that ends well, I suppose.)","(Heehee. All's well that ends well, I suppose.)",アニエス,（ふふ……   良かったですね、アーロンさん。）,"<audio id=""v01_20064""><source src=""talk/11/v01_20064.opus"" type=""audio/ogg; codecs=opus""></audio><a href=""javascript:void(0)"" onclick=""document.getElementById('v01_20064').play()"">（ふふ……<br/>  良かったですね、アーロンさん。）</a>",,"<img class=""itp-kuro"" src=""itp/11/avfc5001_out.webp""/>"
m2310,9,339,Ferry,(Yeah. I'm glad they get to talk like this.),(Yeah. I'm glad they get to talk like this.),フェリ,（はい、最近あんまり   話してなかったみたいですし……）,"<audio id=""v02_20061""><source src=""talk/11/v02_20061.opus"" type=""audio/ogg; codecs=opus""></audio><a href=""javascript:void(0)"" onclick=""document.getElementById('v02_20061').play()"">（はい、最近あんまり<br/>  話してなかったみたいですし……）</a>",,"<img class=""itp-kuro"" src=""itp/11/avfc5003_out.webp""/>"
m2310,9,340,Van,Hold up.,Hold up.,ヴァン,──待てよ、爺さん。,"<audio id=""v00_20115""><source src=""talk/11/v00_20115.opus"" type=""audio/ogg; codecs=opus""></audio><a href=""javascript:void(0)"" onclick=""document.getElementById('v00_20115').play()"">──待てよ、爺さん。</a>",,"<img class=""itp-kuro"" src=""itp/11/avfc0000_out.webp""/>"
m2310,9,341,Aaron,...?,...?,アーロン,……？,"<audio id=""v03_20155""><source src=""talk/11/v03_20155.opus"" type=""audio/ogg; codecs=opus""></audio><a href=""javascript:void(0)"" onclick=""document.getElementById('v03_20155').play()"">……？</a>",,"<img class=""itp-kuro"" src=""itp/11/avfc0002_out.webp""/>"
m2310,9,342,Old Guillen,"Is something the matter, spriggan?","Is something the matter, spriggan?",ギエン老,どうした、裏解決屋（スプリガン）？,"<audio id=""v66_20028""><source src=""talk/11/v66_20028.opus"" type=""audio/ogg; codecs=opus""></audio><a href=""javascript:void(0)"" onclick=""document.getElementById('v66_20028').play()"">どうした、裏解決屋（スプリガン）？</a>",,
m2310,9,343,Old Guillen,"If it concerns your compensation, my son will handle that matter in my stead.","If it concerns your compensation, my son will handle<br/>that matter in my stead.",ギエン老,報酬については息子に伝えるといい。 悪いようにはせん。,"<audio id=""v66_20029""><source src=""talk/11/v66_20029.opus"" type=""audio/ogg; codecs=opus""></audio><a href=""javascript:void(0)"" onclick=""document.getElementById('v66_20029').play()"">報酬については息子に伝えるといい。<br/>悪いようにはせん。</a>",,
m2310,9,344,Van,"Good to know, but actually, it's somethin' else.","Good to know, but actually, it's somethin' else.",ヴァン,それはありがたいが、そっちじゃねぇ。 確かめたいことがあるんでね。,"<audio id=""v00_20116""><source src=""talk/11/v00_20116.opus"" type=""audio/ogg; codecs=opus""></audio><a href=""javascript:void(0)"" onclick=""document.getElementById('v00_20116').play()"">それはありがたいが、そっちじゃねぇ。<br/>確かめたいことがあるんでね。</a>",,"<img class=""itp-kuro"" src=""itp/11/avfc0000_out.webp""/>"
m2310,9,345,Van,"Say, you were in cahoots with Almata, weren't you?","Say, you were in cahoots with Almata, weren't you?",ヴァン,あんた── アルマータと手を組んでやがったな</B>？,"<audio id=""v00_20117""><source src=""talk/11/v00_20117.opus"" type=""audio/ogg; codecs=opus""></audio><a href=""javascript:void(0)"" onclick=""document.getElementById('v00_20117').play()"">あんた──<br/>アルマータと手を組んでやがったな</B>？</a>",,"<img class=""itp-kuro"" src=""itp/11/avfc0000_out.webp""/>"
m2310,9,346,Aaron,What?!,What?!,アーロン,！？　ハアアアッ！？,"<audio id=""v03_20156""><source src=""talk/11/v03_20156.opus"" type=""audio/ogg; codecs=opus""></audio><a href=""javascript:void(0)"" onclick=""document.getElementById('v03_20156').play()"">！？　ハアアアッ！？</a>",,"<img class=""itp-kuro"" src=""itp/11/avfc0002_out.webp""/>"
m2310,9,347,Ferry,H-Huh?!,H-Huh?!,フェリ,え、え……,"<audio id=""v02_20062""><source src=""talk/11/v02_20062.opus"" type=""audio/ogg; codecs=opus""></audio><a href=""javascript:void(0)"" onclick=""document.getElementById('v02_20062').play()"">え、え……</a>",,"<img class=""itp-kuro"" src=""itp/11/avfc5003_out.webp""/>"
m2310,9,348,Agnes,"Wait, then...","Wait, then...",アニエス,……それって………,"<audio id=""v01_20065""><source src=""talk/11/v01_20065.opus"" type=""audio/ogg; codecs=opus""></audio><a href=""javascript:void(0)"" onclick=""document.getElementById('v01_20065').play()"">……それって………</a>",,"<img class=""itp-kuro"" src=""itp/11/avfc5001_out.webp""/>"
m2310,9,349,Old Guillen,...,...,ギエン老,………………………………,"<audio id=""v66_20030""><source src=""talk/11/v66_20030.opus"" type=""audio/ogg; codecs=opus""></audio><a href=""javascript:void(0)"" onclick=""document.getElementById('v66_20030').play()"">………………………………</a>",,
m2310,9,350,Van,I have no doubt that you truly are enemies deep down.,I have no doubt that you truly are enemies<br/>deep down.,ヴァン,……黒月とアルマータが 本気で対立しているのは本当だろう。,"<audio id=""v00_20118""><source src=""talk/11/v00_20118.opus"" type=""audio/ogg; codecs=opus""></audio><a href=""javascript:void(0)"" onclick=""document.getElementById('v00_20118').play()"">……黒月とアルマータが<br/>本気で対立しているのは本当だろう。</a>",,"<img class=""itp-kuro"" src=""itp/11/avfc0000_out.webp""/>"
m2310,9,351,Van,"Had a battle broken out, I'm sure you woulda gone all out on 'em.","Had a battle broken out, I'm sure you woulda gone all<br/>out on 'em.",ヴァン,今回、お互いこの地で ガチで戦争をするつもりだったのもな。,"<audio id=""v00_20119""><source src=""talk/11/v00_20119.opus"" type=""audio/ogg; codecs=opus""></audio><a href=""javascript:void(0)"" onclick=""document.getElementById('v00_20119').play()"">今回、お互いこの地で<br/>ガチで戦争をするつもりだったのもな。</a>",,"<img class=""itp-kuro"" src=""itp/11/avfc0000_out.webp""/>"
m2310,9,352,Van,"That said, I think you guys ended up findin' something you agree on.","That said, I think you guys ended up findin'<br/>something you agree on.",ヴァン,だが──ある一点についてのみは “協定”に近いことが連中と結ばれていた。,"<audio id=""v00_20120""><source src=""talk/11/v00_20120.opus"" type=""audio/ogg; codecs=opus""></audio><a href=""javascript:void(0)"" onclick=""document.getElementById('v00_20120').play()"">だが──ある一点についてのみは<br/>“協定”に近いことが連中と結ばれていた。</a>",,"<img class=""itp-kuro"" src=""itp/11/avfc0000_out.webp""/>"
m2310,9,353,Van,Somethin' that only you and the other elders would know about.,Somethin' that only you and the other elders would<br/>know about.,ヴァン,ギエン・ルウ──あんたと、 恐らく他の長老のみが知る密約として。,"<audio id=""v00_20121""><source src=""talk/11/v00_20121.opus"" type=""audio/ogg; codecs=opus""></audio><a href=""javascript:void(0)"" onclick=""document.getElementById('v00_20121').play()"">ギエン・ルウ──あんたと、<br/>恐らく他の長老のみが知る密約として。</a>",,"<img class=""itp-kuro"" src=""itp/11/avfc0000_out.webp""/>"
m2310,9,354,Ferry,You mean...?,You mean...?,フェリ,密約……,"<audio id=""v02_20063""><source src=""talk/11/v02_20063.opus"" type=""audio/ogg; codecs=opus""></audio><a href=""javascript:void(0)"" onclick=""document.getElementById('v02_20063').play()"">密約……</a>",,"<img class=""itp-kuro"" src=""itp/11/avfc5003_out.webp""/>"
m2310,9,355,Aaron,No way... You've gotta be shittin' me.,No way... You've gotta be shittin' me.,アーロン,オイオイ…… ……何を馬鹿な………,"<audio id=""v03_20157""><source src=""talk/11/v03_20157.opus"" type=""audio/ogg; codecs=opus""></audio><a href=""javascript:void(0)"" onclick=""document.getElementById('v03_20157').play()"">オイオイ……<br/>……何を馬鹿な………</a>",,"<img class=""itp-kuro"" src=""itp/11/avfc0002_out.webp""/>"
m2310,9,356,Agnes,I'm reminded of a certain phrase you used: 'Let external woes reveal internal wounds.',I'm reminded of a certain phrase you used: 'Let<br/>external woes reveal internal wounds.',アニエス,……あの言葉……… 『外禍を通じ内患を見定める』ですか。,"<audio id=""v01_20066""><source src=""talk/11/v01_20066.opus"" type=""audio/ogg; codecs=opus""></audio><a href=""javascript:void(0)"" onclick=""document.getElementById('v01_20066').play()"">……あの言葉………<br/>『外禍を通じ内患を見定める』ですか。</a>",,"<img class=""itp-kuro"" src=""itp/11/avfc5001_out.webp""/>"
m2310,9,357,Van,Obvious one is the external woe bein' Almata.,Obvious one is the external woe bein' Almata.,ヴァン,ああ…… “外禍”は当然だが《アルマータ》。,"<audio id=""v00_20122""><source src=""talk/11/v00_20122.opus"" type=""audio/ogg; codecs=opus""></audio><a href=""javascript:void(0)"" onclick=""document.getElementById('v00_20122').play()"">ああ……<br/>“外禍”は当然だが《アルマータ》。</a>",,"<img class=""itp-kuro"" src=""itp/11/avfc0000_out.webp""/>"
m2310,9,358,Van,...But that makes the internal wound the Tyrant here.,...But that makes the internal wound the Tyrant here.,ヴァン,“内患”は── つまりは《大君》ってわけだ。,"<audio id=""v00_20123""><source src=""talk/11/v00_20123.opus"" type=""audio/ogg; codecs=opus""></audio><a href=""javascript:void(0)"" onclick=""document.getElementById('v00_20123').play()"">“内患”は──<br/>つまりは《大君》ってわけだ。</a>",,"<img class=""itp-kuro"" src=""itp/11/avfc0000_out.webp""/>"
m2310,9,359,Aaron,...!,...!,アーロン,！！！,"<audio id=""v03_20158""><source src=""talk/11/v03_20158.opus"" type=""audio/ogg; codecs=opus""></audio><a href=""javascript:void(0)"" onclick=""document.getElementById('v03_20158').play()"">！！！</a>",,"<img class=""itp-kuro"" src=""itp/11/avfc0002_out.webp""/>"
