gameId,fname,scene,row,engChrName,engSearchText,engHtmlText,jpnChrName,jpnSearchText,jpnHtmlText,opName,pcIconHtml,evoIconHtml
m3200,1,1,Dingo,I'll do my best to get in touch with both the police and guild to make arrangements with them.,I'll do my best to get in touch with both the police<br/>and guild to make arrangements with them.,ディンゴ,各方面への連絡と段取りは任せてくれ。,各方面への連絡と段取りは任せてくれ。,,
m3200,1,2,Dingo,"But time's not on our side, so we can't just sit around. Whatever you do, keep Marielle and the kid safe!","But time's not on our side, so we can't just sit around.<br/>Whatever you do, keep Marielle and the kid safe!",ディンゴ,だがこのままでは手遅れになりかねん…… マリエルたちの事、どうか頼んだぞ！,だがこのままでは手遅れになりかねん……<br/>マリエルたちの事、どうか頼んだぞ！,,
m3200,1,3,Dingo,"The police and guild are rushing over as fast as they can, but it's going to take time for them to get here.","The police and guild are rushing over as fast as they<br/>can, but it's going to take time for them to get here.",ディンゴ,ギルドや警察もこちらに急行しているが やはり時間はかかりそうだ。,ギルドや警察もこちらに急行しているが<br/>やはり時間はかかりそうだ。,,
m3200,1,4,Dingo,"I hate to say this, but you guys will have to go on ahead and confront those thugs by yourselves. Good luck!","I hate to say this, but you guys will have to go on<br/>ahead and confront those thugs by yourselves.<br/>Good luck!",ディンゴ,すまないが、お前たちだけでも 先行して突入してくれ！,すまないが、お前たちだけでも<br/>先行して突入してくれ！,,
m3200,2,5,Van,Those goons should be just up ahead.,Those goons should be just up ahead.,ヴァン,連中が向かったのはこの先だな。,連中が向かったのはこの先だな。,,"<img class=""itp-kuro"" src=""itp/11/avfc0000_out.webp""/>"
m3200,2,6,Van,Last thing we need is to get spotted and have more people taken hostage. Better to follow 'em on foot the rest of the way.,Last thing we need is to get spotted and have more<br/>people taken hostage. Better to follow 'em on foot the<br/>rest of the way.,ヴァン,気付かれて人質に取られたら厄介だ。 ここからは歩きで追跡するぞ。,気付かれて人質に取られたら厄介だ。<br/>ここからは歩きで追跡するぞ。,,"<img class=""itp-kuro"" src=""itp/11/avfc0000_out.webp""/>"
m3200,2,7,Van,"We'll hit you up once we find 'em, Dingo. In the meantime, try to contact as many people as you can.","We'll hit you up once we find 'em, Dingo. In the<br/>meantime, try to contact as many people as you can.",ヴァン,発見しだい連絡する──お前は ここで各方面と連絡を取ってくれ。,発見しだい連絡する──お前は<br/>ここで各方面と連絡を取ってくれ。,,"<img class=""itp-kuro"" src=""itp/11/avfc0000_out.webp""/>"
m3200,2,8,Agnes,"Yes, please! Especially the police and guild! We could really use the help!","Yes, please! Especially the police and guild! We could<br/>really use the help!",アニエス,警察とギルド方面への 働きかけをお願いします……！,警察とギルド方面への<br/>働きかけをお願いします……！,,"<img class=""itp-kuro"" src=""itp/11/avfc5001_out.webp""/>"
m3200,2,9,Dingo,Right. I'll see if I can get them to come over and provide backup once things are under control in the city.,Right. I'll see if I can get them to come over and<br/>provide backup once things are under control in<br/>the city.,ディンゴ,ああ、乱闘騒ぎが収まりしだい、 応援に来るよう手配する。,ああ、乱闘騒ぎが収まりしだい、<br/>応援に来るよう手配する。,,
m3200,2,10,Dingo,...Take good care of Marielle and the kid in there.,...Take good care of Marielle and the kid in there.,ディンゴ,……マリエルたちを頼む。,……マリエルたちを頼む。,,
m3200,2,11,Ferry,You got it!,You got it!,フェリ,了解ですっ！,了解ですっ！,,"<img class=""itp-kuro"" src=""itp/11/avfc5003_out.webp""/>"
m3200,2,12,Aaron,"Well, what're we waiting for? Let's get to work. The sooner we find the girls, the sooner we can get them out!","Well, what're we waiting for? Let's get to work.<br/>The sooner we find the girls, the sooner we can get<br/>them out!",アーロン,ハッ、とっとと捜し出して サクッと助け出してやるよ！,ハッ、とっとと捜し出して<br/>サクッと助け出してやるよ！,,"<img class=""itp-kuro"" src=""itp/11/avfc0002_out.webp""/>"
m3200,2,13,Lisette,Indeed. Time to start tracking the perpetrators.,Indeed. Time to start tracking the perpetrators.,リゼット,それでは追跡を 開始いたしましょう。,それでは追跡を<br/>開始いたしましょう。,,"<img class=""itp-kuro"" src=""itp/11/avfc5005_out.webp""/>"
m3200,3,14,Van,"For a pretty normal car, those guys sure managed to get it way out into the dunes. Sheesh.","For a pretty normal car, those guys sure managed to<br/>get it way out into the dunes. Sheesh.",ヴァン,しかし、車とはいえ よくこんな砂漠を行きやがるぜ。,しかし、車とはいえ<br/>よくこんな砂漠を行きやがるぜ。,,"<img class=""itp-kuro"" src=""itp/11/avfc0000_out.webp""/>"
m3200,3,15,Van,"Normally, this is about as far as you could go in one. The terrain past here is too rough.","Normally, this is about as far as you could go in one.<br/>The terrain past here is too rough.",ヴァン,このあたりはギリギリ行けるが すぐ車じゃ通れない地形になる筈だ。,このあたりはギリギリ行けるが<br/>すぐ車じゃ通れない地形になる筈だ。,,"<img class=""itp-kuro"" src=""itp/11/avfc0000_out.webp""/>"
m3200,3,16,Ferry,For sure. That's exactly what happened the last time I was here—we couldn't use our vehicles for very long at all.,For sure. That's exactly what happened the last time I<br/>was here—we couldn't use our vehicles for very long<br/>at all.,フェリ,はい……以前来た時も すぐに車が使えなくなりました。,はい……以前来た時も<br/>すぐに車が使えなくなりました。,,"<img class=""itp-kuro"" src=""itp/11/avfc5003_out.webp""/>"
m3200,3,17,Agnes,"And it's not even really a 'normal' car, it's a limousine. You'd think that would do even worse in this kind of environment...","And it's not even really a 'normal' car, it's a limousine.<br/>You'd think that would do even worse in this kind<br/>of environment...",アニエス,どうやらリムジンタイプの車のようですが こんな環境には向いていないでしょうし……,どうやらリムジンタイプの車のようですが<br/>こんな環境には向いていないでしょうし……,,"<img class=""itp-kuro"" src=""itp/11/avfc5001_out.webp""/>"
m3200,3,18,Lisette,"On a separate note, I can confirm that the both of them are travelers from Oración to the northeast.","On a separate note, I can confirm that the both of<br/>them are travelers from Oración to the northeast.",リゼット,ちなみに２人とも北東のオラシオン市の 旅行者であるのは確かなようです。,ちなみに２人とも北東のオラシオン市の<br/>旅行者であるのは確かなようです。,,"<img class=""itp-kuro"" src=""itp/11/avfc5005_out.webp""/>"
m3200,3,19,Lisette,"One of them was born into wealth, while the other appears to have made their fortune through a new business venture.","One of them was born into wealth, while the other<br/>appears to have made their fortune through a new<br/>business venture.",リゼット,やはり一人は富裕層出身、もう一人は 新規ビジネスで財を成したようで……,やはり一人は富裕層出身、もう一人は<br/>新規ビジネスで財を成したようで……,,"<img class=""itp-kuro"" src=""itp/11/avfc5005_out.webp""/>"
m3200,3,20,Lisette,"Nobody seems to have direct links to A, including the two bodyguards hired to escort them.","Nobody seems to have direct links to A, including the<br/>two bodyguards hired to escort them.",リゼット,雇われた護衛２名も含め、 《Ａ》との直接の繋がりはなさそうです。,雇われた護衛２名も含め、<br/>《Ａ》との直接の繋がりはなさそうです。,,"<img class=""itp-kuro"" src=""itp/11/avfc5005_out.webp""/>"
m3200,3,21,Aaron,Huh? How the hell do you know all—,Huh? How the hell do you know all—,アーロン,は……？ 何でそんなことが──,は……？<br/>何でそんなことが──,,"<img class=""itp-kuro"" src=""itp/11/avfc0002_out.webp""/>"
m3200,3,22,Lisette,"Last night, when we encountered them at the hotel, I ran a check on their identities via the orbal network.","Last night, when we encountered them at the hotel, I<br/>ran a check on their identities via the orbal network.",リゼット,昨夜、ホテルで遭遇した際に 導力ネット経由で照会いたしました。,昨夜、ホテルで遭遇した際に<br/>導力ネット経由で照会いたしました。,,"<img class=""itp-kuro"" src=""itp/11/avfc5005_out.webp""/>"
m3200,3,23,Lisette,"Rest assured, my inquiry was within legal limits and undertaken purely as a part of my work in risk management data collection.","Rest assured, my inquiry was within legal limits and<br/>undertaken purely as a part of my work in risk<br/>management data collection.",リゼット,あくまで危機管理データ収集の一環で、 適法範囲内なのでご心配なく。,あくまで危機管理データ収集の一環で、<br/>適法範囲内なのでご心配なく。,,"<img class=""itp-kuro"" src=""itp/11/avfc5005_out.webp""/>"
m3200,3,24,Agnes,"Umm... That's good to hear, I guess.","Umm... That's good to hear, I guess.",アニエス,そ、そうだったんですか……,そ、そうだったんですか……,,"<img class=""itp-kuro"" src=""itp/11/avfc5001_out.webp""/>"
m3200,3,25,Aaron,Damn. That's a lot of power for a random-ass maid to have.,Damn. That's a lot of power for a random-ass maid<br/>to have.,アーロン,……オイ、やっぱり ヤベーどころじゃねぇんじゃねえか？,……オイ、やっぱり<br/>ヤベーどころじゃねぇんじゃねえか？,,"<img class=""itp-kuro"" src=""itp/11/avfc0002_out.webp""/>"
m3200,3,26,Van,Good thing she's on our side. I'd hate to have a lady as capable as her as an enemy.,Good thing she's on our side. I'd hate to have a lady<br/>as capable as her as an enemy.,ヴァン,ま、敵に回さなきゃ これほど心強い相手もいねぇだろ。,ま、敵に回さなきゃ<br/>これほど心強い相手もいねぇだろ。,,"<img class=""itp-kuro"" src=""itp/11/avfc0000_out.webp""/>"
m3200,3,27,Lisette,"You're too kind, Mr. Arkride.","You're too kind, Mr. Arkride.",リゼット,ふふ、恐れ入ります。,ふふ、恐れ入ります。,,"<img class=""itp-kuro"" src=""itp/11/avfc5005_out.webp""/>"
m3200,3,28,Ferry,"But wait—if these guys are just tourists, it seems weird to me that they'd just go hanging out in the desert.","But wait—if these guys are just tourists, it seems<br/>weird to me that they'd just go hanging out in<br/>the desert.",フェリ,でもただの旅行者となると…… 砂漠に来たこと自体が異様かもです。,でもただの旅行者となると……<br/>砂漠に来たこと自体が異様かもです。,,"<img class=""itp-kuro"" src=""itp/11/avfc5003_out.webp""/>"
m3200,3,29,Agnes,"I think so, too. It makes you wonder what they could possibly be after.","I think so, too. It makes you wonder what they could<br/>possibly be after.",アニエス,ええ、一体何の目的で……,ええ、一体何の目的で……,,"<img class=""itp-kuro"" src=""itp/11/avfc5001_out.webp""/>"
m3200,3,30,Van,...Stay focused. There are still more tracks to follow. Be careful and keep your eyes peeled.,...Stay focused. There are still more tracks to follow.<br/>Be careful and keep your eyes peeled.,ヴァン,……轍（わだち）もまだ先に続いている。 ここからは慎重に進むぞ。,……轍（わだち）もまだ先に続いている。<br/>ここからは慎重に進むぞ。,,"<img class=""itp-kuro"" src=""itp/11/avfc0000_out.webp""/>"
m3200,4,31,Aaron,Jackpot. I see footprints for four men and two ladies.,Jackpot. I see footprints for four men and two ladies.,アーロン,ハン、男４人に 娘２人の足跡があるな。,ハン、男４人に<br/>娘２人の足跡があるな。,,"<img class=""itp-kuro"" src=""itp/11/avfc0002_out.webp""/>"
m3200,4,32,Ferry,"They must've just been here. If we rush in right now, we could still catch them!","They must've just been here. If we rush in right now,<br/>we could still catch them!",フェリ,つい先ほどくらいです。 今ならすぐ突入すれば……！,つい先ほどくらいです。<br/>今ならすぐ突入すれば……！,,"<img class=""itp-kuro"" src=""itp/11/avfc5003_out.webp""/>"
m3200,4,33,Dingo,"Good to know. It sounds like the guild and the cops have gotten things back under control in the city, too.","Good to know. It sounds like the guild and the cops<br/>have gotten things back under control in the city, too.",ディンゴ,そうか……ギルドと警察も ようやく対応が終わったようだ。,<C1>そうか……ギルドと警察も<br/>ようやく対応が終わったようだ。,,
m3200,4,34,Dingo,"They're on their way, but I wouldn't expect them to get there anytime soon.","They're on their way, but I wouldn't expect them to<br/>get there anytime soon.",ディンゴ,ただ到着には時間がかかるだろう。,<C1>ただ到着には時間がかかるだろう。,,
m3200,4,35,Agnes,But we don't have any time to wait...,But we don't have any time to wait...,アニエス,待っている時間はなさそうですね……,待っている時間はなさそうですね……,,"<img class=""itp-kuro"" src=""itp/11/avfc5001_out.webp""/>"
m3200,4,36,Van,"Yep. Dingo, keep in touch with the others. We're going on ahead.","Yep. Dingo, keep in touch with the others.<br/>We're going on ahead.",ヴァン,ああ──このまま先行する。 そっち方面の連絡は頼んだぜ。,ああ──このまま先行する。<br/>そっち方面の連絡は頼んだぜ。,,"<img class=""itp-kuro"" src=""itp/11/avfc0000_out.webp""/>"
m3200,4,37,Dingo,Got'cha. Be careful out there. I'm counting on you.,Got'cha. Be careful out there. I'm counting on you.,ディンゴ,了解だ、気を付けて行け。 ……頼んだぞ。,<C1>了解だ、気を付けて行け。<br/>……頼んだぞ。,,
m3200,5,38,Agnes,Huh?!,Huh?!,アニエス,え……！？,え……！？,,"<img class=""itp-kuro"" src=""itp/11/avfc5001_out.webp""/>"
m3200,5,39,Ferry,Wah!,Wah!,フェリ,あ……！,あ……！,,"<img class=""itp-kuro"" src=""itp/11/avfc5003_out.webp""/>"
m3200,5,40,Lisette,That happened last night as well.,That happened last night as well.,リゼット,昨夜見かけた……,昨夜見かけた……,,"<img class=""itp-kuro"" src=""itp/11/avfc5005_out.webp""/>"
m3200,5,41,Ferry,"Yeah, and when we went inside the underground waterway back in the city.","Yeah, and when we went inside the underground<br/>waterway back in the city.",フェリ,はい、それと 地下水路に入った時も……,はい、それと<br/>地下水路に入った時も……,,"<img class=""itp-kuro"" src=""itp/11/avfc5003_out.webp""/>"
m3200,5,42,Aaron,"That can only mean one thing, then.","That can only mean one thing, then.",アーロン,……ハッ、っつーことは。,……ハッ、っつーことは。,,"<img class=""itp-kuro"" src=""itp/11/avfc0002_out.webp""/>"
m3200,5,43,Van,Right. This might just give us the chance we've been looking for.,Right. This might just give us the chance we've been<br/>looking for.,ヴァン,ああ……ある意味 チャンスかもしれねぇな。,ああ……ある意味<br/>チャンスかもしれねぇな。,,"<img class=""itp-kuro"" src=""itp/11/avfc0000_out.webp""/>"
m3200,5,44,Agnes,"Obviously, rescuing Shaheena and Marielle comes first. No questions asked.","Obviously, rescuing Shaheena and Marielle<br/>comes first. No questions asked.",アニエス,今はあくまでシャヒーナさんと マリエルさんが最優先です。,今はあくまでシャヒーナさんと<br/>マリエルさんが最優先です。,,"<img class=""itp-kuro"" src=""itp/11/avfc5001_out.webp""/>"
m3200,5,45,Agnes,"But we should make sure we're prepared for anything, just in case!","But we should make sure we're prepared for anything,<br/>just in case!",アニエス,ですが、それ以外</B>にも 前もって備えておきましょう！,ですが、<B>それ以外</B>にも<br/>前もって備えておきましょう！,,"<img class=""itp-kuro"" src=""itp/11/avfc5001_out.webp""/>"
m3200,5,46,Lisette,"Yes, I think that's an apt assessment.","Yes, I think that's an apt assessment.",リゼット,……良い判断かと。,……良い判断かと。,,"<img class=""itp-kuro"" src=""itp/11/avfc5005_out.webp""/>"
m3200,6,47,Van,There they are!,There they are!,ヴァン,いたか……！,いたか……！,,"<img class=""itp-kuro"" src=""itp/11/avfc0000_out.webp""/>"
m3200,6,48,Ferry,Shaheena! Marielle!,Shaheena! Marielle!,フェリ,シャヒーナさん、マリエルさん！,シャヒーナさん、マリエルさん！,,"<img class=""itp-kuro"" src=""itp/11/avfc5003_out.webp""/>"
m3200,6,49,Mariel,It's you guys!,It's you guys!,マリエル,み、皆さん……！？,"<audio id=""v21_30005""><source src=""talk/11/v21_30005.opus"" type=""audio/ogg; codecs=opus""></audio><a href=""javascript:void(0)"" onclick=""document.getElementById('v21_30005').play()"">み、皆さん……！？</a>",,
m3200,6,50,Shahina,You came! You really came...!,You came! You really came...!,シャヒーナ,お兄さんたち、来てくれたんだ……！,"<audio id=""v53_30023""><source src=""talk/11/v53_30023.opus"" type=""audio/ogg; codecs=opus""></audio><a href=""javascript:void(0)"" onclick=""document.getElementById('v53_30023').play()"">お兄さんたち、来てくれたんだ……！</a>",,
m3200,6,51,Van,We sure did. Sorry to keep you two waiting.,We sure did. Sorry to keep you two waiting.,ヴァン,悪い、遅れちまったな。,悪い、遅れちまったな。,,"<img class=""itp-kuro"" src=""itp/11/avfc0000_out.webp""/>"
m3200,6,52,Agnes,"I'm so glad you're both okay. Hold on just a minute, we're going to—","I'm so glad you're both okay. Hold on just a minute,<br/>we're going to—",アニエス,良かった、無事みたいで。 待っててください、今──,良かった、無事みたいで。<br/>待っててください、今──,,"<img class=""itp-kuro"" src=""itp/11/avfc5001_out.webp""/>"
m3200,6,53,Aaron,Hold up! What the hell is that thing?!,Hold up! What the hell is that thing?!,アーロン,って、なんだありゃあ……？,って、なんだありゃあ……？,,"<img class=""itp-kuro"" src=""itp/11/avfc0002_out.webp""/>"
m3200,6,54,The arrogant tourist,Huh...? What're you guys doing here?,Huh...? What're you guys doing here?,傲慢そうな観光客,──なんだァ、お前らは……,<C2>──なんだァ、お前らは……,,
m3200,6,55,The arrogant tourist,"Decided to come join the party, have you?","Decided to come join the party, have you?",傲慢そうな観光客,あァ、お前らも パーティに参加したいのかよ……？,<C2>あァ、お前らも<br/>パーティに参加したいのかよ……？,,
m3200,6,56,Affluent tourists,"Fine with me! Come on over and let's have some fun, man!","Fine with me! Come on over and let's have some<br/>fun, man!",裕福そうな観光客,いいじゃんいいじゃん！ 一緒に愉しもうじゃないかぁ……！,<C2>いいじゃんいいじゃん！<br/>一緒に愉しもうじゃないかぁ……！,,
m3200,6,57,Van,Something's definitely wrong with these bozos.,Something's definitely wrong with these bozos.,ヴァン,チッ……普通</B>じゃねえな。,チッ……<B>普通</B>じゃねえな。,,"<img class=""itp-kuro"" src=""itp/11/avfc0000_out.webp""/>"
m3200,6,58,Ferry,"I'm picking up this weird aura, like they're being infested by something!","I'm picking up this weird aura, like they're being<br/>infested by something!",フェリ,“息吹”がおかしいです！ 何かに侵されているような……！,“息吹”がおかしいです！<br/>何かに侵されているような……！,,"<img class=""itp-kuro"" src=""itp/11/avfc5003_out.webp""/>"
m3200,6,59,Aaron,What the hell? They sure don't look like zombie puppets to me!,What the hell? They sure don't look like zombie<br/>puppets to me!,アーロン,ハン、くたばって操られてるって わけじゃなさそうだが……！,ハン、くたばって操られてるって<br/>わけじゃなさそうだが……！,,"<img class=""itp-kuro"" src=""itp/11/avfc0002_out.webp""/>"
m3200,6,60,Lisette,...Incoming attack. Beware.,...Incoming attack. Beware.,リゼット,──来ます、迎撃を。,──来ます、迎撃を。,,"<img class=""itp-kuro"" src=""itp/11/avfc5005_out.webp""/>"
m3200,6,61,Tourists & escorts,RAAAAAAAAAHH!,RAAAAAAAAAHH!,観光客＆護衛,キシャアアアアアアアッ……！！！,<C2><S5>キシャアアアアアアアッ……！！！,,
m3200,7,62,Ferry,Whew...,Whew...,フェリ,ふうっ……,"<audio id=""v02_30029""><source src=""talk/11/v02_30029.opus"" type=""audio/ogg; codecs=opus""></audio><a href=""javascript:void(0)"" onclick=""document.getElementById('v02_30029').play()"">ふうっ……</a>",,"<img class=""itp-kuro"" src=""itp/11/avfc5003_out.webp""/>"
m3200,7,63,Aaron,"Weird vibes or not, in the end, they were still pushovers.","Weird vibes or not, in the end, they were<br/>still pushovers.",アーロン,妙な“気”を纏ってやがったが 所詮はザコだったな。,"<audio id=""v03_30044""><source src=""talk/11/v03_30044.opus"" type=""audio/ogg; codecs=opus""></audio><a href=""javascript:void(0)"" onclick=""document.getElementById('v03_30044').play()"">妙な“気”を纏ってやがったが<br/>所詮はザコだったな。</a>",,"<img class=""itp-kuro"" src=""itp/11/avfc0002_out.webp""/>"
m3200,7,64,Shahina,"Wow, that was amazing! You guys are awesome!","Wow, that was amazing! You guys are awesome!",シャヒーナ,やったあ！ すごいよ、フェリたち！！,"<audio id=""v53_30024""><source src=""talk/11/v53_30024.opus"" type=""audio/ogg; codecs=opus""></audio><a href=""javascript:void(0)"" onclick=""document.getElementById('v53_30024').play()"">やったあ！<br/>すごいよ、フェリたち！！</a>",,
m3200,7,65,Mariel,"*sniffle* We're saved! Finally, I can get out of these sandy—","*sniffle* We're saved! Finally, I can get out of these<br/>sandy—",マリエル,ううっ、助かりました～…… もう服が砂だらけで──,"<audio id=""v21_30006""><source src=""talk/11/v21_30006.opus"" type=""audio/ogg; codecs=opus""></audio><a href=""javascript:void(0)"" onclick=""document.getElementById('v21_30006').play()"">ううっ、助かりました～……<br/>もう服が砂だらけで──</a>",,
m3200,7,66,Van,Up above!,Up above!,ヴァン,──上だ！！,"<audio id=""v00_30048""><source src=""talk/11/v00_30048.opus"" type=""audio/ogg; codecs=opus""></audio><a href=""javascript:void(0)"" onclick=""document.getElementById('v00_30048').play()"">──上だ！！</a>",,"<img class=""itp-kuro"" src=""itp/11/avfc0000_out.webp""/>"
m3200,7,67,Agnes,I knew it!,I knew it!,アニエス,っ……やっぱり……！,"<audio id=""v01_30041""><source src=""talk/11/v01_30041.opus"" type=""audio/ogg; codecs=opus""></audio><a href=""javascript:void(0)"" onclick=""document.getElementById('v01_30041').play()"">っ……やっぱり……！</a>",,"<img class=""itp-kuro"" src=""itp/11/avfc5001_out.webp""/>"
m3200,7,68,Aaron,They were lying in wait!,They were lying in wait!,アーロン,潜んでやがったかよ……！,"<audio id=""v03_30045""><source src=""talk/11/v03_30045.opus"" type=""audio/ogg; codecs=opus""></audio><a href=""javascript:void(0)"" onclick=""document.getElementById('v03_30045').play()"">潜んでやがったかよ……！</a>",,"<img class=""itp-kuro"" src=""itp/11/avfc0002_out.webp""/>"
m3200,7,69,Van,"This ain't a show, so quit spectatin' and come out where we can see you. Now!","This ain't a show, so quit spectatin' and come out<br/>where we can see you. Now!",ヴァン,高見の見物は終わりだ── 居るんだろうが、出てこいや！,"<audio id=""v00_30049""><source src=""talk/11/v00_30049.opus"" type=""audio/ogg; codecs=opus""></audio><a href=""javascript:void(0)"" onclick=""document.getElementById('v00_30049').play()"">高見の見物は終わりだ──<br/>居るんだろうが、出てこいや！</a>",,"<img class=""itp-kuro"" src=""itp/11/avfc0000_out.webp""/>"
m3200,7,70,voice,I see. So you were prepared for me to ambush you.,I see. So you were prepared for me to ambush you.,声,なるほど、私が潜んでいる 可能性に備えていましたか。,"<audio id=""v29_30003""><source src=""talk/11/v29_30003.opus"" type=""audio/ogg; codecs=opus""></audio><a href=""javascript:void(0)"" onclick=""document.getElementById('v29_30003').play()"">なるほど、私が潜んでいる<br/>可能性に備えていましたか。</a>",,
