gameId,fname,scene,row,engChrName,engSearchText,engHtmlText,jpnChrName,jpnSearchText,jpnHtmlText,opName,pcIconHtml,evoIconHtml
m3200,7,71,Ferry,Are you one of Almata's minions? Or some kind of assassin of theirs?,Are you one of Almata's minions? Or some kind of<br/>assassin of theirs?,フェリ,アルマータの手先── いえ、暗殺者（アサシン）ですか？,"<audio id=""v02_30030""><source src=""talk/11/v02_30030.opus"" type=""audio/ogg; codecs=opus""></audio><a href=""javascript:void(0)"" onclick=""document.getElementById('v02_30030').play()"">アルマータの手先──<br/>いえ、暗殺者（アサシン）ですか？</a>",,"<img class=""itp-kuro"" src=""itp/11/avfc5003_out.webp""/>"
m3200,7,72,Daughter of Silver,No. I've simply formed a contract with them—no more and no less.,No. I've simply formed a contract with them—no<br/>more and no less.,白銀の娘,否定します──彼らとは “契約”を結んでいるに過ぎません。,"<audio id=""v29_30004""><source src=""talk/11/v29_30004.opus"" type=""audio/ogg; codecs=opus""></audio><a href=""javascript:void(0)"" onclick=""document.getElementById('v29_30004').play()"">否定します──彼らとは<br/>“契約”を結んでいるに過ぎません。</a>",,
m3200,7,73,Daughter of Silver,"Moreover, our mission—mine and Ishtanti's—is over now.","Moreover, our mission—mine and Ishtanti's—is<br/>over now.",白銀の娘,そして今回、私と《イシュタンティ》の 役目はここまで</B>です。,"<audio id=""v29_30005""><source src=""talk/11/v29_30005.opus"" type=""audio/ogg; codecs=opus""></audio><a href=""javascript:void(0)"" onclick=""document.getElementById('v29_30005').play()"">そして今回、私と《イシュタンティ》の<br/>役目はここまで</B>です。</a>",,
m3200,7,74,Van,Ishtanti... Is that what you call your angel friend?,Ishtanti... Is that what you call your angel friend?,ヴァン,イシュタンティ…… そいつがその“天使”の名前か。,"<audio id=""v00_30050""><source src=""talk/11/v00_30050.opus"" type=""audio/ogg; codecs=opus""></audio><a href=""javascript:void(0)"" onclick=""document.getElementById('v00_30050').play()"">イシュタンティ……<br/>そいつがその“天使”の名前か。</a>",,"<img class=""itp-kuro"" src=""itp/11/avfc0000_out.webp""/>"
m3200,7,75,Lisette,"Whatever it is, it certainly doesn't look like it was produced with contemporary technology.","Whatever it is, it certainly doesn't look like it was<br/>produced with contemporary technology.",リゼット,……どうやら現代の技術で 製造されたものでは無さそうですね。,"<audio id=""v04_30042""><source src=""talk/11/v04_30042.opus"" type=""audio/ogg; codecs=opus""></audio><a href=""javascript:void(0)"" onclick=""document.getElementById('v04_30042').play()"">……どうやら現代の技術で<br/>製造されたものでは無さそうですね。</a>",,"<img class=""itp-kuro"" src=""itp/11/avfc5005_out.webp""/>"
m3200,7,76,Lisette,Those slash marks—they distinctly resemble ones I've seen within Marduk's records.,Those slash marks—they distinctly resemble ones I've<br/>seen within Marduk's records.,リゼット,その斬撃痕──ＭＫ社の調査記録に 類似のものがあったと記憶しています。,"<audio id=""v04_30043""><source src=""talk/11/v04_30043.opus"" type=""audio/ogg; codecs=opus""></audio><a href=""javascript:void(0)"" onclick=""document.getElementById('v04_30043').play()"">その斬撃痕──ＭＫ社の調査記録に<br/>類似のものがあったと記憶しています。</a>",,"<img class=""itp-kuro"" src=""itp/11/avfc5005_out.webp""/>"
m3200,7,77,Lisette,"Specifically, those from the investigation into the Eisenschild squad that was eradicated two months ago.","Specifically, those from the investigation into the<br/>Eisenschild squad that was eradicated two<br/>months ago.",リゼット,──先々月に全滅した、 アイゼンシルト中隊についての。,"<audio id=""v04_30044""><source src=""talk/11/v04_30044.opus"" type=""audio/ogg; codecs=opus""></audio><a href=""javascript:void(0)"" onclick=""document.getElementById('v04_30044').play()"">──先々月に全滅した、<br/>アイゼンシルト中隊についての。</a>",,"<img class=""itp-kuro"" src=""itp/11/avfc5005_out.webp""/>"
m3200,7,78,Agnes,...!,...!,アニエス,……！,"<audio id=""v01_30042""><source src=""talk/11/v01_30042.opus"" type=""audio/ogg; codecs=opus""></audio><a href=""javascript:void(0)"" onclick=""document.getElementById('v01_30042').play()"">……！</a>",,"<img class=""itp-kuro"" src=""itp/11/avfc5001_out.webp""/>"
m3200,7,79,Ferry,Are you from the same old group as that Almata guy? Did you help him attack Aida and her corps?!,Are you from the same old group as that<br/>Almata guy? Did you help him attack Aida and<br/>her corps?!,フェリ,あの幹部（メルキオル）の“古巣”の…… アイーダさんたちを襲った……！？,"<audio id=""v02_30031""><source src=""talk/11/v02_30031.opus"" type=""audio/ogg; codecs=opus""></audio><a href=""javascript:void(0)"" onclick=""document.getElementById('v02_30031').play()"">あの幹部（メルキオル）の“古巣”の……<br/>アイーダさんたちを襲った……！？</a>",,"<img class=""itp-kuro"" src=""itp/11/avfc5003_out.webp""/>"
m3200,7,80,Daughter of Silver,I did. That was part of my contract.,I did. That was part of my contract.,白銀の娘,肯定します──契約の一環として。,"<audio id=""v29_30006""><source src=""talk/11/v29_30006.opus"" type=""audio/ogg; codecs=opus""></audio><a href=""javascript:void(0)"" onclick=""document.getElementById('v29_30006').play()"">肯定します──契約の一環として。</a>",,
m3200,7,81,Daughter of Silver,The Eisenschild commander put up a harder fight than I anticipated. She has my respect.,The Eisenschild commander put up a harder fight<br/>than I anticipated. She has my respect.,白銀の娘,女性中隊長は想定以上の強敵でした。 敬意を表します。,"<audio id=""v29_30007""><source src=""talk/11/v29_30007.opus"" type=""audio/ogg; codecs=opus""></audio><a href=""javascript:void(0)"" onclick=""document.getElementById('v29_30007').play()"">女性中隊長は想定以上の強敵でした。<br/>敬意を表します。</a>",,
m3200,7,82,Ferry,Gah... Raaaaaah!,Gah... Raaaaaah!,フェリ,ッ……ああああっ！！,"<audio id=""v02_30032""><source src=""talk/11/v02_30032.opus"" type=""audio/ogg; codecs=opus""></audio><a href=""javascript:void(0)"" onclick=""document.getElementById('v02_30032').play()"">ッ……ああああっ！！</a>",,"<img class=""itp-kuro"" src=""itp/11/avfc5003_out.webp""/>"
m3200,7,83,Lisette,...Ms. Al-Fayed.,...Ms. Al-Fayed.,リゼット,……フェリ様。,"<audio id=""v04_30045""><source src=""talk/11/v04_30045.opus"" type=""audio/ogg; codecs=opus""></audio><a href=""javascript:void(0)"" onclick=""document.getElementById('v04_30045').play()"">……フェリ様。</a>",,"<img class=""itp-kuro"" src=""itp/11/avfc5005_out.webp""/>"
m3200,7,84,Ferry,*pant* *pant*,*pant* *pant*,フェリ,……はあっはあっ……,"<audio id=""v02_30033""><source src=""talk/11/v02_30033.opus"" type=""audio/ogg; codecs=opus""></audio><a href=""javascript:void(0)"" onclick=""document.getElementById('v02_30033').play()"">……はあっはあっ……</a>",,"<img class=""itp-kuro"" src=""itp/11/avfc5003_out.webp""/>"
m3200,7,85,Daughter of Silver,This concludes the on-site testing.,This concludes the on-site testing.,白銀の娘,一連の“実地検証”は完了しました。,"<audio id=""v29_30008""><source src=""talk/11/v29_30008.opus"" type=""audio/ogg; codecs=opus""></audio><a href=""javascript:void(0)"" onclick=""document.getElementById('v29_30008').play()"">一連の“実地検証”は完了しました。</a>",,
m3200,7,86,Daughter of Silver,"I have no orders to engage in combat. Therefore, Ishtanti and I will be departing.","I have no orders to engage in combat.<br/>Therefore, Ishtanti and I will be departing.",白銀の娘,交戦のオーダーは受けていないため 私たちは失礼します。,"<audio id=""v29_30009""><source src=""talk/11/v29_30009.opus"" type=""audio/ogg; codecs=opus""></audio><a href=""javascript:void(0)"" onclick=""document.getElementById('v29_30009').play()"">交戦のオーダーは受けていないため<br/>私たちは失礼します。</a>",,
m3200,7,87,Aaron,"Hey, isn't that—","Hey, isn't that—",アーロン,おい、あの女──！？,"<audio id=""v03_30046""><source src=""talk/11/v03_30046.opus"" type=""audio/ogg; codecs=opus""></audio><a href=""javascript:void(0)"" onclick=""document.getElementById('v03_30046').play()"">おい、あの女──！？</a>",,"<img class=""itp-kuro"" src=""itp/11/avfc0002_out.webp""/>"
m3200,7,88,Van,"It sure is. You know, miss, I've noticed something off about you since our run-in at the waterway.","It sure is. You know, miss, I've noticed something<br/>off about you since our run-in at the waterway.",ヴァン,……やっぱりな。 ここでも、地下水路でも感じてたぜ。,"<audio id=""v00_30051""><source src=""talk/11/v00_30051.opus"" type=""audio/ogg; codecs=opus""></audio><a href=""javascript:void(0)"" onclick=""document.getElementById('v00_30051').play()"">……やっぱりな。<br/>ここでも、地下水路でも感じてたぜ。</a>",,"<img class=""itp-kuro"" src=""itp/11/avfc0000_out.webp""/>"
m3200,7,89,Van,"It's like there's no warmth in your eyes. You view others, even yourself, as nothing but 'things.' Thought so at the club last night, too.","It's like there's no warmth in your eyes. You view<br/>others, even yourself, as nothing but 'things.'<br/>Thought so at the club last night, too.",ヴァン,昨夜のステージと同じ──自分も他人も “物”として見てる温度のない視線をな。,"<audio id=""v00_30052""><source src=""talk/11/v00_30052.opus"" type=""audio/ogg; codecs=opus""></audio><a href=""javascript:void(0)"" onclick=""document.getElementById('v00_30052').play()"">昨夜のステージと同じ──自分も他人も<br/>“物”として見てる温度のない視線をな。</a>",,"<img class=""itp-kuro"" src=""itp/11/avfc0000_out.webp""/>"
m3200,7,90,Daughter of Silver,"...You have an astute eye. Or, I suppose nose, in your case, due to how you pick up 'scents.'","...You have an astute eye. Or, I suppose nose, in your<br/>case, due to how you pick up 'scents.'",白銀の娘,……なかなかの観察眼。 いえ、貴方の場合は“匂い”ですか。,"<audio id=""v29_30010""><source src=""talk/11/v29_30010.opus"" type=""audio/ogg; codecs=opus""></audio><a href=""javascript:void(0)"" onclick=""document.getElementById('v29_30010').play()"">……なかなかの観察眼。<br/>いえ、貴方の場合は“匂い”ですか。</a>",,
m3200,7,91,Daughter of Silver,"Regardless, do not let those senses of yours go to waste. Farewell.","Regardless, do not let those senses of yours go<br/>to waste. Farewell.",白銀の娘,せいぜいその嗅覚を無駄にせぬよう。 ──それでは。,"<audio id=""v29_30011""><source src=""talk/11/v29_30011.opus"" type=""audio/ogg; codecs=opus""></audio><a href=""javascript:void(0)"" onclick=""document.getElementById('v29_30011').play()"">せいぜいその嗅覚を無駄にせぬよう。<br/>──それでは。</a>",,
m3200,7,92,Aaron,Tch. What a piece of work. Acting like she's above it all...,Tch. What a piece of work. Acting like she's above<br/>it all...,アーロン,チッ……余裕かましやがって。,"<audio id=""v03_30047""><source src=""talk/11/v03_30047.opus"" type=""audio/ogg; codecs=opus""></audio><a href=""javascript:void(0)"" onclick=""document.getElementById('v03_30047').play()"">チッ……余裕かましやがって。</a>",,"<img class=""itp-kuro"" src=""itp/11/avfc0002_out.webp""/>"
m3200,7,93,Ferry,Ugh... I've still got a long ways to go...,Ugh... I've still got a long ways to go...,フェリ,はい…… ……わたし、まだまだです……,"<audio id=""v02_30034""><source src=""talk/11/v02_30034.opus"" type=""audio/ogg; codecs=opus""></audio><a href=""javascript:void(0)"" onclick=""document.getElementById('v02_30034').play()"">はい……<br/>……わたし、まだまだです……</a>",,"<img class=""itp-kuro"" src=""itp/11/avfc5003_out.webp""/>"
m3200,7,94,Agnes,"Oh, Feri...","Oh, Feri...",アニエス,フェリちゃん……,"<audio id=""v01_30043""><source src=""talk/11/v01_30043.opus"" type=""audio/ogg; codecs=opus""></audio><a href=""javascript:void(0)"" onclick=""document.getElementById('v01_30043').play()"">フェリちゃん……</a>",,"<img class=""itp-kuro"" src=""itp/11/avfc5001_out.webp""/>"
m3200,7,95,Van,"I was hopin' we could nab that Genesis if she left an opening, but I guess she's not gonna make it that easy.","I was hopin' we could nab that Genesis if she left an<br/>opening, but I guess she's not gonna make it<br/>that easy.",ヴァン,……ゲネシスも隙あらばと思ったが、 そんな甘い相手じゃなかったな。,"<audio id=""v00_30053""><source src=""talk/11/v00_30053.opus"" type=""audio/ogg; codecs=opus""></audio><a href=""javascript:void(0)"" onclick=""document.getElementById('v00_30053').play()"">……ゲネシスも隙あらばと思ったが、<br/>そんな甘い相手じゃなかったな。</a>",,"<img class=""itp-kuro"" src=""itp/11/avfc0000_out.webp""/>"
m3200,7,96,Agnes,"It's fine, really. I'm just glad nobody's hurt.","It's fine, really. I'm just glad nobody's hurt.",アニエス,いえ、いいんです。 みんな無事だっただけでも……,"<audio id=""v01_30044""><source src=""talk/11/v01_30044.opus"" type=""audio/ogg; codecs=opus""></audio><a href=""javascript:void(0)"" onclick=""document.getElementById('v01_30044').play()"">いえ、いいんです。<br/>みんな無事だっただけでも……</a>",,"<img class=""itp-kuro"" src=""itp/11/avfc5001_out.webp""/>"
m3200,7,97,Agnes,"Shaheena, are you okay?","Shaheena, are you okay?",アニエス,シャヒーナさん、大丈夫ですか？,"<audio id=""v01_30045""><source src=""talk/11/v01_30045.opus"" type=""audio/ogg; codecs=opus""></audio><a href=""javascript:void(0)"" onclick=""document.getElementById('v01_30045').play()"">シャヒーナさん、大丈夫ですか？</a>",,"<img class=""itp-kuro"" src=""itp/11/avfc5001_out.webp""/>"
m3200,7,98,Shahina,"My arm's a little tingly, but that's all. Thank you so much, Agnès!","My arm's a little tingly, but that's all. Thank you so<br/>much, Agnès!",シャヒーナ,うん、ちょっと腕が痺れたけど…… ──アニエスさん、ありがとね！,"<audio id=""v53_30025""><source src=""talk/11/v53_30025.opus"" type=""audio/ogg; codecs=opus""></audio><a href=""javascript:void(0)"" onclick=""document.getElementById('v53_30025').play()"">うん、ちょっと腕が痺れたけど……<br/>──アニエスさん、ありがとね！</a>",,
m3200,7,99,Mariel,"What she said, times a million... Oooh, if only I had my camera with me!","What she said, times a million... Oooh, if only I had<br/>my camera with me!",マリエル,あ、ありがとうございます。 ……ううっ、カメラを持ってきてれば！,"<audio id=""v21_30007""><source src=""talk/11/v21_30007.opus"" type=""audio/ogg; codecs=opus""></audio><a href=""javascript:void(0)"" onclick=""document.getElementById('v21_30007').play()"">あ、ありがとうございます。<br/>……ううっ、カメラを持ってきてれば！</a>",,
m3200,7,100,Aaron,"Putting aside these bozos for a moment, just what the hell is that giant plant?","Putting aside these bozos for a moment, just what the<br/>hell is that giant plant?",アーロン,で、馬鹿共はともかく このデカイ植物はなんなんだ？,"<audio id=""v03_30048""><source src=""talk/11/v03_30048.opus"" type=""audio/ogg; codecs=opus""></audio><a href=""javascript:void(0)"" onclick=""document.getElementById('v03_30048').play()"">で、馬鹿共はともかく<br/>このデカイ植物はなんなんだ？</a>",,"<img class=""itp-kuro"" src=""itp/11/avfc0002_out.webp""/>"
m3200,7,101,Van,"My guess is a kind of succulent. From the way it's glowin', it could even be—","My guess is a kind of succulent. From the way it's<br/>glowin', it could even be—",ヴァン,多肉植物の一種だろう。 この輝き、もしかして──,"<audio id=""v00_30054""><source src=""talk/11/v00_30054.opus"" type=""audio/ogg; codecs=opus""></audio><a href=""javascript:void(0)"" onclick=""document.getElementById('v00_30054').play()"">多肉植物の一種だろう。<br/>この輝き、もしかして──</a>",,"<img class=""itp-kuro"" src=""itp/11/avfc0000_out.webp""/>"
m3200,7,102,voice,...And you have it. Alas that we appear to have missed the excitement.,...And you have it. Alas that we appear to have<br/>missed the excitement.,声,──ビンゴだったか。 良い場面は逃したようだが。,"<audio id=""v28_30023""><source src=""talk/11/v28_30023.opus"" type=""audio/ogg; codecs=opus""></audio><a href=""javascript:void(0)"" onclick=""document.getElementById('v28_30023').play()"">──ビンゴだったか。<br/>良い場面は逃したようだが。</a>",,
m3200,7,103,Ferry,...Oh!,...Oh!,フェリ,……ぁ………,"<audio id=""v02_30035""><source src=""talk/11/v02_30035.opus"" type=""audio/ogg; codecs=opus""></audio><a href=""javascript:void(0)"" onclick=""document.getElementById('v02_30035').play()"">……ぁ………</a>",,"<img class=""itp-kuro"" src=""itp/11/avfc5003_out.webp""/>"
m3200,7,104,Agnes,You're...,You're...,アニエス,あ、貴方は……,"<audio id=""v01_30046""><source src=""talk/11/v01_30046.opus"" type=""audio/ogg; codecs=opus""></audio><a href=""javascript:void(0)"" onclick=""document.getElementById('v01_30046').play()"">あ、貴方は……</a>",,"<img class=""itp-kuro"" src=""itp/11/avfc5001_out.webp""/>"
m3200,7,105,Shahina,You're the one who scouted out my sister.,You're the one who scouted out my sister.,シャヒーナ,お姉のスカウトに来てた……,"<audio id=""v53_30026""><source src=""talk/11/v53_30026.opus"" type=""audio/ogg; codecs=opus""></audio><a href=""javascript:void(0)"" onclick=""document.getElementById('v53_30026').play()"">お姉のスカウトに来てた……</a>",,
m3200,7,106,Mariel,Prince Sherid?!,Prince Sherid?!,マリエル,シェリド公太子殿下……！？,"<audio id=""v21_30008""><source src=""talk/11/v21_30008.opus"" type=""audio/ogg; codecs=opus""></audio><a href=""javascript:void(0)"" onclick=""document.getElementById('v21_30008').play()"">シェリド公太子殿下……！？</a>",,
m3200,7,107,Van,Guessin' you were on the same trail we were?,Guessin' you were on the same trail we were?,ヴァン,……どうやらそちらも 同じネタを追ってたみたいですね？,"<audio id=""v00_30055""><source src=""talk/11/v00_30055.opus"" type=""audio/ogg; codecs=opus""></audio><a href=""javascript:void(0)"" onclick=""document.getElementById('v00_30055').play()"">……どうやらそちらも<br/>同じネタを追ってたみたいですね？</a>",,"<img class=""itp-kuro"" src=""itp/11/avfc0000_out.webp""/>"
m3200,7,108,Prince Sheridan,"In some fashion. As it so happens, our country and Calvard have had warm relations for a long time now.","In some fashion. As it so happens, our country and<br/>Calvard have had warm relations for a long time now.",シェリド公太子,フフ、我が国とカルバードは 昔から良き隣人だからね。,"<audio id=""v28_30024""><source src=""talk/11/v28_30024.opus"" type=""audio/ogg; codecs=opus""></audio><a href=""javascript:void(0)"" onclick=""document.getElementById('v28_30024').play()"">フフ、我が国とカルバードは<br/>昔から良き隣人だからね。</a>",,
m3200,7,109,Prince Sheridan,"We've been actively involved in the technology, investing, and, as you've seen, the movie production sectors recently as well.","We've been actively involved in the technology,<br/>investing, and, as you've seen, the movie production<br/>sectors recently as well.",シェリド公太子,技術に投資、最近では映画産業にも 積極的に関わらせてもらっている。,"<audio id=""v28_30025""><source src=""talk/11/v28_30025.opus"" type=""audio/ogg; codecs=opus""></audio><a href=""javascript:void(0)"" onclick=""document.getElementById('v28_30025').play()"">技術に投資、最近では映画産業にも<br/>積極的に関わらせてもらっている。</a>",,
m3200,7,110,Prince Sheridan,"To that end, we have kept our eyes on certain kinds of activity, and... Well, Naje? Is that plant what we're looking for?","To that end, we have kept our eyes on certain kinds<br/>of activity, and... Well, Naje? Is that plant what we're<br/>looking for?",シェリド公太子,そんな中、怪しい動きを調べていたが…… ──ナージェ、その植物かい？,"<audio id=""v28_30026""><source src=""talk/11/v28_30026.opus"" type=""audio/ogg; codecs=opus""></audio><a href=""javascript:void(0)"" onclick=""document.getElementById('v28_30026').play()"">そんな中、怪しい動きを調べていたが……<br/>──ナージェ、その植物かい？</a>",,
m3200,7,111,Nager,"Yes, Your Highness. It appears to be a type of agave plant containing alkaloids.","Yes, Your Highness. It appears to be a type of agave<br/>plant containing alkaloids.",ナージェ,ええ、アルカロイド成分を含む 竜舌蘭（リュウゼツラン）の一種でしょう。,"<audio id=""v43_30004""><source src=""talk/11/v43_30004.opus"" type=""audio/ogg; codecs=opus""></audio><a href=""javascript:void(0)"" onclick=""document.getElementById('v43_30004').play()"">ええ、アルカロイド成分を含む<br/>竜舌蘭（リュウゼツラン）の一種でしょう。</a>",,
m3200,7,112,Nager,"Most likely, it's been energized via reaction with the septium veins.","Most likely, it's been energized via reaction with the<br/>septium veins.",ナージェ,やはり七耀脈に反応して 活性化しているようです。,"<audio id=""v43_30005""><source src=""talk/11/v43_30005.opus"" type=""audio/ogg; codecs=opus""></audio><a href=""javascript:void(0)"" onclick=""document.getElementById('v43_30005').play()"">やはり七耀脈に反応して<br/>活性化しているようです。</a>",,
m3200,7,113,Agnes,"Alkaloids? Those can only be extracted from certain types of plants, right?","Alkaloids? Those can only be extracted from certain<br/>types of plants, right?",アニエス,アルカロイド…… 一部の植物から抽出されるという。,"<audio id=""v01_30047""><source src=""talk/11/v01_30047.opus"" type=""audio/ogg; codecs=opus""></audio><a href=""javascript:void(0)"" onclick=""document.getElementById('v01_30047').play()"">アルカロイド……<br/>一部の植物から抽出されるという。</a>",,"<img class=""itp-kuro"" src=""itp/11/avfc5001_out.webp""/>"
m3200,7,114,Lisette,Correct. They serve as an ingredient in things such as anesthetics.,Correct. They serve as an ingredient in things such<br/>as anesthetics.,リゼット,ええ、麻酔薬などの 原料にも使われる成分ですね。,"<audio id=""v04_30046""><source src=""talk/11/v04_30046.opus"" type=""audio/ogg; codecs=opus""></audio><a href=""javascript:void(0)"" onclick=""document.getElementById('v04_30046').play()"">ええ、麻酔薬などの<br/>原料にも使われる成分ですね。</a>",,"<img class=""itp-kuro"" src=""itp/11/avfc5005_out.webp""/>"
m3200,7,115,Lisette,"However, depending on the amount, application, and plant type, they can also act as stimulants or produce hallucinations.","However, depending on the amount, application, and<br/>plant type, they can also act as stimulants or<br/>produce hallucinations.",リゼット,──植物の種類、用法・用量によっては 幻覚や覚醒作用をもたらすものもあります。,"<audio id=""v04_30047""><source src=""talk/11/v04_30047.opus"" type=""audio/ogg; codecs=opus""></audio><a href=""javascript:void(0)"" onclick=""document.getElementById('v04_30047').play()"">──植物の種類、用法・用量によっては<br/>幻覚や覚醒作用をもたらすものもあります。</a>",,"<img class=""itp-kuro"" src=""itp/11/avfc5005_out.webp""/>"
m3200,7,116,Ferry,...!,...!,フェリ,……！,"<audio id=""v02_30036""><source src=""talk/11/v02_30036.opus"" type=""audio/ogg; codecs=opus""></audio><a href=""javascript:void(0)"" onclick=""document.getElementById('v02_30036').play()"">……！</a>",,"<img class=""itp-kuro"" src=""itp/11/avfc5003_out.webp""/>"
m3200,7,117,Aaron,So our guess was right on the mark.,So our guess was right on the mark.,アーロン,ハッ、予想通りだったみてぇだな。,"<audio id=""v03_30049""><source src=""talk/11/v03_30049.opus"" type=""audio/ogg; codecs=opus""></audio><a href=""javascript:void(0)"" onclick=""document.getElementById('v03_30049').play()"">ハッ、予想通りだったみてぇだな。</a>",,"<img class=""itp-kuro"" src=""itp/11/avfc0002_out.webp""/>"
m3200,7,118,Van,Yeah. This thing's being used to make drugs.,Yeah. This thing's being used to make drugs.,ヴァン,ああ──ドラッグの材料</B>。,"<audio id=""v00_30056""><source src=""talk/11/v00_30056.opus"" type=""audio/ogg; codecs=opus""></audio><a href=""javascript:void(0)"" onclick=""document.getElementById('v00_30056').play()"">ああ──ドラッグの材料</B>。</a>",,"<img class=""itp-kuro"" src=""itp/11/avfc0000_out.webp""/>"
