gameId,fname,scene,row,engChrName,engSearchText,engHtmlText,jpnChrName,jpnSearchText,jpnHtmlText,opName,pcIconHtml,evoIconHtml
m3200,7,119,Van,It's clear as day that this all ties into what happened in Messeldam.,It's clear as day that this all ties into what happened<br/>in Messeldam.,ヴァン,メッセルダムの事件にも 関係してたのは間違いねぇだろう。,"<audio id=""v00_30057""><source src=""talk/11/v00_30057.opus"" type=""audio/ogg; codecs=opus""></audio><a href=""javascript:void(0)"" onclick=""document.getElementById('v00_30057').play()"">メッセルダムの事件にも<br/>関係してたのは間違いねぇだろう。</a>",,"<img class=""itp-kuro"" src=""itp/11/avfc0000_out.webp""/>"
m3200,7,120,Shahina,That's crazy! How could we have that in Tharbad...?,That's crazy! How could we have that in Tharbad...?,シャヒーナ,サ、サルバッドにそんなものが……,"<audio id=""v53_30027""><source src=""talk/11/v53_30027.opus"" type=""audio/ogg; codecs=opus""></audio><a href=""javascript:void(0)"" onclick=""document.getElementById('v53_30027').play()"">サ、サルバッドにそんなものが……</a>",,
m3200,7,121,Mariel,Holy... This is an enormous scoop!,Holy... This is an enormous scoop!,マリエル,すごいスクープですっ……！,"<audio id=""v21_30009""><source src=""talk/11/v21_30009.opus"" type=""audio/ogg; codecs=opus""></audio><a href=""javascript:void(0)"" onclick=""document.getElementById('v21_30009').play()"">すごいスクープですっ……！</a>",,
m3200,7,122,Prince Sheridan,I'm impressed you caught up to us so quickly. We had been investigating for a month.,I'm impressed you caught up to us so quickly. We had<br/>been investigating for a month.,シェリド公太子,フッ、一月近く探っていた 私たちに追いつくとはね……,"<audio id=""v28_30027""><source src=""talk/11/v28_30027.opus"" type=""audio/ogg; codecs=opus""></audio><a href=""javascript:void(0)"" onclick=""document.getElementById('v28_30027').play()"">フッ、一月近く探っていた<br/>私たちに追いつくとはね……</a>",,
m3200,7,123,Prince Sheridan,It seems I was right to come down here and enter the fray myself.,It seems I was right to come down here and enter the<br/>fray myself.,シェリド公太子,──やはり</B>直接ここに 乗り込んできて正解だったようだ。,"<audio id=""v28_30028""><source src=""talk/11/v28_30028.opus"" type=""audio/ogg; codecs=opus""></audio><a href=""javascript:void(0)"" onclick=""document.getElementById('v28_30028').play()"">──やはり</B>直接ここに<br/>乗り込んできて正解だったようだ。</a>",,
m3200,7,124,Ferry,...?!,...?!,フェリ,……！？,"<audio id=""v02_30037""><source src=""talk/11/v02_30037.opus"" type=""audio/ogg; codecs=opus""></audio><a href=""javascript:void(0)"" onclick=""document.getElementById('v02_30037').play()"">……！？</a>",,"<img class=""itp-kuro"" src=""itp/11/avfc5003_out.webp""/>"
m3200,7,125,Aaron,Oho.,Oho.,アーロン,へえ……？,"<audio id=""v03_30050""><source src=""talk/11/v03_30050.opus"" type=""audio/ogg; codecs=opus""></audio><a href=""javascript:void(0)"" onclick=""document.getElementById('v03_30050').play()"">へえ……？</a>",,"<img class=""itp-kuro"" src=""itp/11/avfc0002_out.webp""/>"
m3200,7,126,Van,So...we're both after the same thing.,So...we're both after the same thing.,ヴァン,……目的は同じ。,"<audio id=""v00_30058""><source src=""talk/11/v00_30058.opus"" type=""audio/ogg; codecs=opus""></audio><a href=""javascript:void(0)"" onclick=""document.getElementById('v00_30058').play()"">……目的は同じ。</a>",,"<img class=""itp-kuro"" src=""itp/11/avfc0000_out.webp""/>"
m3200,7,127,Van,"But I get the feeling you're not here to team up with us, are you?","But I get the feeling you're not here to team up with<br/>us, are you?",ヴァン,だが協力に来たって ノリでもなさそうですね？,"<audio id=""v00_30059""><source src=""talk/11/v00_30059.opus"" type=""audio/ogg; codecs=opus""></audio><a href=""javascript:void(0)"" onclick=""document.getElementById('v00_30059').play()"">だが協力に来たって<br/>ノリでもなさそうですね？</a>",,"<img class=""itp-kuro"" src=""itp/11/avfc0000_out.webp""/>"
m3200,7,128,Agnes,What?,What?,アニエス,え……,"<audio id=""v01_30048""><source src=""talk/11/v01_30048.opus"" type=""audio/ogg; codecs=opus""></audio><a href=""javascript:void(0)"" onclick=""document.getElementById('v01_30048').play()"">え……</a>",,"<img class=""itp-kuro"" src=""itp/11/avfc5001_out.webp""/>"
m3200,7,129,Prince Sheridan,"Haha. It's a shame, really. Everything else aside, on a personal level, I feel like you and I could get along quite well.","Haha. It's a shame, really. Everything else aside, on a<br/>personal level, I feel like you and I could get along<br/>quite well.",シェリド公太子,フフ……君とは個人的には 気が合いそうだとは思ったんだが。,"<audio id=""v28_30029""><source src=""talk/11/v28_30029.opus"" type=""audio/ogg; codecs=opus""></audio><a href=""javascript:void(0)"" onclick=""document.getElementById('v28_30029').play()"">フフ……君とは個人的には<br/>気が合いそうだとは思ったんだが。</a>",,
m3200,7,130,Prince Sheridan,"Unfortunately, among other matters, I'm not on the best of terms with the employer of that maid of yours.","Unfortunately, among other matters, I'm not on the<br/>best of terms with the employer of that maid of yours.",シェリド公太子,元々、そちらのメイド君の “出向元”とは折り合いが悪くてね。,"<audio id=""v28_30030""><source src=""talk/11/v28_30030.opus"" type=""audio/ogg; codecs=opus""></audio><a href=""javascript:void(0)"" onclick=""document.getElementById('v28_30030').play()"">元々、そちらのメイド君の<br/>“出向元”とは折り合いが悪くてね。</a>",,
m3200,7,131,Lisette,...I'm sorry to hear that.,...I'm sorry to hear that.,リゼット,……恐れ入ります。,"<audio id=""v04_30048""><source src=""talk/11/v04_30048.opus"" type=""audio/ogg; codecs=opus""></audio><a href=""javascript:void(0)"" onclick=""document.getElementById('v04_30048').play()"">……恐れ入ります。</a>",,"<img class=""itp-kuro"" src=""itp/11/avfc5005_out.webp""/>"
m3200,7,132,Prince Sheridan,"But even more than that, the number one thing I can't bring myself to trust is you, Van Arkride.","But even more than that, the number one thing I<br/>can't bring myself to trust is you, Van Arkride.",シェリド公太子,何より信用できないのは君だよ、 ヴァン・アークライド君。,"<audio id=""v28_30031""><source src=""talk/11/v28_30031.opus"" type=""audio/ogg; codecs=opus""></audio><a href=""javascript:void(0)"" onclick=""document.getElementById('v28_30031').play()"">何より信用できないのは君だよ、<br/>ヴァン・アークライド君。</a>",,
m3200,7,133,Prince Sheridan,"Not only are you an external tester for Marduk, you have unique ties to both the seemly and unseemly parts of society.","Not only are you an external tester for Marduk, you<br/>have unique ties to both the seemly and unseemly<br/>parts of society.",シェリド公太子,マルドゥック社の社外テスターにして 表と裏のどちらにも顔が利く特異な立場。,"<audio id=""v28_30032""><source src=""talk/11/v28_30032.opus"" type=""audio/ogg; codecs=opus""></audio><a href=""javascript:void(0)"" onclick=""document.getElementById('v28_30032').play()"">マルドゥック社の社外テスターにして<br/>表と裏のどちらにも顔が利く特異な立場。</a>",,
m3200,7,134,Prince Sheridan,"In fact, depending on the situation, I suspect those ties could run even as far as the likes of 'them.'","In fact, depending on the situation, I suspect those<br/>ties could run even as far as the likes of 'them.'",シェリド公太子,……場合によっては“彼ら”と 裏で繋がっている可能性もありそうだ。,"<audio id=""v28_30033""><source src=""talk/11/v28_30033.opus"" type=""audio/ogg; codecs=opus""></audio><a href=""javascript:void(0)"" onclick=""document.getElementById('v28_30033').play()"">……場合によっては“彼ら”と<br/>裏で繋がっている可能性もありそうだ。</a>",,
m3200,7,135,Ferry,Wh-What?! You can't be serious!,Wh-What?! You can't be serious!,フェリ,っ……そんなっ！？,"<audio id=""v02_30038""><source src=""talk/11/v02_30038.opus"" type=""audio/ogg; codecs=opus""></audio><a href=""javascript:void(0)"" onclick=""document.getElementById('v02_30038').play()"">っ……そんなっ！？</a>",,"<img class=""itp-kuro"" src=""itp/11/avfc5003_out.webp""/>"
m3200,7,136,Aaron,Now hold on. You accusing our boss of working with Almata?,Now hold on. You accusing our boss of working<br/>with Almata?,アーロン,ハア……？ コイツがアルマータとか？,"<audio id=""v03_30051""><source src=""talk/11/v03_30051.opus"" type=""audio/ogg; codecs=opus""></audio><a href=""javascript:void(0)"" onclick=""document.getElementById('v03_30051').play()"">ハア……？<br/>コイツがアルマータとか？</a>",,"<img class=""itp-kuro"" src=""itp/11/avfc0002_out.webp""/>"
m3200,7,137,Van,"I'll put it like this: as long as they respect my rules, I'm not, in principle, above workin' for any particular client.","I'll put it like this: as long as they respect my rules,<br/>I'm not, in principle, above workin' for any<br/>particular client.",ヴァン,ま、確かに筋さえ通せばどんな連中の 依頼も受ける可能性はありますがね──,"<audio id=""v00_30060""><source src=""talk/11/v00_30060.opus"" type=""audio/ogg; codecs=opus""></audio><a href=""javascript:void(0)"" onclick=""document.getElementById('v00_30060').play()"">ま、確かに筋さえ通せばどんな連中の<br/>依頼も受ける可能性はありますがね──</a>",,"<img class=""itp-kuro"" src=""itp/11/avfc0000_out.webp""/>"
m3200,7,138,Agnes,"But in practice, he would NEVER work for them. They've crossed far too many lines at this point.","But in practice, he would NEVER work for them.<br/>They've crossed far too many lines at this point.",アニエス,でもあり得ません……あの人たちは 幾つも一線を踏み越えていますから。,"<audio id=""v01_30049""><source src=""talk/11/v01_30049.opus"" type=""audio/ogg; codecs=opus""></audio><a href=""javascript:void(0)"" onclick=""document.getElementById('v01_30049').play()"">でもあり得ません……あの人たちは<br/>幾つも一線を踏み越えていますから。</a>",,"<img class=""itp-kuro"" src=""itp/11/avfc5001_out.webp""/>"
m3200,7,139,Agnes,"I'm confident if they ever came to him asking for his help, he would refuse.","I'm confident if they ever came to him asking for his<br/>help, he would refuse.",アニエス,その時点でヴァンさんが 受ける可能性はゼロだと思います。,"<audio id=""v01_30050""><source src=""talk/11/v01_30050.opus"" type=""audio/ogg; codecs=opus""></audio><a href=""javascript:void(0)"" onclick=""document.getElementById('v01_30050').play()"">その時点でヴァンさんが<br/>受ける可能性はゼロだと思います。</a>",,"<img class=""itp-kuro"" src=""itp/11/avfc5001_out.webp""/>"
m3200,7,140,Van,...,...,ヴァン,……………………,"<audio id=""v00_30061""><source src=""talk/11/v00_30061.opus"" type=""audio/ogg; codecs=opus""></audio><a href=""javascript:void(0)"" onclick=""document.getElementById('v00_30061').play()"">……………………</a>",,"<img class=""itp-kuro"" src=""itp/11/avfc0000_out.webp""/>"
m3200,7,141,Ferry,Agnès...,Agnès...,フェリ,アニエスさん……,"<audio id=""v02_30039""><source src=""talk/11/v02_30039.opus"" type=""audio/ogg; codecs=opus""></audio><a href=""javascript:void(0)"" onclick=""document.getElementById('v02_30039').play()"">アニエスさん……</a>",,"<img class=""itp-kuro"" src=""itp/11/avfc5003_out.webp""/>"
m3200,7,142,Prince Sheridan,"You have some loyal assistants, I see. But that does little to assuage my concerns.","You have some loyal assistants, I see. But that does<br/>little to assuage my concerns.",シェリド公太子,ふふ、良い助手を持ったね。 だが──それとこれとは話が別だ。,"<audio id=""v28_30034""><source src=""talk/11/v28_30034.opus"" type=""audio/ogg; codecs=opus""></audio><a href=""javascript:void(0)"" onclick=""document.getElementById('v28_30034').play()"">ふふ、良い助手を持ったね。<br/>だが──それとこれとは話が別だ。</a>",,
m3200,7,143,Ferry,She's got a gun shamshir!,She's got a gun shamshir!,フェリ,湾曲銃刀（ガンシャムシール）……！,"<audio id=""v02_30040""><source src=""talk/11/v02_30040.opus"" type=""audio/ogg; codecs=opus""></audio><a href=""javascript:void(0)"" onclick=""document.getElementById('v02_30040').play()"">湾曲銃刀（ガンシャムシール）……！</a>",,"<img class=""itp-kuro"" src=""itp/11/avfc5003_out.webp""/>"
m3200,7,144,Aaron,Heh! Now we're talking! I hardly broke a sweat with those losers earlier.,Heh! Now we're talking! I hardly broke a sweat with<br/>those losers earlier.,アーロン,クク、上等だ…… さっきはザコばかりだったからな。,"<audio id=""v03_30052""><source src=""talk/11/v03_30052.opus"" type=""audio/ogg; codecs=opus""></audio><a href=""javascript:void(0)"" onclick=""document.getElementById('v03_30052').play()"">クク、上等だ……<br/>さっきはザコばかりだったからな。</a>",,"<img class=""itp-kuro"" src=""itp/11/avfc0002_out.webp""/>"
m3200,7,145,Mariel,Wh-What the...?!,Wh-What the...?!,マリエル,えっ、えっ……！？,"<audio id=""v21_30010""><source src=""talk/11/v21_30010.opus"" type=""audio/ogg; codecs=opus""></audio><a href=""javascript:void(0)"" onclick=""document.getElementById('v21_30010').play()"">えっ、えっ……！？</a>",,
m3200,7,146,Shahina,Can someone explain what's going on here?!,Can someone explain what's going on here?!,シャヒーナ,なんなの、どうなってるの～！？,"<audio id=""v53_30028""><source src=""talk/11/v53_30028.opus"" type=""audio/ogg; codecs=opus""></audio><a href=""javascript:void(0)"" onclick=""document.getElementById('v53_30028').play()"">なんなの、どうなってるの～！？</a>",,
m3200,7,147,Lisette,It seems we're left with no choice.,It seems we're left with no choice.,リゼット,是非もなし、ですか。,"<audio id=""v04_30049""><source src=""talk/11/v04_30049.opus"" type=""audio/ogg; codecs=opus""></audio><a href=""javascript:void(0)"" onclick=""document.getElementById('v04_30049').play()"">是非もなし、ですか。</a>",,"<img class=""itp-kuro"" src=""itp/11/avfc5005_out.webp""/>"
m3200,7,148,Van,"Nope. I take it you're throwing your hat in the ring, too, Your Highness?","Nope. I take it you're throwing your hat in<br/>the ring, too, Your Highness?",ヴァン,ああ……しかし アンタもやるつもりかい？,"<audio id=""v00_30062""><source src=""talk/11/v00_30062.opus"" type=""audio/ogg; codecs=opus""></audio><a href=""javascript:void(0)"" onclick=""document.getElementById('v00_30062').play()"">ああ……しかし<br/>アンタもやるつもりかい？</a>",,"<img class=""itp-kuro"" src=""itp/11/avfc0000_out.webp""/>"
m3200,7,149,Prince Sheridan,Why not? It's all in good fun. Though Naje here is more than capable on her own.,Why not? It's all in good fun. Though Naje here is<br/>more than capable on her own.,シェリド公太子,なに、ただの余興さ。 彼女一人でも十分だろうがね。,"<audio id=""v28_30035""><source src=""talk/11/v28_30035.opus"" type=""audio/ogg; codecs=opus""></audio><a href=""javascript:void(0)"" onclick=""document.getElementById('v28_30035').play()"">なに、ただの余興さ。<br/>彼女一人でも十分だろうがね。</a>",,
m3200,7,150,Prince Sheridan,"Either way, words alone simply are not enough for me to surmise the strength and character of you and the rest of your team.","Either way, words alone simply are not enough for<br/>me to surmise the strength and character of you and<br/>the rest of your team.",シェリド公太子,言葉だけでは不足だ…… 君と、君たちの力と質（たち）を推し量るには。,"<audio id=""v28_30036""><source src=""talk/11/v28_30036.opus"" type=""audio/ogg; codecs=opus""></audio><a href=""javascript:void(0)"" onclick=""document.getElementById('v28_30036').play()"">言葉だけでは不足だ……<br/>君と、君たちの力と質（たち）を推し量るには。</a>",,
m3200,7,151,Prince Sheridan,"And so I, Sherid Asval...","And so I, Sherid Asval...",シェリド公太子,このシェリド・アスヴァール──,"<audio id=""v28_30037""><source src=""talk/11/v28_30037.opus"" type=""audio/ogg; codecs=opus""></audio><a href=""javascript:void(0)"" onclick=""document.getElementById('v28_30037').play()"">このシェリド・アスヴァール──</a>",,
m3200,7,152,Prince Sheridan,...shall personally evaluate Arkride Solutions!,...shall personally evaluate Arkride Solutions!,シェリド公太子,手ずからアークライド解決事務所を 検分させてもらうよ！,"<audio id=""v28_30038""><source src=""talk/11/v28_30038.opus"" type=""audio/ogg; codecs=opus""></audio><a href=""javascript:void(0)"" onclick=""document.getElementById('v28_30038').play()"">手ずからアークライド解決事務所を<br/>検分させてもらうよ！</a>",,
m3200,7,153,Nager,"And I, Naje Berka, stand with him!","And I, Naje Berka, stand with him!",ナージェ,公王家護衛官ナージェ・ベルカ、参る……！,"<audio id=""v43_30006""><source src=""talk/11/v43_30006.opus"" type=""audio/ogg; codecs=opus""></audio><a href=""javascript:void(0)"" onclick=""document.getElementById('v43_30006').play()"">公王家護衛官ナージェ・ベルカ、参る……！</a>",,
m3200,8,154,Nager,They're formidable.,They're formidable.,ナージェ,……中々やりますね。,"<audio id=""v43_30007""><source src=""talk/11/v43_30007.opus"" type=""audio/ogg; codecs=opus""></audio><a href=""javascript:void(0)"" onclick=""document.getElementById('v43_30007').play()"">……中々やりますね。</a>",,
m3200,8,155,Prince Sheridan,I'm impressed they held out this long.,I'm impressed they held out this long.,シェリド公太子,ハハ、ここまでとはね……！,"<audio id=""v28_30039""><source src=""talk/11/v28_30039.opus"" type=""audio/ogg; codecs=opus""></audio><a href=""javascript:void(0)"" onclick=""document.getElementById('v28_30039').play()"">ハハ、ここまでとはね……！</a>",,
m3200,8,156,Prince Sheridan,I think we've evaluated them enough.,I think we've evaluated them enough.,シェリド公太子,ナージェ、 様子見はもう</B>十分だろう。,"<audio id=""v28_30040""><source src=""talk/11/v28_30040.opus"" type=""audio/ogg; codecs=opus""></audio><a href=""javascript:void(0)"" onclick=""document.getElementById('v28_30040').play()"">ナージェ、<br/>様子見はもう</B>十分だろう。</a>",,
m3200,8,157,Nager,"Shall I end it, then?","Shall I end it, then?",ナージェ,……仕留めても？,"<audio id=""v43_30008""><source src=""talk/11/v43_30008.opus"" type=""audio/ogg; codecs=opus""></audio><a href=""javascript:void(0)"" onclick=""document.getElementById('v43_30008').play()"">……仕留めても？</a>",,
m3200,8,158,Prince Sheridan,Go easy on the lackeys. Otherwise? By all means.,Go easy on the lackeys. Otherwise? By all means.,シェリド公太子,助手君たち以外は そのつもりで行くといい！,"<audio id=""v28_30041""><source src=""talk/11/v28_30041.opus"" type=""audio/ogg; codecs=opus""></audio><a href=""javascript:void(0)"" onclick=""document.getElementById('v28_30041').play()"">助手君たち以外は<br/>そのつもりで行くといい！</a>",,
m3200,8,159,Aaron,"Oh, screw you!","Oh, screw you!",アーロン,ナメんな……！！,"<audio id=""v03_30053""><source src=""talk/11/v03_30053.opus"" type=""audio/ogg; codecs=opus""></audio><a href=""javascript:void(0)"" onclick=""document.getElementById('v03_30053').play()"">ナメんな……！！</a>",,"<img class=""itp-kuro"" src=""itp/11/avfc0002_out.webp""/>"
m3200,8,160,Van,"Well, all right, then—guess we're doin' this!","Well, all right, then—guess we're doin' this!",ヴァン,やれやれ──仕方ねえな！,"<audio id=""v00_30063""><source src=""talk/11/v00_30063.opus"" type=""audio/ogg; codecs=opus""></audio><a href=""javascript:void(0)"" onclick=""document.getElementById('v00_30063').play()"">やれやれ──仕方ねえな！</a>",,"<img class=""itp-kuro"" src=""itp/11/avfc0000_out.webp""/>"
m3200,8,161,voice,Don't even think about it.,Don't even think about it.,声,──双方そこまで。,"<audio id=""v14_30015""><source src=""talk/11/v14_30015.opus"" type=""audio/ogg; codecs=opus""></audio><a href=""javascript:void(0)"" onclick=""document.getElementById('v14_30015').play()"">──双方そこまで。</a>",,
m3200,8,162,Nager,...!,...!,ナージェ,……！,"<audio id=""v43_30009""><source src=""talk/11/v43_30009.opus"" type=""audio/ogg; codecs=opus""></audio><a href=""javascript:void(0)"" onclick=""document.getElementById('v43_30009').play()"">……！</a>",,
m3200,8,163,Van,What?!,What?!,ヴァン,なに……！？,"<audio id=""v00_30064""><source src=""talk/11/v00_30064.opus"" type=""audio/ogg; codecs=opus""></audio><a href=""javascript:void(0)"" onclick=""document.getElementById('v00_30064').play()"">なに……！？</a>",,"<img class=""itp-kuro"" src=""itp/11/avfc0000_out.webp""/>"
m3200,8,164,Ferry,It's Sylphid...,It's Sylphid...,フェリ,……妖精………,"<audio id=""v02_30041""><source src=""talk/11/v02_30041.opus"" type=""audio/ogg; codecs=opus""></audio><a href=""javascript:void(0)"" onclick=""document.getElementById('v02_30041').play()"">……妖精………</a>",,"<img class=""itp-kuro"" src=""itp/11/avfc5003_out.webp""/>"
m3200,8,165,Prince Sheridan,"Well, would you look at that? I didn't think you'd get here so soon, Fie.","Well, would you look at that? I didn't think you'd get<br/>here so soon, Fie.",シェリド公太子,やれやれ、フィー君…… もう到着したのかい。,"<audio id=""v28_30042""><source src=""talk/11/v28_30042.opus"" type=""audio/ogg; codecs=opus""></audio><a href=""javascript:void(0)"" onclick=""document.getElementById('v28_30042').play()"">やれやれ、フィー君……<br/>もう到着したのかい。</a>",,
m3200,8,166,Fee,"Well, I have. That's enough, Your Highness.","Well, I have. That's enough, Your Highness.",フィー,殿下、そのくらいで。,"<audio id=""v14_30016""><source src=""talk/11/v14_30016.opus"" type=""audio/ogg; codecs=opus""></audio><a href=""javascript:void(0)"" onclick=""document.getElementById('v14_30016').play()"">殿下、そのくらいで。</a>",,"<img class=""itp-kuro"" src=""itp/11/avfc5112_out.webp""/>"
m3200,8,167,Fee,"Playtime's over. Now that I'm here, we need to let the victims rest.","Playtime's over. Now that I'm here, we need to let the<br/>victims rest.",フィー,わたしが来た以上、その子たちを 休ませるのを優先させてもらう。,"<audio id=""v14_30017""><source src=""talk/11/v14_30017.opus"" type=""audio/ogg; codecs=opus""></audio><a href=""javascript:void(0)"" onclick=""document.getElementById('v14_30017').play()"">わたしが来た以上、その子たちを<br/>休ませるのを優先させてもらう。</a>",,"<img class=""itp-kuro"" src=""itp/11/avfc5112_out.webp""/>"
m3200,8,168,voice,"Marielle, are you all right?!","Marielle, are you all right?!",声,マリエル、無事か……！,"<audio id=""v20_30010""><source src=""talk/11/v20_30010.opus"" type=""audio/ogg; codecs=opus""></audio><a href=""javascript:void(0)"" onclick=""document.getElementById('v20_30010').play()"">マリエル、無事か……！</a>",,
m3200,8,169,Mariel,Dingo!,Dingo!,マリエル,ディンゴさん……！？,"<audio id=""v21_30011""><source src=""talk/11/v21_30011.opus"" type=""audio/ogg; codecs=opus""></audio><a href=""javascript:void(0)"" onclick=""document.getElementById('v21_30011').play()"">ディンゴさん……！？</a>",,
m3200,8,170,Mariel,*sniffle* Where have you been? I've been trying to get a hold of you all this time!,*sniffle* Where have you been? I've been trying to get<br/>a hold of you all this time!,マリエル,ううっ、どこにいたんですかっ！？ 今朝からぜんぜん連絡が──！,"<audio id=""v21_30012""><source src=""talk/11/v21_30012.opus"" type=""audio/ogg; codecs=opus""></audio><a href=""javascript:void(0)"" onclick=""document.getElementById('v21_30012').play()"">ううっ、どこにいたんですかっ！？<br/>今朝からぜんぜん連絡が──！</a>",,
m3200,8,171,Dingo,...Heh. Guess I had nothing to worry about.,...Heh. Guess I had nothing to worry about.,ディンゴ,……フッ、大丈夫そうだな。,"<audio id=""v20_30011""><source src=""talk/11/v20_30011.opus"" type=""audio/ogg; codecs=opus""></audio><a href=""javascript:void(0)"" onclick=""document.getElementById('v20_30011').play()"">……フッ、大丈夫そうだな。</a>",,
m3200,8,172,Bracer Renton,These must be the perpetrators.,These must be the perpetrators.,遊撃士レントン,こいつらが誘拐犯か。,こいつらが誘拐犯か。,,
m3200,8,173,Bracer Ismail,This saves us a lot of trouble. You okay if we bring them in?,This saves us a lot of trouble. You okay if we bring<br/>them in?,遊撃士イスマイル,助かりました。 こちらで確保しても？,助かりました。<br/>こちらで確保しても？,,
