gameId,fname,scene,row,engChrName,engSearchText,engHtmlText,jpnChrName,jpnSearchText,jpnHtmlText,opName,pcIconHtml,evoIconHtml
m3400,4,64,Grimm Cats,"It looks like neither of them are hurt, thank Aidios.","It looks like neither of them are hurt, thank Aidios.",グリムキャッツ,……とりあえず 怪我とかはないみたいね。,"<audio id=""v06_30055""><source src=""talk/11/v06_30055.opus"" type=""audio/ogg; codecs=opus""></audio><a href=""javascript:void(0)"" onclick=""document.getElementById('v06_30055').play()"">……とりあえず<br/>怪我とかはないみたいね。</a>",,"<img class=""itp-kuro"" src=""itp/11/avfc5007_out.webp""/>"
m3400,4,65,Director Gotch,G-Grimcat! What's that spicy cougar doing here?!,G-Grimcat! What's that spicy cougar doing here?!,ゴッチ監督,グ、グリムキャッツ……！？ 噂のけしからん雌猫がどうして！？,"<audio id=""v54_30050""><source src=""talk/11/v54_30050.opus"" type=""audio/ogg; codecs=opus""></audio><a href=""javascript:void(0)"" onclick=""document.getElementById('v54_30050').play()"">グ、グリムキャッツ……！？<br/>噂のけしからん雌猫がどうして！？</a>",,
m3400,4,66,Grimm Cats,"I'm too young to be a COUGAR, thank you!","I'm too young to be a COUGAR, thank you!",グリムキャッツ,けしからん言うなっ！,"<audio id=""v06_30056""><source src=""talk/11/v06_30056.opus"" type=""audio/ogg; codecs=opus""></audio><a href=""javascript:void(0)"" onclick=""document.getElementById('v06_30056').play()"">けしからん言うなっ！</a>",,"<img class=""itp-kuro"" src=""itp/11/avfc5007_out.webp""/>"
m3400,4,67,Nina,"What ARE you doing here, though?","What ARE you doing here, though?",ニナ,でも、どうしてここに……,"<audio id=""v18_30064""><source src=""talk/11/v18_30064.opus"" type=""audio/ogg; codecs=opus""></audio><a href=""javascript:void(0)"" onclick=""document.getElementById('v18_30064').play()"">でも、どうしてここに……</a>",,
m3400,4,68,Grimm Cats,"Ahhhhh... Umm, well, I was asked by an actress to come and...help, you see!","Ahhhhh... Umm, well, I was asked by an actress to<br/>come and...help, you see!",グリムキャッツ,あー……まあちょっと とある女優に頼まれちゃってね。,"<audio id=""v06_30057""><source src=""talk/11/v06_30057.opus"" type=""audio/ogg; codecs=opus""></audio><a href=""javascript:void(0)"" onclick=""document.getElementById('v06_30057').play()"">あー……まあちょっと<br/>とある女優に頼まれちゃってね。</a>",,"<img class=""itp-kuro"" src=""itp/11/avfc5007_out.webp""/>"
m3400,4,69,Melchior,"So you're the phantom thief people are talking about... Come to steal our 'treasure,' I take it?","So you're the phantom thief people are<br/>talking about... Come to steal our 'treasure,' I take it?",メルキオル,巷で噂の怪盗だっけ── 僕らの“お宝”を奪いに来たのかな？,"<audio id=""v38_30009""><source src=""talk/11/v38_30009.opus"" type=""audio/ogg; codecs=opus""></audio><a href=""javascript:void(0)"" onclick=""document.getElementById('v38_30009').play()"">巷で噂の怪盗だっけ──<br/>僕らの“お宝”を奪いに来たのかな？</a>",,
m3400,4,70,Melchior,"I didn't realize you were working hand in hand—or rather, paw in hand—with the spriggan.","I didn't realize you were working hand in hand—or<br/>rather, paw in hand—with the spriggan.",メルキオル,裏解決屋（君たち）と対立してたかと思ったけど。,"<audio id=""v38_30010""><source src=""talk/11/v38_30010.opus"" type=""audio/ogg; codecs=opus""></audio><a href=""javascript:void(0)"" onclick=""document.getElementById('v38_30010').play()"">裏解決屋（君たち）と対立してたかと思ったけど。</a>",,
m3400,4,71,Aaron,We're not friends or anything... Just united in wanting to smash your face in.,We're not friends or anything... Just united in<br/>wanting to smash your face in.,アーロン,別に仲良くはしちゃいねぇさ…… てめぇらをブチのめすのに都合がいいだけだ。,"<audio id=""v03_30070""><source src=""talk/11/v03_30070.opus"" type=""audio/ogg; codecs=opus""></audio><a href=""javascript:void(0)"" onclick=""document.getElementById('v03_30070').play()"">別に仲良くはしちゃいねぇさ……<br/>てめぇらをブチのめすのに都合がいいだけだ。</a>",,"<img class=""itp-kuro"" src=""itp/11/avfc0002_out.webp""/>"
m3400,4,72,Ferry,"Not just for what you did to Aida, but for all the hurt you caused Shaheena and so many others in Tharbad, too!","Not just for what you did to Aida, but for all the hurt<br/>you caused Shaheena and so many others in<br/>Tharbad, too!",フェリ,……はい、仇討ちだけじゃなく、 シャヒーナさんたちのためにも。,"<audio id=""v02_30054""><source src=""talk/11/v02_30054.opus"" type=""audio/ogg; codecs=opus""></audio><a href=""javascript:void(0)"" onclick=""document.getElementById('v02_30054').play()"">……はい、仇討ちだけじゃなく、<br/>シャヒーナさんたちのためにも。</a>",,"<img class=""itp-kuro"" src=""itp/11/avfc5003_out.webp""/>"
m3400,4,73,voice,Could we perhaps tone the noise down?,Could we perhaps tone the noise down?,声,──悪いが、 少し</B>静かにしてもらおうか。,"<audio id=""v37_30016""><source src=""talk/11/v37_30016.opus"" type=""audio/ogg; codecs=opus""></audio><a href=""javascript:void(0)"" onclick=""document.getElementById('v37_30016').play()"">──悪いが、<br/>少し</B>静かにしてもらおうか。</a>",,
m3400,4,74,Man in coat,The show is almost at its climax.,The show is almost at its climax.,コートの男,舞台もいよいよクライマックスに 差し掛かったところだ……,"<audio id=""v37_30017""><source src=""talk/11/v37_30017.opus"" type=""audio/ogg; codecs=opus""></audio><a href=""javascript:void(0)"" onclick=""document.getElementById('v37_30017').play()"">舞台もいよいよクライマックスに<br/>差し掛かったところだ……</a>",,
m3400,4,75,Man in coat,It would be a shame to miss it over a bout of petty sniping.,It would be a shame to miss it over a bout of<br/>petty sniping.,コートの男,ここで見逃したら勿体ないだろう？,"<audio id=""v37_30018""><source src=""talk/11/v37_30018.opus"" type=""audio/ogg; codecs=opus""></audio><a href=""javascript:void(0)"" onclick=""document.getElementById('v37_30018').play()"">ここで見逃したら勿体ないだろう？</a>",,
m3400,4,76,Van,...,...,ヴァン,っ……,"<audio id=""v00_30084""><source src=""talk/11/v00_30084.opus"" type=""audio/ogg; codecs=opus""></audio><a href=""javascript:void(0)"" onclick=""document.getElementById('v00_30084').play()"">っ……</a>",,"<img class=""itp-kuro"" src=""itp/11/avfc0000_out.webp""/>"
m3400,4,77,Melchior,"Haha. Sorry about that, boss. ❤","Haha. Sorry about that, boss. ❤",メルキオル,フフ──ごめんよ、ボス</B>❤,"<audio id=""v38_30011""><source src=""talk/11/v38_30011.opus"" type=""audio/ogg; codecs=opus""></audio><a href=""javascript:void(0)"" onclick=""document.getElementById('v38_30011').play()"">フフ──ごめんよ、ボス</B>❤</a>",,
m3400,4,78,Agnes,...!,...!,アニエス,……！,"<audio id=""v01_30060""><source src=""talk/11/v01_30060.opus"" type=""audio/ogg; codecs=opus""></audio><a href=""javascript:void(0)"" onclick=""document.getElementById('v01_30060').play()"">……！</a>",,"<img class=""itp-kuro"" src=""itp/11/avfc5001_out.webp""/>"
m3400,4,79,Aaron,Wait... Are you telling me...?,Wait... Are you telling me...?,アーロン,……おい、まさか……,"<audio id=""v03_30071""><source src=""talk/11/v03_30071.opus"" type=""audio/ogg; codecs=opus""></audio><a href=""javascript:void(0)"" onclick=""document.getElementById('v03_30071').play()"">……おい、まさか……</a>",,"<img class=""itp-kuro"" src=""itp/11/avfc0002_out.webp""/>"
m3400,4,80,Ferry,N-No way...,N-No way...,フェリ,あ、あの人が……,"<audio id=""v02_30055""><source src=""talk/11/v02_30055.opus"" type=""audio/ogg; codecs=opus""></audio><a href=""javascript:void(0)"" onclick=""document.getElementById('v02_30055').play()"">あ、あの人が……</a>",,"<img class=""itp-kuro"" src=""itp/11/avfc5003_out.webp""/>"
m3400,4,81,Gerard,"My name is Gerard Dantès, the head of Almata.","My name is Gerard Dantès, the head of Almata.",ジェラール,《アルマータ》を仕切っている ジェラール・ダンテスという。,"<audio id=""v37_30019""><source src=""talk/11/v37_30019.opus"" type=""audio/ogg; codecs=opus""></audio><a href=""javascript:void(0)"" onclick=""document.getElementById('v37_30019').play()"">《アルマータ》を仕切っている<br/>ジェラール・ダンテスという。</a>",,
m3400,4,82,Gerard,So you are the spriggan. Somehow this doesn't quite feel like our first encounter.,So you are the spriggan. Somehow this doesn't quite<br/>feel like our first encounter.,ジェラール,裏解決屋──だったか？ 初めましてという気はしないな。,"<audio id=""v37_30020""><source src=""talk/11/v37_30020.opus"" type=""audio/ogg; codecs=opus""></audio><a href=""javascript:void(0)"" onclick=""document.getElementById('v37_30020').play()"">裏解決屋──だったか？<br/>初めましてという気はしないな。</a>",,
m3400,4,83,Gerard,"Would you care to join us in watching the show? It seems, perhaps, that this was fated to be.","Would you care to join us in watching the show?<br/>It seems, perhaps, that this was fated to be.",ジェラール,これまでの縁もある── 良ければ一緒に観ていくといい。,"<audio id=""v37_30021""><source src=""talk/11/v37_30021.opus"" type=""audio/ogg; codecs=opus""></audio><a href=""javascript:void(0)"" onclick=""document.getElementById('v37_30021').play()"">これまでの縁もある──<br/>良ければ一緒に観ていくといい。</a>",,
m3400,4,84,Van,Heh. We plan to see this to the end...but hell if we're gonna do it with you.,Heh. We plan to see this to the end...but hell if we're<br/>gonna do it with you.,ヴァン,……ハッ、見届けはするが 一緒にっつーのは遠慮しておくぜ。,"<audio id=""v00_30085""><source src=""talk/11/v00_30085.opus"" type=""audio/ogg; codecs=opus""></audio><a href=""javascript:void(0)"" onclick=""document.getElementById('v00_30085').play()"">……ハッ、見届けはするが<br/>一緒にっつーのは遠慮しておくぜ。</a>",,"<img class=""itp-kuro"" src=""itp/11/avfc0000_out.webp""/>"
m3400,4,85,Van,That'd just rain all over the hard work these kids've put in.,That'd just rain all over the hard work these kids've<br/>put in.,ヴァン,あの子たちの頑張りに ケチが付いちまいそうだからな。,"<audio id=""v00_30086""><source src=""talk/11/v00_30086.opus"" type=""audio/ogg; codecs=opus""></audio><a href=""javascript:void(0)"" onclick=""document.getElementById('v00_30086').play()"">あの子たちの頑張りに<br/>ケチが付いちまいそうだからな。</a>",,"<img class=""itp-kuro"" src=""itp/11/avfc0000_out.webp""/>"
m3400,4,86,Gerard,Hmm... A pity.,Hmm... A pity.,ジェラール,フフ、それは残念だ。,"<audio id=""v37_30022""><source src=""talk/11/v37_30022.opus"" type=""audio/ogg; codecs=opus""></audio><a href=""javascript:void(0)"" onclick=""document.getElementById('v37_30022').play()"">フフ、それは残念だ。</a>",,
m3400,4,87,Lisette,Almata's leader. An SS-level threat.,Almata's leader. An SS-level threat.,リゼット,《アルマータ》の首領（ドン）── 脅威度ＳＳクラスの危険人物ですか。,"<audio id=""v04_30065""><source src=""talk/11/v04_30065.opus"" type=""audio/ogg; codecs=opus""></audio><a href=""javascript:void(0)"" onclick=""document.getElementById('v04_30065').play()"">《アルマータ》の首領（ドン）──<br/>脅威度ＳＳクラスの危険人物ですか。</a>",,"<img class=""itp-kuro"" src=""itp/11/avfc5005_out.webp""/>"
m3400,4,88,Lisette,"Fate notwithstanding, you are correct. This isn't even our first time meeting in this city.","Fate notwithstanding, you are correct. This isn't even<br/>our first time meeting in this city.",リゼット,これまでの縁はともかく──確かに この地でも</B>初めてではありませんね？,"<audio id=""v04_30066""><source src=""talk/11/v04_30066.opus"" type=""audio/ogg; codecs=opus""></audio><a href=""javascript:void(0)"" onclick=""document.getElementById('v04_30066').play()"">これまでの縁はともかく──確かに<br/>この地でも</B>初めてではありませんね？</a>",,"<img class=""itp-kuro"" src=""itp/11/avfc5005_out.webp""/>"
m3400,4,89,Aaron,...What?,...What?,アーロン,……なに……,"<audio id=""v03_30072""><source src=""talk/11/v03_30072.opus"" type=""audio/ogg; codecs=opus""></audio><a href=""javascript:void(0)"" onclick=""document.getElementById('v03_30072').play()"">……なに……</a>",,"<img class=""itp-kuro"" src=""itp/11/avfc0002_out.webp""/>"
m3400,4,90,Agnes,*gasp* You don't mean...,*gasp* You don't mean...,アニエス,……！ も、もしかして……,"<audio id=""v01_30061""><source src=""talk/11/v01_30061.opus"" type=""audio/ogg; codecs=opus""></audio><a href=""javascript:void(0)"" onclick=""document.getElementById('v01_30061').play()"">……！<br/>も、もしかして……</a>",,"<img class=""itp-kuro"" src=""itp/11/avfc5001_out.webp""/>"
m3400,4,91,Ferry,He was that guy in the casino?!,He was that guy in the casino?!,フェリ,カジノにいた……,"<audio id=""v02_30056""><source src=""talk/11/v02_30056.opus"" type=""audio/ogg; codecs=opus""></audio><a href=""javascript:void(0)"" onclick=""document.getElementById('v02_30056').play()"">カジノにいた……</a>",,"<img class=""itp-kuro"" src=""itp/11/avfc5003_out.webp""/>"
m3400,4,92,Van,"There I was, thinkin' Almata had no presence here in this city...","There I was, thinkin' Almata had no presence here in<br/>this city...",ヴァン,……構成員や半グレの影はねぇ、 なんてのはとんだ見込み違いか。,"<audio id=""v00_30087""><source src=""talk/11/v00_30087.opus"" type=""audio/ogg; codecs=opus""></audio><a href=""javascript:void(0)"" onclick=""document.getElementById('v00_30087').play()"">……構成員や半グレの影はねぇ、<br/>なんてのはとんだ見込み違いか。</a>",,"<img class=""itp-kuro"" src=""itp/11/avfc0000_out.webp""/>"
m3400,4,93,Van,...when their leader was hidin' in plain sight the whole damn time.,...when their leader was hidin' in plain sight the<br/>whole damn time.,ヴァン,まさかアタマ自らが 最初から</B>潜伏してたとはな。,"<audio id=""v00_30088""><source src=""talk/11/v00_30088.opus"" type=""audio/ogg; codecs=opus""></audio><a href=""javascript:void(0)"" onclick=""document.getElementById('v00_30088').play()"">まさかアタマ自らが<br/>最初から</B>潜伏してたとはな。</a>",,"<img class=""itp-kuro"" src=""itp/11/avfc0000_out.webp""/>"
m3400,4,94,Gerard,It's simply a matter of efficiency. I believe in taking a hands-on approach to my work.,It's simply a matter of efficiency. I believe in taking a<br/>hands-on approach to my work.,ジェラール,なに、効率の問題だ。 これでも“現場主義”なんでな。,"<audio id=""v37_30023""><source src=""talk/11/v37_30023.opus"" type=""audio/ogg; codecs=opus""></audio><a href=""javascript:void(0)"" onclick=""document.getElementById('v37_30023').play()"">なに、効率の問題だ。<br/>これでも“現場主義”なんでな。</a>",,
m3400,4,95,Gerard,"Whether it is disposing of pawns and abandoning positions, or giving tools and products a firsthand trial.","Whether it is disposing of pawns and abandoning<br/>positions, or giving tools and products a<br/>firsthand trial.",ジェラール,用済みの駒と陣地の廃棄に、 “鍵”と“商品”の試験運用も含めて。,"<audio id=""v37_30024""><source src=""talk/11/v37_30024.opus"" type=""audio/ogg; codecs=opus""></audio><a href=""javascript:void(0)"" onclick=""document.getElementById('v37_30024').play()"">用済みの駒と陣地の廃棄に、<br/>“鍵”と“商品”の試験運用も含めて。</a>",,
m3400,4,96,Aaron,You son of a bitch...,You son of a bitch...,アーロン,……てめえ………,"<audio id=""v03_30073""><source src=""talk/11/v03_30073.opus"" type=""audio/ogg; codecs=opus""></audio><a href=""javascript:void(0)"" onclick=""document.getElementById('v03_30073').play()"">……てめえ………</a>",,"<img class=""itp-kuro"" src=""itp/11/avfc0002_out.webp""/>"
m3400,4,97,Van,Now I get it.,Now I get it.,ヴァン,……なるほどな。,"<audio id=""v00_30089""><source src=""talk/11/v00_30089.opus"" type=""audio/ogg; codecs=opus""></audio><a href=""javascript:void(0)"" onclick=""document.getElementById('v00_30089').play()"">……なるほどな。</a>",,"<img class=""itp-kuro"" src=""itp/11/avfc0000_out.webp""/>"
m3400,4,98,Van,"There's a lot goin' on here, but your main goal here was some kinda experiment.","There's a lot goin' on here, but your main goal here<br/>was some kinda experiment.",ヴァン,色々ありそうだがお前らの主目的は 要するに“実験”だったってワケか。,"<audio id=""v00_30090""><source src=""talk/11/v00_30090.opus"" type=""audio/ogg; codecs=opus""></audio><a href=""javascript:void(0)"" onclick=""document.getElementById('v00_30090').play()"">色々ありそうだがお前らの主目的は<br/>要するに“実験”だったってワケか。</a>",,"<img class=""itp-kuro"" src=""itp/11/avfc0000_out.webp""/>"
m3400,4,99,Van,To see just what you could pull off by combining those drugs with that device.,To see just what you could pull off by combining<br/>those drugs with that device.,ヴァン,その装置と、ドラッグを組み合わせて どれだけのことを引き起こせるかの。,"<audio id=""v00_30091""><source src=""talk/11/v00_30091.opus"" type=""audio/ogg; codecs=opus""></audio><a href=""javascript:void(0)"" onclick=""document.getElementById('v00_30091').play()"">その装置と、ドラッグを組み合わせて<br/>どれだけのことを引き起こせるかの。</a>",,"<img class=""itp-kuro"" src=""itp/11/avfc0000_out.webp""/>"
m3400,4,100,Ferry,Wha...?,Wha...?,フェリ,あ……,"<audio id=""v02_30057""><source src=""talk/11/v02_30057.opus"" type=""audio/ogg; codecs=opus""></audio><a href=""javascript:void(0)"" onclick=""document.getElementById('v02_30057').play()"">あ……</a>",,"<img class=""itp-kuro"" src=""itp/11/avfc5003_out.webp""/>"
m3400,4,101,Agnes,"That does fit with what they were trying to do in Creil and Langport, too.","That does fit with what they were trying to do in<br/>Creil and Langport, too.",アニエス,クレイユやラングポートでも そんなことを言ってましたが……,"<audio id=""v01_30062""><source src=""talk/11/v01_30062.opus"" type=""audio/ogg; codecs=opus""></audio><a href=""javascript:void(0)"" onclick=""document.getElementById('v01_30062').play()"">クレイユやラングポートでも<br/>そんなことを言ってましたが……</a>",,"<img class=""itp-kuro"" src=""itp/11/avfc5001_out.webp""/>"
m3400,4,102,Agnes,"So this chaos right now isn't a means to an end, it's an end in itself?","So this chaos right now isn't a means to an end, it's<br/>an end in itself?",アニエス,今のこの状況──“手段”ではなく、 そのものが“目的”だったんですね？,"<audio id=""v01_30063""><source src=""talk/11/v01_30063.opus"" type=""audio/ogg; codecs=opus""></audio><a href=""javascript:void(0)"" onclick=""document.getElementById('v01_30063').play()"">今のこの状況──“手段”ではなく、<br/>そのものが“目的”だったんですね？</a>",,"<img class=""itp-kuro"" src=""itp/11/avfc5001_out.webp""/>"
m3400,4,103,Gerard,Correct.,Correct.,ジェラール,フフ……正解だ。,"<audio id=""v37_30025""><source src=""talk/11/v37_30025.opus"" type=""audio/ogg; codecs=opus""></audio><a href=""javascript:void(0)"" onclick=""document.getElementById('v37_30025').play()"">フフ……正解だ。</a>",,
m3400,4,104,Gerard,"Whether it was securing new distribution routes, or testing our ability to use this heirloom to instigate an uprising of sorts...","Whether it was securing new distribution routes, or<br/>testing our ability to use this heirloom to instigate an<br/>uprising of sorts...",ジェラール,“嗜好品”を絡めた新たな流通ルートに “遺産”を介した人工的な暴動発生。,"<audio id=""v37_30026""><source src=""talk/11/v37_30026.opus"" type=""audio/ogg; codecs=opus""></audio><a href=""javascript:void(0)"" onclick=""document.getElementById('v37_30026').play()"">“嗜好品”を絡めた新たな流通ルートに<br/>“遺産”を介した人工的な暴動発生。</a>",,
m3400,4,105,Gerard,...the data we've obtained from this promises to be quite valuable in what is to come.,...the data we've obtained from this promises to be<br/>quite valuable in what is to come.,ジェラール,どのデータも今後の展開に それなりに</B>有意義ではあるだろう。,"<audio id=""v37_30027""><source src=""talk/11/v37_30027.opus"" type=""audio/ogg; codecs=opus""></audio><a href=""javascript:void(0)"" onclick=""document.getElementById('v37_30027').play()"">どのデータも今後の展開に<br/>それなりに</B>有意義ではあるだろう。</a>",,
m3400,4,106,Gerard,"The mask cannot be reused, alas—but I believe this to be a satisfactory application.","The mask cannot be reused, alas—but I believe this to<br/>be a satisfactory application.",ジェラール,あの“仮面”は一回限りだが ああいう使い方ならば惜しくはない。,"<audio id=""v37_30028""><source src=""talk/11/v37_30028.opus"" type=""audio/ogg; codecs=opus""></audio><a href=""javascript:void(0)"" onclick=""document.getElementById('v37_30028').play()"">あの“仮面”は一回限りだが<br/>ああいう使い方ならば惜しくはない。</a>",,
m3400,4,107,Gerard,"Good work, Melchior.","Good work, Melchior.",ジェラール,よくやったな──メルキオル。,"<audio id=""v37_30029""><source src=""talk/11/v37_30029.opus"" type=""audio/ogg; codecs=opus""></audio><a href=""javascript:void(0)"" onclick=""document.getElementById('v37_30029').play()"">よくやったな──メルキオル。</a>",,
m3400,4,108,Melchior,"Thanks, boss. ❤","Thanks, boss. ❤",メルキオル,ありがと、ボス❤,"<audio id=""v38_30012""><source src=""talk/11/v38_30012.opus"" type=""audio/ogg; codecs=opus""></audio><a href=""javascript:void(0)"" onclick=""document.getElementById('v38_30012').play()"">ありがと、ボス❤</a>",,
m3400,4,109,Melchior,"That pretty thing latches on to the darkness and vulnerability in people's hearts, making puppets out of them.","That pretty thing latches on to the darkness and<br/>vulnerability in people's hearts, making puppets out<br/>of them.",メルキオル,人の弱みや昏い部分に取り憑いて “力”の代行者として傀儡化する──,"<audio id=""v38_30013""><source src=""talk/11/v38_30013.opus"" type=""audio/ogg; codecs=opus""></audio><a href=""javascript:void(0)"" onclick=""document.getElementById('v38_30013').play()"">人の弱みや昏い部分に取り憑いて<br/>“力”の代行者として傀儡化する──</a>",,
m3400,4,110,Melchior,I'm glad I was able to steal a spare during the chaos in Crossbell a year and a half ago. ♪,I'm glad I was able to steal a spare during the chaos in<br/>Crossbell a year and a half ago. ♪,メルキオル,一年半前にクロスベルに探りを入れて “予備”を盗んだ甲斐があったよ♪,"<audio id=""v38_30014""><source src=""talk/11/v38_30014.opus"" type=""audio/ogg; codecs=opus""></audio><a href=""javascript:void(0)"" onclick=""document.getElementById('v38_30014').play()"">一年半前にクロスベルに探りを入れて<br/>“予備”を盗んだ甲斐があったよ♪</a>",,
m3400,4,111,Ferry,They're...total monsters...,They're...total monsters...,フェリ,……なんて人たち………,"<audio id=""v02_30058""><source src=""talk/11/v02_30058.opus"" type=""audio/ogg; codecs=opus""></audio><a href=""javascript:void(0)"" onclick=""document.getElementById('v02_30058').play()"">……なんて人たち………</a>",,"<img class=""itp-kuro"" src=""itp/11/avfc5003_out.webp""/>"
m3400,4,112,Lisette,Yes. We may need to increase their threat level to SS+.,Yes. We may need to increase their threat level<br/>to SS+.,リゼット,……脅威度ＳＳ＋に 格上げが必要そうですね……,"<audio id=""v04_30067""><source src=""talk/11/v04_30067.opus"" type=""audio/ogg; codecs=opus""></audio><a href=""javascript:void(0)"" onclick=""document.getElementById('v04_30067').play()"">……脅威度ＳＳ＋に<br/>格上げが必要そうですね……</a>",,"<img class=""itp-kuro"" src=""itp/11/avfc5005_out.webp""/>"
m3400,4,113,Grimm Cats,(Huh... That was one of the many crises SHE was involved in...),(Huh... That was one of the many crises<br/>SHE was involved in...),グリムキャッツ,（そうか──   “彼女”が関わったっていう。）,"<audio id=""v06_30058""><source src=""talk/11/v06_30058.opus"" type=""audio/ogg; codecs=opus""></audio><a href=""javascript:void(0)"" onclick=""document.getElementById('v06_30058').play()"">（そうか──<br/>  “彼女”が関わったっていう。）</a>",,"<img class=""itp-kuro"" src=""itp/11/avfc5007_out.webp""/>"
