gameId,fname,scene,row,engChrName,engSearchText,engHtmlText,jpnChrName,jpnSearchText,jpnHtmlText,opName,pcIconHtml,evoIconHtml
m3400,4,114,Agnes,We will not allow this madness to go on a moment longer!,We will not allow this madness to go on<br/>a moment longer!,アニエス,……これ以上こんな事を 続けさせるわけにはいきません。,"<audio id=""v01_30064""><source src=""talk/11/v01_30064.opus"" type=""audio/ogg; codecs=opus""></audio><a href=""javascript:void(0)"" onclick=""document.getElementById('v01_30064').play()"">……これ以上こんな事を<br/>続けさせるわけにはいきません。</a>",,"<img class=""itp-kuro"" src=""itp/11/avfc5001_out.webp""/>"
m3400,4,115,Agnes,"We're taking that Genesis back from you, whatever it takes!","We're taking that Genesis back from you, whatever<br/>it takes!",アニエス,その《ゲネシス》── 何としても手放してもらいます……！,"<audio id=""v01_30065""><source src=""talk/11/v01_30065.opus"" type=""audio/ogg; codecs=opus""></audio><a href=""javascript:void(0)"" onclick=""document.getElementById('v01_30065').play()"">その《ゲネシス》──<br/>何としても手放してもらいます……！</a>",,"<img class=""itp-kuro"" src=""itp/11/avfc5001_out.webp""/>"
m3400,4,116,Gerard,"Oh! Well, you can have it.","Oh! Well, you can have it.",ジェラール,ああ、別にそれは構わんぞ？,"<audio id=""v37_30030""><source src=""talk/11/v37_30030.opus"" type=""audio/ogg; codecs=opus""></audio><a href=""javascript:void(0)"" onclick=""document.getElementById('v37_30030').play()"">ああ、別にそれは構わんぞ？</a>",,
m3400,4,117,Gerard,These devices were designed to eventually come into the hands of their rightful owners regardless. That is their nature.,These devices were designed to eventually come into<br/>the hands of their rightful owners regardless. That is<br/>their nature.,ジェラール,いずれ正当な所有者の元に集まる── 元々そういう代物</B>のようだからな。,"<audio id=""v37_30031""><source src=""talk/11/v37_30031.opus"" type=""audio/ogg; codecs=opus""></audio><a href=""javascript:void(0)"" onclick=""document.getElementById('v37_30031').play()"">いずれ正当な所有者の元に集まる──<br/>元々そういう代物</B>のようだからな。</a>",,
m3400,4,118,Agnes,What...?,What...?,アニエス,え───,"<audio id=""v01_30066""><source src=""talk/11/v01_30066.opus"" type=""audio/ogg; codecs=opus""></audio><a href=""javascript:void(0)"" onclick=""document.getElementById('v01_30066').play()"">え───</a>",,"<img class=""itp-kuro"" src=""itp/11/avfc5001_out.webp""/>"
m3400,4,119,Van,Sounds like you have a lot of info you could share with us.,Sounds like you have a lot of info you could share<br/>with us.,ヴァン,……どうやら 色々ご存じのようじゃねえか？,"<audio id=""v00_30092""><source src=""talk/11/v00_30092.opus"" type=""audio/ogg; codecs=opus""></audio><a href=""javascript:void(0)"" onclick=""document.getElementById('v00_30092').play()"">……どうやら<br/>色々ご存じのようじゃねえか？</a>",,"<img class=""itp-kuro"" src=""itp/11/avfc0000_out.webp""/>"
m3400,4,120,Gerard,Perhaps. Yet only a fraction of all there is to know.,Perhaps. Yet only a fraction of all there is to know.,ジェラール,フフ、ほんの一部ではあるがな。,"<audio id=""v37_30032""><source src=""talk/11/v37_30032.opus"" type=""audio/ogg; codecs=opus""></audio><a href=""javascript:void(0)"" onclick=""document.getElementById('v37_30032').play()"">フフ、ほんの一部ではあるがな。</a>",,
m3400,4,121,Gerard,"Now that we have seen the fruits of our labor, our work here is done.","Now that we have seen the fruits of our labor, our<br/>work here is done.",ジェラール,──さて、こちらとしては成果を 確認できた時点で目的は達成している。,"<audio id=""v37_30033""><source src=""talk/11/v37_30033.opus"" type=""audio/ogg; codecs=opus""></audio><a href=""javascript:void(0)"" onclick=""document.getElementById('v37_30033').play()"">──さて、こちらとしては成果を<br/>確認できた時点で目的は達成している。</a>",,
m3400,4,122,Gerard,Withdrawing would be a valid option. However...,Withdrawing would be a valid option. However...,ジェラール,このまま退いてもいいんだが……,"<audio id=""v37_30034""><source src=""talk/11/v37_30034.opus"" type=""audio/ogg; codecs=opus""></audio><a href=""javascript:void(0)"" onclick=""document.getElementById('v37_30034').play()"">このまま退いてもいいんだが……</a>",,
m3400,4,123,Grimm Cats,Wha...?,Wha...?,グリムキャッツ,なっ……！？,"<audio id=""v06_30059""><source src=""talk/11/v06_30059.opus"" type=""audio/ogg; codecs=opus""></audio><a href=""javascript:void(0)"" onclick=""document.getElementById('v06_30059').play()"">なっ……！？</a>",,"<img class=""itp-kuro"" src=""itp/11/avfc5007_out.webp""/>"
m3400,4,124,Nina,Prince Sherid...?,Prince Sherid...?,ニナ,シェ、シェリド殿下……？,"<audio id=""v18_30065""><source src=""talk/11/v18_30065.opus"" type=""audio/ogg; codecs=opus""></audio><a href=""javascript:void(0)"" onclick=""document.getElementById('v18_30065').play()"">シェ、シェリド殿下……？</a>",,
m3400,4,125,Director Gotch,"And Naje, too... I thought the two of you had escaped?","And Naje, too... I thought the two of you<br/>had escaped?",ゴッチ監督,ナージェ嬢も── 何とか逃れたんじゃあ……！？,"<audio id=""v54_30051""><source src=""talk/11/v54_30051.opus"" type=""audio/ogg; codecs=opus""></audio><a href=""javascript:void(0)"" onclick=""document.getElementById('v54_30051').play()"">ナージェ嬢も──<br/>何とか逃れたんじゃあ……！？</a>",,
m3400,4,126,Nager,...,...,ナージェ,っ………！,"<audio id=""v43_30012""><source src=""talk/11/v43_30012.opus"" type=""audio/ogg; codecs=opus""></audio><a href=""javascript:void(0)"" onclick=""document.getElementById('v43_30012').play()"">っ………！</a>",,
m3400,4,127,Prince Sheridan,"...I'm sorry, everyone.","...I'm sorry, everyone.",シェリド公太子,……ヴァン君たち………すまない</B>。,"<audio id=""v28_30075""><source src=""talk/11/v28_30075.opus"" type=""audio/ogg; codecs=opus""></audio><a href=""javascript:void(0)"" onclick=""document.getElementById('v28_30075').play()"">……ヴァン君たち………すまない</B>。</a>",,
m3400,4,128,Van,Don't tell me...,Don't tell me...,ヴァン,！　まさか……！,"<audio id=""v00_30093""><source src=""talk/11/v00_30093.opus"" type=""audio/ogg; codecs=opus""></audio><a href=""javascript:void(0)"" onclick=""document.getElementById('v00_30093').play()"">！　まさか……！</a>",,"<img class=""itp-kuro"" src=""itp/11/avfc0000_out.webp""/>"
m3400,4,129,Agnes,"You've had some of that drug, too?!","You've had some of that drug, too?!",アニエス,殿下たちにも あの薬物の成分を……！？,"<audio id=""v01_30067""><source src=""talk/11/v01_30067.opus"" type=""audio/ogg; codecs=opus""></audio><a href=""javascript:void(0)"" onclick=""document.getElementById('v01_30067').play()"">殿下たちにも<br/>あの薬物の成分を……！？</a>",,"<img class=""itp-kuro"" src=""itp/11/avfc5001_out.webp""/>"
m3400,4,130,Melchior,Ahaha! Yep! All it took was a few little droplets in their welcome drink. ❤,Ahaha! Yep! All it took was a few little droplets in<br/>their welcome drink. ❤,メルキオル,あはは、正解！ ウェルカムドリンクにほんの数滴ね❤,"<audio id=""v38_30015""><source src=""talk/11/v38_30015.opus"" type=""audio/ogg; codecs=opus""></audio><a href=""javascript:void(0)"" onclick=""document.getElementById('v38_30015').play()"">あはは、正解！<br/>ウェルカムドリンクにほんの数滴ね❤</a>",,
m3400,4,131,Gerard,Here is the final amusement of the festival.,Here is the final amusement of the festival.,ジェラール,これが最後の余興だ。,"<audio id=""v37_30035""><source src=""talk/11/v37_30035.opus"" type=""audio/ogg; codecs=opus""></audio><a href=""javascript:void(0)"" onclick=""document.getElementById('v37_30035').play()"">これが最後の余興だ。</a>",,
m3400,4,132,Gerard,I do hope you can keep me at least as entertained as those dancers did.,I do hope you can keep me at least as entertained as<br/>those dancers did.,ジェラール,あの踊り手たちに負けないくらい 存分に愉しませてもらおうか？,"<audio id=""v37_30036""><source src=""talk/11/v37_30036.opus"" type=""audio/ogg; codecs=opus""></audio><a href=""javascript:void(0)"" onclick=""document.getElementById('v37_30036').play()"">あの踊り手たちに負けないくらい<br/>存分に愉しませてもらおうか？</a>",,
m3400,4,133,Prince Sheridan,Ngh... Aaaaaargh!,Ngh... Aaaaaargh!,シェリド公太子,っ……おおおおおおっ……！！,"<audio id=""v28_30076""><source src=""talk/11/v28_30076.opus"" type=""audio/ogg; codecs=opus""></audio><a href=""javascript:void(0)"" onclick=""document.getElementById('v28_30076').play()"">っ……おおおおおおっ……！！</a>",,
m3400,4,134,Nager,Nnrrgh...!,Nnrrgh...!,ナージェ,ぐううううううっ……！！,"<audio id=""v43_30013""><source src=""talk/11/v43_30013.opus"" type=""audio/ogg; codecs=opus""></audio><a href=""javascript:void(0)"" onclick=""document.getElementById('v43_30013').play()"">ぐううううううっ……！！</a>",,
m3400,4,135,Melchior,Catgirls and gentlemen!,Catgirls and gentlemen!,メルキオル,さぁさ、お立ち会い──,"<audio id=""v38_30016""><source src=""talk/11/v38_30016.opus"" type=""audio/ogg; codecs=opus""></audio><a href=""javascript:void(0)"" onclick=""document.getElementById('v38_30016').play()"">さぁさ、お立ち会い──</a>",,
m3400,4,136,Melchior,"In one corner, we have none other than a crown prince of the desert and his ever-so loyal servant!","In one corner, we have none other than a crown<br/>prince of the desert and his ever-so loyal servant!",メルキオル,目くるめく祭りのトリを飾るのは、 熱砂の国の公太子とその忠実なる僕（しもべ）。,"<audio id=""v38_30017""><source src=""talk/11/v38_30017.opus"" type=""audio/ogg; codecs=opus""></audio><a href=""javascript:void(0)"" onclick=""document.getElementById('v38_30017').play()"">目くるめく祭りのトリを飾るのは、<br/>熱砂の国の公太子とその忠実なる僕（しもべ）。</a>",,
m3400,4,137,Melchior,"And in the other, we have the simple spriggan of Edith. Just who between them will emerge victorious?","And in the other, we have the simple spriggan<br/>of Edith. Just who between them will<br/>emerge victorious?",メルキオル,挑みたるは首都の裏解決屋── 果たしてその運命やいかに♪,"<audio id=""v38_30018""><source src=""talk/11/v38_30018.opus"" type=""audio/ogg; codecs=opus""></audio><a href=""javascript:void(0)"" onclick=""document.getElementById('v38_30018').play()"">挑みたるは首都の裏解決屋──<br/>果たしてその運命やいかに♪</a>",,
m3400,4,138,Ferry,Those golden auras are bad news...,Those golden auras are bad news...,フェリ,お、黄金の闘気……,"<audio id=""v02_30059""><source src=""talk/11/v02_30059.opus"" type=""audio/ogg; codecs=opus""></audio><a href=""javascript:void(0)"" onclick=""document.getElementById('v02_30059').play()"">お、黄金の闘気……</a>",,"<img class=""itp-kuro"" src=""itp/11/avfc5003_out.webp""/>"
m3400,4,139,Aaron,We're really in it now!,We're really in it now!,アーロン,ヤベえな、こりゃ……！,"<audio id=""v03_30074""><source src=""talk/11/v03_30074.opus"" type=""audio/ogg; codecs=opus""></audio><a href=""javascript:void(0)"" onclick=""document.getElementById('v03_30074').play()"">ヤベえな、こりゃ……！</a>",,"<img class=""itp-kuro"" src=""itp/11/avfc0002_out.webp""/>"
m3400,4,140,Lisette,This tension... It's incomparable to that of our fight in the cave!,This tension... It's incomparable to that of our fight<br/>in the cave!,リゼット,霊圧上昇──砂岩窟の時とは 比較にならないでしょう！,"<audio id=""v04_30068""><source src=""talk/11/v04_30068.opus"" type=""audio/ogg; codecs=opus""></audio><a href=""javascript:void(0)"" onclick=""document.getElementById('v04_30068').play()"">霊圧上昇──砂岩窟の時とは<br/>比較にならないでしょう！</a>",,"<img class=""itp-kuro"" src=""itp/11/avfc5005_out.webp""/>"
m3400,4,141,Nina,Take care!,Take care!,ニナ,み、皆さん……！,"<audio id=""v18_30066""><source src=""talk/11/v18_30066.opus"" type=""audio/ogg; codecs=opus""></audio><a href=""javascript:void(0)"" onclick=""document.getElementById('v18_30066').play()"">み、皆さん……！</a>",,
m3400,4,142,Director Gotch,Wh-What are you gonna do?!,Wh-What are you gonna do?!,ゴッチ監督,ど、どうするつもりじゃあ！？,"<audio id=""v54_30052""><source src=""talk/11/v54_30052.opus"" type=""audio/ogg; codecs=opus""></audio><a href=""javascript:void(0)"" onclick=""document.getElementById('v54_30052').play()"">ど、どうするつもりじゃあ！？</a>",,
m3400,4,143,Van,We're gonna neutralize 'em—we ain't got any other options!,We're gonna neutralize 'em—we ain't got<br/>any other options!,ヴァン,こうなりゃ是非もねぇ…… まずは無力化させてもらいますよ！,"<audio id=""v00_30094""><source src=""talk/11/v00_30094.opus"" type=""audio/ogg; codecs=opus""></audio><a href=""javascript:void(0)"" onclick=""document.getElementById('v00_30094').play()"">こうなりゃ是非もねぇ……<br/>まずは無力化させてもらいますよ！</a>",,"<img class=""itp-kuro"" src=""itp/11/avfc0000_out.webp""/>"
m3400,4,144,Grimm Cats,They're sponsors to the festival! We need to make them see sense!,They're sponsors to the festival! We need to make<br/>them see sense!,グリムキャッツ,大切なスポンサーだからこそ 何とか目覚めさせてみせるわっ！,"<audio id=""v06_30060""><source src=""talk/11/v06_30060.opus"" type=""audio/ogg; codecs=opus""></audio><a href=""javascript:void(0)"" onclick=""document.getElementById('v06_30060').play()"">大切なスポンサーだからこそ<br/>何とか目覚めさせてみせるわっ！</a>",,"<img class=""itp-kuro"" src=""itp/11/avfc5007_out.webp""/>"
m3400,4,145,Agnes,"Right! Saara and Shaheena are depending on us, too!","Right! Saara and Shaheena are depending on us, too!",アニエス,はい……！　サァラさんや シャヒーナさんたちのためにも……！,"<audio id=""v01_30068""><source src=""talk/11/v01_30068.opus"" type=""audio/ogg; codecs=opus""></audio><a href=""javascript:void(0)"" onclick=""document.getElementById('v01_30068').play()"">はい……！　サァラさんや<br/>シャヒーナさんたちのためにも……！</a>",,"<img class=""itp-kuro"" src=""itp/11/avfc5001_out.webp""/>"
m3400,5,146,Nager,...Well fought.,...Well fought.,ナージェ,っ……お見事です……,"<audio id=""v43_30014""><source src=""talk/11/v43_30014.opus"" type=""audio/ogg; codecs=opus""></audio><a href=""javascript:void(0)"" onclick=""document.getElementById('v43_30014').play()"">っ……お見事です……</a>",,
m3400,5,147,Prince Sheridan,Haha. That it was.,Haha. That it was.,シェリド公太子,……ハハ、さすがだな……,"<audio id=""v28_30077""><source src=""talk/11/v28_30077.opus"" type=""audio/ogg; codecs=opus""></audio><a href=""javascript:void(0)"" onclick=""document.getElementById('v28_30077').play()"">……ハハ、さすがだな……</a>",,
m3400,5,148,Ferry,They're back to normal!,They're back to normal!,フェリ,お二人が元に……！,"<audio id=""v02_30060""><source src=""talk/11/v02_30060.opus"" type=""audio/ogg; codecs=opus""></audio><a href=""javascript:void(0)"" onclick=""document.getElementById('v02_30060').play()"">お二人が元に……！</a>",,"<img class=""itp-kuro"" src=""itp/11/avfc5003_out.webp""/>"
m3400,5,149,Agnes,W-We did it!,W-We did it!,アニエス,や、やりましたね……！,"<audio id=""v01_30069""><source src=""talk/11/v01_30069.opus"" type=""audio/ogg; codecs=opus""></audio><a href=""javascript:void(0)"" onclick=""document.getElementById('v01_30069').play()"">や、やりましたね……！</a>",,"<img class=""itp-kuro"" src=""itp/11/avfc5001_out.webp""/>"
m3400,5,150,Gerard,On the contrary. We've hardly started.,On the contrary. We've hardly started.,ジェラール,──いや、ここからだ</B>。,"<audio id=""v37_30037""><source src=""talk/11/v37_30037.opus"" type=""audio/ogg; codecs=opus""></audio><a href=""javascript:void(0)"" onclick=""document.getElementById('v37_30037').play()"">──いや、ここからだ</B>。</a>",,
m3400,5,151,Gerard,"This device can do far, far more.","This device can do far, far more.",ジェラール,コイツにはまだ“先”がある。,"<audio id=""v37_30038""><source src=""talk/11/v37_30038.opus"" type=""audio/ogg; codecs=opus""></audio><a href=""javascript:void(0)"" onclick=""document.getElementById('v37_30038').play()"">コイツにはまだ“先”がある。</a>",,
m3400,5,152,Gerard,For it is capable of stimulating the emotion that lies at the root of all others: fear.,For it is capable of stimulating the emotion that lies<br/>at the root of all others: fear.,ジェラール,あらゆる感情の根源にあるもの…… “恐怖”を揺り動かすほどの機（はたらき）が。,"<audio id=""v37_30039""><source src=""talk/11/v37_30039.opus"" type=""audio/ogg; codecs=opus""></audio><a href=""javascript:void(0)"" onclick=""document.getElementById('v37_30039').play()"">あらゆる感情の根源にあるもの……<br/>“恐怖”を揺り動かすほどの機（はたらき）が。</a>",,
m3400,5,153,Gerard,"Now, why don't you show me yours?","Now, why don't you show me yours?",ジェラール,さあ──見せてもらおうか！？,"<audio id=""v37_30040""><source src=""talk/11/v37_30040.opus"" type=""audio/ogg; codecs=opus""></audio><a href=""javascript:void(0)"" onclick=""document.getElementById('v37_30040').play()"">さあ──見せてもらおうか！？</a>",,
m3400,5,154,Nager,Ugh... AAAAAAAAAAAAGH!,Ugh... AAAAAAAAAAAAGH!,ナージェ,ッ、ああああああああああっ……！？,"<audio id=""v43_30015""><source src=""talk/11/v43_30015.opus"" type=""audio/ogg; codecs=opus""></audio><a href=""javascript:void(0)"" onclick=""document.getElementById('v43_30015').play()"">ッ、ああああああああああっ……！？</a>",,
m3400,5,155,Prince Sheridan,Naje!,Naje!,シェリド公太子,ナージェ……！？,"<audio id=""v28_30078""><source src=""talk/11/v28_30078.opus"" type=""audio/ogg; codecs=opus""></audio><a href=""javascript:void(0)"" onclick=""document.getElementById('v28_30078').play()"">ナージェ……！？</a>",,
m3400,5,156,Prince Sheridan,Urgh... My... My mana is—?!,Urgh... My... My mana is—?!,シェリド公太子,……ぐうっ…… これは、私の霊力（マナ）を……！？,"<audio id=""v28_30079""><source src=""talk/11/v28_30079.opus"" type=""audio/ogg; codecs=opus""></audio><a href=""javascript:void(0)"" onclick=""document.getElementById('v28_30079').play()"">……ぐうっ……<br/>これは、私の霊力（マナ）を……！？</a>",,
m3400,5,157,Van,You gotta be shittin' me...,You gotta be shittin' me...,ヴァン,！？　まさか──,"<audio id=""v00_30094b""><source src=""talk/11/v00_30094b.opus"" type=""audio/ogg; codecs=opus""></audio><a href=""javascript:void(0)"" onclick=""document.getElementById('v00_30094b').play()"">！？　まさか──</a>",,"<img class=""itp-kuro"" src=""itp/11/avfc0000_out.webp""/>"
m3400,5,158,Aaron,It's like what I went through!,It's like what I went through!,アーロン,俺の時と同じ……！？,"<audio id=""v03_30074b""><source src=""talk/11/v03_30074b.opus"" type=""audio/ogg; codecs=opus""></audio><a href=""javascript:void(0)"" onclick=""document.getElementById('v03_30074b').play()"">俺の時と同じ……！？</a>",,"<img class=""itp-kuro"" src=""itp/11/avfc0002_out.webp""/>"
m3400,5,159,Nager,AAAAAAAAARGH!,AAAAAAAAARGH!,ナージェ,オオオオオオオオオオオオンンッ！！！,"<audio id=""v43_30016""><source src=""talk/11/v43_30016.opus"" type=""audio/ogg; codecs=opus""></audio><a href=""javascript:void(0)"" onclick=""document.getElementById('v43_30016').play()"">オオオオオオオオオオオオンンッ！！！</a>",,
m3400,5,160,Grimm Cats,What in the...?!,What in the...?!,グリムキャッツ,ウ、ウソでしょ……！？,"<audio id=""v06_30061""><source src=""talk/11/v06_30061.opus"" type=""audio/ogg; codecs=opus""></audio><a href=""javascript:void(0)"" onclick=""document.getElementById('v06_30061').play()"">ウ、ウソでしょ……！？</a>",,"<img class=""itp-kuro"" src=""itp/11/avfc5007_out.webp""/>"
m3400,5,161,Agnes,I-It really is what happened to Aida and Aaron...,I-It really is what happened to Aida and Aaron...,アニエス,ア、アイーダさんや アーロンさんの時みたいな……！,"<audio id=""v01_30070""><source src=""talk/11/v01_30070.opus"" type=""audio/ogg; codecs=opus""></audio><a href=""javascript:void(0)"" onclick=""document.getElementById('v01_30070').play()"">ア、アイーダさんや<br/>アーロンさんの時みたいな……！</a>",,"<img class=""itp-kuro"" src=""itp/11/avfc5001_out.webp""/>"
m3400,5,162,Ferry,The legendary Verethragna...,The legendary Verethragna...,フェリ,……お伽話の、雷獣王（ウルスラグナ）……,"<audio id=""v02_30061""><source src=""talk/11/v02_30061.opus"" type=""audio/ogg; codecs=opus""></audio><a href=""javascript:void(0)"" onclick=""document.getElementById('v02_30061').play()"">……お伽話の、雷獣王（ウルスラグナ）……</a>",,"<img class=""itp-kuro"" src=""itp/11/avfc5003_out.webp""/>"
m3400,5,163,Melchior,"Ahaha! A being from a higher plane? Looks like you managed to reel in a big one, boss!","Ahaha! A being from a higher plane? Looks like you<br/>managed to reel in a big one, boss!",メルキオル,アハハ、どうやら高位次元の ヤバいのを引き込んじゃったみたいだね！,"<audio id=""v38_30019""><source src=""talk/11/v38_30019.opus"" type=""audio/ogg; codecs=opus""></audio><a href=""javascript:void(0)"" onclick=""document.getElementById('v38_30019').play()"">アハハ、どうやら高位次元の<br/>ヤバいのを引き込んじゃったみたいだね！</a>",,
m3400,5,164,Prince Sheridan,Everyone... You need to run...,Everyone... You need to run...,シェリド公太子,……君たち……逃げたま──,"<audio id=""v28_30080""><source src=""talk/11/v28_30080.opus"" type=""audio/ogg; codecs=opus""></audio><a href=""javascript:void(0)"" onclick=""document.getElementById('v28_30080').play()"">……君たち……逃げたま──</a>",,
m3400,5,165,Golden Beastman,ROOOOOOOOOAR!,ROOOOOOOOOAR!,黄金の獣人,ガアアアアアアアッ……！！,"<audio id=""v43_30017""><source src=""talk/11/v43_30017.opus"" type=""audio/ogg; codecs=opus""></audio><a href=""javascript:void(0)"" onclick=""document.getElementById('v43_30017').play()"">ガアアアアアアアッ……！！</a>",,
m3400,5,166,Lisette and Grim Cats,Nngh! / Aaaaaah!,Nngh! / Aaaaaah!,リゼット＆グリムキャッツ,っ……！！／きゃああっ！？,"<audio id=""v999_30004""><source src=""talk/11/v999_30004.opus"" type=""audio/ogg; codecs=opus""></audio><a href=""javascript:void(0)"" onclick=""document.getElementById('v999_30004').play()"">っ……！！／きゃああっ！？</a>",,"<img class=""itp-kuro"" src=""itp/11/avfc5005_out.webp""/>"
m3400,5,167,Nina,Argh!,Argh!,ニナ,ああっ……！,"<audio id=""v18_30067""><source src=""talk/11/v18_30067.opus"" type=""audio/ogg; codecs=opus""></audio><a href=""javascript:void(0)"" onclick=""document.getElementById('v18_30067').play()"">ああっ……！</a>",,
m3400,5,168,Director Gotch,Whoaaa!,Whoaaa!,ゴッチ監督,のわあああああっ……！？,"<audio id=""v54_30053""><source src=""talk/11/v54_30053.opus"" type=""audio/ogg; codecs=opus""></audio><a href=""javascript:void(0)"" onclick=""document.getElementById('v54_30053').play()"">のわあああああっ……！？</a>",,
m3400,5,169,Aaron,Not on our watch!,Not on our watch!,アーロン,させるかよ──！,"<audio id=""v03_30075""><source src=""talk/11/v03_30075.opus"" type=""audio/ogg; codecs=opus""></audio><a href=""javascript:void(0)"" onclick=""document.getElementById('v03_30075').play()"">させるかよ──！</a>",,"<img class=""itp-kuro"" src=""itp/11/avfc0002_out.webp""/>"
m3400,5,170,Ferry,"This time, we'll protect you!","This time, we'll protect you!",フェリ,今度はわたしが守りますっ！,"<audio id=""v02_30062""><source src=""talk/11/v02_30062.opus"" type=""audio/ogg; codecs=opus""></audio><a href=""javascript:void(0)"" onclick=""document.getElementById('v02_30062').play()"">今度はわたしが守りますっ！</a>",,"<img class=""itp-kuro"" src=""itp/11/avfc5003_out.webp""/>"
m3400,5,171,Van,Guys...,Guys...,ヴァン,お前ら……！,"<audio id=""v00_30095""><source src=""talk/11/v00_30095.opus"" type=""audio/ogg; codecs=opus""></audio><a href=""javascript:void(0)"" onclick=""document.getElementById('v00_30095').play()"">お前ら……！</a>",,"<img class=""itp-kuro"" src=""itp/11/avfc0000_out.webp""/>"
m3400,5,172,Aaron,Argh!,Argh!,アーロン,がッ！,"<audio id=""v03_30076""><source src=""talk/11/v03_30076.opus"" type=""audio/ogg; codecs=opus""></audio><a href=""javascript:void(0)"" onclick=""document.getElementById('v03_30076').play()"">がッ！</a>",,"<img class=""itp-kuro"" src=""itp/11/avfc0002_out.webp""/>"
