gameId,fname,scene,row,engChrName,engSearchText,engHtmlText,jpnChrName,jpnSearchText,jpnHtmlText,opName,pcIconHtml,evoIconHtml
sys_event,24,282,Judith,"For real? You, like, friends or something?","For real? You, like, friends or something?",ジュディス,あたしと彼女は“裏”方面での デビュー時からのライバルでね。,"<audio id=""v06_50008""><source src=""talk/11/v06_50008.opus"" type=""audio/ogg; codecs=opus""></audio><a href=""javascript:void(0)"" onclick=""document.getElementById('v06_50008').play()"">あたしと彼女は“裏”方面での<br/>デビュー時からのライバルでね。</a>",,"<img class=""itp-kuro"" src=""itp/11/avfc5007_out.webp""/>"
sys_event,24,283,Judith,"Yeah. Although, we're not just friends. We're rivals.","Yeah. Although, we're not just friends. We're rivals.",ジュディス,８年前、同じく“先代”から継ぐため、 見習いとして活動してた頃に出会って……,"<audio id=""v06_50009""><source src=""talk/11/v06_50009.opus"" type=""audio/ogg; codecs=opus""></audio><a href=""javascript:void(0)"" onclick=""document.getElementById('v06_50009').play()"">８年前、同じく“先代”から継ぐため、<br/>見習いとして活動してた頃に出会って……</a>",,"<img class=""itp-kuro"" src=""itp/11/avfc5007_out.webp""/>"
sys_event,24,284,Judith,And we've been that way since the day we met.,And we've been that way since the day we met.,ジュディス,“立場”の違いはあったけど時に対立し、 時に協力し高め合ってきた──,"<audio id=""v06_50010""><source src=""talk/11/v06_50010.opus"" type=""audio/ogg; codecs=opus""></audio><a href=""javascript:void(0)"" onclick=""document.getElementById('v06_50010').play()"">“立場”の違いはあったけど時に対立し、<br/>時に協力し高め合ってきた──</a>",,"<img class=""itp-kuro"" src=""itp/11/avfc5007_out.webp""/>"
sys_event,24,285,Judith,That was...eight years ago now? We had only just taken up the mantle from our predecessors at that point.,That was...eight years ago now? We had only just<br/>taken up the mantle from our predecessors at<br/>that point.,ジュディス,同い年のライバルで…… 間違いなく“戦友”だったと思ってる。,"<audio id=""v06_50011""><source src=""talk/11/v06_50011.opus"" type=""audio/ogg; codecs=opus""></audio><a href=""javascript:void(0)"" onclick=""document.getElementById('v06_50011').play()"">同い年のライバルで……<br/>間違いなく“戦友”だったと思ってる。</a>",,"<img class=""itp-kuro"" src=""itp/11/avfc5007_out.webp""/>"
sys_event,24,286,Ferry,"Sometimes our jobs put us in conflict with one another, but we got to team up every now and then.","Sometimes our jobs put us in conflict with one<br/>another, but we got to team up every now and then.",フェリ,あ……,あ……,,"<img class=""itp-kuro"" src=""itp/11/avfc5003_out.webp""/>"
sys_event,24,287,Agnes,"We may have been rivals, but we were comrades, too.","We may have been rivals, but we were comrades, too.",アニエス,そ、そんな事情が……,そ、そんな事情が……,,"<img class=""itp-kuro"" src=""itp/11/avfc5001_out.webp""/>"
sys_event,24,288,Lesha,...,...,リーシャ,……懐かしいな、お互いの背負っていた ものについても相談し合ったりしたよね。,"<audio id=""v34_50005""><source src=""talk/11/v34_50005.opus"" type=""audio/ogg; codecs=opus""></audio><a href=""javascript:void(0)"" onclick=""document.getElementById('v34_50005').play()"">……懐かしいな、お互いの背負っていた<br/>ものについても相談し合ったりしたよね。</a>",,"<img class=""itp-kuro"" src=""itp/11/avfc5113_out.webp""/>"
sys_event,24,289,Lesha,I never would've guessed.,I never would've guessed.,リーシャ,でも貴女は、もう一つの世界で どんどん輝くようになって行って──,"<audio id=""v34_50006""><source src=""talk/11/v34_50006.opus"" type=""audio/ogg; codecs=opus""></audio><a href=""javascript:void(0)"" onclick=""document.getElementById('v34_50006').play()"">でも貴女は、もう一つの世界で<br/>どんどん輝くようになって行って──</a>",,"<img class=""itp-kuro"" src=""itp/11/avfc5113_out.webp""/>"
sys_event,24,290,Lesha,The memories are coming back to me. We spent many hours discussing the weight of what we had inherited.,The memories are coming back to me. We spent<br/>many hours discussing the weight of what we<br/>had inherited.,リーシャ,嬉しく感じると同時に、どこか私だけ 取り残されたような気分にもなったわ。,"<audio id=""v34_50007""><source src=""talk/11/v34_50007.opus"" type=""audio/ogg; codecs=opus""></audio><a href=""javascript:void(0)"" onclick=""document.getElementById('v34_50007').play()"">嬉しく感じると同時に、どこか私だけ<br/>取り残されたような気分にもなったわ。</a>",,"<img class=""itp-kuro"" src=""itp/11/avfc5113_out.webp""/>"
sys_event,24,291,Judith,"Before I knew it, though, you had found your place amongst the stars. You were thriving in a world unbeknownst to me.","Before I knew it, though, you had found your place<br/>amongst the stars. You were thriving in a world<br/>unbeknownst to me.",ジュディス,だから──だからクロスベルで あんな道を選んだっていうの……！？,"<audio id=""v06_50012""><source src=""talk/11/v06_50012.opus"" type=""audio/ogg; codecs=opus""></audio><a href=""javascript:void(0)"" onclick=""document.getElementById('v06_50012').play()"">だから──だからクロスベルで<br/>あんな道を選んだっていうの……！？</a>",,"<img class=""itp-kuro"" src=""itp/11/avfc5007_out.webp""/>"
sys_event,24,292,Lesha,"Oh, but don't misunderstand. I was truly happy for you, but I was a little sad as well. I felt left behind.","Oh, but don't misunderstand. I was truly happy for<br/>you, but I was a little sad as well. I felt left behind.",リーシャ,ううん、違うわ。,"<audio id=""v34_50008""><source src=""talk/11/v34_50008.opus"" type=""audio/ogg; codecs=opus""></audio><a href=""javascript:void(0)"" onclick=""document.getElementById('v34_50008').play()"">ううん、違うわ。</a>",,"<img class=""itp-kuro"" src=""itp/11/avfc5113_out.webp""/>"
sys_event,24,293,Lesha,So you left for Crossbell and followed that other path...because of me?!,So you left for Crossbell and followed that other<br/>path...because of me?!,リーシャ,“あの場所”はそれとは関係ない── でも、どこか貴女に影響されてたのも確か。,"<audio id=""v34_50009""><source src=""talk/11/v34_50009.opus"" type=""audio/ogg; codecs=opus""></audio><a href=""javascript:void(0)"" onclick=""document.getElementById('v34_50009').play()"">“あの場所”はそれとは関係ない──<br/>でも、どこか貴女に影響されてたのも確か。</a>",,"<img class=""itp-kuro"" src=""itp/11/avfc5113_out.webp""/>"
sys_event,24,294,Lesha,Not at all. The path I chose was entirely my own.,Not at all. The path I chose was entirely my own.,リーシャ,“月”でしかない私が、貴女やあの人</B>みたいに 輝くことは出来ないけど……,"<audio id=""v34_50010""><source src=""talk/11/v34_50010.opus"" type=""audio/ogg; codecs=opus""></audio><a href=""javascript:void(0)"" onclick=""document.getElementById('v34_50010').play()"">“月”でしかない私が、貴女やあの人</B>みたいに<br/>輝くことは出来ないけど……</a>",,"<img class=""itp-kuro"" src=""itp/11/avfc5113_out.webp""/>"
sys_event,24,295,Lesha,"Having said that, it's possible I was subconsciously influenced by you on some level.","Having said that, it's possible I was subconsciously<br/>influenced by you on some level.",リーシャ,たった一つの舞台を高めるという喜びに どうしようもなく取り憑かれてしまっただけ。,"<audio id=""v34_50011""><source src=""talk/11/v34_50011.opus"" type=""audio/ogg; codecs=opus""></audio><a href=""javascript:void(0)"" onclick=""document.getElementById('v34_50011').play()"">たった一つの舞台を高めるという喜びに<br/>どうしようもなく取り憑かれてしまっただけ。</a>",,"<img class=""itp-kuro"" src=""itp/11/avfc5113_out.webp""/>"
sys_event,24,296,Lesha,You're like the brightest star in the sky. I'm just a moon—I can't shine like you...or her.,You're like the brightest star in the sky. I'm just a<br/>moon—I can't shine like you...or her.,リーシャ,貴女が映画に賭ける情熱と同じように。,"<audio id=""v34_50012""><source src=""talk/11/v34_50012.opus"" type=""audio/ogg; codecs=opus""></audio><a href=""javascript:void(0)"" onclick=""document.getElementById('v34_50012').play()"">貴女が映画に賭ける情熱と同じように。</a>",,"<img class=""itp-kuro"" src=""itp/11/avfc5113_out.webp""/>"
sys_event,24,297,Judith,But I came to know the joy of the stage—as well as being at the center of it. The life of theater has captivated me ever since...,But I came to know the joy of the stage—as well as<br/>being at the center of it. The life of theater has<br/>captivated me ever since...,ジュディス,……ぁ………,"<audio id=""v06_50013""><source src=""talk/11/v06_50013.opus"" type=""audio/ogg; codecs=opus""></audio><a href=""javascript:void(0)"" onclick=""document.getElementById('v06_50013').play()"">……ぁ………</a>",,"<img class=""itp-kuro"" src=""itp/11/avfc5007_out.webp""/>"
sys_event,24,298,Judith,...just like how the life of cinema has done the same for you.,...just like how the life of cinema has done the same<br/>for you.,ジュディス,……ほんっとズルいわね。 あたしの方は何でも相談してきたのに。,"<audio id=""v06_50014""><source src=""talk/11/v06_50014.opus"" type=""audio/ogg; codecs=opus""></audio><a href=""javascript:void(0)"" onclick=""document.getElementById('v06_50014').play()"">……ほんっとズルいわね。<br/>あたしの方は何でも相談してきたのに。</a>",,"<img class=""itp-kuro"" src=""itp/11/avfc5007_out.webp""/>"
sys_event,24,299,Judith,...,...,ジュディス,あんたは昔から、勝手に自分を決めつけて、 勝手に新たな道を選び取って──,"<audio id=""v06_50015""><source src=""talk/11/v06_50015.opus"" type=""audio/ogg; codecs=opus""></audio><a href=""javascript:void(0)"" onclick=""document.getElementById('v06_50015').play()"">あんたは昔から、勝手に自分を決めつけて、<br/>勝手に新たな道を選び取って──</a>",,"<img class=""itp-kuro"" src=""itp/11/avfc5007_out.webp""/>"
sys_event,24,300,Lesha,"Y'know, I'm almost jealous. When I was struggling to find my way, you lent me an ear and your wisdom.","Y'know, I'm almost jealous. When I was struggling to<br/>find my way, you lent me an ear and your wisdom.",リーシャ,ええ、だからこの機会に 私が新たに得た物を見てもらう……！,"<audio id=""v34_50900""><source src=""talk/11/v34_50900.opus"" type=""audio/ogg; codecs=opus""></audio><a href=""javascript:void(0)"" onclick=""document.getElementById('v34_50900').play()"">ええ、だからこの機会に<br/>私が新たに得た物を見てもらう……！</a>",,"<img class=""itp-kuro"" src=""itp/11/avfc5113_out.webp""/>"
sys_event,24,301,Judith,"You never needed my help, though. You found the path you wanted to follow all on your own.","You never needed my help, though. You found the<br/>path you wanted to follow all on your own.",ジュディス,そっちも確かめてみなさい…… あたしがこの４年で掴んだ“力”を！！,"<audio id=""v06_50017""><source src=""talk/11/v06_50017.opus"" type=""audio/ogg; codecs=opus""></audio><a href=""javascript:void(0)"" onclick=""document.getElementById('v06_50017').play()"">そっちも確かめてみなさい……<br/>あたしがこの４年で掴んだ“力”を！！</a>",,"<img class=""itp-kuro"" src=""itp/11/avfc5007_out.webp""/>"
sys_event,24,302,Lesha,I did. And now I'm going to show you everything I've learned during the time we've been apart.,I did. And now I'm going to show you everything I've<br/>learned during the time we've been apart.,リーシャ,ええ──望むところよ！！,"<audio id=""v34_50013""><source src=""talk/11/v34_50013.opus"" type=""audio/ogg; codecs=opus""></audio><a href=""javascript:void(0)"" onclick=""document.getElementById('v34_50013').play()"">ええ──望むところよ！！</a>",,"<img class=""itp-kuro"" src=""itp/11/avfc5113_out.webp""/>"
sys_event,24,303,Aaron,I'm curious to see which of us has grown more these past four years.,I'm curious to see which of us has grown more these<br/>past four years.,アーロン,───ハッ……！！,"<audio id=""v03_50006""><source src=""talk/11/v03_50006.opus"" type=""audio/ogg; codecs=opus""></audio><a href=""javascript:void(0)"" onclick=""document.getElementById('v03_50006').play()"">───ハッ……！！</a>",,"<img class=""itp-kuro"" src=""itp/11/avfc0002_out.webp""/>"
sys_event,24,304,Aaron,As am I. Let's do this!,As am I. Let's do this!,アーロン,熱くさせてくれんじゃねぇか…… ならついでに俺も乗らせてもらうぜ。,"<audio id=""v03_50007""><source src=""talk/11/v03_50007.opus"" type=""audio/ogg; codecs=opus""></audio><a href=""javascript:void(0)"" onclick=""document.getElementById('v03_50007').play()"">熱くさせてくれんじゃねぇか……<br/>ならついでに俺も乗らせてもらうぜ。</a>",,"<img class=""itp-kuro"" src=""itp/11/avfc0002_out.webp""/>"
sys_event,24,305,Aaron,Heh.,Heh.,アーロン,ツァオ──本気のアンタと 一度やり合うためにもなァ！！,"<audio id=""v03_50008""><source src=""talk/11/v03_50008.opus"" type=""audio/ogg; codecs=opus""></audio><a href=""javascript:void(0)"" onclick=""document.getElementById('v03_50008').play()"">ツァオ──本気のアンタと<br/>一度やり合うためにもなァ！！</a>",,"<img class=""itp-kuro"" src=""itp/11/avfc0002_out.webp""/>"
sys_event,24,306,Tsao,I think I'll add my own fuel to the fire.,I think I'll add my own fuel to the fire.,ツァオ,フフ、いいでしょう。 私が買っている若者の一人──,"<audio id=""v33_50500""><source src=""talk/11/v33_50500.opus"" type=""audio/ogg; codecs=opus""></audio><a href=""javascript:void(0)"" onclick=""document.getElementById('v33_50500').play()"">フフ、いいでしょう。<br/>私が買っている若者の一人──</a>",,"<img class=""itp-kuro"" src=""itp/11/avfc0301_out.webp""/>"
sys_event,24,307,Tsao,"Cao! I've got a score to settle, and I'm not gonna be satisfied until I beat the everloving shit outta you.","Cao! I've got a score to settle, and I'm not gonna be<br/>satisfied until I beat the everloving shit outta you.",ツァオ,《羅州の麒麟児》がどこまで殻を破れたか 存分に見せてもらいましょうか！,"<audio id=""v33_50005""><source src=""talk/11/v33_50005.opus"" type=""audio/ogg; codecs=opus""></audio><a href=""javascript:void(0)"" onclick=""document.getElementById('v33_50005').play()"">《羅州の麒麟児》がどこまで殻を破れたか<br/>存分に見せてもらいましょうか！</a>",,"<img class=""itp-kuro"" src=""itp/11/avfc0301_out.webp""/>"
sys_event,24,308,Aaron,"Very well. I hold your potential in high regard, Little Conqueror.","Very well. I hold your potential in high regard,<br/>Little Conqueror.",アーロン,ハッ──上等だ！！,"<audio id=""v03_50009""><source src=""talk/11/v03_50009.opus"" type=""audio/ogg; codecs=opus""></audio><a href=""javascript:void(0)"" onclick=""document.getElementById('v03_50009').play()"">ハッ──上等だ！！</a>",,"<img class=""itp-kuro"" src=""itp/11/avfc0002_out.webp""/>"
sys_event,24,309,Van,Let's see if you managed to break out of your shell. Show me that my confidence in you is not misplaced!,Let's see if you managed to break out of your shell.<br/>Show me that my confidence in you is not misplaced!,ヴァン,やれやれ……ま、 こういうノリの方がやりやすいぜ。,やれやれ……ま、<br/>こういうノリの方がやりやすいぜ。,,"<img class=""itp-kuro"" src=""itp/11/avfc0000_out.webp""/>"
sys_event,24,310,Elaine,"I'll do more than that, you four-eyed bastard!","I'll do more than that, you four-eyed<br/>bastard!",エレイン,相手は《銀》に《白蘭竜》、 くれぐれも油断しないで！,相手は《銀》に《白蘭竜》、<br/>くれぐれも油断しないで！,,"<img class=""itp-kuro"" src=""itp/11/avfc5110_out.webp""/>"
sys_event,24,311,Kurogane,"Well, I'm glad that he's fired up, at least.","Well, I'm glad that he's fired up, at least.",クロガネ,東方を源流とするもの同士、 その深奥──見せて頂こう！,東方を源流とするもの同士、<br/>その深奥──見せて頂こう！,,"<img class=""itp-kuro"" src=""itp/11/avfc0304_out.webp""/>"
sys_event,24,312,Walter the Skinny Wolf,We're up against both Yin and the White Orchid Dragon. Don't let your guard down!,We're up against both Yin and the White<br/>Orchid Dragon. Don't let your guard down!,痩せ狼ヴァルター,クク……“先代”とは以前、 愉しくやり合わせてもらったが。,クク……“先代”とは以前、<br/>愉しくやり合わせてもらったが。,,"<img class=""itp-kuro"" src=""itp/11/avfc0113_out.webp""/>"
sys_event,24,313,Walter the Skinny Wolf,I am interested to see just what the famous White Orchid Dragon can do.,I am interested to see just what the famous White<br/>Orchid Dragon can do.,痩せ狼ヴァルター,勝負に水を差さねえ程度に 味見させてもらおうかァ……！,勝負に水を差さねえ程度に<br/>味見させてもらおうかァ……！,,"<img class=""itp-kuro"" src=""itp/11/avfc0113_out.webp""/>"
sys_event,25,314,Tsao,I had a pretty damn good time fighting your predecessor.,I had a pretty damn good time fighting<br/>your predecessor.,ツァオ,フフ……なるほど。,"<audio id=""v33_50006""><source src=""talk/11/v33_50006.opus"" type=""audio/ogg; codecs=opus""></audio><a href=""javascript:void(0)"" onclick=""document.getElementById('v33_50006').play()"">フフ……なるほど。</a>",,"<img class=""itp-kuro"" src=""itp/11/avfc0301_out.webp""/>"
sys_event,25,315,Tsao,Hopefully you can measure up!,Hopefully you can measure up!,ツァオ,どうやらヴァンさんの所で 着実に研鑽を積んでいるようですね？,"<audio id=""v33_50007""><source src=""talk/11/v33_50007.opus"" type=""audio/ogg; codecs=opus""></audio><a href=""javascript:void(0)"" onclick=""document.getElementById('v33_50007').play()"">どうやらヴァンさんの所で<br/>着実に研鑽を積んでいるようですね？</a>",,"<img class=""itp-kuro"" src=""itp/11/avfc0301_out.webp""/>"
sys_event,25,316,Aaron,Interesting. Very interesting.,Interesting. Very interesting.,アーロン,はあはあはあ……実戦の機会だけは しこたまあったからな。,"<audio id=""v03_50010""><source src=""talk/11/v03_50010.opus"" type=""audio/ogg; codecs=opus""></audio><a href=""javascript:void(0)"" onclick=""document.getElementById('v03_50010').play()"">はあはあはあ……実戦の機会だけは<br/>しこたまあったからな。</a>",,"<img class=""itp-kuro"" src=""itp/11/avfc0002_out.webp""/>"
sys_event,25,317,Aaron,The time you have spent under Van has clearly done wonders in drawing out your latent potential.,The time you have spent under Van has clearly done<br/>wonders in drawing out your latent potential.,アーロン,アンタの《月華》の秘奥── 引き出すにはまだまだみてぇだが。,"<audio id=""v03_50011""><source src=""talk/11/v03_50011.opus"" type=""audio/ogg; codecs=opus""></audio><a href=""javascript:void(0)"" onclick=""document.getElementById('v03_50011').play()"">アンタの《月華》の秘奥──<br/>引き出すにはまだまだみてぇだが。</a>",,"<img class=""itp-kuro"" src=""itp/11/avfc0002_out.webp""/>"
sys_event,25,318,Judith,"*pant* I've been seeing a hell of a lot of combat, that's for sure.","*pant* I've been seeing a hell of a lot of combat, that's<br/>for sure.",ジュディス,ふう……参ったわね。,"<audio id=""v06_50018""><source src=""talk/11/v06_50018.opus"" type=""audio/ogg; codecs=opus""></audio><a href=""javascript:void(0)"" onclick=""document.getElementById('v06_50018').play()"">ふう……参ったわね。</a>",,"<img class=""itp-kuro"" src=""itp/11/avfc5007_out.webp""/>"
sys_event,25,319,Judith,"You barely broke a sweat through that whole thing, though. Looks like I've got a ways to go.","You barely broke a sweat through that whole<br/>thing, though. Looks like I've got a ways to go.",ジュディス,この戦力差でそこまで 粘り切られちゃうなんて……,"<audio id=""v06_50028""><source src=""talk/11/v06_50028.opus"" type=""audio/ogg; codecs=opus""></audio><a href=""javascript:void(0)"" onclick=""document.getElementById('v06_50028').play()"">この戦力差でそこまで<br/>粘り切られちゃうなんて……</a>",,"<img class=""itp-kuro"" src=""itp/11/avfc5007_out.webp""/>"
sys_event,25,320,Lesha,Whew... You sure are something.,Whew... You sure are something.,リーシャ,ふふ……そんなことないわ。,"<audio id=""v34_50014""><source src=""talk/11/v34_50014.opus"" type=""audio/ogg; codecs=opus""></audio><a href=""javascript:void(0)"" onclick=""document.getElementById('v34_50014').play()"">ふふ……そんなことないわ。</a>",,"<img class=""itp-kuro"" src=""itp/11/avfc5113_out.webp""/>"
sys_event,25,321,Lesha,"You were waaay outnumbered, but you still put up one heck of a fight. You're in a class of your own.","You were waaay outnumbered, but you still put up<br/>one heck of a fight. You're in a class of your own.",リーシャ,用意していた“符”を全て使って 全身全霊を出させてもらった……,"<audio id=""v34_50023""><source src=""talk/11/v34_50023.opus"" type=""audio/ogg; codecs=opus""></audio><a href=""javascript:void(0)"" onclick=""document.getElementById('v34_50023').play()"">用意していた“符”を全て使って<br/>全身全霊を出させてもらった……</a>",,"<img class=""itp-kuro"" src=""itp/11/avfc5113_out.webp""/>"
sys_event,25,322,Lesha,Haha. I don't think that's true at all.,Haha. I don't think that's true at all.,リーシャ,ジュディスはどう？ ……ガッカリさせちゃったかな？,"<audio id=""v34_50016""><source src=""talk/11/v34_50016.opus"" type=""audio/ogg; codecs=opus""></audio><a href=""javascript:void(0)"" onclick=""document.getElementById('v34_50016').play()"">ジュディスはどう？<br/>……ガッカリさせちゃったかな？</a>",,"<img class=""itp-kuro"" src=""itp/11/avfc5113_out.webp""/>"
sys_event,25,323,Judith,"I came at you with everything I had, and that was still the best I could do.","I came at you with everything I had, and that was still<br/>the best I could do.",ジュディス,ったく……,"<audio id=""v06_50021""><source src=""talk/11/v06_50021.opus"" type=""audio/ogg; codecs=opus""></audio><a href=""javascript:void(0)"" onclick=""document.getElementById('v06_50021').play()"">ったく……</a>",,"<img class=""itp-kuro"" src=""itp/11/avfc5007_out.webp""/>"
sys_event,25,324,Lesha,I hope my performance didn't leave you disappointed.,I hope my performance didn't leave you disappointed.,リーシャ,あ……,あ……,,"<img class=""itp-kuro"" src=""itp/11/avfc5113_out.webp""/>"
sys_event,25,325,Judith,"Oh, you have GOT to be kidding me.","Oh, you have GOT to be kidding me.",ジュディス,強かったわよ── 本当に見違えるくらいに。,"<audio id=""v06_50022""><source src=""talk/11/v06_50022.opus"" type=""audio/ogg; codecs=opus""></audio><a href=""javascript:void(0)"" onclick=""document.getElementById('v06_50022').play()"">強かったわよ──<br/>本当に見違えるくらいに。</a>",,"<img class=""itp-kuro"" src=""itp/11/avfc5007_out.webp""/>"
sys_event,25,326,Judith,...,...,ジュディス,──ああもう、例の先輩ってのは 本当に腹が立つわね……！,"<audio id=""v06_50023""><source src=""talk/11/v06_50023.opus"" type=""audio/ogg; codecs=opus""></audio><a href=""javascript:void(0)"" onclick=""document.getElementById('v06_50023').play()"">──ああもう、例の先輩ってのは<br/>本当に腹が立つわね……！</a>",,"<img class=""itp-kuro"" src=""itp/11/avfc5007_out.webp""/>"
sys_event,25,327,Judith,"If I had to rate it on a scale of one to ten, I'd give you an eleven. You were that amazing.","If I had to rate it on a scale of one to ten, I'd give you<br/>an eleven. You were that amazing.",ジュディス,太陽だか不死鳥だか知らないけど あんたをここまで引き上げて……！,"<audio id=""v06_50024""><source src=""talk/11/v06_50024.opus"" type=""audio/ogg; codecs=opus""></audio><a href=""javascript:void(0)"" onclick=""document.getElementById('v06_50024').play()"">太陽だか不死鳥だか知らないけど<br/>あんたをここまで引き上げて……！</a>",,"<img class=""itp-kuro"" src=""itp/11/avfc5007_out.webp""/>"
sys_event,25,328,Lesha,Argh. I am SO jealous of that woman! She has you all to herself!,Argh. I am SO jealous of that woman! She has you all<br/>to herself!,リーシャ,ふふっ、ちょっと貴女と 似てるところもある人だけど……,"<audio id=""v34_50018""><source src=""talk/11/v34_50018.opus"" type=""audio/ogg; codecs=opus""></audio><a href=""javascript:void(0)"" onclick=""document.getElementById('v34_50018').play()"">ふふっ、ちょっと貴女と<br/>似てるところもある人だけど……</a>",,"<img class=""itp-kuro"" src=""itp/11/avfc5113_out.webp""/>"
