gameId,fname,scene,row,engChrName,engSearchText,engHtmlText,jpnChrName,jpnSearchText,jpnHtmlText,opName,pcIconHtml,evoIconHtml
sys_event,52,787,Aaron,I'll be waiting to join you!,I'll be waiting to join you!,アーロン,ハン、思った以上に手がかりになりそうな 情報が出てきやがったな。,ハン、思った以上に手がかりになりそうな<br/>情報が出てきやがったな。,,"<img class=""itp-kuro"" src=""itp/11/avfc0002_out.webp""/>"
sys_event,52,788,Agnes,Thank you.,Thank you.,アニエス,ええ、荷台の中から聞こえてきた音に、 誰も乗ってなかったような運転席ですね。,ええ、荷台の中から聞こえてきた音に、<br/>誰も乗ってなかったような運転席ですね。,,"<img class=""itp-kuro"" src=""itp/11/avfc5001_out.webp""/>"
sys_event,52,789,Agnes,Nice. We got way more clues here than I expected.,Nice. We got way more clues here than I expected.,アニエス,どちらもレッドスターの大型運搬車…… 同じ車の可能性は高そうです。,どちらもレッドスターの大型運搬車……<br/>同じ車の可能性は高そうです。,,"<img class=""itp-kuro"" src=""itp/11/avfc5001_out.webp""/>"
sys_event,52,790,Ferry,The two accounts we heard both involved a Red Star transport...,The two accounts we heard both involved a Red<br/>Star transport...,フェリ,はい、誰も乗ってないっていうのは ゾッとしませんけど……,はい、誰も乗ってないっていうのは<br/>ゾッとしませんけど……,,"<img class=""itp-kuro"" src=""itp/11/avfc5003_out.webp""/>"
sys_event,52,791,Van,...which leads me to believe we are dealing with one—and only one—vehicle.,...which leads me to believe we are dealing with<br/>one—and only one—vehicle.,ヴァン,ま、夜のシチュエーションといい、 いかにもな雰囲気ではあるだろうが……,ま、夜のシチュエーションといい、<br/>いかにもな雰囲気ではあるだろうが……,,"<img class=""itp-kuro"" src=""itp/11/avfc0000_out.webp""/>"
sys_event,52,792,Van,I'm still freaking out about the whole 'driverless truck' thing.,I'm still freaking out about the whole 'driverless<br/>truck' thing.,ヴァン,カトル──お前さんならカラクリについて ある程度見当が付いてんじゃねえか？,カトル──お前さんならカラクリについて<br/>ある程度見当が付いてんじゃねえか？,,"<img class=""itp-kuro"" src=""itp/11/avfc0000_out.webp""/>"
sys_event,52,793,Ferry,Don't blame ya. The fact that it happened at night turns this whole thing into a bona fide ghost story.,Don't blame ya. The fact that it happened at night<br/>turns this whole thing into a bona fide ghost story.,フェリ,そ、そうなんですかっ？,そ、そうなんですかっ？,,"<img class=""itp-kuro"" src=""itp/11/avfc5003_out.webp""/>"
sys_event,52,794,Agnes,"There's probably a logical explanation, though, and I'm sure Quatre can provide it.","There's probably a logical explanation, though, and<br/>I'm sure Quatre can provide it.",アニエス,カトル君ならという事は もしかして……,カトル君ならという事は<br/>もしかして……,,"<img class=""itp-kuro"" src=""itp/11/avfc5001_out.webp""/>"
sys_event,52,795,Quatre,"Wait, for real?","Wait, for real?",カトル,うん……完全実用化はされてないけど 各国で研究されてる技術があってね。,うん……完全実用化はされてないけど<br/>各国で研究されてる技術があってね。,,"<img class=""itp-kuro"" src=""itp/11/avfc0004_out.webp""/>"
sys_event,52,796,Quatre,"Oh, is it related to technology you have insider knowledge about?","Oh, is it related to technology you have insider<br/>knowledge about?",カトル,『ＡＩによる自動運転技術』── ホロウが人間の代わりに運転するイメージかな。,『ＡＩによる自動運転技術』──<br/>ホロウが人間の代わりに運転するイメージかな。,,"<img class=""itp-kuro"" src=""itp/11/avfc0004_out.webp""/>"
sys_event,52,797,Quatre,Correct. I believe it is utilizing tech that is currently in the R&D phase of development in many countries.,Correct. I believe it is utilizing tech that is currently<br/>in the R&D phase of development in many countries.,カトル,空き缶にも動じずに運転し続けたのなんか まさにＡＩらしい反応とも言えるかな。,空き缶にも動じずに運転し続けたのなんか<br/>まさにＡＩらしい反応とも言えるかな。,,"<img class=""itp-kuro"" src=""itp/11/avfc0004_out.webp""/>"
sys_event,52,798,Agnes,"It's called an automated vehicle, and it allows a person to go from place to place without lifting a finger— because a holo core is doing the driving.","It's called an automated vehicle, and it allows a person<br/>to go from place to place without lifting a finger—<br/>because a holo core is doing the driving.",アニエス,やっぱり……レン先輩から ちょっと聞いたことがありましたが。,やっぱり……レン先輩から<br/>ちょっと聞いたことがありましたが。,,"<img class=""itp-kuro"" src=""itp/11/avfc5001_out.webp""/>"
sys_event,52,799,Ferry,The fact that it kept going in spite of the empty soda can makes me strongly suspect it's an AI-controlled vehicle.,The fact that it kept going in spite of the empty<br/>soda can makes me strongly suspect it's an<br/>AI-controlled vehicle.,フェリ,ふわあ～……そんな技術が。 そ、それじゃあ霊（ジン）の仕業とかじゃ──,ふわあ～……そんな技術が。<br/>そ、それじゃあ霊（ジン）の仕業とかじゃ──,,"<img class=""itp-kuro"" src=""itp/11/avfc5003_out.webp""/>"
sys_event,52,800,Aaron,"My suspicions were correct, then. Renne told me a little about this before.","My suspicions were correct, then. Renne told me a<br/>little about this before.",アーロン,いやぁ、分からねえぞ～？,いやぁ、分からねえぞ～？,,"<img class=""itp-kuro"" src=""itp/11/avfc0002_out.webp""/>"
sys_event,52,801,Aaron,Wow! That's so cool! So that means it wasn't a ghost. Phew...,Wow! That's so cool! So that means it wasn't a ghost.<br/>Phew...,アーロン,ブラックな環境で過労死したトラック運転手が 現世に未練を残して──ほらお前の後ろに！,ブラックな環境で過労死したトラック運転手が<br/>現世に未練を残して──ほらお前の後ろに！,,"<img class=""itp-kuro"" src=""itp/11/avfc0002_out.webp""/>"
sys_event,52,802,Ferry,"Well, you never know. Maybe there WAS a driver— until his shitty job worked him to death. Now he lives on as a vengeful ghost behind the wheel...","Well, you never know. Maybe there WAS a driver—<br/>until his shitty job worked him to death. Now he lives<br/>on as a vengeful ghost behind the wheel...",フェリ,！！？？ひゃあああっ！？,！！？？ひゃあああっ！？,,"<img class=""itp-kuro"" src=""itp/11/avfc5003_out.webp""/>"
sys_event,52,803,Ferry,"Wait, what's that? Oh, SHIT! It's right behind you, Ferida!","Wait, what's that? Oh, SHIT! It's right behind<br/>you, Ferida!",フェリ,──って何もないじゃないですかっ！,──って何もないじゃないですかっ！,,"<img class=""itp-kuro"" src=""itp/11/avfc5003_out.webp""/>"
sys_event,52,804,Aaron,Wha...?! EEEEEK!,Wha...?! EEEEEK!,アーロン,ブハハ、引っかかってやんの。,ブハハ、引っかかってやんの。,,"<img class=""itp-kuro"" src=""itp/11/avfc0002_out.webp""/>"
sys_event,52,805,Agnes,...Hey! There's nothing there!,...Hey! There's nothing there!,アニエス,もう、アーロンさん…… そんな場合じゃないでしょう。,もう、アーロンさん……<br/>そんな場合じゃないでしょう。,,"<img class=""itp-kuro"" src=""itp/11/avfc5001_out.webp""/>"
sys_event,52,806,Van,BAHAHAHA! You should've seen the look on your face!,BAHAHAHA! You should've seen the look on<br/>your face!,ヴァン,真面目にやれ、真面目に。,真面目にやれ、真面目に。,,"<img class=""itp-kuro"" src=""itp/11/avfc0000_out.webp""/>"
sys_event,52,807,Van,Why are you like this...?,Why are you like this...?,ヴァン,──無人の自動運転技術については 数年前から裏の世界で事件を起こしている。,──無人の自動運転技術については<br/>数年前から裏の世界で事件を起こしている。,,"<img class=""itp-kuro"" src=""itp/11/avfc0000_out.webp""/>"
sys_event,52,808,Van,"You want me to stop calling you a kid, stop acting like one.","You want me to stop calling you a kid, stop acting<br/>like one.",ヴァン,ま、事故も起こさず市内を回り続けてるってのは なかなかハードルの高そうな技術だろうがな。,ま、事故も起こさず市内を回り続けてるってのは<br/>なかなかハードルの高そうな技術だろうがな。,,"<img class=""itp-kuro"" src=""itp/11/avfc0000_out.webp""/>"
sys_event,52,809,Quatre,Back on topic. There was an incident regarding unmanned driving tech. Everyone in the underworld was goin' on and on about it at the time.,Back on topic. There was an incident regarding<br/>unmanned driving tech. Everyone in the underworld<br/>was goin' on and on about it at the time.,カトル,うん……それでも市内の道路情報や 交通管理システムと繋がれば不可能じゃない。,うん……それでも市内の道路情報や<br/>交通管理システムと繋がれば不可能じゃない。,,"<img class=""itp-kuro"" src=""itp/11/avfc0004_out.webp""/>"
sys_event,52,810,Quatre,So I'm amazed this thing is driving around the city without causing any problems. It's kinda insane.,So I'm amazed this thing is driving around the city<br/>without causing any problems. It's kinda insane.,カトル,ひょっとしたら──キャラハン先生が ああなった</B>技術を応用してる可能性もある。,ひょっとしたら──キャラハン先生が<br/><B>ああなった</B>技術を応用してる可能性もある。,,"<img class=""itp-kuro"" src=""itp/11/avfc0004_out.webp""/>"
sys_event,52,811,Ferry,I'm not too surprised. You could prevent most accidents by connecting it to the traffic management system and the info on the city roads.,I'm not too surprised. You could prevent most<br/>accidents by connecting it to the traffic management<br/>system and the info on the city roads.,フェリ,あ……,あ……,,"<img class=""itp-kuro"" src=""itp/11/avfc5003_out.webp""/>"
sys_event,52,812,Agnes,"The technology should be state of the art. In fact, I suspect it's the same tech that caused Professor Callaghan's downfall.","The technology should be state of the art. In fact, I<br/>suspect it's the same tech that caused Professor<br/>Callaghan's downfall.",アニエス,……それは………,……それは………,,"<img class=""itp-kuro"" src=""itp/11/avfc5001_out.webp""/>"
sys_event,52,813,Quatre,Oh...,Oh...,カトル,はは……気にしないでよ。 今は感傷に浸ってる場合じゃないし。,はは……気にしないでよ。<br/>今は感傷に浸ってる場合じゃないし。,,"<img class=""itp-kuro"" src=""itp/11/avfc0004_out.webp""/>"
sys_event,52,814,Quatre,"I-I'm sorry, Quatre...","I-I'm sorry, Quatre...",カトル,でも──どうするのヴァンさん？,でも──どうするのヴァンさん？,,"<img class=""itp-kuro"" src=""itp/11/avfc0004_out.webp""/>"
sys_event,52,815,Quatre,"You've nothing to be sorry for. And I'm all right, promise. Now's not the time to wallow in sentimentality.","You've nothing to be sorry for. And I'm all<br/>right, promise. Now's not the time to wallow<br/>in sentimentality.",カトル,積んでるＡＩの性能やパターン次第では 簡単には捕まえられないかもしれないよ？,積んでるＡＩの性能やパターン次第では<br/>簡単には捕まえられないかもしれないよ？,,"<img class=""itp-kuro"" src=""itp/11/avfc0004_out.webp""/>"
sys_event,52,816,Van,"So what's the plan, Van?","So what's the plan, Van?",ヴァン,ああ、後はあの少尉に連絡して警察あたりに 丸投げしてもいいかもしれねぇが……,ああ、後はあの少尉に連絡して警察あたりに<br/>丸投げしてもいいかもしれねぇが……,,"<img class=""itp-kuro"" src=""itp/11/avfc0000_out.webp""/>"
sys_event,52,817,Van,The AI's functionality and patterns could make it quite difficult to capture.,The AI's functionality and patterns could make it<br/>quite difficult to capture.,ヴァン,車好きの端くれとして、ヤベエ代物を運んだ 無人暴走車を見過ごすわけにもいかねぇ。,車好きの端くれとして、ヤベエ代物を運んだ<br/>無人暴走車を見過ごすわけにもいかねぇ。,,"<img class=""itp-kuro"" src=""itp/11/avfc0000_out.webp""/>"
sys_event,52,818,Aaron,"I know. Normally, I'd be fine with dumping this on the second lieutenant or the cops.","I know. Normally, I'd be fine with dumping this on<br/>the second lieutenant or the cops.",アーロン,ハッ、てめぇらしい物言いだが、 ──そんじゃあどうすんだ？,ハッ、てめぇらしい物言いだが、<br/>──そんじゃあどうすんだ？,,"<img class=""itp-kuro"" src=""itp/11/avfc0002_out.webp""/>"
sys_event,52,819,Van,"But I'm a car lover at heart, and I do NOT like seein' them be used as vehicles for bringing weapons into the city. This shit is personal.","But I'm a car lover at heart, and I do NOT like seein'<br/>them be used as vehicles for bringing weapons into<br/>the city. This shit is personal.",ヴァン,そのＡＩとやらがどこまでやるのか 直接、確かめさせてもらうだけの話だ。,そのＡＩとやらがどこまでやるのか<br/>直接、確かめさせてもらうだけの話だ。,,"<img class=""itp-kuro"" src=""itp/11/avfc0000_out.webp""/>"
sys_event,52,820,Van,"Figures. Well, any bright ideas, chief?","Figures. Well, any bright ideas, chief?",ヴァン,ただし手段を選ぶつもりはねぇ── “助っ人”を見込ませてもらうぜ。,ただし手段を選ぶつもりはねぇ──<br/>“助っ人”を見込ませてもらうぜ。,,"<img class=""itp-kuro"" src=""itp/11/avfc0000_out.webp""/>"
sys_event,52,821,Quatre,First order of business is seeing how far this AI can really go.,First order of business is seeing how far this AI can<br/>really go.,カトル,す、助っ人……？,す、助っ人……？,,"<img class=""itp-kuro"" src=""itp/11/avfc0004_out.webp""/>"
sys_event,52,822,Ferry,"Also, I'm gonna bring on some outside help for this gig.","Also, I'm gonna bring on some outside help for<br/>this gig.",フェリ,あ、ひょっとして ちょうどバーゼルに来ている……！,あ、ひょっとして<br/>ちょうどバーゼルに来ている……！,,"<img class=""itp-kuro"" src=""itp/11/avfc5003_out.webp""/>"
sys_event,52,823,Van,What kind of outside help?,What kind of outside help?,ヴァン,ああ、一応連絡を入れておくか。,ああ、一応連絡を入れておくか。,,"<img class=""itp-kuro"" src=""itp/11/avfc0000_out.webp""/>"
sys_event,52,824,　,"Wait, you don't mean them, do you?","Wait, you don't mean them, do you?",　,ヴァンはザイファで走り屋の ユニファたちに連絡を入れ……,<C1>ヴァンはザイファで走り屋の<br/>ユニファたちに連絡を入れ……,,
sys_event,52,825,　,"Bingo. And they're right here in Basel, so I'm gonna call 'em up right now.","Bingo. And they're right here in Basel, so I'm gonna<br/>call 'em up right now.",　,彼らが待っている新市街の モーターパビリオンに向かうことにした。,<C1>彼らが待っている新市街の<br/>モーターパビリオンに向かうことにした。,,
sys_event,52,826,Agnes,Van used his Xipha to get in touch with Junifer and the others.,Van used his Xipha to get in touch with Junifer and<br/>the others.,アニエス,えっと、どなたか心当たりでも？,えっと、どなたか心当たりでも？,,"<img class=""itp-kuro"" src=""itp/11/avfc5001_out.webp""/>"
sys_event,52,827,Van,The party then headed to the Motor Pavilion in New Town where they were waiting.,The party then headed to the Motor Pavilion in New<br/>Town where they were waiting.,ヴァン,ああ──（たしか中古整備屋で こっちに来てると聞いたが……）,ああ──（たしか中古整備屋で<br/>こっちに来てると聞いたが……）,,"<img class=""itp-kuro"" src=""itp/11/avfc0000_out.webp""/>"
sys_event,52,828,　,"Umm, do you have somebody in mind?","Umm, do you have somebody in mind?",　,ヴァンはザイファでとある面々が バーゼルに来ていることを確認し……,<C1>ヴァンはザイファでとある面々が<br/>バーゼルに来ていることを確認し……,,
sys_event,52,829,　,Yep. (I heard that they'd be here...),Yep.<br/>(I heard that they'd be here...),　,彼らが待っているという新市街の モーターパビリオンへと向かうことにした。,<C1>彼らが待っているという新市街の<br/>モーターパビリオンへと向かうことにした。,,
sys_event,53,830,Van,Van used his Xipha to get in touch with some familiar faces in Basel.,Van used his Xipha to get in touch with some familiar<br/>faces in Basel.,ヴァン,そういや“アイドル”が 相方の行方を捜してるっつう話だったな。,そういや“アイドル”が<br/>相方の行方を捜してるっつう話だったな。,,"<img class=""itp-kuro"" src=""itp/11/avfc0000_out.webp""/>"
sys_event,53,831,Van,The party then headed to the Motor Pavilion in New Town where they were waiting.,The party then headed to the Motor Pavilion in New<br/>Town where they were waiting.,ヴァン,話を聞きに行くか？,話を聞きに行くか？,,"<img class=""itp-kuro"" src=""itp/11/avfc0000_out.webp""/>"
sys_event,53,832,,Should I go talk to that idol about her friend now?,Should I go talk to that idol about her friend now?,,この４ＳＰＧを開始すると ストックタイムがリセットされます。,<C1>この４ＳＰＧを開始すると<br/>ストックタイムがリセットされます。,,
sys_event,53,833,,"I've gotta do it soon, but it doesn't have to be right now.","I've gotta do it soon, but it doesn't have to be<br/>right now.",,夜の首都も自由に回れなくなるので 注意して下さい。,<C1>夜の首都も自由に回れなくなるので<br/>注意して下さい。,,
sys_event,54,834,Van,"Once you start this 4SPG, you will no longer be able to use your free time points.","Once you start this 4SPG, you will no longer be able<br/>to use your free time points.",ヴァン,よし、依頼者の元へ出向くとすっか。,よし、依頼者の元へ出向くとすっか。,,"<img class=""itp-kuro"" src=""itp/11/avfc0000_out.webp""/>"
sys_event,54,835,Van,You will also no longer be able to walk around the capital freely.,You will also no longer be able to walk around the<br/>capital freely.,ヴァン,そういやまだ十分に街を回れてなかったな。,そういやまだ十分に街を回れてなかったな。,,"<img class=""itp-kuro"" src=""itp/11/avfc0000_out.webp""/>"
sys_event,54,836,Van,All right. Let me go see my client.,All right. Let me go see my client.,ヴァン,一通り他を片付けてから取り掛かるとすっか。,一通り他を片付けてから取り掛かるとすっか。,,"<img class=""itp-kuro"" src=""itp/11/avfc0000_out.webp""/>"
sys_event,55,837,Agnes,"Actually, I think there was some other stuff I wanted to do.","Actually, I think there was some other stuff I wanted<br/>to do.",アニエス,これで３か所、回り終えましたね。,これで３か所、回り終えましたね。,,"<img class=""itp-kuro"" src=""itp/11/avfc5001_out.webp""/>"
sys_event,55,838,Ferry,I'll take care of that first before goin' to see her.,I'll take care of that first before goin' to see her.,フェリ,残っているのは赤いトラムですね。,残っているのは赤いトラムですね。,,"<img class=""itp-kuro"" src=""itp/11/avfc5003_out.webp""/>"
sys_event,55,839,Van,Okay. That's three locations down.,Okay. That's three locations down.,ヴァン,今のこの時間なら……そうだな……,今のこの時間なら……そうだな……,,"<img class=""itp-kuro"" src=""itp/11/avfc0000_out.webp""/>"
sys_event,55,840,Van,Now all that's left is the red tram.,Now all that's left is the red tram.,ヴァン,ちょうど北街区の停留所辺りに 停まっているかもしれねえ。,ちょうど北街区の停留所辺りに<br/>停まっているかもしれねえ。,,"<img class=""itp-kuro"" src=""itp/11/avfc0000_out.webp""/>"
sys_event,55,841,Aaron,Hmm...,Hmm...,アーロン,ハッ、流石に詳しいじゃねえか。,ハッ、流石に詳しいじゃねえか。,,"<img class=""itp-kuro"" src=""itp/11/avfc0002_out.webp""/>"
sys_event,55,842,Van,"At this time of day, it's gonna be at the stop in the North District.","At this time of day, it's gonna be at the stop in the<br/>North District.",ヴァン,ま、ガキの頃に興味半分で 探して回ったことがあるからな。,ま、ガキの頃に興味半分で<br/>探して回ったことがあるからな。,,"<img class=""itp-kuro"" src=""itp/11/avfc0000_out.webp""/>"
sys_event,55,843,Van,"Wait, you've got the tram schedule memorized? What a nerd.","Wait, you've got the tram schedule memorized?<br/>What a nerd.",ヴァン,とにかく向かうぞ。,とにかく向かうぞ。,,"<img class=""itp-kuro"" src=""itp/11/avfc0000_out.webp""/>"
sys_event,56,844,Van,"Hey, I ain't a nerd. I just spent a lot of time looking for the thing as a kid, so its schedule is burned into my memory.","Hey, I ain't a nerd. I just spent a lot of time looking<br/>for the thing as a kid, so its schedule is burned into<br/>my memory.",ヴァン,オラシオンクイズの答え、 ４つとも揃ったようだな。,オラシオンクイズの答え、<br/>４つとも揃ったようだな。,,"<img class=""itp-kuro"" src=""itp/11/avfc0000_out.webp""/>"
sys_event,56,845,Bellegarde,"Anyway, let's get on over there.","Anyway, let's get on over there.",ベルガルド,では早速あの若人たちの所に 帰るとしよう。,では早速あの若人たちの所に<br/>帰るとしよう。,,"<img class=""itp-kuro"" src=""itp/11/avfc0006_out.webp""/>"
sys_event,56,846,Aaron,"Okay, we've got all four answers.","Okay, we've got all four answers.",アーロン,早くしねえと爆発しちまうかもな。,早くしねえと爆発しちまうかもな。,,"<img class=""itp-kuro"" src=""itp/11/avfc0002_out.webp""/>"
sys_event,56,847,Agnes,"Let's return to our clients quickly, then.","Let's return to our clients quickly, then.",アニエス,そ、そういう冗談はやめてください……,そ、そういう冗談はやめてください……,,"<img class=""itp-kuro"" src=""itp/11/avfc5001_out.webp""/>"
sys_event,57,848,Van,Good idea. I'd rather not find a pile of splattered remains when we get back.,Good idea. I'd rather not find a pile of splattered<br/>remains when we get back.,ヴァン,依頼にあったヤツで間違いねえな。,依頼にあったヤツで間違いねえな。,,"<img class=""itp-kuro"" src=""itp/11/avfc0000_out.webp""/>"
sys_event,57,849,Fee,Aaron! Not appropriate!,Aaron! Not appropriate!,フィー,元気そうだね。,元気そうだね。,,"<img class=""itp-kuro"" src=""itp/11/avfc5112_out.webp""/>"
sys_event,57,850,silver,Looks like we've found our prey.,Looks like we've found our prey.,銀,かなり凶暴みたいですね。,かなり凶暴みたいですね。,,"<img class=""itp-kuro"" src=""itp/11/avfc5113_out.webp""/>"
sys_event,57,851,Shizuna,They look perky.,They look perky.,シズナ,なかなか活きがいいね！,なかなか活きがいいね！,,"<img class=""itp-kuro"" src=""itp/11/avfc5117_out.webp""/>"
sys_event,57,852,Walter the Skinny Wolf,They look fierce.,They look fierce.,痩せ狼ヴァルター,活きがいいじゃねぇか。,活きがいいじゃねぇか。,,"<img class=""itp-kuro"" src=""itp/11/avfc0113_out.webp""/>"
sys_event,57,853,Aaron,They look lively.,They look lively.,アーロン,こんなヤツ、前はいなかったよな？,こんなヤツ、前はいなかったよな？,,"<img class=""itp-kuro"" src=""itp/11/avfc0002_out.webp""/>"
sys_event,57,854,Ferry,Nice. Fresh meat.,Nice. Fresh meat.,フェリ,こんな敵、前はいなかったはずです……！,こんな敵、前はいなかったはずです……！,,"<img class=""itp-kuro"" src=""itp/11/avfc5003_out.webp""/>"
sys_event,57,855,Quatre,I don't remember seeing other monsters like them down here before.,I don't remember seeing other monsters like them<br/>down here before.,カトル,こんな敵、前はいなかったと思うけど……,こんな敵、前はいなかったと思うけど……,,"<img class=""itp-kuro"" src=""itp/11/avfc0004_out.webp""/>"
sys_event,57,856,Van,I don't remember seeing other monsters like them down here before!,I don't remember seeing other monsters like them<br/>down here before!,ヴァン,たまたま行き会わなかったか、 それともアルマータの置き土産か……,たまたま行き会わなかったか、<br/>それともアルマータの置き土産か……,,"<img class=""itp-kuro"" src=""itp/11/avfc0000_out.webp""/>"
