gameId,fname,scene,row,engChrName,engSearchText,engHtmlText,jpnChrName,jpnSearchText,jpnHtmlText,opName,pcIconHtml,evoIconHtml
sys_event,28,521,Walter the Skinny Wolf,Good. Glad we're in agreement.,Good. Glad we're in agreement.,痩せ狼ヴァルター,ハ……まあ、いいだろう。,ハ……まあ、いいだろう。,,"<img class=""itp-kuro"" src=""itp/11/avfc0113_out.webp""/>"
sys_event,28,522,Golden Butterfly Lucrezia,"Let's go, you two. We're leaving.","Let's go, you two. We're leaving.",黄金蝶ルクレツィア,あんじょうしぃ</B>や、お兄はんたち。,<B>あんじょうしぃ</B>や、お兄はんたち。,,"<img class=""itp-kuro"" src=""itp/11/avfc5118_out.webp""/>"
sys_event,28,523,Van,Whatever you say.,Whatever you say.,ヴァン,（……微妙に引っかかりやがる……）,（……微妙に引っかかりやがる……）,,"<img class=""itp-kuro"" src=""itp/11/avfc0000_out.webp""/>"
sys_event,28,524,Van,"Best of luck, everyone.","Best of luck, everyone.",ヴァン,（このまま行かせていいのか……？）,（このまま行かせていいのか……？）,,"<img class=""itp-kuro"" src=""itp/11/avfc0000_out.webp""/>"
sys_event,28,525,Ren,(Something's not right here...),(Something's not right here...),レン,せめて《千の破戒者》以外の、裏の世界での 彼の“もう一つの”異名を教えてあげる。,<C8>せめて《千の破戒者》以外の、裏の世界での<br/>彼の“もう一つの”異名を教えてあげる。,,"<img class=""itp-kuro"" src=""itp/11/avfc0000_out.webp""/>"
sys_event,28,526,Ren,(Is this really the right call? Should I let them go?),(Is this really the right call? Should I let them go?),レン,『犯罪の天才』──そんな風に呼ばれてるわ。,<C8>『犯罪の天才』──そんな風に呼ばれてるわ。,,"<img class=""itp-kuro"" src=""itp/11/avfc0000_out.webp""/>"
sys_event,28,527,Van,But I will share one little known fact: the Thousand Oathbreaker isn't his only title.,But I will share one little known fact: the Thousand<br/>Oathbreaker isn't his only title.,ヴァン,──待ちな。,──待ちな。,,"<img class=""itp-kuro"" src=""itp/11/avfc0000_out.webp""/>"
sys_event,28,528,Harwood the Breach,He's also known as the Savant Lawbreaker.,He's also known as the Savant Lawbreaker.,破戒のハーウッド,まだ何かあんのか？,"<audio id=""v36_50066""><source src=""talk/11/v36_50066.opus"" type=""audio/ogg; codecs=opus""></audio><a href=""javascript:void(0)"" onclick=""document.getElementById('v36_50066').play()"">まだ何かあんのか？</a>",,
sys_event,28,529,Harwood the Breach,...Wait. I got a question for you.,...Wait. I got a question for you.,破戒のハーウッド,とりあえず他の連中を下してから どうするか話し合うべきじゃねえか？,"<audio id=""v36_50067""><source src=""talk/11/v36_50067.opus"" type=""audio/ogg; codecs=opus""></audio><a href=""javascript:void(0)"" onclick=""document.getElementById('v36_50067').play()"">とりあえず他の連中を下してから<br/>どうするか話し合うべきじゃねえか？</a>",,
sys_event,28,530,Van,"Ugh. Really, now?","Ugh. Really, now?",ヴァン,それはいい…… ──だがアンタ、何を企んでる？,それはいい……<br/>──だがアンタ、何を企んでる？,,"<img class=""itp-kuro"" src=""itp/11/avfc0000_out.webp""/>"
sys_event,28,531,Agnes,Can't it wait till after we take out the other teams?,Can't it wait till after we take out the other teams?,アニエス,……ヴァンさん？,……ヴァンさん？,,"<img class=""itp-kuro"" src=""itp/11/avfc5001_out.webp""/>"
sys_event,28,532,Harwood the Breach,"No, it can't. Tell me, Ellroy. Are you up to something?","No, it can't. Tell me, Ellroy. Are you up<br/>to something?",破戒のハーウッド,ハハ、つまらねぇ質問だな。,"<audio id=""v36_50068""><source src=""talk/11/v36_50068.opus"" type=""audio/ogg; codecs=opus""></audio><a href=""javascript:void(0)"" onclick=""document.getElementById('v36_50068').play()"">ハハ、つまらねぇ質問だな。</a>",,
sys_event,28,533,Harwood the Breach,...Huh?,...Huh?,破戒のハーウッド,これでもオジサン、働き者でなぁ。 企んでねぇ時間の方が短いくらいだぜ。,"<audio id=""v36_50069""><source src=""talk/11/v36_50069.opus"" type=""audio/ogg; codecs=opus""></audio><a href=""javascript:void(0)"" onclick=""document.getElementById('v36_50069').play()"">これでもオジサン、働き者でなぁ。<br/>企んでねぇ時間の方が短いくらいだぜ。</a>",,
sys_event,28,534,Van,Haha. Now that's a silly question.,Haha. Now that's a silly question.,ヴァン,なら質問を変えるが……,なら質問を変えるが……,,"<img class=""itp-kuro"" src=""itp/11/avfc0000_out.webp""/>"
sys_event,28,535,Van,Allow me to let you in on a little secret: I'm always up to something.,Allow me to let you in on a little secret: I'm always up<br/>to something.,ヴァン,俺たちとの交戦を避ける 本当の理由はなんだ</B>？,<B>俺たちとの交戦を避ける<br/>本当の理由はなんだ</B>？,,"<img class=""itp-kuro"" src=""itp/11/avfc0000_out.webp""/>"
sys_event,28,536,Harwood the Breach,"Okay, let me rephrase.","Okay, let me rephrase.",破戒のハーウッド,クク……レンあたりの忠告ってトコか？,"<audio id=""v36_50070""><source src=""talk/11/v36_50070.opus"" type=""audio/ogg; codecs=opus""></audio><a href=""javascript:void(0)"" onclick=""document.getElementById('v36_50070').play()"">クク……レンあたりの忠告ってトコか？</a>",,
sys_event,28,537,Harwood the Breach,What's your real reason for avoiding a fight?,What's your real reason for avoiding a fight?,破戒のハーウッド,あいつがガキの頃、博士よりは 優しく接してやったつもりなんだがなぁ。,"<audio id=""v36_50071""><source src=""talk/11/v36_50071.opus"" type=""audio/ogg; codecs=opus""></audio><a href=""javascript:void(0)"" onclick=""document.getElementById('v36_50071').play()"">あいつがガキの頃、博士よりは<br/>優しく接してやったつもりなんだがなぁ。</a>",,
sys_event,28,538,Van,"Oh? Did Renne give you a word of warning about me, perhaps?","Oh? Did Renne give you a word of warning about<br/>me, perhaps?",ヴァン,ガキだから、だろう。 あの天稟（てんぴん）に加えて本質を見抜く年頃だ。,ガキだから、だろう。<br/>あの天稟（てんぴん）に加えて本質を見抜く年頃だ。,,"<img class=""itp-kuro"" src=""itp/11/avfc0000_out.webp""/>"
sys_event,28,539,Van,"And here I was thinking she took a liking to me. Unlike the professor, I was reasonably nice to her when she was a child.","And here I was thinking she took a liking to me.<br/>Unlike the professor, I was reasonably nice to her<br/>when she was a child.",ヴァン,アンタ──この地下遺構自体に 何か仕掛けようとしてるんじゃねぇか？,アンタ──この地下遺構自体に<br/>何か仕掛けようとしてるんじゃねぇか？,,"<img class=""itp-kuro"" src=""itp/11/avfc0000_out.webp""/>"
sys_event,28,540,Harwood the Breach,"If you thought you could fool Renne with fake smiles and honeyed words, then you clearly didn't know her.","If you thought you could fool Renne with fake smiles<br/>and honeyed words, then you clearly didn't know her.",破戒のハーウッド,…………………………,"<audio id=""v36_50072""><source src=""talk/11/v36_50072.opus"" type=""audio/ogg; codecs=opus""></audio><a href=""javascript:void(0)"" onclick=""document.getElementById('v36_50072').play()"">…………………………</a>",,
sys_event,28,541,Ferry,"And you can't fool me, either. You're setting up some kinda trap in this place, aren't you?","And you can't fool me, either. You're setting up some<br/>kinda trap in this place, aren't you?",フェリ,な、何か、ですか……？,な、何か、ですか……？,,"<img class=""itp-kuro"" src=""itp/11/avfc5003_out.webp""/>"
sys_event,28,542,Quatre,...,...,カトル,ＦＩＯが索敵しながら進んでるけど 上位属性以外に目立った異常は……,ＦＩＯが索敵しながら進んでるけど<br/>上位属性以外に目立った異常は……,,"<img class=""itp-kuro"" src=""itp/11/avfc0004_out.webp""/>"
sys_event,28,543,Van,"Wait, really?","Wait, really?",ヴァン,具体的な方法までは分からねぇ。,具体的な方法までは分からねぇ。,,"<img class=""itp-kuro"" src=""itp/11/avfc0000_out.webp""/>"
sys_event,28,544,Van,The only abnormality FIO picked up was the presence of the higher elements.,The only abnormality FIO picked up was the<br/>presence of the higher elements.,ヴァン,だが、アンタとこれまで敵対した組織は どこも少なからず“自滅”してるそうだな？,だが、アンタとこれまで敵対した組織は<br/>どこも少なからず“自滅”してるそうだな？,,"<img class=""itp-kuro"" src=""itp/11/avfc0000_out.webp""/>"
sys_event,28,545,Van,I'm not exactly sure what stunt you're pullin' here...,I'm not exactly sure what stunt you're pullin' here...,ヴァン,不幸な事故、何らかの偶然、 あるいは突発的な“同士討ち”──,不幸な事故、何らかの偶然、<br/>あるいは突発的な“同士討ち”──,,"<img class=""itp-kuro"" src=""itp/11/avfc0000_out.webp""/>"
sys_event,28,546,Van,...but I'm on to you. We know that most groups that've opposed you got silenced—permanently.,...but I'm on to you. We know that most groups<br/>that've opposed you got silenced—permanently.,ヴァン,どれも偶然か、原因不明の変死として 当局も片付けるしかなかったようだが……,どれも偶然か、原因不明の変死として<br/>当局も片付けるしかなかったようだが……,,"<img class=""itp-kuro"" src=""itp/11/avfc0000_out.webp""/>"
sys_event,28,547,Van,"Their cases were labeled as 'accidents,' 'resulting from internal conflict,' and other things of that nature.","Their cases were labeled as 'accidents,' 'resulting from<br/>internal conflict,' and other things of that nature.",ヴァン,恐らくは未発見の細菌やウイルス── もしくは検出不能な“毒物”あたりか？,恐らくは未発見の細菌やウイルス──<br/>もしくは検出不能な“毒物”あたりか？,,"<img class=""itp-kuro"" src=""itp/11/avfc0000_out.webp""/>"
sys_event,28,548,Walter the Skinny Wolf,The authorities wrote off every death in those cases as 'cause unknown' or coincidental.,The authorities wrote off every death in those cases as<br/>'cause unknown' or coincidental.,痩せ狼ヴァルター,……ヒュウ…………,……ヒュウ…………,,"<img class=""itp-kuro"" src=""itp/11/avfc0113_out.webp""/>"
sys_event,28,549,Golden Butterfly Lucrezia,Though I'm thinkin' you're using some kind of unknown bacteria or virus—or an untraceable poison.,Though I'm thinkin' you're using some kind of<br/>unknown bacteria or virus—or an untraceable poison.,黄金蝶ルクレツィア,……あらまあ…………,……あらまあ…………,,"<img class=""itp-kuro"" src=""itp/11/avfc5118_out.webp""/>"
sys_event,28,550,Harwood the Breach,Heh.,Heh.,破戒のハーウッド,……………………………,"<audio id=""v36_50073""><source src=""talk/11/v36_50073.opus"" type=""audio/ogg; codecs=opus""></audio><a href=""javascript:void(0)"" onclick=""document.getElementById('v36_50073').play()"">……………………………</a>",,
sys_event,28,551,Judith,"Oh, my.","Oh, my.",ジュディス,さ、細菌にウイルス…… もしくは毒物ですって……！？,さ、細菌にウイルス……<br/>もしくは毒物ですって……！？,,"<img class=""itp-kuro"" src=""itp/11/avfc5007_out.webp""/>"
sys_event,28,552,Quatre,...,...,カトル,……ＢＣ兵器………,……ＢＣ兵器………,,"<img class=""itp-kuro"" src=""itp/11/avfc0004_out.webp""/>"
sys_event,28,553,Lisette,He's using WHAT?!,He's using WHAT?!,リゼット,国際的にも既に禁止されている……,国際的にも既に禁止されている……,,"<img class=""itp-kuro"" src=""itp/11/avfc5005_out.webp""/>"
sys_event,28,554,Harwood the Breach,So he possesses biological and chemical weapons...,So he possesses biological and chemical weapons...,破戒のハーウッド,クク……オジサン驚いちゃったぜ。 どうやらマジで鼻が利くようじゃねえか？,"<audio id=""v36_50074""><source src=""talk/11/v36_50074.opus"" type=""audio/ogg; codecs=opus""></audio><a href=""javascript:void(0)"" onclick=""document.getElementById('v36_50074').play()"">クク……オジサン驚いちゃったぜ。<br/>どうやらマジで鼻が利くようじゃねえか？</a>",,
sys_event,28,555,Harwood the Breach,Those are illegal under international law.,Those are illegal under international law.,破戒のハーウッド,──ああ、ちなみに基本は“Ｃ”だ。 “Ｂ”もたまに使うが扱いが面倒でなぁ。,"<audio id=""v36_50075""><source src=""talk/11/v36_50075.opus"" type=""audio/ogg; codecs=opus""></audio><a href=""javascript:void(0)"" onclick=""document.getElementById('v36_50075').play()"">──ああ、ちなみに基本は“Ｃ”だ。<br/>“Ｂ”もたまに使うが扱いが面倒でなぁ。</a>",,
sys_event,28,556,Ferry,"Heheh. That nose of yours really is something, isn't it?","Heheh. That nose of yours really is something,<br/>isn't it?",フェリ,……っ…………,……っ…………,,"<img class=""itp-kuro"" src=""itp/11/avfc5003_out.webp""/>"
sys_event,28,557,Agnes,"I do indeed use both, but I prefer the chemical variety. Biological weapons are harder to handle.","I do indeed use both, but I prefer the<br/>chemical variety. Biological weapons are harder<br/>to handle.",アニエス,………………………………,………………………………,,"<img class=""itp-kuro"" src=""itp/11/avfc5001_out.webp""/>"
sys_event,28,558,Walter the Skinny Wolf,...,...,痩せ狼ヴァルター,だから言っただろう、 マジモンの最悪なんだよ、旦那は。,だから言っただろう、<br/>マジモンの最悪なんだよ、旦那は。,,"<img class=""itp-kuro"" src=""itp/11/avfc0113_out.webp""/>"
sys_event,28,559,Walter the Skinny Wolf,...,...,痩せ狼ヴァルター,やるじゃねえかアークライド。 首の皮一枚、何とか繋がったな？,やるじゃねえかアークライド。<br/>首の皮一枚、何とか繋がったな？,,"<img class=""itp-kuro"" src=""itp/11/avfc0113_out.webp""/>"
sys_event,28,560,Golden Butterfly Lucrezia,Now you know why I said there isn't a bigger monster in all of Zemuria than him.,Now you know why I said there isn't a bigger monster<br/>in all of Zemuria than him.,黄金蝶ルクレツィア,うふふ、気付いた時には全身が弛緩して 女神行きにならへんでよかったねぇ。,うふふ、気付いた時には全身が弛緩して<br/>女神行きにならへんでよかったねぇ。,,"<img class=""itp-kuro"" src=""itp/11/avfc5118_out.webp""/>"
sys_event,28,561,Fee,"Nice detective work, Arkride. Looks like you might walk outta this alive after all.","Nice detective work, Arkride. Looks like you might<br/>walk outta this alive after all.",フィー,なるほど…… 参加者全員ってことか。,なるほど……<br/>参加者全員ってことか。,,"<img class=""itp-kuro"" src=""itp/11/avfc5112_out.webp""/>"
sys_event,28,562,Immovable Jin,Now you won't have to die in the most painful way imaginable. Death by asphyxiation is a dreadful way to go.,Now you won't have to die in the most painful<br/>way imaginable. Death by asphyxiation is a dreadful<br/>way to go.,不動のジン,《破戒》…… 良くない噂ばかり聞いたが。,《破戒》……<br/>良くない噂ばかり聞いたが。,,"<img class=""itp-kuro"" src=""itp/11/avfc0111_out.webp""/>"
sys_event,28,563,Lesha,So your plan is to win the game by murdering all the players at once.,So your plan is to win the game by murdering all the<br/>players at once.,リーシャ,一気に参加者全員を……,一気に参加者全員を……,,"<img class=""itp-kuro"" src=""itp/11/avfc5113_out.webp""/>"
sys_event,28,564,Tsao,The rumors don't do you justice. You're far more evil than they make you out to be.,The rumors don't do you justice. You're far more evil<br/>than they make you out to be.,ツァオ,さすがは“犯罪の天才”、 やることの次元が違いますねぇ。,さすがは“犯罪の天才”、<br/>やることの次元が違いますねぇ。,,"<img class=""itp-kuro"" src=""itp/11/avfc0301_out.webp""/>"
sys_event,28,565,Shizuna,So you were planning to eliminate all of the players in one move...,So you were planning to eliminate all of the players in<br/>one move...,シズナ,ふむ……《朧月流》でも そんな戦法があったっけ？,ふむ……《朧月流》でも<br/>そんな戦法があったっけ？,,"<img class=""itp-kuro"" src=""itp/11/avfc5117_out.webp""/>"
sys_event,28,566,Kurogane,You've quite the imagination. You may be a more cunning schemer than I.,You've quite the imagination. You may be a more<br/>cunning schemer than I.,クロガネ,ええ──この広範囲となると 簡単にはいきませんが……,ええ──この広範囲となると<br/>簡単にはいきませんが……,,"<img class=""itp-kuro"" src=""itp/11/avfc0304_out.webp""/>"
sys_event,28,567,Harwood the Breach,Hmm... Isn't there a technique in the Rougetsu school that can do something similar?,Hmm... Isn't there a technique in the Rougetsu<br/>school that can do something similar?,破戒のハーウッド,一応、連中の提示した“ルール”には 抵触していないはずだぜ？,"<audio id=""v36_50076""><source src=""talk/11/v36_50076.opus"" type=""audio/ogg; codecs=opus""></audio><a href=""javascript:void(0)"" onclick=""document.getElementById('v36_50076').play()"">一応、連中の提示した“ルール”には<br/>抵触していないはずだぜ？</a>",,
sys_event,28,568,Harwood the Breach,There is. Though it would not be easy to use on this large of a scale.,There is. Though it would not be easy to use on this<br/>large of a scale.,破戒のハーウッド,ま、“破戒”としては 破っちまうのもアリだとは思うが……,"<audio id=""v36_50077""><source src=""talk/11/v36_50077.opus"" type=""audio/ogg; codecs=opus""></audio><a href=""javascript:void(0)"" onclick=""document.getElementById('v36_50077').play()"">ま、“破戒”としては<br/>破っちまうのもアリだとは思うが……</a>",,
sys_event,28,569,Harwood the Breach,My plan doesn't break any of the rules they laid out.,My plan doesn't break any of the rules they laid out.,破戒のハーウッド,──連中込み</B>で、手っ取り早くゲームを 終わらせるいい方法だとは思わねえか？,"<audio id=""v36_50078""><source src=""talk/11/v36_50078.opus"" type=""audio/ogg; codecs=opus""></audio><a href=""javascript:void(0)"" onclick=""document.getElementById('v36_50078').play()"">──連中込み</B>で、手っ取り早くゲームを<br/>終わらせるいい方法だとは思わねえか？</a>",,
sys_event,28,570,Harwood the Breach,"Though that was never a concern of mine. After all, I am the Oathbreaker. Breaking oaths and rules is what I do.","Though that was never a concern of mine. After all, I<br/>am the Oathbreaker. Breaking oaths and rules is what<br/>I do.",破戒のハーウッド,見抜いた特典としてお前らは助かる── ４ｓｐｇをやりながら朗報を待ちゃあいい。,"<audio id=""v36_50079""><source src=""talk/11/v36_50079.opus"" type=""audio/ogg; codecs=opus""></audio><a href=""javascript:void(0)"" onclick=""document.getElementById('v36_50079').play()"">見抜いた特典としてお前らは助かる──<br/>４ｓｐｇをやりながら朗報を待ちゃあいい。</a>",,
sys_event,28,571,Harwood the Breach,And you can't deny it's the most effective way to win the game. I'm taking out all the players—and the organizers—in one fell swoop.,And you can't deny it's the most effective way to win<br/>the game. I'm taking out all the players—and the<br/>organizers—in one fell swoop.,破戒のハーウッド,どうだ──お互い悪くない落とし所だろう？,"<audio id=""v36_50080""><source src=""talk/11/v36_50080.opus"" type=""audio/ogg; codecs=opus""></audio><a href=""javascript:void(0)"" onclick=""document.getElementById('v36_50080').play()"">どうだ──お互い悪くない落とし所だろう？</a>",,
sys_event,28,572,Aaron,I'll spare you alone. That's your reward for figuring out my plan. You can run along back to the city and take care of requests while we wrap this up.,I'll spare you alone. That's your reward for figuring<br/>out my plan. You can run along back to the city and<br/>take care of requests while we wrap this up.,アーロン,ざけんじゃねえ……！ アルマータと同じじゃねえか！,ざけんじゃねえ……！<br/>アルマータと同じじゃねえか！,,"<img class=""itp-kuro"" src=""itp/11/avfc0002_out.webp""/>"
sys_event,28,573,Ferry,"Not a bad deal, huh?","Not a bad deal, huh?",フェリ,戦場でも“外道”のやり方…… そんな虐殺を許すわけにはいきません！,戦場でも“外道”のやり方……<br/>そんな虐殺を許すわけにはいきません！,,"<img class=""itp-kuro"" src=""itp/11/avfc5003_out.webp""/>"
sys_event,28,574,Van,"'Not a bad deal,' my ass! You're no better than Almata!","'Not a bad deal,' my ass! You're no better<br/>than Almata!",ヴァン,ま、市民を巻き込まないだけ 連中よりはマシかもしれねぇが……,ま、市民を巻き込まないだけ<br/>連中よりはマシかもしれねぇが……,,"<img class=""itp-kuro"" src=""itp/11/avfc0000_out.webp""/>"
sys_event,28,575,Van,There are rules that have to be followed—even during war. We won't let you get away with this!,There are rules that have to be followed—even<br/>during war. We won't let you get away with this!,ヴァン,ルールに抵触しなけりゃやってた</B>な？,ルールに抵触しなけりゃ<B>やってた</B>な？,,"<img class=""itp-kuro"" src=""itp/11/avfc0000_out.webp""/>"
sys_event,28,576,Harwood the Breach,"Well, at least you're not involvin' innocent civilians...","Well, at least you're not involvin' innocent civilians...",破戒のハーウッド,ハハ、そりゃ状況次第だろ。,"<audio id=""v36_50081""><source src=""talk/11/v36_50081.opus"" type=""audio/ogg; codecs=opus""></audio><a href=""javascript:void(0)"" onclick=""document.getElementById('v36_50081').play()"">ハハ、そりゃ状況次第だろ。</a>",,
sys_event,28,577,Van,"...is what I'd like to say, but you and I both know that the rules are the only reason why you're leaving them out of this.","...is what I'd like to say, but you and I both know that<br/>the rules are the only reason why you're leaving them<br/>out of this.",ヴァン,だったらアンタらには ここで脱落（リタイア）してもらう。,だったらアンタらには<br/>ここで脱落（リタイア）してもらう。,,"<img class=""itp-kuro"" src=""itp/11/avfc0000_out.webp""/>"
sys_event,28,578,Van,Heh. I make decisions like that on a case-by-case basis.,Heh. I make decisions like that on a<br/>case-by-case basis.,ヴァン,──ルール上、参加者にも 手出しできなくなるだろうからな。,──ルール上、参加者にも<br/>手出しできなくなるだろうからな。,,"<img class=""itp-kuro"" src=""itp/11/avfc0000_out.webp""/>"
sys_event,28,579,Harwood the Breach,And I'm makin' the executive decision to smash your face in.,And I'm makin' the executive decision to smash your<br/>face in.,破戒のハーウッド,クク、道理だな。,"<audio id=""v36_50082""><source src=""talk/11/v36_50082.opus"" type=""audio/ogg; codecs=opus""></audio><a href=""javascript:void(0)"" onclick=""document.getElementById('v36_50082').play()"">クク、道理だな。</a>",,
sys_event,28,580,Harwood the Breach,"As soon as you're out of the game, you can't interfere with any of the players, which means your plan will be dead in the water.","As soon as you're out of the game, you can't interfere<br/>with any of the players, which means your plan will be<br/>dead in the water.",破戒のハーウッド,そんじゃあ予定通り── “殺し合い”と洒落込もうか。,"<audio id=""v36_50083""><source src=""talk/11/v36_50083.opus"" type=""audio/ogg; codecs=opus""></audio><a href=""javascript:void(0)"" onclick=""document.getElementById('v36_50083').play()"">そんじゃあ予定通り──<br/>“殺し合い”と洒落込もうか。</a>",,
sys_event,28,581,Golden Butterfly Lucrezia,Heheh. So you're going to stand in my way?,Heheh. So you're going to stand in my way?,黄金蝶ルクレツィア,ま、こっちの方が ウチはやっぱり好みかなぁ。,"<audio id=""v27_50029""><source src=""talk/11/v27_50029.opus"" type=""audio/ogg; codecs=opus""></audio><a href=""javascript:void(0)"" onclick=""document.getElementById('v27_50029').play()"">ま、こっちの方が<br/>ウチはやっぱり好みかなぁ。</a>",,"<img class=""itp-kuro"" src=""itp/11/avfc5118_out.webp""/>"
