gameId,fname,scene,row,engChrName,engSearchText,engHtmlText,jpnChrName,jpnSearchText,jpnHtmlText,opName,pcIconHtml,evoIconHtml
t1400,11,127,Ferry,(She's really knocked him off guard!),(She's really knocked him off guard!),フェリ,（なんだか露天商さんが   たじろいでます……）,（なんだか露天商さんが<br/>  たじろいでます……）,,"<img class=""itp-kuro"" src=""itp/11/avfc5003_out.webp""/>"
t1400,11,128,Van,"(No kiddin'. Wasn't expectin' her to bust out the puppy dog eyes, but whatever works, I guess.)","(No kiddin'. Wasn't expectin' her to bust out the<br/>puppy dog eyes, but whatever works, I guess.)",ヴァン,（眩しさの不意打ちってヤツだな。   ……段取りとは違うがまあアリか。）,（眩しさの不意打ちってヤツだな。<br/>  ……段取りとは違うがまあアリか。）,,"<img class=""itp-kuro"" src=""itp/11/avfc0000_out.webp""/>"
t1400,11,129,Van,"After hearin' her cry for help, we couldn't leave her out to dry.","After hearin' her cry for help, we couldn't leave her<br/>out to dry.",ヴァン,詳しくは言えねぇが聞くも涙、 語るも涙の事情があってな……,詳しくは言えねぇが聞くも涙、<br/>語るも涙の事情があってな……,,"<img class=""itp-kuro"" src=""itp/11/avfc0000_out.webp""/>"
t1400,11,130,Van,We've been doin' all we can to help get back what's rightfully hers.,We've been doin' all we can to help get back what's<br/>rightfully hers.,ヴァン,俺たちも偶然知っちまって 前から捜索を手伝ってるんだよ。,俺たちも偶然知っちまって<br/>前から捜索を手伝ってるんだよ。,,"<img class=""itp-kuro"" src=""itp/11/avfc0000_out.webp""/>"
t1400,11,131,Van,"Hell, the little one here even flew in from the Central East to help investigate.","Hell, the little one here even flew in from the Central<br/>East to help investigate.",ヴァン,そっちの子なんか遙か大陸中東から 手伝いに駆け付けてくれたくらいだぜ？,そっちの子なんか遙か大陸中東から<br/>手伝いに駆け付けてくれたくらいだぜ？,,"<img class=""itp-kuro"" src=""itp/11/avfc0000_out.webp""/>"
t1400,11,132,Agnes,...Huh?,...Huh?,アニエス,え。,え。,,"<img class=""itp-kuro"" src=""itp/11/avfc5001_out.webp""/>"
t1400,11,133,Ferry,That's right! Arusha teaches us to never ignore someone in need!,That's right! Arusha teaches us to never ignore<br/>someone in need!,フェリ,はいっ、義を見てせざるはですから！ 翼の女神（アルーシャ）のお導きですっ！,はいっ、義を見てせざるはですから！<br/>翼の女神（アルーシャ）のお導きですっ！,,"<img class=""itp-kuro"" src=""itp/11/avfc5003_out.webp""/>"
t1400,11,134,Agnes,F-Feri...,F-Feri...,アニエス,ちょっとフェリちゃん……,ちょっとフェリちゃん……,,"<img class=""itp-kuro"" src=""itp/11/avfc5001_out.webp""/>"
t1400,11,135,Van,"I don't know about you, but I'd feel like a real asshole if I sat by and did nothing knowin' these kids are doin' all they can.","I don't know about you, but I'd feel like a real asshole<br/>if I sat by and did nothing knowin' these kids are<br/>doin' all they can.",ヴァン,見ろ、こんな子供まで 他人のために頑張ってるんだぜ？,見ろ、こんな子供まで<br/>他人のために頑張ってるんだぜ？,,"<img class=""itp-kuro"" src=""itp/11/avfc0000_out.webp""/>"
t1400,11,136,Van,So whaddaya say? Wanna do a good deed in the name of the Heavenly Mother?,So whaddaya say? Wanna do a good deed in the name<br/>of the Heavenly Mother?,ヴァン,アンタもここらで女神、いや天上聖母（てんじょうせいぼ）の 覚えも良くなる功徳を積んじゃあどうだ？,アンタもここらで女神、いや天上聖母（てんじょうせいぼ）の<br/>覚えも良くなる功徳を積んじゃあどうだ？,,"<img class=""itp-kuro"" src=""itp/11/avfc0000_out.webp""/>"
t1400,11,137,Agnes,(There he goes again...),(There he goes again...),アニエス,………ううっ……………,………ううっ……………,,"<img class=""itp-kuro"" src=""itp/11/avfc5001_out.webp""/>"
t1400,11,138,Street vendor Guhan,Sheesh. Talk about laying it on thick! Fine. I'll tell you what I know.,Sheesh. Talk about laying it on thick! Fine. I'll tell<br/>you what I know.,露天商グハン,ったく、何だか知らねぇが そこまで言うなら教えてやるよ。,ったく、何だか知らねぇが<br/>そこまで言うなら教えてやるよ。,,
t1400,11,139,Street vendor Guhan,I had an item that looked just like that picture until just recently.,I had an item that looked just like that picture until<br/>just recently.,露天商グハン,──確かに少し前、その画像と かなり似た装置を扱ってたんだが……,──確かに少し前、その画像と<br/>かなり似た装置を扱ってたんだが……,,
t1400,11,140,Street vendor Guhan,"The thing is...if I were you, I'd give up.","The thing is...if I were you, I'd give up.",露天商グハン,嬢ちゃん、悪いことは言わない。 スッパリ諦めちまいな。,嬢ちゃん、悪いことは言わない。<br/>スッパリ諦めちまいな。,,
t1400,11,141,Agnes,B-But why?,B-But why?,アニエス,そ、それはどうして……？,そ、それはどうして……？,,"<img class=""itp-kuro"" src=""itp/11/avfc5001_out.webp""/>"
t1400,11,142,Ferry,"You must have sold it to someone else, right?","You must have sold it to someone else, right?",フェリ,もう他の人に売ったんですか？,もう他の人に売ったんですか？,,"<img class=""itp-kuro"" src=""itp/11/avfc5003_out.webp""/>"
t1400,11,143,Van,"Point us in their direction, and we can haggle with 'em ourselves.","Point us in their direction, and we can haggle with<br/>'em ourselves.",ヴァン,なら、どんな奴に売ったか教えてくれ。 そいつと直接交渉してみるからよ。,なら、どんな奴に売ったか教えてくれ。<br/>そいつと直接交渉してみるからよ。,,"<img class=""itp-kuro"" src=""itp/11/avfc0000_out.webp""/>"
t1400,11,144,Street vendor Guhan,If only it was that simple...,If only it was that simple...,露天商グハン,それだったらまだ良かったんだが……,それだったらまだ良かったんだが……,,
t1400,11,145,Street vendor Guhan,You guys ever heard of the Messeldam Trading Company?,You guys ever heard of the Messeldam<br/>Trading Company?,露天商グハン,──兄ちゃんたち、 《メッセルダム商事》って知ってるか？,──兄ちゃんたち、<br/>《メッセルダム商事》って知ってるか？,,
t1400,11,146,Van,...'Fraid not. I take it they're from the port city up north?,...'Fraid not. I take it they're from the port city<br/>up north?,ヴァン,……いや、聞き覚えはねぇな。 北の港町の会社ってことか？,……いや、聞き覚えはねぇな。<br/>北の港町の会社ってことか？,,"<img class=""itp-kuro"" src=""itp/11/avfc0000_out.webp""/>"
t1400,11,147,Street vendor Guhan,"Yeah, but if you ever meet someone saying they work for that company, haul ass in the opposite direction.","Yeah, but if you ever meet someone saying they work<br/>for that company, haul ass in the opposite direction.",露天商グハン,もしそう名乗る奴らに出くわしたら とっとと逃げることをお勧めするぜ。,もしそう名乗る奴らに出くわしたら<br/>とっとと逃げることをお勧めするぜ。,,
t1400,11,148,Street vendor Guhan,"Couple of weeks ago or so, a source of mine gave me the thing you're looking for and asked me to sell it off.","Couple of weeks ago or so, a source of mine gave me<br/>the thing you're looking for and asked me to sell<br/>it off.",露天商グハン,──実は半月前、嬢ちゃんの探しモンを とある筋からの処分品として並べていたんだ。,──実は半月前、嬢ちゃんの探しモンを<br/>とある筋からの処分品として並べていたんだ。,,
t1400,11,149,Street vendor Guhan,Somehow it caught the eye of some nasty folks who claimed to work for that company.,Somehow it caught the eye of some nasty folks who<br/>claimed to work for that company.,露天商グハン,そしたら、《メッセルダム商事》を名乗る ガラの悪い連中の目に留まっちまってさ……,そしたら、《メッセルダム商事》を名乗る<br/>ガラの悪い連中の目に留まっちまってさ……,,
t1400,11,150,Street vendor Guhan,"Before I knew it, not only did they come after that device, but they made off with all my best stuff without paying a single mira.","Before I knew it, not only did they come after that<br/>device, but they made off with all my best stuff<br/>without paying a single mira.",露天商グハン,他の高価な品も含めて、ミラも払わずに 問答無用で奪われちまったんだよ！,他の高価な品も含めて、ミラも払わずに<br/>問答無用で奪われちまったんだよ！,,
t1400,11,151,Street vendor Guhan,"I tried to stop them, but they just beat the everloving crap outta me. The wounds still haven't fully healed.","I tried to stop them, but they just beat the everloving<br/>crap outta me. The wounds still haven't fully healed.",露天商グハン,当然抗議をしたら暴力を振るわれてよ…… あの時の傷は今でも治りきってねぇんだ。,当然抗議をしたら暴力を振るわれてよ……<br/>あの時の傷は今でも治りきってねぇんだ。,,
t1400,11,152,Agnes,That's awful...,That's awful...,アニエス,そんな………,そんな………,,"<img class=""itp-kuro"" src=""itp/11/avfc5001_out.webp""/>"
t1400,11,153,Ferry,I can't believe them!,I can't believe them!,フェリ,ひどいです……！,ひどいです……！,,"<img class=""itp-kuro"" src=""itp/11/avfc5003_out.webp""/>"
t1400,11,154,Van,"Hmm. Guessin' you can't take this case to the cops or the guild given the kinds of stuff you sell here, either.","Hmm. Guessin' you can't take this case to the cops or<br/>the guild given the kinds of stuff you sell here, either.",ヴァン,……成程な、この店の品揃えじゃ 警察やギルドにも訴えにくいだろうし。,……成程な、この店の品揃えじゃ<br/>警察やギルドにも訴えにくいだろうし。,,"<img class=""itp-kuro"" src=""itp/11/avfc0000_out.webp""/>"
t1400,11,155,Van,"Even if you could, you wouldn't outta consideration for your source, am I right?","Even if you could, you wouldn't outta consideration<br/>for your source, am I right?",ヴァン,“とある筋”への配慮もありそうだな？,“とある筋”への配慮もありそうだな？,,"<img class=""itp-kuro"" src=""itp/11/avfc0000_out.webp""/>"
t1400,11,156,Street vendor Guhan,You're a sharp one.,You're a sharp one.,露天商グハン,……兄ちゃん、鋭いな。,……兄ちゃん、鋭いな。,,
t1400,11,157,Street vendor Guhan,They said to sell it off quietly for cheap and never speak a word of it ever again.,They said to sell it off quietly for cheap and never<br/>speak a word of it ever again.,露天商グハン,その……一切口外しないで 売られるに任せろって言われたんだよ。,その……一切口外しないで<br/>売られるに任せろって言われたんだよ。,,
t1400,11,158,Street vendor Guhan,"But honest to Aidios, that's all I know.","But honest to Aidios, that's all I know.",露天商グハン,悪いがこれ以上は本当に言えないんだ……,悪いがこれ以上は本当に言えないんだ……,,
t1400,11,159,Agnes,(There's clearly more to this than meets the eye...),(There's clearly more to this than meets the eye...),アニエス,（何か事情がありそうですね……）,（何か事情がありそうですね……）,,"<img class=""itp-kuro"" src=""itp/11/avfc5001_out.webp""/>"
t1400,11,160,Van,(We'll have to leave it here for today.),(We'll have to leave it here for today.),ヴァン,（仕方ない、今日は切り上げるか……）,（仕方ない、今日は切り上げるか……）,,"<img class=""itp-kuro"" src=""itp/11/avfc0000_out.webp""/>"
t1400,11,161,A frivolous voice,Huh? Is this a party or what?,Huh? Is this a party or what?,軽薄そうな声,面白い話をしてんねー？,面白い話をしてんねー？,,
t1400,11,162,A tangled voice,"Real rude of ya not to invite us, old man.","Real rude of ya not to invite us, old man.",絡むような声,オレらも混ぜてくれよ～。,オレらも混ぜてくれよ～。,,
t1400,11,163,Street vendor Guhan,U-Uhh...!,U-Uhh...!,露天商グハン,ひぃぃっ！！,ひぃぃっ！！,,
t1400,11,164,Street vendor Guhan,It's them! If you value your lives—run!,It's them! If you value your lives—run!,露天商グハン,こ、こいつらだ！　俺は逃げるぜ！ 兄ちゃんたちもそうしな！,こ、こいつらだ！　俺は逃げるぜ！<br/>兄ちゃんたちもそうしな！,,
t1400,11,165,Agnes,"You're letting him go, then?","You're letting him go, then?",アニエス,あなた方は……,あなた方は……,,"<img class=""itp-kuro"" src=""itp/11/avfc5001_out.webp""/>"
t1400,11,166,Ferry,That means we're the ones they want.,That means we're the ones they want.,フェリ,狙いはわたしたちのようですね。,狙いはわたしたちのようですね。,,"<img class=""itp-kuro"" src=""itp/11/avfc5003_out.webp""/>"
t1400,11,167,Van,I was wonderin' how long it'd be till those 'employees' came to greet us.,I was wonderin' how long it'd be till those<br/>'employees' came to greet us.,ヴァン,ハン、お出ましみてぇだな。 《メッセルダム商事》の社員諸君。,ハン、お出ましみてぇだな。<br/>《メッセルダム商事》の社員諸君。,,"<img class=""itp-kuro"" src=""itp/11/avfc0000_out.webp""/>"
t1400,11,168,Semi-Gray,"So this is the fixer poking around our business, eh?","So this is the fixer poking around our business, eh?",半グレ,てめえらみてぇだなァ？ 余計な茶々入れてるっつう便利屋は。,てめえらみてぇだなァ？<br/>余計な茶々入れてるっつう便利屋は。,,
t1400,11,169,Semi-Gray,"Didn't hear he had some sweet arm candy with him, though. The lucky asshole.","Didn't hear he had some sweet arm candy with<br/>him, though. The lucky asshole.",半グレ,両手に花で羨ましいじゃ～ん。,両手に花で羨ましいじゃ～ん。,,
t1400,11,170,Semi-Gray,"Ignorin' the runt, I wouldn't mind takin' Blondie for a spin, if you know what I mean.","Ignorin' the runt, I wouldn't mind takin' Blondie for a<br/>spin, if you know what I mean.",半グレ,片方はチンチクリンだが 美形だし味見させてもらおうか？,片方はチンチクリンだが<br/>美形だし味見させてもらおうか？,,
t1400,11,171,Ferry,The...runt?,The...runt?,フェリ,チン……チクリン……？,チン……チクリン……？,,"<img class=""itp-kuro"" src=""itp/11/avfc5003_out.webp""/>"
t1400,11,172,Ferry,(Can I hurt them?),(Can I hurt them?),フェリ,（ヴァンさん。   無力化してもいいですか？）,（ヴァンさん。<br/>  無力化してもいいですか？）,,"<img class=""itp-kuro"" src=""itp/11/avfc5003_out.webp""/>"
t1400,11,173,Van,"(Do what you want—nothin' too extreme, though.)","(Do what you want—nothin' too extreme, though.)",ヴァン,（死なない程度ならな。）,（死なない程度ならな。）,,"<img class=""itp-kuro"" src=""itp/11/avfc0000_out.webp""/>"
t1400,11,174,Ferry,(Understood.),(Understood.),フェリ,（了解（ウーラ）。）,（了解（ウーラ）。）,,"<img class=""itp-kuro"" src=""itp/11/avfc5003_out.webp""/>"
t1400,11,175,Agnes,(I-I'm not sure about this...),(I-I'm not sure about this...),アニエス,（い、いいんでしょうか……）,（い、いいんでしょうか……）,,"<img class=""itp-kuro"" src=""itp/11/avfc5001_out.webp""/>"
t1400,11,176,Semi-Gray,"Got some fire in those eyes, Shortie. I've got a LOT of steam to let off thanks to those local bastards.","Got some fire in those eyes, Shortie. I've got a LOT<br/>of steam to let off thanks to those local bastards.",半グレ,クソガキどもに良いようにされて こっちも我慢の限界なんだ……,クソガキどもに良いようにされて<br/>こっちも我慢の限界なんだ……,,
t1400,11,177,Semi-Gray,You're just the punching bag I've been looking for!,You're just the punching bag I've been looking for!,半グレ,血祭りにしてメチャクチャにしてやるよ！,血祭りにしてメチャクチャにしてやるよ！,,
t1400,11,178,Ferry,Five hostiles confirmed! Commencing dismemberment!,Five hostiles confirmed!<br/>Commencing dismemberment!,フェリ,敵集団、殲滅します！,敵集団、殲滅します！,,"<img class=""itp-kuro"" src=""itp/11/avfc5003_out.webp""/>"
t1400,11,179,Agnes,Dismemberment is the definition of extreme!,Dismemberment is the definition of extreme!,アニエス,せ、殲滅しちゃダメですよ！,せ、殲滅しちゃダメですよ！,,"<img class=""itp-kuro"" src=""itp/11/avfc5001_out.webp""/>"
t1400,12,180,Semi-Gray,Th-The hell? Even the chicks are strong!,Th-The hell? Even the chicks are strong!,半グレ,な、なんだコイツら…… ガキ共も含めて普通じゃねぇぞ！？,な、なんだコイツら……<br/>ガキ共も含めて普通じゃねぇぞ！？,,
t1400,12,181,Semi-Gray,"Can't afford to lose now. Quick, grab the blonde one as a hostage—!","Can't afford to lose now. Quick, grab the blonde one<br/>as a hostage—!",半グレ,もう手段は選ぶな！ その娘を何とか人質に取って──,もう手段は選ぶな！<br/>その娘を何とか人質に取って──,,
t1400,12,182,A carefree voice,Are you losers for real? You get whipped and you STILL won't get the hell outta my town?,Are you losers for real? You get whipped and you<br/>STILL won't get the hell outta my town?,飄々とした声,オイオイ、まだこの街から ケツまくって逃げてなかったのかよ？,"<audio id=""v03_20011""><source src=""talk/11/v03_20011.opus"" type=""audio/ogg; codecs=opus""></audio><a href=""javascript:void(0)"" onclick=""document.getElementById('v03_20011').play()"">オイオイ、まだこの街から<br/>ケツまくって逃げてなかったのかよ？</a>",,
t1400,12,183,Semi-Gray,I-It's him...!,I-It's him...!,半グレ,こ、この声は……！,"<audio id=""v80_20000""><source src=""talk/11/v80_20000.opus"" type=""audio/ogg; codecs=opus""></audio><a href=""javascript:void(0)"" onclick=""document.getElementById('v80_20000').play()"">こ、この声は……！</a>",,
t1400,12,184,Semi-Gray,"Aww, shit...","Aww, shit...",半グレ,まさかッ──！？,"<audio id=""v79_20000""><source src=""talk/11/v79_20000.opus"" type=""audio/ogg; codecs=opus""></audio><a href=""javascript:void(0)"" onclick=""document.getElementById('v79_20000').play()"">まさかッ──！？</a>",,
t1400,12,185,Spectators,It's that vigilante from the Eastern Quarter!,It's that vigilante from the Eastern Quarter!,見物人,あれは…… 東方人街の悪タレか！,"<audio id=""v102_20002""><source src=""talk/11/v102_20002.opus"" type=""audio/ogg; codecs=opus""></audio><a href=""javascript:void(0)"" onclick=""document.getElementById('v102_20002').play()"">あれは……<br/>東方人街の悪タレか！</a>",,
t1400,12,186,Spectators,That's our boy! Go get 'em!,That's our boy! Go get 'em!,見物人,来たか、派手にやれ──！！,"<audio id=""v103_20001""><source src=""talk/11/v103_20001.opus"" type=""audio/ogg; codecs=opus""></audio><a href=""javascript:void(0)"" onclick=""document.getElementById('v103_20001').play()"">来たか、派手にやれ──！！</a>",,
t1400,12,187,Agnes,That must be him...,That must be him...,アニエス,あ、あの人が……,"<audio id=""v01_20012""><source src=""talk/11/v01_20012.opus"" type=""audio/ogg; codecs=opus""></audio><a href=""javascript:void(0)"" onclick=""document.getElementById('v01_20012').play()"">あ、あの人が……</a>",,"<img class=""itp-kuro"" src=""itp/11/avfc5001_out.webp""/>"
t1400,12,188,Ferry,It's Aaron!,It's Aaron!,フェリ,アーロン・ウェイさん……！,"<audio id=""v02_20010""><source src=""talk/11/v02_20010.opus"" type=""audio/ogg; codecs=opus""></audio><a href=""javascript:void(0)"" onclick=""document.getElementById('v02_20010').play()"">アーロン・ウェイさん……！</a>",,"<img class=""itp-kuro"" src=""itp/11/avfc5003_out.webp""/>"
t1400,12,189,Van,Right on cue.,Right on cue.,ヴァン,このタイミング…… 狙ってやがったな？,"<audio id=""v00_20023""><source src=""talk/11/v00_20023.opus"" type=""audio/ogg; codecs=opus""></audio><a href=""javascript:void(0)"" onclick=""document.getElementById('v00_20023').play()"">このタイミング……<br/>狙ってやがったな？</a>",,"<img class=""itp-kuro"" src=""itp/11/avfc0000_out.webp""/>"
t1400,12,190,Semi-Gray,Ugh...,Ugh...,半グレ,くっ……,"<audio id=""v79_20001""><source src=""talk/11/v79_20001.opus"" type=""audio/ogg; codecs=opus""></audio><a href=""javascript:void(0)"" onclick=""document.getElementById('v79_20001').play()"">くっ……</a>",,
t1400,12,191,Semi-Gray,"C'mon, we gotta go...!","C'mon, we gotta go...!",半グレ,ここは一旦──,"<audio id=""v80_20001""><source src=""talk/11/v80_20001.opus"" type=""audio/ogg; codecs=opus""></audio><a href=""javascript:void(0)"" onclick=""document.getElementById('v80_20001').play()"">ここは一旦──</a>",,
t1400,12,192,Aaron,Heheh... Seriously? Like I'd let you run away now!,Heheh... Seriously? Like I'd let you run away now!,アーロン,クク……ボケが。 逃げられるワケねえだろ──！！,"<audio id=""v03_20012""><source src=""talk/11/v03_20012.opus"" type=""audio/ogg; codecs=opus""></audio><a href=""javascript:void(0)"" onclick=""document.getElementById('v03_20012').play()"">クク……ボケが。<br/>逃げられるワケねえだろ──！！</a>",,
t1400,12,193,Aaron,Sei! Huang!,Sei! Huang!,アーロン,セイ！　ホアン！,"<audio id=""v03_20013""><source src=""talk/11/v03_20013.opus"" type=""audio/ogg; codecs=opus""></audio><a href=""javascript:void(0)"" onclick=""document.getElementById('v03_20013').play()"">セイ！　ホアン！</a>",,
t1400,12,194,Oriental Youth,Got it!,Got it!,東方人の青年,おお──！！,"<audio id=""v110_20003""><source src=""talk/11/v110_20003.opus"" type=""audio/ogg; codecs=opus""></audio><a href=""javascript:void(0)"" onclick=""document.getElementById('v110_20003').play()"">おお──！！</a>",,
t1400,12,195,Oriental Youth,I've been waitin' for this!,I've been waitin' for this!,東方人の青年,待ってましたァ！！,"<audio id=""v109_20000""><source src=""talk/11/v109_20000.opus"" type=""audio/ogg; codecs=opus""></audio><a href=""javascript:void(0)"" onclick=""document.getElementById('v109_20000').play()"">待ってましたァ！！</a>",,
t1400,12,196,Spectators,Look at him go!,Look at him go!,見物人,おおっ、さすが《麒麟児》だぜ！,"<audio id=""v103_20900""><source src=""talk/11/v103_20900.opus"" type=""audio/ogg; codecs=opus""></audio><a href=""javascript:void(0)"" onclick=""document.getElementById('v103_20900').play()"">おおっ、さすが《麒麟児》だぜ！</a>",,
t1400,12,197,Spectators,"Doing us proud, one butt-kicking at a time.","Doing us proud, one butt-kicking at a time.",見物人,《羅州の小覇王》って名前も 伊達じゃなさそうだな……！,"<audio id=""v102_20003""><source src=""talk/11/v102_20003.opus"" type=""audio/ogg; codecs=opus""></audio><a href=""javascript:void(0)"" onclick=""document.getElementById('v102_20003').play()"">《羅州の小覇王》って名前も<br/>伊達じゃなさそうだな……！</a>",,
t1400,12,198,Agnes,He got them in one fell swoop.,He got them in one fell swoop.,アニエス,凄いですね……,"<audio id=""v01_20013""><source src=""talk/11/v01_20013.opus"" type=""audio/ogg; codecs=opus""></audio><a href=""javascript:void(0)"" onclick=""document.getElementById('v01_20013').play()"">凄いですね……</a>",,"<img class=""itp-kuro"" src=""itp/11/avfc5001_out.webp""/>"
t1400,12,199,Ferry,"A fast swoop, too!","A fast swoop, too!",フェリ,……はい、それに迅さも。,"<audio id=""v02_20011""><source src=""talk/11/v02_20011.opus"" type=""audio/ogg; codecs=opus""></audio><a href=""javascript:void(0)"" onclick=""document.getElementById('v02_20011').play()"">……はい、それに迅さも。</a>",,"<img class=""itp-kuro"" src=""itp/11/avfc5003_out.webp""/>"
t1400,12,200,Van,Guess the stories didn't quite do him justice.,Guess the stories didn't quite do him justice.,ヴァン,ああ──予想以上だな。,"<audio id=""v00_20024""><source src=""talk/11/v00_20024.opus"" type=""audio/ogg; codecs=opus""></audio><a href=""javascript:void(0)"" onclick=""document.getElementById('v00_20024').play()"">ああ──予想以上だな。</a>",,"<img class=""itp-kuro"" src=""itp/11/avfc0000_out.webp""/>"
t1400,12,201,Aaron,I take it you're the guys Cao hired?,I take it you're the guys Cao hired?,アーロン,よお、アンタらが ツァオに雇われたっつー連中だな？,"<audio id=""v03_20014""><source src=""talk/11/v03_20014.opus"" type=""audio/ogg; codecs=opus""></audio><a href=""javascript:void(0)"" onclick=""document.getElementById('v03_20014').play()"">よお、アンタらが<br/>ツァオに雇われたっつー連中だな？</a>",,
