gameId,fname,scene,row,engChrName,engSearchText,engHtmlText,jpnChrName,jpnSearchText,jpnHtmlText,opName,pcIconHtml,evoIconHtml
t1400,12,202,Aaron,"I'd love to give you a proper Langport welcome, but, well—","I'd love to give you a proper Langport welcome, but,<br/>well—",アーロン,首都くんだりから煌都へようこそと 歓迎したい所だが──,"<audio id=""v03_20015""><source src=""talk/11/v03_20015.opus"" type=""audio/ogg; codecs=opus""></audio><a href=""javascript:void(0)"" onclick=""document.getElementById('v03_20015').play()"">首都くんだりから煌都へようこそと<br/>歓迎したい所だが──</a>",,
t1400,12,203,Ferry,Watch out!,Watch out!,フェリ,危ない！！,"<audio id=""v02_20012""><source src=""talk/11/v02_20012.opus"" type=""audio/ogg; codecs=opus""></audio><a href=""javascript:void(0)"" onclick=""document.getElementById('v02_20012').play()"">危ない！！</a>",,"<img class=""itp-kuro"" src=""itp/11/avfc5003_out.webp""/>"
t1400,12,204,Ferry,Ugh!,Ugh!,フェリ,くっ……！,"<audio id=""v02_20013""><source src=""talk/11/v02_20013.opus"" type=""audio/ogg; codecs=opus""></audio><a href=""javascript:void(0)"" onclick=""document.getElementById('v02_20013').play()"">くっ……！</a>",,"<img class=""itp-kuro"" src=""itp/11/avfc5003_out.webp""/>"
t1400,12,205,Aaron,Let me guess—jaeger brat?,Let me guess—jaeger brat?,アーロン,へぇ、猟兵ってヤツか？ その歳にしちゃやるじゃねーか。,"<audio id=""v03_20016""><source src=""talk/11/v03_20016.opus"" type=""audio/ogg; codecs=opus""></audio><a href=""javascript:void(0)"" onclick=""document.getElementById('v03_20016').play()"">へぇ、猟兵ってヤツか？<br/>その歳にしちゃやるじゃねーか。</a>",,
t1400,12,206,Aaron,"Not bad, small fry, but my beef is with the old fart behind you.","Not bad, small fry, but my beef is with the old fart<br/>behind you.",アーロン,──だがすっこんでな、チビ。 てめえじゃそのオッサンの足手まといだ。,"<audio id=""v03_20017""><source src=""talk/11/v03_20017.opus"" type=""audio/ogg; codecs=opus""></audio><a href=""javascript:void(0)"" onclick=""document.getElementById('v03_20017').play()"">──だがすっこんでな、チビ。<br/>てめえじゃそのオッサンの足手まといだ。</a>",,
t1400,12,207,Ferry,...,...,フェリ,ッ……,"<audio id=""v02_20014""><source src=""talk/11/v02_20014.opus"" type=""audio/ogg; codecs=opus""></audio><a href=""javascript:void(0)"" onclick=""document.getElementById('v02_20014').play()"">ッ……</a>",,"<img class=""itp-kuro"" src=""itp/11/avfc5003_out.webp""/>"
t1400,12,208,Van,"Come on, man. I'm only twenty-four!","Come on, man. I'm only twenty-four!",ヴァン,誰がオッサンだ、誰が！,"<audio id=""v00_20025""><source src=""talk/11/v00_20025.opus"" type=""audio/ogg; codecs=opus""></audio><a href=""javascript:void(0)"" onclick=""document.getElementById('v00_20025').play()"">誰がオッサンだ、誰が！</a>",,"<img class=""itp-kuro"" src=""itp/11/avfc0000_out.webp""/>"
t1400,12,209,Van,You really that bent out of shape about outsiders butting in?,You really that bent out of shape about outsiders<br/>butting in?,ヴァン,──確かにとんだ跳ねっ返りだな。 ヨソ者に出張られて面白くねえって所か？,"<audio id=""v00_20026""><source src=""talk/11/v00_20026.opus"" type=""audio/ogg; codecs=opus""></audio><a href=""javascript:void(0)"" onclick=""document.getElementById('v00_20026').play()"">──確かにとんだ跳ねっ返りだな。<br/>ヨソ者に出張られて面白くねえって所か？</a>",,"<img class=""itp-kuro"" src=""itp/11/avfc0000_out.webp""/>"
t1400,12,210,Aaron,"Ding, ding! We have a winner!","Ding, ding! We have a winner!",アーロン,ピンポンピンポン～❤,"<audio id=""v03_20018""><source src=""talk/11/v03_20018.opus"" type=""audio/ogg; codecs=opus""></audio><a href=""javascript:void(0)"" onclick=""document.getElementById('v03_20018').play()"">ピンポンピンポン～❤</a>",,
t1400,12,211,Aaron,"If Heiyue is gonna let things go to shit, then it's up to us to handle things around here.","If Heiyue is gonna let things go to shit, then it's up to<br/>us to handle things around here.",アーロン,黒月が様子見してんなら オレらがやるのがスジってもんだろう？,"<audio id=""v03_20019""><source src=""talk/11/v03_20019.opus"" type=""audio/ogg; codecs=opus""></audio><a href=""javascript:void(0)"" onclick=""document.getElementById('v03_20019').play()"">黒月が様子見してんなら<br/>オレらがやるのがスジってもんだろう？</a>",,
t1400,12,212,Aaron,"And if I can't trust Heiyue, then I sure as hell can't trust their dog either!","And if I can't trust Heiyue, then I sure as hell can't<br/>trust their dog either!",アーロン,すっこんでろやオッサン── この街の流儀が分からねえならな……！！,"<audio id=""v03_20020""><source src=""talk/11/v03_20020.opus"" type=""audio/ogg; codecs=opus""></audio><a href=""javascript:void(0)"" onclick=""document.getElementById('v03_20020').play()"">すっこんでろやオッサン──<br/>この街の流儀が分からねえならな……！！</a>",,
t1400,13,213,Spectators,Whoa! What a show!,Whoa! What a show!,見物人,うおおおっ……！ なんだこの勝負は！？,"<audio id=""v102_20004""><source src=""talk/11/v102_20004.opus"" type=""audio/ogg; codecs=opus""></audio><a href=""javascript:void(0)"" onclick=""document.getElementById('v102_20004').play()"">うおおおっ……！<br/>なんだこの勝負は！？</a>",,
t1400,13,214,Spectators,"Aaron's strong, but that guy in blue's no pushover! Keep it up!","Aaron's strong, but that guy in blue's no pushover!<br/>Keep it up!",見物人,アーロンもだが余所者もやるぞ！ いいぞ、もっとやれ──！,"<audio id=""v103_20002""><source src=""talk/11/v103_20002.opus"" type=""audio/ogg; codecs=opus""></audio><a href=""javascript:void(0)"" onclick=""document.getElementById('v103_20002').play()"">アーロンもだが余所者もやるぞ！<br/>いいぞ、もっとやれ──！</a>",,
t1400,13,215,Oriental Youth,That guy's a beast!,That guy's a beast!,東方人の青年,強ぇ──あの野郎……！,"<audio id=""v110_20004""><source src=""talk/11/v110_20004.opus"" type=""audio/ogg; codecs=opus""></audio><a href=""javascript:void(0)"" onclick=""document.getElementById('v110_20004').play()"">強ぇ──あの野郎……！</a>",,
t1400,13,216,Oriental Youth,Aaron! Isn't that enough already...?,Aaron! Isn't that enough already...?,東方人の青年,アーロン！ 様子見ならこのくらいで……,"<audio id=""v109_20001""><source src=""talk/11/v109_20001.opus"" type=""audio/ogg; codecs=opus""></audio><a href=""javascript:void(0)"" onclick=""document.getElementById('v109_20001').play()"">アーロン！<br/>様子見ならこのくらいで……</a>",,
t1400,13,217,Aaron,No way I'm gonna give up now!,No way I'm gonna give up now!,アーロン,ハッハー、邪魔すんなって！,"<audio id=""v03_20021""><source src=""talk/11/v03_20021.opus"" type=""audio/ogg; codecs=opus""></audio><a href=""javascript:void(0)"" onclick=""document.getElementById('v03_20021').play()"">ハッハー、邪魔すんなって！</a>",,"<img class=""itp-kuro"" src=""itp/11/avfc0002_out.webp""/>"
t1400,13,218,Aaron,Not until this dude is begging at my feet for mercy!,Not until this dude is begging at my feet for mercy!,アーロン,このオッサンの膝を付かせたら 仕舞いにするからよ！！,"<audio id=""v03_20022""><source src=""talk/11/v03_20022.opus"" type=""audio/ogg; codecs=opus""></audio><a href=""javascript:void(0)"" onclick=""document.getElementById('v03_20022').play()"">このオッサンの膝を付かせたら<br/>仕舞いにするからよ！！</a>",,"<img class=""itp-kuro"" src=""itp/11/avfc0002_out.webp""/>"
t1400,13,219,Agnes,Wh-Who's going to win?,Wh-Who's going to win?,アニエス,ど、どうやって止めれば……,"<audio id=""v01_20014""><source src=""talk/11/v01_20014.opus"" type=""audio/ogg; codecs=opus""></audio><a href=""javascript:void(0)"" onclick=""document.getElementById('v01_20014').play()"">ど、どうやって止めれば……</a>",,"<img class=""itp-kuro"" src=""itp/11/avfc5001_out.webp""/>"
t1400,13,220,Ferry,It's hard to say—they're evenly matched.,It's hard to say—they're evenly matched.,フェリ,ここまで伯仲すると 難しいかもです……,"<audio id=""v02_20015""><source src=""talk/11/v02_20015.opus"" type=""audio/ogg; codecs=opus""></audio><a href=""javascript:void(0)"" onclick=""document.getElementById('v02_20015').play()"">ここまで伯仲すると<br/>難しいかもです……</a>",,"<img class=""itp-kuro"" src=""itp/11/avfc5003_out.webp""/>"
t1400,13,221,Van,"(Not too shabby, but it's 'bout time I wrapped this up.)","(Not too shabby, but it's 'bout time I wrapped<br/>this up.)",ヴァン,（いい動きをしてやがんな……   ──なら、“巻き取る”か。）,"<audio id=""v00_20027""><source src=""talk/11/v00_20027.opus"" type=""audio/ogg; codecs=opus""></audio><a href=""javascript:void(0)"" onclick=""document.getElementById('v00_20027').play()"">（いい動きをしてやがんな……<br/>  ──なら、“巻き取る”か。）</a>",,"<img class=""itp-kuro"" src=""itp/11/avfc0000_out.webp""/>"
t1400,13,222,A dignified voice,That's quite enough.,That's quite enough.,凛とした声,いい加減にしなさい──！,"<audio id=""v09_20001""><source src=""talk/11/v09_20001.opus"" type=""audio/ogg; codecs=opus""></audio><a href=""javascript:void(0)"" onclick=""document.getElementById('v09_20001').play()"">いい加減にしなさい──！</a>",,"<img class=""itp-kuro"" src=""itp/11/avfc5110_out.webp""/>"
t1400,13,223,Agnes,Where did she come from?!,Where did she come from?!,アニエス,エレインさん……！？,"<audio id=""v01_20015""><source src=""talk/11/v01_20015.opus"" type=""audio/ogg; codecs=opus""></audio><a href=""javascript:void(0)"" onclick=""document.getElementById('v01_20015').play()"">エレインさん……！？</a>",,"<img class=""itp-kuro"" src=""itp/11/avfc5001_out.webp""/>"
t1400,13,224,Ferry,It's that bracer from before...,It's that bracer from before...,フェリ,遊撃士の……,"<audio id=""v02_20016""><source src=""talk/11/v02_20016.opus"" type=""audio/ogg; codecs=opus""></audio><a href=""javascript:void(0)"" onclick=""document.getElementById('v02_20016').play()"">遊撃士の……</a>",,"<img class=""itp-kuro"" src=""itp/11/avfc5003_out.webp""/>"
t1400,13,225,Spectators,Is that Beauty's Blade?!,Is that Beauty's Blade?!,見物人,ソ、《剣の乙女（ソードメイデン）》……！？,"<audio id=""v103_20003""><source src=""talk/11/v103_20003.opus"" type=""audio/ogg; codecs=opus""></audio><a href=""javascript:void(0)"" onclick=""document.getElementById('v103_20003').play()"">ソ、《剣の乙女（ソードメイデン）》……！？</a>",,
t1400,13,226,Spectators,Yeah! The famous A-rank bracer!,Yeah! The famous A-rank bracer!,見物人,あの有名なＡ級遊撃士の……,"<audio id=""v102_20005""><source src=""talk/11/v102_20005.opus"" type=""audio/ogg; codecs=opus""></audio><a href=""javascript:void(0)"" onclick=""document.getElementById('v102_20005').play()"">あの有名なＡ級遊撃士の……</a>",,
t1400,13,227,Spectators,But what's she doing here?,But what's she doing here?,見物人,どうしてここに！？,"<audio id=""v103_20004""><source src=""talk/11/v103_20004.opus"" type=""audio/ogg; codecs=opus""></audio><a href=""javascript:void(0)"" onclick=""document.getElementById('v103_20004').play()"">どうしてここに！？</a>",,
t1400,13,228,Semi-Gray,You gotta be kidding me...,You gotta be kidding me...,半グレ,う、嘘だろ……,"<audio id=""v79_20002""><source src=""talk/11/v79_20002.opus"" type=""audio/ogg; codecs=opus""></audio><a href=""javascript:void(0)"" onclick=""document.getElementById('v79_20002').play()"">う、嘘だろ……</a>",,
t1400,13,229,Oriental Youth,Holy crap...,Holy crap...,東方人の青年,………マジかよ………,"<audio id=""v110_20005""><source src=""talk/11/v110_20005.opus"" type=""audio/ogg; codecs=opus""></audio><a href=""javascript:void(0)"" onclick=""document.getElementById('v110_20005').play()"">………マジかよ………</a>",,
t1400,13,230,Elaine,I'll have to ask you all to refrain from fighting in public spaces.,I'll have to ask you all to refrain from fighting in<br/>public spaces.,エレイン,曲がりなりにも公共の場── 私闘は禁じられています。,"<audio id=""v09_20002""><source src=""talk/11/v09_20002.opus"" type=""audio/ogg; codecs=opus""></audio><a href=""javascript:void(0)"" onclick=""document.getElementById('v09_20002').play()"">曲がりなりにも公共の場──<br/>私闘は禁じられています。</a>",,"<img class=""itp-kuro"" src=""itp/11/avfc5110_out.webp""/>"
t1400,13,231,Elaine,Do I make myself clear?,Do I make myself clear?,エレイン,そちら</B>の貴方たちも この上まだ暴れ足りませんか？,"<audio id=""v09_20003""><source src=""talk/11/v09_20003.opus"" type=""audio/ogg; codecs=opus""></audio><a href=""javascript:void(0)"" onclick=""document.getElementById('v09_20003').play()"">そちら</B>の貴方たちも<br/>この上まだ暴れ足りませんか？</a>",,"<img class=""itp-kuro"" src=""itp/11/avfc5110_out.webp""/>"
t1400,13,232,Semi-Gray,Don't let that pretty face fool you. She mopped the floor with a bunch of us back home...,Don't let that pretty face fool you. She mopped the<br/>floor with a bunch of us back home...,半グレ,クソが……お綺麗なツラして 前にも地元のチームを一人で……,"<audio id=""v81_20000""><source src=""talk/11/v81_20000.opus"" type=""audio/ogg; codecs=opus""></audio><a href=""javascript:void(0)"" onclick=""document.getElementById('v81_20000').play()"">クソが……お綺麗なツラして<br/>前にも地元のチームを一人で……</a>",,
t1400,13,233,Semi-Gray,I don't care! I ain't gonna let some lady talk down to me!,I don't care! I ain't gonna let some lady talk down<br/>to me!,半グレ,な、何が乙女だ……！ 女ごときにこれ以上舐めた真似──,"<audio id=""v82_20000""><source src=""talk/11/v82_20000.opus"" type=""audio/ogg; codecs=opus""></audio><a href=""javascript:void(0)"" onclick=""document.getElementById('v82_20000').play()"">な、何が乙女だ……！<br/>女ごときにこれ以上舐めた真似──</a>",,
t1400,13,234,Semi-Gray,Eeeeeek!,Eeeeeek!,半グレ,ひぃぃ……！！,"<audio id=""v82_20001""><source src=""talk/11/v82_20001.opus"" type=""audio/ogg; codecs=opus""></audio><a href=""javascript:void(0)"" onclick=""document.getElementById('v82_20001').play()"">ひぃぃ……！！</a>",,
t1400,13,235,Semi-Gray,You haven't seen the last of us!,You haven't seen the last of us!,半グレ,覚えてろおおっ……！！,"<audio id=""v81_20001""><source src=""talk/11/v81_20001.opus"" type=""audio/ogg; codecs=opus""></audio><a href=""javascript:void(0)"" onclick=""document.getElementById('v81_20001').play()"">覚えてろおおっ……！！</a>",,
t1400,13,236,Aaron,Didn't think I'd be running into a celeb today.,Didn't think I'd be running into a<br/>celeb today.,アーロン,ハッ…… 噂のソード・メイデン殿か。,"<audio id=""v03_20024""><source src=""talk/11/v03_20024.opus"" type=""audio/ogg; codecs=opus""></audio><a href=""javascript:void(0)"" onclick=""document.getElementById('v03_20024').play()"">ハッ……<br/>噂のソード・メイデン殿か。</a>",,"<img class=""itp-kuro"" src=""itp/11/avfc0002_out.webp""/>"
t1400,13,237,Aaron,"Look here. Do what you want with pops over there, but those punks are our problem.","Look here. Do what you want with pops over there,<br/>but those punks are our problem.",アーロン,──このオッサンはともかく 連中についてはオレたちの問題だ。,"<audio id=""v03_20025""><source src=""talk/11/v03_20025.opus"" type=""audio/ogg; codecs=opus""></audio><a href=""javascript:void(0)"" onclick=""document.getElementById('v03_20025').play()"">──このオッサンはともかく<br/>連中についてはオレたちの問題だ。</a>",,"<img class=""itp-kuro"" src=""itp/11/avfc0002_out.webp""/>"
t1400,13,238,Aaron,"Doubt the guild wants to stick their nose in Heiyue's business, am I right?","Doubt the guild wants to stick their nose in Heiyue's<br/>business, am I right?",アーロン,《黒月》すら差し置いて 遊撃士が首を突っ込むつもりかよ？,"<audio id=""v03_20026""><source src=""talk/11/v03_20026.opus"" type=""audio/ogg; codecs=opus""></audio><a href=""javascript:void(0)"" onclick=""document.getElementById('v03_20026').play()"">《黒月》すら差し置いて<br/>遊撃士が首を突っ込むつもりかよ？</a>",,"<img class=""itp-kuro"" src=""itp/11/avfc0002_out.webp""/>"
t1400,13,239,Elaine,"Normally, yes—but so long as you're ordinary citizens, it is our duty as bracers to ensure your safety.","Normally, yes—but so long as you're ordinary<br/>citizens, it is our duty as bracers to ensure your safety.",エレイン,ええ、貴方たちが黒月に属さぬ民間人なら 《支える籠手》の名に賭けて──,"<audio id=""v09_20004""><source src=""talk/11/v09_20004.opus"" type=""audio/ogg; codecs=opus""></audio><a href=""javascript:void(0)"" onclick=""document.getElementById('v09_20004').play()"">ええ、貴方たちが黒月に属さぬ民間人なら<br/>《支える籠手》の名に賭けて──</a>",,"<img class=""itp-kuro"" src=""itp/11/avfc5110_out.webp""/>"
t1400,13,240,Elaine,"Though judging by your swordsmanship earlier, I don't imagine you'll be needing our protection.","Though judging by your swordsmanship earlier, I<br/>don't imagine you'll be needing our protection.",エレイン,……まあ、先ほどの腕前を見る限り 優先度は低そうですが。,"<audio id=""v09_20005""><source src=""talk/11/v09_20005.opus"" type=""audio/ogg; codecs=opus""></audio><a href=""javascript:void(0)"" onclick=""document.getElementById('v09_20005').play()"">……まあ、先ほどの腕前を見る限り<br/>優先度は低そうですが。</a>",,"<img class=""itp-kuro"" src=""itp/11/avfc5110_out.webp""/>"
t1400,13,241,Aaron,Glad to hear it.,Glad to hear it.,アーロン,ならいい──癪だが アンタが格上なのは認めてやるよ。,"<audio id=""v03_20027""><source src=""talk/11/v03_20027.opus"" type=""audio/ogg; codecs=opus""></audio><a href=""javascript:void(0)"" onclick=""document.getElementById('v03_20027').play()"">ならいい──癪だが<br/>アンタが格上なのは認めてやるよ。</a>",,"<img class=""itp-kuro"" src=""itp/11/avfc0002_out.webp""/>"
t1400,13,242,Aaron,"Keep the guild out of our way, and we won't have any problems.","Keep the guild out of our way, and we won't have<br/>any problems.",アーロン,こっちもギルドと対立するつもりはねぇ、 余計な手出しさえしなけりゃな。,"<audio id=""v03_20028""><source src=""talk/11/v03_20028.opus"" type=""audio/ogg; codecs=opus""></audio><a href=""javascript:void(0)"" onclick=""document.getElementById('v03_20028').play()"">こっちもギルドと対立するつもりはねぇ、<br/>余計な手出しさえしなけりゃな。</a>",,"<img class=""itp-kuro"" src=""itp/11/avfc0002_out.webp""/>"
t1400,13,243,Aaron,Same goes for you guys.,Same goes for you guys.,アーロン,クク……てめえらも同じだ。 オレたちの邪魔だけはすんじゃねえ。,"<audio id=""v03_20029""><source src=""talk/11/v03_20029.opus"" type=""audio/ogg; codecs=opus""></audio><a href=""javascript:void(0)"" onclick=""document.getElementById('v03_20029').play()"">クク……てめえらも同じだ。<br/>オレたちの邪魔だけはすんじゃねえ。</a>",,"<img class=""itp-kuro"" src=""itp/11/avfc0002_out.webp""/>"
t1400,13,244,Aaron,"Go dance in the Lu family's palm for a while, see the sights, and then get the hell outta my town.","Go dance in the Lu family's palm for a while, see the<br/>sights, and then get the hell outta my town.",アーロン,せいぜいルウ家の使いっ走りとして ぬりぃ人助けと観光だけして帰るんだな。,"<audio id=""v03_20030""><source src=""talk/11/v03_20030.opus"" type=""audio/ogg; codecs=opus""></audio><a href=""javascript:void(0)"" onclick=""document.getElementById('v03_20030').play()"">せいぜいルウ家の使いっ走りとして<br/>ぬりぃ人助けと観光だけして帰るんだな。</a>",,"<img class=""itp-kuro"" src=""itp/11/avfc0002_out.webp""/>"
t1400,13,245,Van,Hmph. That kid's even more of a handful than I was expectin'.,Hmph. That kid's even more of a handful than I<br/>was expectin'.,ヴァン,ったく……実力はともかく、 聞いてた以上のこじらせぶりだな。,ったく……実力はともかく、<br/>聞いてた以上のこじらせぶりだな。,,"<img class=""itp-kuro"" src=""itp/11/avfc0000_out.webp""/>"
t1400,13,246,Elaine,"Hello, pot. I'm kettle.","Hello, pot. I'm kettle.",エレイン,人のことを言えるのかしら？,人のことを言えるのかしら？,,"<img class=""itp-kuro"" src=""itp/11/avfc5110_out.webp""/>"
t1400,13,247,Ferry,The way you broke up that fight was amazing!,The way you broke up that fight was amazing!,フェリ,先ほどの仲裁、お見事でした！,先ほどの仲裁、お見事でした！,,"<img class=""itp-kuro"" src=""itp/11/avfc5003_out.webp""/>"
t1400,13,248,Agnes,Sorry we ended up causing you trouble.,Sorry we ended up causing you trouble.,アニエス,……その、すみません。 お手数をおかけしてしまって……,……その、すみません。<br/>お手数をおかけしてしまって……,,"<img class=""itp-kuro"" src=""itp/11/avfc5001_out.webp""/>"
t1400,13,249,Elaine,"Don't worry, it's all part of the job.","Don't worry, it's all part of the job.",エレイン,ふう……気にしないで。 あれも遊撃士の仕事だしね。,ふう……気にしないで。<br/>あれも遊撃士の仕事だしね。,,"<img class=""itp-kuro"" src=""itp/11/avfc5110_out.webp""/>"
t1400,13,250,Elaine,As is making sure everyday people aren't dragged into dangerous situations.,As is making sure everyday people aren't dragged into<br/>dangerous situations.,エレイン,民間人を危険に 巻き込ませない</B>のも含めて。,<B>民間人を危険に<br/>巻き込ませない</B>のも含めて。,,"<img class=""itp-kuro"" src=""itp/11/avfc5110_out.webp""/>"
t1400,13,251,Agnes,Oh...,Oh...,アニエス,ううっ……,ううっ……,,"<img class=""itp-kuro"" src=""itp/11/avfc5001_out.webp""/>"
t1400,13,252,Van,"I hear ya, all right?","I hear ya, all right?",ヴァン,あー、なんだ……,あー、なんだ……,,"<img class=""itp-kuro"" src=""itp/11/avfc0000_out.webp""/>"
t1400,13,253,Van,"Anyway, since we're here, why don't we go grab a bite?","Anyway, since we're here, why don't we go grab<br/>a bite?",ヴァン,……折角の煌都だし 適当な所でメシでも喰うか？,……折角の煌都だし<br/>適当な所でメシでも喰うか？,,"<img class=""itp-kuro"" src=""itp/11/avfc0000_out.webp""/>"
t1400,14,254,Van,(This is the place. Better make sure we're ready before we head in.),(This is the place. Better make sure we're ready before<br/>we head in.),ヴァン,（そこが例の大型倉庫か……   準備ができたら探ってみるぞ。）,（そこが例の大型倉庫か……<br/>  準備ができたら探ってみるぞ。）,,"<img class=""itp-kuro"" src=""itp/11/avfc0000_out.webp""/>"
t1400,15,255,Agnes,This is where they've been hiding?,This is where they've been hiding?,アニエス,ここが《サルバッド通運》が 先月から借りているという大型倉庫……,ここが《サルバッド通運》が<br/>先月から借りているという大型倉庫……,,"<img class=""itp-kuro"" src=""itp/11/avfc5001_out.webp""/>"
t1400,15,256,Van,Yeah. Almata's base on the front lines for fightin' Heiyue.,Yeah. Almata's base on the front lines for<br/>fightin' Heiyue.,ヴァン,ああ、アルマータの 対黒月の前線基地の筈だが……,ああ、アルマータの<br/>対黒月の前線基地の筈だが……,,"<img class=""itp-kuro"" src=""itp/11/avfc0000_out.webp""/>"
t1400,15,257,Van,"(But if so, why ain't I sensin' any people around here? Wait... There is somethin' faint.)","(But if so, why ain't I sensin' any people around here?<br/>Wait... There is somethin' faint.)",ヴァン,（人の気配が……   ……いや、微かに匂いやがるな。）,（人の気配が……<br/>  ……いや、微かに匂いやがるな。）,,"<img class=""itp-kuro"" src=""itp/11/avfc0000_out.webp""/>"
t1400,15,258,Ferry,Ohh! Look at that!,Ohh! Look at that!,フェリ,ヴァンさん、アニエスさん、 見てください！,ヴァンさん、アニエスさん、<br/>見てください！,,"<img class=""itp-kuro"" src=""itp/11/avfc5003_out.webp""/>"
t1400,15,259,Ferry,The lock is broken.,The lock is broken.,フェリ,カギが、壊されています。,カギが、壊されています。,,"<img class=""itp-kuro"" src=""itp/11/avfc5003_out.webp""/>"
t1400,15,260,Van,"Looks like someone busted in, if you ask me.","Looks like someone busted in, if you ask me.",ヴァン,……壊されてるっつうより、 “断ち切られて”やがるな。,……壊されてるっつうより、<br/>“断ち切られて”やがるな。,,"<img class=""itp-kuro"" src=""itp/11/avfc0000_out.webp""/>"
