gameId,fname,scene,row,engChrName,engSearchText,engHtmlText,jpnChrName,jpnSearchText,jpnHtmlText,opName,pcIconHtml,evoIconHtml
t2200,1,1,CHR_THIS,"Temporary placement to check event progression. Once sub-events have been officially added, please delete.","Temporary placement to check event progression.<br/>Once sub-events have been officially added,<br/>please delete.",CHR_THIS,イベント進行確認用に仮配置しています。 ※サブイベントが正式入力しましたら削除をお願いいたします。,イベント進行確認用に仮配置しています。<br/>※サブイベントが正式入力しましたら削除をお願いいたします。,,
t2200,2,2,CHR_THIS,These settings are for checking mob placement during day/evening/night. Remove these once they are no longer needed.,These settings are for checking mob placement<br/>during day/evening/night. Remove these once they<br/>are no longer needed.,CHR_THIS,昼・夕・夜のモブ配置確認用です。 ※不要になりましたら削除をお願いいたします。,昼・夕・夜のモブ配置確認用です。<br/>※不要になりましたら削除をお願いいたします。,,
t2200,3,3,,HP and EP were fully restored!,HP and EP were fully restored!,,ＨＰ・ＥＰが全回復した！,<C1>ＨＰ・ＥＰが全回復した！,,
t2200,4,4,Rasham,"I always knew something was fishy about those orbal hookahs, but I never imagined they were using unapproved ingredients!","I always knew something was fishy about those orbal<br/>hookahs, but I never imagined they were using<br/>unapproved ingredients!",ラシャーム,導力シーシャ、胡散臭いとは思っていたが…… まさか未認可の成分が入っていたとは。,導力シーシャ、胡散臭いとは思っていたが……<br/>まさか未認可の成分が入っていたとは。,,
t2200,4,5,Rasham,"I had some in stock myself, unfortunately. Makes me glad I kept recommending the traditional ones to customers.","I had some in stock myself, unfortunately. Makes me<br/>glad I kept recommending the traditional ones<br/>to customers.",ラシャーム,うちにも在庫は流れてきたが…… 伝統シーシャの方を勧めていて良かったよ。,うちにも在庫は流れてきたが……<br/>伝統シーシャの方を勧めていて良かったよ。,,
t2200,4,6,Rasham,I did get pretty worried since I had some customers who bought some of the orbal hookahs I had in stock.,I did get pretty worried since I had some customers<br/>who bought some of the orbal hookahs I had in stock.,ラシャーム,うちで導力シーシャを買って行った 人も幾らかはいて不安だったが……,うちで導力シーシャを買って行った<br/>人も幾らかはいて不安だったが……,,
t2200,4,7,Rasham,"Thankfully, from the way it looks this morning, they all seem to have calmed down. Can't tell you what a relief THAT is.","Thankfully, from the way it looks this morning, they<br/>all seem to have calmed down. Can't tell you what a<br/>relief THAT is.",ラシャーム,今朝の様子を見るに、皆落ち着いているみたいで…… 多少は肩の荷が下りたね。,今朝の様子を見るに、皆落ち着いているみたいで……<br/>多少は肩の荷が下りたね。,,
t2200,4,8,Rasham,"The tourists have been getting pretty...rowdy, lately, to put it nicely.","The tourists have been getting pretty...rowdy, lately,<br/>to put it nicely.",ラシャーム,ここのところの観光客の威勢は 何だか不安になるよな。,ここのところの観光客の威勢は<br/>何だか不安になるよな。,,
t2200,4,9,Rasham,Another hookah seller I know was telling me about how his customers got in such a frenzy that things were a little out of hand.,Another hookah seller I know was telling me about<br/>how his customers got in such a frenzy that things<br/>were a little out of hand.,ラシャーム,シーシャ売りの同業者も客が 昂り過ぎてて困ったって言ってたよ。,シーシャ売りの同業者も客が<br/>昂り過ぎてて困ったって言ってたよ。,,
t2200,4,10,Rasham,"I get everyone's excited about the film festival and all, but it's almost like they've properly lost their minds.","I get everyone's excited about the film festival and all,<br/>but it's almost like they've properly lost their minds.",ラシャーム,映画祭が楽しみとは言え…… ああまで我を忘れるほどのものかね？,映画祭が楽しみとは言え……<br/>ああまで我を忘れるほどのものかね？,,
t2200,4,11,Rasham,"My traditional, flame-powered hookahs still sell pretty well these days.","My traditional, flame-powered hookahs still sell<br/>pretty well these days.",ラシャーム,今のところは俺らの伝統シーシャも ちゃんと売れてはいるが……,今のところは俺らの伝統シーシャも<br/>ちゃんと売れてはいるが……,,
t2200,4,12,Rasham,"But it's these new orbal-powered hookahs that draw in all the repeat customers, now.","But it's these new orbal-powered hookahs that draw<br/>in all the repeat customers, now.",ラシャーム,どうも導力シーシャの方が リピーターは多いんだよな。,どうも導力シーシャの方が<br/>リピーターは多いんだよな。,,
t2200,4,13,Rasham,"It's a shame. The old-fashioned ones still have a lot to offer, as long as you enjoy them in moderation. But times are what they are. *sigh*","It's a shame. The old-fashioned ones still have a lot to<br/>offer, as long as you enjoy them in moderation.<br/>But times are what they are. *sigh*",ラシャーム,こういうのはほどほどに楽しむから 良いものだってのになぁ……,こういうのはほどほどに楽しむから<br/>良いものだってのになぁ……,,
t2200,4,14,Rasham,"Welcome! Have you thought about treating yourself to a hookah? A nice, long hookah session is a traditional pastime in the Central East!","Welcome! Have you thought about treating yourself<br/>to a hookah? A nice, long hookah session is a<br/>traditional pastime in the Central East!",ラシャーム,いらっしゃい、中東の伝統的な水タバコ “シーシャ”はいかがかね？,いらっしゃい、中東の伝統的な水タバコ<br/>“シーシャ”はいかがかね？,,
t2200,4,15,Rasham,"Not only do they smell nice, but they've a wonderful cooling sensation when smoked. Definitely a must in a place that gets as hot as Tharbad!","Not only do they smell nice, but they've a wonderful<br/>cooling sensation when smoked. Definitely a must in<br/>a place that gets as hot as Tharbad!",ラシャーム,香りと一緒に涼しげな気分も味わえるしね、 暑い土地じゃあ有難い品さ。,香りと一緒に涼しげな気分も味わえるしね、<br/>暑い土地じゃあ有難い品さ。,,
t2200,4,16,Rasham,"Lately, these portable orbal-powered hookahs have been all the rage in Tharbad.","Lately, these portable orbal-powered hookahs have<br/>been all the rage in Tharbad.",ラシャーム,最近は流行みたいでな、携帯式の 導力シーシャとやらも回ってきたんだが……,最近は流行みたいでな、携帯式の<br/>導力シーシャとやらも回ってきたんだが……,,
t2200,4,17,Rasham,"Honestly, though, I can't say I'm a big fan. They've got no class! In my book, nothing beats a good, old, traditional hookah.","Honestly, though, I can't say I'm a big fan.<br/>They've got no class! In my book, nothing beats a<br/>good, old, traditional hookah.",ラシャーム,正直、こりゃいまいち風情が無くてね。 やはりこの伝統シーシャが一番さ。,正直、こりゃいまいち風情が無くてね。<br/>やはりこの伝統シーシャが一番さ。,,
t2200,4,18,Rasham,"When tourists come to me looking for the hookah hookup, I want them to enjoy something with some real taste to it. Do it right, you know?","When tourists come to me looking for the hookah<br/>hookup, I want them to enjoy something with some<br/>real taste to it. Do it right, you know?",ラシャーム,俺としては、やっぱり風情ってものを 観光客にも味わってもらいたくてね。,俺としては、やっぱり風情ってものを<br/>観光客にも味わってもらいたくてね。,,
t2200,4,19,Rasham,"I offer orbal hookahs to those who want them, but otherwise, I don't go out of my way to push 'em on to folks. They just aren't my style.","I offer orbal hookahs to those who want them, but<br/>otherwise, I don't go out of my way to push 'em on<br/>to folks. They just aren't my style.",ラシャーム,導力シーシャも一応は置いているが、 あんまり押し出す気にはなれないな。,導力シーシャも一応は置いているが、<br/>あんまり押し出す気にはなれないな。,,
t2200,5,20,Imani,Mother Jamileh said it was okay for me to go back outside.,Mother Jamileh said it was okay for me to go<br/>back outside.,イマーニ,司祭さんが、今はもうお外に出て 良いって言ってくれたの。,司祭さんが、今はもうお外に出て<br/>良いって言ってくれたの。,,
t2200,5,21,Imani,It's much calmer now than it was yesterday. I'm so glad!,It's much calmer now than it was yesterday. I'm<br/>so glad!,イマーニ,たしかに、きのうまでとはなんだか ゼンゼンフンイキがちがうね！,たしかに、きのうまでとはなんだか<br/>ゼンゼンフンイキがちがうね！,,
t2200,5,22,Imani,"Clim's going home soon, so we're going to enjoy the film festival while we can!","Clim's going home soon, so we're going to enjoy the<br/>film festival while we can!",イマーニ,クリム君ももうすぐ帰っちゃうし、 イッショにエイガサイ楽しむんだ！,クリム君ももうすぐ帰っちゃうし、<br/>イッショにエイガサイ楽しむんだ！,,
t2200,5,23,Imani,"There are a lot of people yelling and fighting outside. It's safe inside the temple, though.","There are a lot of people yelling and fighting outside.<br/>It's safe inside the temple, though.",イマーニ,お外で大声を出したりケンカしたりしている ヒトもいるけど、寺院にいればアンシンなの。,お外で大声を出したりケンカしたりしている<br/>ヒトもいるけど、寺院にいればアンシンなの。,,
t2200,5,24,Imani,But I'm worried about my mom. She works in the bazaar. I wish she could be with me here...,But I'm worried about my mom. She works in<br/>the bazaar. I wish she could be with me here...,イマーニ,むしろ、バザールでおしごとしてるお母さんが シンパイ……寺院にイッショにいればいいのに。,むしろ、バザールでおしごとしてるお母さんが<br/>シンパイ……寺院にイッショにいればいいのに。,,
t2200,5,25,Imani,Clim is really interested in fairy tales. I wonder what sort of books he likes to read at home?,Clim is really interested in fairy tales. I wonder what<br/>sort of books he likes to read at home?,イマーニ,クリム君はおとぎ話を楽しそうに聞いてるけど、 ふだんはどんなお話を読んでいるんだろう？,クリム君はおとぎ話を楽しそうに聞いてるけど、<br/>ふだんはどんなお話を読んでいるんだろう？,,
t2200,5,26,Imani,"After talking to him, now I want to learn about stories from further west!","After talking to him, now I want to learn about<br/>stories from further west!",イマーニ,わたしも、西方のおとぎ話を聞いて みたくなっちゃった！,わたしも、西方のおとぎ話を聞いて<br/>みたくなっちゃった！,,
t2200,5,27,Imani,I'm so happy Clim likes hearing about Central Eastern fairy tales!,I'm so happy Clim likes hearing about Central<br/>Eastern fairy tales!,イマーニ,中東のおとぎ話、クリムくんも よろこんでくれてうれしい！,中東のおとぎ話、クリムくんも<br/>よろこんでくれてうれしい！,,
t2200,5,28,Imani,Most kids who visit Tharbad don't really care about them. It's so nice to meet someone who does!,Most kids who visit Tharbad don't really care<br/>about them. It's so nice to meet someone who does!,イマーニ,カンコウの子だと、あんまり キョーミ持ってくれない子も多いしね！,カンコウの子だと、あんまり<br/>キョーミ持ってくれない子も多いしね！,,
t2200,6,29,Imani,"...And then, once the djinn appears from the lamp, it repeats the first word and leaves!","...And then, once the djinn appears from the lamp, it<br/>repeats the first word and leaves!",イマーニ,それでね、ランプから出てきた精霊（ジン）が、 サイショの言葉をくりかえして帰っちゃうの！,それでね、ランプから出てきた精霊（ジン）が、<br/>サイショの言葉をくりかえして帰っちゃうの！,,
t2200,6,30,Crim,"Wow, that's awesome! Central Eastern fairy tales are so neat and cool!","Wow, that's awesome! Central Eastern fairy tales are<br/>so neat and cool!",クリム,へぇ～すごいなぁ！ 中東のおとぎ話もフシギだね！,へぇ～すごいなぁ！<br/>中東のおとぎ話もフシギだね！,,
t2200,6,31,Imani,"Heehee, I know, right?","Heehee, I know, right?",イマーニ,えへへ、そうでしょ？,えへへ、そうでしょ？,,
t2200,6,32,Imani,My grandma and the people from the temple tell me stories with different morals all the time!,My grandma and the people from the temple tell me<br/>stories with different morals all the time!,イマーニ,キョウクンがあるって、おばあちゃんや 寺院の人たちがお話してくれるんだ！,キョウクンがあるって、おばあちゃんや<br/>寺院の人たちがお話してくれるんだ！,,
t2200,6,33,Imani,"Do people like to tell any neat, weird stories where you're from? I'd love to hear them!","Do people like to tell any neat, weird stories where<br/>you're from? I'd love to hear them!",イマーニ,キミのところにも、フシギなお話って あったら聞いてみたいな！,キミのところにも、フシギなお話って<br/>あったら聞いてみたいな！,,
t2200,6,34,Crim,Sure! I can tell you about them!,Sure! I can tell you about them!,クリム,いいよ、お礼にお話するね！,いいよ、お礼にお話するね！,,
t2200,6,35,Crim,"But after that, I wanna hear more about your fairy tales, okay?","But after that, I wanna hear more about your fairy<br/>tales, okay?",クリム,でも、そのあと中東のおとぎ話、 もっと聞いてみたいかも！,でも、そのあと中東のおとぎ話、<br/>もっと聞いてみたいかも！,,
t2200,6,36,Imani,Okay! Then why don't we visit the temple?,Okay! Then why don't we visit the temple?,イマーニ,じゃあ、いっしょに寺院に行かない？,じゃあ、いっしょに寺院に行かない？,,
t2200,6,37,Imani,Mother Jamileh knows a lot about stuff like that. I'm sure she'll be able to tell you lots!,Mother Jamileh knows a lot about stuff like that. I'm<br/>sure she'll be able to tell you lots!,イマーニ,司祭さん、色んなおとぎ話にくわしいから、 色々なお話を聞けるとおもうよ！,司祭さん、色んなおとぎ話にくわしいから、<br/>色々なお話を聞けるとおもうよ！,,
t2200,7,38,Imani,See? I told you Mother Jamileh knew lots of stories!,See? I told you Mother Jamileh knew lots of stories!,イマーニ,ね、司祭さん色んなお話を知っているでしょ？,ね、司祭さん色んなお話を知っているでしょ？,,
t2200,7,39,Imani,"She always puts her all into telling them, too. That's what makes going to Sunday School so much fun!","She always puts her all into telling them, too. That's<br/>what makes going to Sunday School so much fun!",イマーニ,お話のしかたもキモチがこもってて凄いし、 日曜学校がいつも楽しみなんだ！,お話のしかたもキモチがこもってて凄いし、<br/>日曜学校がいつも楽しみなんだ！,,
t2200,7,40,Crim,"Yeah, I bet! She's really, really good. I'm so happy I got to hear new stories from her!","Yeah, I bet! She's really, really good. I'm so happy I<br/>got to hear new stories from her!",クリム,うん……ほんとうにじょうずだし、 ボクの知らないお話が聞けて良かった！,うん……ほんとうにじょうずだし、<br/>ボクの知らないお話が聞けて良かった！,,
t2200,7,41,Crim,This temple is so amazing.,This temple is so amazing.,クリム,それにしても……この寺院も なんだかすごいなって。,それにしても……この寺院も<br/>なんだかすごいなって。,,
t2200,7,42,Crim,"Even though we both pray to the same goddess, it looks and feels completely different from the chapel I go to!","Even though we both pray to the same goddess,<br/>it looks and feels completely different from the<br/>chapel I go to!",クリム,同じ女神様なのに、ボクの行っている レイハイドウとはゼンゼン違って面白いし！,同じ女神様なのに、ボクの行っている<br/>レイハイドウとはゼンゼン違って面白いし！,,
t2200,7,43,Imani,"Wow, it's really that different? That's crazy!","Wow, it's really that different? That's crazy!",イマーニ,へえ、やっぱりちがうんだ！,へえ、やっぱりちがうんだ！,,
t2200,7,44,Imani,I'd love to hear what western ones are like. Could you tell me a little about them?,I'd love to hear what western ones are like. Could you<br/>tell me a little about them?,イマーニ,うーん、わたしも一回、西方の レイハイドウでお話聞いてみたいなー。,うーん、わたしも一回、西方の<br/>レイハイドウでお話聞いてみたいなー。,,
t2200,8,45,Imani,This movie festival's totally unlike the festivals we usually have around here. It's great!,This movie festival's totally unlike the festivals we<br/>usually have around here. It's great!,イマーニ,エイガサイ、ふだんのおまつりとはゼンゼン フンイキがちがっておもしろい！,エイガサイ、ふだんのおまつりとはゼンゼン<br/>フンイキがちがっておもしろい！,,
t2200,8,46,Imani,Are western festivals like this?,Are western festivals like this?,イマーニ,西方のおまつりってこういうのなの？,西方のおまつりってこういうのなの？,,
t2200,8,47,Crim,"No way! We don't have any festivals like this in my town, either!","No way! We don't have any festivals like this in my<br/>town, either!",クリム,ううん、キンジョのおまつりもこういうの じゃなかったよ！,ううん、キンジョのおまつりもこういうの<br/>じゃなかったよ！,,
t2200,8,48,Crim,My dad told me that this one is special and that an amazing guy called Salvatore Gotti came up with it!,My dad told me that this one is special and that an<br/>amazing guy called Salvatore Gotti came up with it!,クリム,エイガサイはトクベツで、ゴッチって エラいヒトが考えてるんだってパパがいってた！,エイガサイはトクベツで、ゴッチって<br/>エラいヒトが考えてるんだってパパがいってた！,,
t2200,8,49,Imani,"Oh, wow! I didn't know that!","Oh, wow! I didn't know that!",イマーニ,そうなんだ！,そうなんだ！,,
t2200,8,50,Imani,"Umm, I don't know a lot about movies, actually.","Umm, I don't know a lot about movies, actually.",イマーニ,でも、じつはわたしエイガはあんまりしらなくて……,でも、じつはわたしエイガはあんまりしらなくて……,,
t2200,8,51,Imani,Could you maybe tell me about western movies while we walk around? I wanna learn more!,Could you maybe tell me about western movies while<br/>we walk around? I wanna learn more!,イマーニ,せっかくイッショにまわれるんだし、 西方のエイガとかもいろいろ教えてよ！,せっかくイッショにまわれるんだし、<br/>西方のエイガとかもいろいろ教えてよ！,,
t2200,8,52,Crim,"Yeah, okay! There are movies about everything! They even make ones based on picture books!","Yeah, okay! There are movies about everything!<br/>They even make ones based on picture books!",クリム,うん、いいよ！ 絵本がゲンサクになったエイガとかもあるんだ！,うん、いいよ！<br/>絵本がゲンサクになったエイガとかもあるんだ！,,
t2200,8,53,Crim,"If I see them at the festival, I'll tell you!","If I see them at the festival, I'll tell you!",クリム,エイガサイででてきたら教えるね！,エイガサイででてきたら教えるね！,,
t2200,9,54,Crim,My dad is all better now! Yippee! Now we can all enjoy the film festival!,My dad is all better now! Yippee! Now we can all<br/>enjoy the film festival!,クリム,パパがいつものパパになってよかった、 これでみんなでエイガサイ見れるね！,パパがいつものパパになってよかった、<br/>これでみんなでエイガサイ見れるね！,,
t2200,9,55,Crim,I'm gonna walk around and see what's going on with my new friend.,I'm gonna walk around and see what's going on with<br/>my new friend.,クリム,新しいお友達もできたし、 イッショに回るんだ。,新しいお友達もできたし、<br/>イッショに回るんだ。,,
t2200,9,56,Crim,"Once the film festival is over, I plan to give Imani this picture book I brought with me, just before I go home. I hope she likes it!","Once the film festival is over, I plan to give Imani this<br/>picture book I brought with me, just before I<br/>go home. I hope she likes it!",クリム,エイガサイ終わったら帰る前に、イマーニちゃんに 持ってきた絵本もプレゼントするよ！,エイガサイ終わったら帰る前に、イマーニちゃんに<br/>持ってきた絵本もプレゼントするよ！,,
t2200,9,57,Crim,Dad's been acting really weird since last night. He never yells like that...,Dad's been acting really weird since last night.<br/>He never yells like that...,クリム,パパ、きのうの夜からなんだかヘンなんだ。 ふだんはあんなに大声出さないのに……,パパ、きのうの夜からなんだかヘンなんだ。<br/>ふだんはあんなに大声出さないのに……,,
t2200,9,58,Crim,He must be tired. I'm sure he'll be back to normal soon.,He must be tired. I'm sure he'll be back to<br/>normal soon.,クリム,でも、パパだってつかれてるし、 いつもどおりにもどるよね。,でも、パパだってつかれてるし、<br/>いつもどおりにもどるよね。,,
t2200,9,59,Crim,I'm not scared at all! The people in the temple are all so nice.,I'm not scared at all! The people in the temple are all<br/>so nice.,クリム,寺院の人たちも優しいし、 ちっともこわくなんかないよ。,寺院の人たちも優しいし、<br/>ちっともこわくなんかないよ。,,
t2200,9,60,Crim,I wanna teach Imani all about the fairy tales of where I'm from!,I wanna teach Imani all about the fairy tales of where<br/>I'm from!,クリム,イマーニちゃんにも、ボクたちのおとぎ話を もっとおしえてあげたいなー。,イマーニちゃんにも、ボクたちのおとぎ話を<br/>もっとおしえてあげたいなー。,,
t2200,9,61,Crim,I know! Maybe I should give her my picture book that I brought with me!,I know! Maybe I should give her my picture book that<br/>I brought with me!,クリム,そうだ、あとでボクの持ってきた絵本を プレゼントしようかな！,そうだ、あとでボクの持ってきた絵本を<br/>プレゼントしようかな！,,
t2200,9,62,Crim,"That's okay, isn't it? It'll be like a souvenir, but of me, since it's from my home! She won't even hafta travel for it!","That's okay, isn't it? It'll be like a souvenir, but of me,<br/>since it's from my home! She won't even hafta travel<br/>for it!",クリム,ボクたちがおみやげをもらうように、 ボクがここの子にプレゼントあげてもいいよね？,ボクたちがおみやげをもらうように、<br/>ボクがここの子にプレゼントあげてもいいよね？,,
t2200,9,63,Crim,I've read a lot of picture books before.,I've read a lot of picture books before.,クリム,これまでいろんな絵本を読んできたけど……,これまでいろんな絵本を読んできたけど……,,
t2200,9,64,Crim,But the Central East has so many fairy tales I've never heard of!,But the Central East has so many fairy tales I've never<br/>heard of!,クリム,中東ってところには、まだボクの しらないお話がいっぱいあるんだね！,中東ってところには、まだボクの<br/>しらないお話がいっぱいあるんだね！,,
t2200,9,65,Crim,"Imani knows a lot about them! I'm gonna ask the bishop lady to tell me some, too!","Imani knows a lot about them! I'm gonna ask the<br/>bishop lady to tell me some, too!",クリム,イマーニちゃんもモノシリだし、 シサイさんのお話も聞いてみたいな！,イマーニちゃんもモノシリだし、<br/>シサイさんのお話も聞いてみたいな！,,
t2200,10,66,Ulrich,I really lost my mind yesterday. It was pathetic. All I did was make my family worry about me...,I really lost my mind yesterday. It was pathetic.<br/>All I did was make my family worry about me...,ウルリッヒ,昨日はどうかしていた……家族にも 心配をかけて、本当に情けないものだよ。,昨日はどうかしていた……家族にも<br/>心配をかけて、本当に情けないものだよ。,,
