gameId,fname,scene,row,engChrName,engSearchText,engHtmlText,jpnChrName,jpnSearchText,jpnHtmlText,opName,pcIconHtml,evoIconHtml
t2200,36,428,Receptionist Jibril,I've been hearing a lot of talk about you guys since you came into town.,I've been hearing a lot of talk about you guys since<br/>you came into town.,受付ジブリール,裏解決屋という方々でしょうか。,裏解決屋という方々でしょうか。,,
t2200,36,429,Van,"You have, huh? Guess word travels pretty fast in these parts.","You have, huh? Guess word travels pretty fast in<br/>these parts.",ヴァン,ああ、そっちも情報が早いみたいで。,ああ、そっちも情報が早いみたいで。,,"<img class=""itp-kuro"" src=""itp/11/avfc0000_out.webp""/>"
t2200,36,430,Receptionist Jibril,"It does, although the main branch told me about you all, as well, so I'm a little familiar with you already.","It does, although the main branch told me about you<br/>all, as well, so I'm a little familiar with you already.",受付ジブリール,ええ、あなた方については総支部からも 聞いておりますし、最低限把握しています。,ええ、あなた方については総支部からも<br/>聞いておりますし、最低限把握しています。,,
t2200,36,431,Receptionist Jibril,Including what you guys got up to over in Langport. Apparently you were even more capable than expected.,Including what you guys got up to over in Langport.<br/>Apparently you were even more capable<br/>than expected.,受付ジブリール,もちろん、煌都での活動も聞き及んでいます、 どうやら想定以上に腕が立つようで。,もちろん、煌都での活動も聞き及んでいます、<br/>どうやら想定以上に腕が立つようで。,,
t2200,36,432,Aaron,"Well, would you look at that? Sounds like the guild's giving us some props. About time, if you ask me!","Well, would you look at that? Sounds like the guild's<br/>giving us some props. About time, if you ask me!",アーロン,クク、随分と一目置かれているみてぇだな。,クク、随分と一目置かれているみてぇだな。,,"<img class=""itp-kuro"" src=""itp/11/avfc0002_out.webp""/>"
t2200,36,433,Van,"Yeah, but that also means we now got a reputation to maintain with these people, especially in light of what's going on.","Yeah, but that also means we now got a reputation to<br/>maintain with these people, especially in light of<br/>what's going on.",ヴァン,まあ、その口ぶりとサルバッドの状況を 見れば……何を期待してんのかは察しがつくぜ。,まあ、その口ぶりとサルバッドの状況を<br/>見れば……何を期待してんのかは察しがつくぜ。,,"<img class=""itp-kuro"" src=""itp/11/avfc0000_out.webp""/>"
t2200,36,434,Van,Not that we mind taking a load off the guild—ain't the first time. But don't expect us to take everything. We still reserve the right to decide.,Not that we mind taking a load off the guild—ain't the<br/>first time. But don't expect us to take everything.<br/>We still reserve the right to decide.,ヴァン,ま、ギルドの下請けってのも今に始まった 事じゃねぇが、仕事は選ばせてもらうからな？,ま、ギルドの下請けってのも今に始まった<br/>事じゃねぇが、仕事は選ばせてもらうからな？,,"<img class=""itp-kuro"" src=""itp/11/avfc0000_out.webp""/>"
t2200,36,435,Receptionist Jibril,"I understand. We appreciate you being so up front about it. Don't worry, we'll be careful in what we choose to pass on to you.","I understand. We appreciate you being so up front<br/>about it. Don't worry, we'll be careful in what we<br/>choose to pass on to you.",受付ジブリール,話が早くて有難いですね、まあ私達としても、 あなた方へ回す仕事も選びますのでご安心を。,話が早くて有難いですね、まあ私達としても、<br/>あなた方へ回す仕事も選びますのでご安心を。,,
t2200,36,436,Receptionist Jibril,We simply appreciate your ability to handle some of our load and delegate responsibilities among yourselves as needed.,We simply appreciate your ability to handle some of<br/>our load and delegate responsibilities among<br/>yourselves as needed.,受付ジブリール,聞く限りでは、ある程度は私達との負担の分散や 役割分担もできる方々との事ですので。,聞く限りでは、ある程度は私達との負担の分散や<br/>役割分担もできる方々との事ですので。,,
t2200,36,437,Receptionist Jibril,"As you can imagine, we have more on our plate than simply providing security for the festival and sorting out any tourist problems.","As you can imagine, we have more on our plate than<br/>simply providing security for the festival and sorting<br/>out any tourist problems.",受付ジブリール,一応、私達もやるべき事は映画祭の警備や 観光客トラブルへの対応だけではないので。,一応、私達もやるべき事は映画祭の警備や<br/>観光客トラブルへの対応だけではないので。,,
t2200,36,438,Van,"(Hmm... Sounds like the guild could be investigating something on their end, too.)","(Hmm... Sounds like the guild could be investigating<br/>something on their end, too.)",ヴァン,（ギルドでも何かを探っているって感じか。）,（ギルドでも何かを探っているって感じか。）,,"<img class=""itp-kuro"" src=""itp/11/avfc0000_out.webp""/>"
t2200,36,439,Van,"(All the more reason to help 'em out, then. Not only will they owe us a favor or two, we might be able to get some intel out of 'em.)","(All the more reason to help 'em out, then. Not only<br/>will they owe us a favor or two, we might be able to<br/>get some intel out of 'em.)",ヴァン,（それならここでも、恩を売るついでに   何か情報も得られるかもしれねぇな……）,（それならここでも、恩を売るついでに<br/>  何か情報も得られるかもしれねぇな……）,,"<img class=""itp-kuro"" src=""itp/11/avfc0000_out.webp""/>"
t2200,36,440,Receptionist Jibril,"I'm sure you've sensed it yourselves, but Tharbad is in somewhat of a peculiar position.","I'm sure you've sensed it yourselves, but Tharbad is in<br/>somewhat of a peculiar position.",受付ジブリール,おそらくあなた達もお気づきかとは思いますが、 サルバッドは少々特殊な状況下に在ります。,おそらくあなた達もお気づきかとは思いますが、<br/>サルバッドは少々特殊な状況下に在ります。,,
t2200,36,441,Receptionist Jibril,"More and more issues are cropping up, and while we're not sure why yet, we do know that it's not just because of the film festival.","More and more issues are cropping up, and while<br/>we're not sure why yet, we do know that it's not just<br/>because of the film festival.",受付ジブリール,単に映画祭でトラブルが増えている、 それだけではない事は確かでしょう。,単に映画祭でトラブルが増えている、<br/>それだけではない事は確かでしょう。,,
t2200,36,442,Receptionist Jibril,I won't intrude into whatever business has brought you here. But you should be aware that we do have an investigation underway.,I won't intrude into whatever business has brought<br/>you here. But you should be aware that we do have an<br/>investigation underway.,受付ジブリール,そちらの受けた案件には踏み込みませんが、 こちらも一応、調査は始めていまして。,そちらの受けた案件には踏み込みませんが、<br/>こちらも一応、調査は始めていまして。,,
t2200,36,443,Receptionist Jibril,"So if you could bear in mind the complexity of the situation before making any moves, we'd appreciate it.","So if you could bear in mind the complexity of the<br/>situation before making any moves, we'd<br/>appreciate it.",受付ジブリール,ですのであなた方も、状況の複雑さはある程度 弁えて行動してもらえると助かります。,ですのであなた方も、状況の複雑さはある程度<br/>弁えて行動してもらえると助かります。,,
t2200,37,444,Bracer Renton,"We might've gotten the trouble sorted out at the bazaar, but something about it all still doesn't sit right with me.","We might've gotten the trouble sorted out at the<br/>bazaar, but something about it all still doesn't sit right<br/>with me.",遊撃士レントン,一応、バザールの方でもトラブルには対応したが やっぱりどこか引っかかる気がするな……,一応、バザールの方でもトラブルには対応したが<br/>やっぱりどこか引っかかる気がするな……,,
t2200,37,445,Bracer Renton,"I've heard Tharbad's seeing more and more tourists who are getting out of hand, like what those dancers had to deal with.","I've heard Tharbad's seeing more and more tourists<br/>who are getting out of hand, like what those dancers<br/>had to deal with.",遊撃士レントン,昼間に踊り子に絡んだ観光客みたいな、 ああいうパターンが増えているらしい。,昼間に踊り子に絡んだ観光客みたいな、<br/>ああいうパターンが増えているらしい。,,
t2200,37,446,Bracer Renton,Hmm... I think tomorrow I'll focus my efforts on the Entertainment District. More people from out of town end up there.,Hmm... I think tomorrow I'll focus my efforts on the<br/>Entertainment District. More people from out of<br/>town end up there.,遊撃士レントン,……明日は歓楽街の方を中心に対応しようか、 あっちの方が外部の人も多く来る事だしね。,……明日は歓楽街の方を中心に対応しようか、<br/>あっちの方が外部の人も多く来る事だしね。,,
t2200,37,447,Bracer Renton,You must be the people from Arkride Solutions. I've heard all about your exploits in Edith and Langport from Alvis.,You must be the people from Arkride Solutions.<br/>I've heard all about your exploits in Edith and<br/>Langport from Alvis.,遊撃士レントン,あんたらが裏解決屋だな、 首都や煌都での活躍は僕も聞いているよ。,あんたらが裏解決屋だな、<br/>首都や煌都での活躍は僕も聞いているよ。,,
t2200,37,448,Bracer Renton,He always grumbles about you guys whenever you come up. What the heck did you guys do to give him a fuse like that?,He always grumbles about you guys whenever you<br/>come up. What the heck did you guys do to give him<br/>a fuse like that?,遊撃士レントン,まあ、アルヴィスからは悪口しか聞いてないけど…… 一体何をああまで怒っているのやら。,まあ、アルヴィスからは悪口しか聞いてないけど……<br/>一体何をああまで怒っているのやら。,,
t2200,37,449,Van,"You'll have to ask him. You're a friend of Alvis, though, huh? Guess I can see it. You two look 'bout the same age.","You'll have to ask him. You're a friend of Alvis,<br/>though, huh? Guess I can see it. You two look 'bout<br/>the same age.",ヴァン,あんたはアルヴィスと知り合いなのか。 見たところ同年代っぽいな。,あんたはアルヴィスと知り合いなのか。<br/>見たところ同年代っぽいな。,,"<img class=""itp-kuro"" src=""itp/11/avfc0000_out.webp""/>"
t2200,37,450,Bracer Renton,"We're actually a year apart, but we came up in the guild around the same time, yeah. We worked together a fair bit when we were junior bracers.","We're actually a year apart, but we came up in the<br/>guild around the same time, yeah. We worked<br/>together a fair bit when we were junior bracers.",遊撃士レントン,まあ、一年違いだがほぼ同期みたいなものかな。 準遊撃士の頃はそこそこ絡んでいたよ。,まあ、一年違いだがほぼ同期みたいなものかな。<br/>準遊撃士の頃はそこそこ絡んでいたよ。,,
t2200,37,451,Bracer Renton,"I was the first one to get promoted up to C-rank between us, but I think I might not stay ahead much longer.","I was the first one to get promoted up to C-rank<br/>between us, but I think I might not stay ahead<br/>much longer.",遊撃士レントン,ちなみに、Ｃ級への昇格は僕が先だったんでね。 Ｂ級も先を越されないようにしたいが……,ちなみに、Ｃ級への昇格は僕が先だったんでね。<br/>Ｂ級も先を越されないようにしたいが……,,
t2200,37,452,Bracer Renton,He says he's on the verge of hitting B-rank. Going to have to hustle if I don't want him to beat me.,He says he's on the verge of hitting B-rank. Going to<br/>have to hustle if I don't want him to beat me.,遊撃士レントン,アルヴィスがＢ級目前って話も聞くし、 僕もここらが頑張りどころかな。,アルヴィスがＢ級目前って話も聞くし、<br/>僕もここらが頑張りどころかな。,,
t2200,37,453,Aaron,Sounds like you guys have got yourselves a nice little rivalry. I know what that's like. I've got some folks like that over in my theater.,Sounds like you guys have got yourselves a nice<br/>little rivalry. I know what that's like. I've got some<br/>folks like that over in my theater.,アーロン,ハッ、大したライバル意識じゃねぇか。 オレにも華劇でライバル視してくる奴がいるぜ。,ハッ、大したライバル意識じゃねぇか。<br/>オレにも華劇でライバル視してくる奴がいるぜ。,,"<img class=""itp-kuro"" src=""itp/11/avfc0002_out.webp""/>"
t2200,37,454,Bracer Renton,"I wouldn't say it's anything that serious. Just a little friendly competition, I guess.","I wouldn't say it's anything that serious. Just a little<br/>friendly competition, I guess.",遊撃士レントン,別にライバルってほど大したものでもないよ。,別にライバルってほど大したものでもないよ。,,
t2200,37,455,Bracer Renton,But I have done my fair share of training while traveling all over the place. I want to make the most of my time while I'm out here.,But I have done my fair share of training while<br/>traveling all over the place. I want to make the most<br/>of my time while I'm out here.,遊撃士レントン,まあ、元より各地を周って修練してる身だしな、 この機会は活かすつもりさ。,まあ、元より各地を周って修練してる身だしな、<br/>この機会は活かすつもりさ。,,
t2200,37,456,Bracer Renton,"Plus this city has its problems right now. As a bracer, I can't just ignore them. I have to do something to help.","Plus this city has its problems right now. As a bracer,<br/>I can't just ignore them. I have to do something<br/>to help.",遊撃士レントン,どの道、遊撃士である以上は困っている この状況は見逃す訳にいかないしね。,どの道、遊撃士である以上は困っている<br/>この状況は見逃す訳にいかないしね。,,
t2200,37,457,Van,"Good on you, man. For someone who looks pretty laid back on the outside, you actually sound pretty passionate about your job. Respect.","Good on you, man. For someone who looks pretty<br/>laid back on the outside, you actually sound pretty<br/>passionate about your job. Respect.",ヴァン,淡々としているようで随分と 熱い奴じゃねぇか。,淡々としているようで随分と<br/>熱い奴じゃねぇか。,,"<img class=""itp-kuro"" src=""itp/11/avfc0000_out.webp""/>"
t2200,37,458,Van,I think we're gonna get along just fine. You don't sound like the type of guy who'll give us trouble like Alvis.,I think we're gonna get along just fine. You don't<br/>sound like the type of guy who'll give us trouble<br/>like Alvis.,ヴァン,まあ、アルヴィスよりは面倒が無くて 俺達としては付き合いやすそうだが。,まあ、アルヴィスよりは面倒が無くて<br/>俺達としては付き合いやすそうだが。,,"<img class=""itp-kuro"" src=""itp/11/avfc0000_out.webp""/>"
t2200,37,459,Bracer Renton,"Oh, yeah! I forgot that we were supposed to have a B-rank bracer coming in to help from the main branch.","Oh, yeah! I forgot that we were supposed to have a<br/>B-rank bracer coming in to help from the<br/>main branch.",遊撃士レントン,そういえば、総支部からＢ級遊撃士が 応援に来るとも聞いていたな。,そういえば、総支部からＢ級遊撃士が<br/>応援に来るとも聞いていたな。,,
t2200,37,460,Bracer Renton,"It'll be good to have the extra help around, but I can't let myself become dependent on it, either.","It'll be good to have the extra help around, but I can't<br/>let myself become dependent on it, either.",遊撃士レントン,心強い限りだけど、その人に 甘える訳にもいかないしな。,心強い限りだけど、その人に<br/>甘える訳にもいかないしな。,,
t2200,37,461,Bracer Renton,"If I'm going to hit that B-rank myself, I've got to try and pull my weight as best I can.","If I'm going to hit that B-rank myself, I've got to try<br/>and pull my weight as best I can.",遊撃士レントン,まあ、その人に追い付くくらいの つもりで僕もやってみるとするさ。,まあ、その人に追い付くくらいの<br/>つもりで僕もやってみるとするさ。,,
t2200,38,462,Bracer Ismail,"I'm so shocked and humbled to know His Highness is at the hamam. I'd heard he was an affable man, but to witness him in person...","I'm so shocked and humbled to know His Highness is<br/>at the hamam. I'd heard he was an affable man, but<br/>to witness him in person...",遊撃士イスマイル,まさか殿下があちらのハマムにいらっしゃるとは。 親しみやすい方とは聞いておりましたが……,まさか殿下があちらのハマムにいらっしゃるとは。<br/>親しみやすい方とは聞いておりましたが……,,
t2200,38,463,Bracer Ismail,I never dreamed the day would come that I would have the honor of protecting someone from the royal family alongside Naje.,I never dreamed the day would come that I would<br/>have the honor of protecting someone from the royal<br/>family alongside Naje.,遊撃士イスマイル,しかし、ナージェ殿と共に公王家の方を お守りする日が来る事になろうとは。,しかし、ナージェ殿と共に公王家の方を<br/>お守りする日が来る事になろうとは。,,
t2200,38,464,Bracer Ismail,"It's an extremely great honor, as you can imagine, not just as a bracer, but as someone versed in Elsaim's royal swordfighting style.","It's an extremely great honor, as you can imagine, not<br/>just as a bracer, but as someone versed in Elsaim's<br/>royal swordfighting style.",遊撃士イスマイル,遊撃士であると共に、宮廷剣術を修める身として、 光栄な事であると言えるでしょうな。,遊撃士であると共に、宮廷剣術を修める身として、<br/>光栄な事であると言えるでしょうな。,,
t2200,38,465,Bracer Ismail,"That was a nasty turn of events last night, and it's a shame those orbal hookahs proliferated as far as they did, even if only temporarily.","That was a nasty turn of events last night, and it's a<br/>shame those orbal hookahs proliferated as far as they<br/>did, even if only temporarily.",遊撃士イスマイル,昨晩には不幸な事件もあり、導力シーシャも 一度は広まってしまいましたが……,昨晩には不幸な事件もあり、導力シーシャも<br/>一度は広まってしまいましたが……,,
t2200,38,466,Bracer Ismail,"Thankfully, none of that has stopped the festival. Now it's time to do my part to ensure it's a good event for the people of Tharbad.","Thankfully, none of that has stopped the festival.<br/>Now it's time to do my part to ensure it's a good<br/>event for the people of Tharbad.",遊撃士イスマイル,こうして映画祭を開催できた以上、この街の方々の ためになる催しになるようにしたいところです。,こうして映画祭を開催できた以上、この街の方々の<br/>ためになる催しになるようにしたいところです。,,
t2200,38,467,Bracer Ismail,"I have to do whatever I can to help mitigate any disturbances or other concerns that might arise, so that everyone can get the most out of today.","I have to do whatever I can to help mitigate any<br/>disturbances or other concerns that might arise, so<br/>that everyone can get the most out of today.",遊撃士イスマイル,私は遊撃士として少しでも混乱や不安を排除し、 皆が映画祭の恩恵を受けられるようにせねば。,私は遊撃士として少しでも混乱や不安を排除し、<br/>皆が映画祭の恩恵を受けられるようにせねば。,,
t2200,38,468,Bracer Ismail,"Renton's apparently checking into the general movements of new arrivals, so I'm going to tackle things from a different angle.","Renton's apparently checking into the general<br/>movements of new arrivals, so I'm going to tackle<br/>things from a different angle.",遊撃士イスマイル,レントンは来訪者の動向を探るそうなので 私は土地勘を活かすといたしましょうか。,レントンは来訪者の動向を探るそうなので<br/>私は土地勘を活かすといたしましょうか。,,
t2200,38,469,Bracer Ismail,"Specifically, I'm going to ask the caravanners if they've noticed any unusual activity nearby to see if I can glean anything with their insight.","Specifically, I'm going to ask the caravanners if<br/>they've noticed any unusual activity nearby to see if I<br/>can glean anything with their insight.",遊撃士イスマイル,サルバッドの近辺で何か不穏な動きが無いか、 キャラバンの方々にも聞くとしましょう。,サルバッドの近辺で何か不穏な動きが無いか、<br/>キャラバンの方々にも聞くとしましょう。,,
t2200,38,470,Bracer Ismail,I just wish we didn't have to worry about more fights breaking out. I'd really prefer to focus entirely on our investigation. *sigh*,I just wish we didn't have to worry about more fights<br/>breaking out. I'd really prefer to focus entirely on<br/>our investigation. *sigh*,遊撃士イスマイル,とは言え……再び乱闘が起きる可能性も考えると、 調査だけに注力できないのは心苦しいですが。,とは言え……再び乱闘が起きる可能性も考えると、<br/>調査だけに注力できないのは心苦しいですが。,,
t2200,38,471,Bracer Ismail,I've been looking into the new arrivals who are coming into the area from the Central East.,I've been looking into the new arrivals who are<br/>coming into the area from the Central East.,遊撃士イスマイル,一応、中東方面から新たに来訪する方々にも 探りは入れてはいるのですが……,一応、中東方面から新たに来訪する方々にも<br/>探りは入れてはいるのですが……,,
t2200,38,472,Bracer Ismail,"So far, nothing suspicious has turned up about those coming from Elsaim, which means... Hmm...","So far, nothing suspicious has turned up about those<br/>coming from Elsaim, which means... Hmm...",遊撃士イスマイル,やはり、エルザイム方面のルートには怪しい 部分は無さそうですね、となると……,やはり、エルザイム方面のルートには怪しい<br/>部分は無さそうですね、となると……,,
t2200,38,473,Bracer Ismail,"Either way, Tharbad is going to see an influx of tourists starting tomorrow. We have to optimize our intel gathering as best we can.","Either way, Tharbad is going to see an influx of<br/>tourists starting tomorrow. We have to optimize our<br/>intel gathering as best we can.",遊撃士イスマイル,何にせよ明日以降は一層観光客も増えますし…… 情報収集も可能な限り効率化せねばなりません。,何にせよ明日以降は一層観光客も増えますし……<br/>情報収集も可能な限り効率化せねばなりません。,,
t2200,38,474,Bracer Ismail,We can't expect our help from the capital to take care of everything for us.,We can't expect our help from the capital to take care<br/>of everything for us.,遊撃士イスマイル,首都から来るという応援の方に頼りきりに なる訳にもいきませんからな。,首都から来るという応援の方に頼りきりに<br/>なる訳にもいきませんからな。,,
t2200,38,475,Bracer Ismail,It's fair to say that Tharbad acts as a bridge between the Principality of Elsaim and Calvard.,It's fair to say that Tharbad acts as a bridge between<br/>the Principality of Elsaim and Calvard.,遊撃士イスマイル,この地はいわば、エルザイム公国と共和国の 架け橋と言っても過言ではありません。,この地はいわば、エルザイム公国と共和国の<br/>架け橋と言っても過言ではありません。,,
t2200,38,476,Bracer Ismail,"You can see that in the film festival. The Elsaim royal family has such high expectations for it, they've directly invested in it.","You can see that in the film festival. The Elsaim royal<br/>family has such high expectations for it, they've<br/>directly invested in it.",遊撃士イスマイル,その地で、公王家も期待を注ぎ出資された 催しが行われようとしている。,その地で、公王家も期待を注ぎ出資された<br/>催しが行われようとしている。,,
