gameId,fname,scene,row,engChrName,engSearchText,engHtmlText,jpnChrName,jpnSearchText,jpnHtmlText,opName,pcIconHtml,evoIconHtml
t2200,56,994,Agnes,"(Quick, Agnès! You've got to contribute something! Somethiiing...!)","(Quick, Agnès! You've got to contribute something!<br/>Somethiiing...!)",アニエス,（な、なんとなく立場が……）,（な、なんとなく立場が……）,,"<img class=""itp-kuro"" src=""itp/11/avfc5001_out.webp""/>"
t2200,56,995,Agnes,"Oh, yes! We still need to deliver those autographs to Shaheena!","Oh, yes! We still need to deliver those autographs<br/>to Shaheena!",アニエス,──そうですっ、シャヒーナさんに 色紙の方をお渡ししないと！,──そうですっ、シャヒーナさんに<br/>色紙の方をお渡ししないと！,,"<img class=""itp-kuro"" src=""itp/11/avfc5001_out.webp""/>"
t2200,56,996,Van,"Hey, you're right. I forgot all about that.","Hey, you're right. I forgot all about that.",ヴァン,おっと、そいつがあったか。,おっと、そいつがあったか。,,"<img class=""itp-kuro"" src=""itp/11/avfc0000_out.webp""/>"
t2200,56,997,Ferry,"Gaaah! Me, too! D'you think she's home by now?","Gaaah! Me, too! D'you think she's home by now?",フェリ,そうでしたっ！　えと…… もう家に帰ってる頃でしょうか？,そうでしたっ！　えと……<br/>もう家に帰ってる頃でしょうか？,,"<img class=""itp-kuro"" src=""itp/11/avfc5003_out.webp""/>"
t2200,56,998,Aaron,"Nah, not yet. Don't you remember? She said she wanted to stop by the hamam on their way back from work.","Nah, not yet. Don't you remember? She said she<br/>wanted to stop by the hamam on their way back<br/>from work.",アーロン,いや、たしか興行帰りに ハマムに寄るとか言ってなかったか？,いや、たしか興行帰りに<br/>ハマムに寄るとか言ってなかったか？,,"<img class=""itp-kuro"" src=""itp/11/avfc0002_out.webp""/>"
t2200,56,999,Van,Good point. I'm sure it's reopened by now. Might as well stop by and see how they're doing.,Good point. I'm sure it's reopened by now. Might as<br/>well stop by and see how they're doing.,ヴァン,ああ、無事再開できただろうし、 折角だから寄ってもいいかもな。,ああ、無事再開できただろうし、<br/>折角だから寄ってもいいかもな。,,"<img class=""itp-kuro"" src=""itp/11/avfc0000_out.webp""/>"
t2200,56,1000,Agnes,"Sounds like a plan! W-Well, what are we waiting for? No time to lose! Let's get to work, everyone!","Sounds like a plan! W-Well, what are we waiting for?<br/>No time to lose! Let's get to work, everyone!",アニエス,そ、それでは夜の解決業務、 再開ですね……！,そ、それでは夜の解決業務、<br/>再開ですね……！,,"<img class=""itp-kuro"" src=""itp/11/avfc5001_out.webp""/>"
t2200,56,1001,Lisette,"Heehee, indeed. Lead the way, everyone. I'll follow along.","Heehee, indeed. Lead the way, everyone. I'll<br/>follow along.",リゼット,ふふ…… お付き合いさせて頂きます。,ふふ……<br/>お付き合いさせて頂きます。,,"<img class=""itp-kuro"" src=""itp/11/avfc5005_out.webp""/>"
t2200,57,1002,,Received,Received,,ハマムから謝礼としてミラが振り込まれた。,ハマムから謝礼として<C2><C0>ミラが振り込まれた。,,
t2200,57,1003,,Risette joined the party.,Risette joined the party.,,リゼットがパーティに加わった。,<C1>リゼットがパーティに加わった。,,
t2200,58,1004,Ferry,"Hi, Shaheena! Hi, Saara!","Hi, Shaheena! Hi, Saara!",フェリ,シャヒーナさん、サァラさん！,シャヒーナさん、サァラさん！,,"<img class=""itp-kuro"" src=""itp/11/avfc5003_out.webp""/>"
t2200,58,1005,Van,Looks like our hunch was right. Good to see you ladies.,Looks like our hunch was right. Good to see<br/>you ladies.,ヴァン,やっぱりここに寄ってたか。,やっぱりここに寄ってたか。,,"<img class=""itp-kuro"" src=""itp/11/avfc0000_out.webp""/>"
t2200,58,1006,Sarah,"Oh, hello, everyone!","Oh, hello, everyone!",サァラ,あ……皆さん！,あ……皆さん！,,
t2200,58,1007,Sarah,The owner was just telling us about you all.,The owner was just telling us about you all.,サァラ,ふふっ、ちょうどご主人から 皆さんの話を聞いていたところです。,ふふっ、ちょうどご主人から<br/>皆さんの話を聞いていたところです。,,
t2200,58,1008,Shahina,It sounds like you guys had to clear out some monsters to get the baths back up and running.,It sounds like you guys had to clear out some<br/>monsters to get the baths back up and running.,シャヒーナ,地下の魔獣をやっつけて ハマムを再開してくれたんだってね～！,地下の魔獣をやっつけて<br/>ハマムを再開してくれたんだってね～！,,
t2200,58,1009,Shahina,That's amazing! I knew you guys were talented!,That's amazing! I knew you guys were talented!,シャヒーナ,うんうん、さっすが あたしが見込んだみんなだよ！,うんうん、さっすが<br/>あたしが見込んだみんなだよ！,,
t2200,58,1010,Manager Jaham,Thanks again for everything you all did. I'd still be in dire straits if it weren't for you folks.,Thanks again for everything you all did. I'd still be in<br/>dire straits if it weren't for you folks.,ジャハム支配人,いや、昼間は本当に助かったよ。 改めて礼を言わせてくれ。,いや、昼間は本当に助かったよ。<br/>改めて礼を言わせてくれ。,,
t2200,58,1011,Van,"Eh, all part of being a spriggan. We got plenty out of that whole exercise, too, so it was good for everyone.","Eh, all part of being a spriggan. We got plenty out of<br/>that whole exercise, too, so it was good for everyone.",ヴァン,ま、これも仕事ってヤツさ。 おかげで色々収穫もあったしな。,ま、これも仕事ってヤツさ。<br/>おかげで色々収穫もあったしな。,,"<img class=""itp-kuro"" src=""itp/11/avfc0000_out.webp""/>"
t2200,58,1012,Sarah,"Well, that's good to hear.","Well, that's good to hear.",サァラ,ふふ、それは何よりでしたね。,ふふ、それは何よりでしたね。,,
t2200,58,1013,Sarah,"By the way, who might you be? I don't believe you were with them earlier.","By the way, who might you be? I don't believe you<br/>were with them earlier.",サァラ,そういえばそちらの方は？ 昼間はお見掛けしませんでしたが。,そういえばそちらの方は？<br/>昼間はお見掛けしませんでしたが。,,
t2200,58,1014,Lisette,Forgive my late introduction. You may call me Risette. I was dispatched here on short notice.,Forgive my late introduction. You may call<br/>me Risette. I was dispatched here on short notice.,リゼット,遅ればせながら、急遽“出向”で 参加することとなったリゼットと申します。,遅ればせながら、急遽“出向”で<br/>参加することとなったリゼットと申します。,,"<img class=""itp-kuro"" src=""itp/11/avfc5005_out.webp""/>"
t2200,58,1015,Lisette,"You two are Ms. Saara and Ms. Shaheena, correct? It's a pleasure to make your acquaintance.","You two are Ms. Saara and Ms. Shaheena, correct?<br/>It's a pleasure to make your acquaintance.",リゼット,サァラ様にシャヒーナ様でしたか、 滞在中はよろしくお願いいたします。,サァラ様にシャヒーナ様でしたか、<br/>滞在中はよろしくお願いいたします。,,"<img class=""itp-kuro"" src=""itp/11/avfc5005_out.webp""/>"
t2200,58,1016,Sarah,"N-Nice to meet you, too.","N-Nice to meet you, too.",サァラ,はい、これはご丁寧に……,はい、これはご丁寧に……,,
t2200,58,1017,Shahina,"Wait, is that a maid outfit you're wearing?! I've never seen one of those in person before!","Wait, is that a maid outfit you're wearing?! I've never<br/>seen one of those in person before!",シャヒーナ,その衣装、メイドさんってやつ？ あたし初めて見たかも！,その衣装、メイドさんってやつ？<br/>あたし初めて見たかも！,,
t2200,58,1018,Lisette,Hmm... Not precisely. This is the uniform that I wear for work.,Hmm... Not precisely. This is the uniform that I wear<br/>for work.,リゼット,ふふ、正確には “出向元”の制服となります。,ふふ、正確には<br/>“出向元”の制服となります。,,"<img class=""itp-kuro"" src=""itp/11/avfc5005_out.webp""/>"
t2200,58,1019,Lisette,You can think of it as a combat suit designed to let me offer maximum support to my customers when needed.,You can think of it as a combat suit designed to let<br/>me offer maximum support to my customers<br/>when needed.,リゼット,顧客を最大限サポートするための 戦闘服のようなものでしょうか。,顧客を最大限サポートするための<br/>戦闘服のようなものでしょうか。,,"<img class=""itp-kuro"" src=""itp/11/avfc5005_out.webp""/>"
t2200,58,1020,Shahina,"That sounds, umm, complicated. Whatever it is, you look super cool in it, that's for sure!","That sounds, umm, complicated. Whatever it is, you<br/>look super cool in it, that's for sure!",シャヒーナ,よく分かんないけどカッコイー！,よく分かんないけどカッコイー！,,
t2200,58,1021,Shahina,"Hey, since we're all here, why don't you guys join us in the baths?","Hey, since we're all here, why don't you guys join us<br/>in the baths?",シャヒーナ,そうだ、せっかくだから みんなも一緒に入っていったら？,そうだ、せっかくだから<br/>みんなも一緒に入っていったら？,,
t2200,58,1022,Shahina,There's so much I wanna talk about!,There's so much I wanna talk about!,シャヒーナ,色々話も聞きたいし！,色々話も聞きたいし！,,
t2200,58,1023,Sarah,"That sounds like fun. Maybe we could all get dinner together afterwards, too?","That sounds like fun. Maybe we could all get dinner<br/>together afterwards, too?",サァラ,ふふ、それはいいわね。 よかったら夕食もご一緒にどうですか？,ふふ、それはいいわね。<br/>よかったら夕食もご一緒にどうですか？,,
t2200,58,1024,Sarah,There's a place close by I always go to that I'm sure you all would enjoy.,There's a place close by I always go to that I'm sure<br/>you all would enjoy.,サァラ,この近くに行きつけの店があるんです。,この近くに行きつけの店があるんです。,,
t2200,58,1025,Van,Sure. We'd be happy to take you up on that.,Sure. We'd be happy to take you up on that.,ヴァン,そうだな…… せっかくだからご相伴にあずかるか。,そうだな……<br/>せっかくだからご相伴にあずかるか。,,"<img class=""itp-kuro"" src=""itp/11/avfc0000_out.webp""/>"
t2200,58,1026,Van,"Probably not a bad idea for us to wash up before we meet with our clients again, anyway.","Probably not a bad idea for us to wash up before we<br/>meet with our clients again, anyway.",ヴァン,依頼人に会う前に汗を流しとくのも 当然のマナーだろうしな。,依頼人に会う前に汗を流しとくのも<br/>当然のマナーだろうしな。,,"<img class=""itp-kuro"" src=""itp/11/avfc0000_out.webp""/>"
t2200,58,1027,Aaron,Say what you like—I know you're just looking for an excuse to take a dip. Not that I'm AGAINST it.,Say what you like—I know you're just looking for an<br/>excuse to take a dip. Not that I'm AGAINST it.,アーロン,ハッ、てめぇが入りてぇだけだろ…… と言いたいところだが。,ハッ、てめぇが入りてぇだけだろ……<br/>と言いたいところだが。,,"<img class=""itp-kuro"" src=""itp/11/avfc0002_out.webp""/>"
t2200,58,1028,Ferry,"I could really use a bite to eat, but that's okay. A bath sounds good after everything we've done today!","I could really use a bite to eat, but that's okay. A bath<br/>sounds good after everything we've done today!",フェリ,お腹も空いていますけど…… その前にサッパリもしたいですっ！,お腹も空いていますけど……<br/>その前にサッパリもしたいですっ！,,"<img class=""itp-kuro"" src=""itp/11/avfc5003_out.webp""/>"
t2200,58,1029,Agnes,Then it's settled. We'll join you two in the baths.,Then it's settled. We'll join you two in the baths.,アニエス,ふふっ、それでは ぜひご一緒させてください。,ふふっ、それでは<br/>ぜひご一緒させてください。,,"<img class=""itp-kuro"" src=""itp/11/avfc5001_out.webp""/>"
t2200,58,1030,Shahina,"Yay! That's perfect! Come on, I'll show you where the girls' ones are!","Yay! That's perfect! Come on, I'll show you where the<br/>girls' ones are!",シャヒーナ,やったぁ、決まりだねー！ ほら、女の子はこっちこっち！,やったぁ、決まりだねー！<br/>ほら、女の子はこっちこっち！,,
t2200,58,1031,Sarah,"Shaheena, calm down. They've had a long day.","Shaheena, calm down. They've had a long day.",サァラ,シャヒーナ、はしゃがないの。,シャヒーナ、はしゃがないの。,,
t2200,58,1032,Manager Jaham,"Haha. Take as long as you want in there, folks. You've earned it.","Haha. Take as long as you want in there, folks.<br/>You've earned it.",ジャハム支配人,はは、ごゆっくりどうぞ。,はは、ごゆっくりどうぞ。,,
t2200,58,1033,Aaron,"Maaan, this blows. I didn't consider the fact that I'd be stuck alone in here with you.","Maaan, this blows. I didn't consider the fact that I'd<br/>be stuck alone in here with you.",アーロン,考えてみりゃてめぇと二人きりかよ…… チッ、面白くもなんともねぇ。,"<audio id=""v03_30036""><source src=""talk/11/v03_30036.opus"" type=""audio/ogg; codecs=opus""></audio><a href=""javascript:void(0)"" onclick=""document.getElementById('v03_30036').play()"">考えてみりゃてめぇと二人きりかよ……<br/>チッ、面白くもなんともねぇ。</a>",,"<img class=""itp-kuro"" src=""itp/11/avfc0002_out.webp""/>"
t2200,58,1034,Van,Would you pipe down? You're killin' the vibe.,Would you pipe down? You're killin' the vibe.,ヴァン,ウダウダうるせえな、静かにしてろ。,"<audio id=""v00_30039""><source src=""talk/11/v00_30039.opus"" type=""audio/ogg; codecs=opus""></audio><a href=""javascript:void(0)"" onclick=""document.getElementById('v00_30039').play()"">ウダウダうるせえな、静かにしてろ。</a>",,"<img class=""itp-kuro"" src=""itp/11/avfc0000_out.webp""/>"
t2200,58,1035,Van,"Just close your eyes and relax. Embrace the tranquility, and then—","Just close your eyes and relax. Embrace the<br/>tranquility, and then—",ヴァン,いいか、目を瞑って心を落ち着けるんだ。 やがて来る“その瞬間”を見極めて──,"<audio id=""v00_30040""><source src=""talk/11/v00_30040.opus"" type=""audio/ogg; codecs=opus""></audio><a href=""javascript:void(0)"" onclick=""document.getElementById('v00_30040').play()"">いいか、目を瞑って心を落ち着けるんだ。<br/>やがて来る“その瞬間”を見極めて──</a>",,"<img class=""itp-kuro"" src=""itp/11/avfc0000_out.webp""/>"
t2200,58,1036,Aaron,"Oh, shut up. I bet you every mira in my wallet the girls are living it up on the other side of this wall.","Oh, shut up. I bet you every mira in my wallet the<br/>girls are living it up on the other side of this wall.",アーロン,ハッ、向こうじゃさぞ姦しく、 キャッキャウフフしてんだろうなァ。,"<audio id=""v03_30037""><source src=""talk/11/v03_30037.opus"" type=""audio/ogg; codecs=opus""></audio><a href=""javascript:void(0)"" onclick=""document.getElementById('v03_30037').play()"">ハッ、向こうじゃさぞ姦しく、<br/>キャッキャウフフしてんだろうなァ。</a>",,"<img class=""itp-kuro"" src=""itp/11/avfc0002_out.webp""/>"
t2200,58,1037,Aaron,"Speaking of girls, man, I'd kill to check out that maid and the older sister's scorching bods right about—bwah!","Speaking of girls, man, I'd kill to check out that maid<br/>and the older sister's scorching bods right<br/>about—bwah!",アーロン,小娘どもはどうでもいいが、メイドや 姉の方は中々そそる身体を──ぶっ！？,"<audio id=""v03_30038""><source src=""talk/11/v03_30038.opus"" type=""audio/ogg; codecs=opus""></audio><a href=""javascript:void(0)"" onclick=""document.getElementById('v03_30038').play()"">小娘どもはどうでもいいが、メイドや<br/>姉の方は中々そそる身体を──ぶっ！？</a>",,"<img class=""itp-kuro"" src=""itp/11/avfc0002_out.webp""/>"
t2200,58,1038,Van,"We sit on sacred ground, punk. Don't defile it with your libido.","We sit on sacred ground, punk. Don't defile it with<br/>your libido.",ヴァン,神聖な儀式（セッション）を乱すんじゃねえ。,"<audio id=""v00_30041""><source src=""talk/11/v00_30041.opus"" type=""audio/ogg; codecs=opus""></audio><a href=""javascript:void(0)"" onclick=""document.getElementById('v00_30041').play()"">神聖な儀式（セッション）を乱すんじゃねえ。</a>",,"<img class=""itp-kuro"" src=""itp/11/avfc0000_out.webp""/>"
t2200,58,1039,Van,"Keep it up and I'll scrub you down till your skin is raw, if that's what it takes to clean that dirty brain of yours for the first time.","Keep it up and I'll scrub you down till your skin is<br/>raw, if that's what it takes to clean that dirty brain of<br/>yours for the first time.",ヴァン,てめぇのその邪念、肌が赤くなるまで 垢スリでこそぎ落としてやろうか？,"<audio id=""v00_30042""><source src=""talk/11/v00_30042.opus"" type=""audio/ogg; codecs=opus""></audio><a href=""javascript:void(0)"" onclick=""document.getElementById('v00_30042').play()"">てめぇのその邪念、肌が赤くなるまで<br/>垢スリでこそぎ落としてやろうか？</a>",,"<img class=""itp-kuro"" src=""itp/11/avfc0000_out.webp""/>"
t2200,58,1040,Aaron,"All right, I'll drop it! Aidios, you don't have to be so serious about it.","All right, I'll drop it! Aidios, you don't have to be so<br/>serious about it.",アーロン,わ、分ーったっつの…… つかマジトーンになんじゃねえよ！？,"<audio id=""v03_30039""><source src=""talk/11/v03_30039.opus"" type=""audio/ogg; codecs=opus""></audio><a href=""javascript:void(0)"" onclick=""document.getElementById('v03_30039').play()"">わ、分ーったっつの……<br/>つかマジトーンになんじゃねえよ！？</a>",,"<img class=""itp-kuro"" src=""itp/11/avfc0002_out.webp""/>"
t2200,58,1041,Lisette,Heehee. They're certainly having a lively time over there.,Heehee. They're certainly having a lively time<br/>over there.,リゼット,ふふ…… 盛り上がってらっしゃいますね。,"<audio id=""v04_30037""><source src=""talk/11/v04_30037.opus"" type=""audio/ogg; codecs=opus""></audio><a href=""javascript:void(0)"" onclick=""document.getElementById('v04_30037').play()"">ふふ……<br/>盛り上がってらっしゃいますね。</a>",,"<img class=""itp-kuro"" src=""itp/11/avfc5005_out.webp""/>"
t2200,58,1042,Agnes,Ugh... Don't they realize we can hear every word they're saying?,Ugh... Don't they realize we can hear every word<br/>they're saying?,アニエス,もう、聞こえてるの 分かってるんでしょうか……,"<audio id=""v01_30037""><source src=""talk/11/v01_30037.opus"" type=""audio/ogg; codecs=opus""></audio><a href=""javascript:void(0)"" onclick=""document.getElementById('v01_30037').play()"">もう、聞こえてるの<br/>分かってるんでしょうか……</a>",,"<img class=""itp-kuro"" src=""itp/11/avfc5001_out.webp""/>"
t2200,58,1043,Shahina,"He's not wrong, though. All you girls are just as gorgeous as Saara.","He's not wrong, though. All you girls are just as<br/>gorgeous as Saara.",シャヒーナ,うーん、でも確かにみんな サァラ姉にも負けないくらい綺麗だよね～。,"<audio id=""v53_30011""><source src=""talk/11/v53_30011.opus"" type=""audio/ogg; codecs=opus""></audio><a href=""javascript:void(0)"" onclick=""document.getElementById('v53_30011').play()"">うーん、でも確かにみんな<br/>サァラ姉にも負けないくらい綺麗だよね～。</a>",,
t2200,58,1044,Shahina,"I mean, Risette's hair and skin are both so silky, she practically looks like a doll!","I mean, Risette's hair and skin are both so silky, she<br/>practically looks like a doll!",シャヒーナ,リゼットさんは髪サラサラ、肌もスベスベで まるでお人形さんみたいだし。,"<audio id=""v53_30012""><source src=""talk/11/v53_30012.opus"" type=""audio/ogg; codecs=opus""></audio><a href=""javascript:void(0)"" onclick=""document.getElementById('v53_30012').play()"">リゼットさんは髪サラサラ、肌もスベスベで<br/>まるでお人形さんみたいだし。</a>",,
t2200,58,1045,Shahina,"You're so pretty, too, Agnès! And how do you get those when you're only sixteen?!","You're so pretty, too, Agnès! And how do you<br/>get those when you're only sixteen?!",シャヒーナ,アニエスさんも── っていうかホントにまだ１６歳なのっ？,"<audio id=""v53_30013""><source src=""talk/11/v53_30013.opus"" type=""audio/ogg; codecs=opus""></audio><a href=""javascript:void(0)"" onclick=""document.getElementById('v53_30013').play()"">アニエスさんも──<br/>っていうかホントにまだ１６歳なのっ？</a>",,
t2200,58,1046,Agnes,Huh?,Huh?,アニエス,えっ……,"<audio id=""v01_30038""><source src=""talk/11/v01_30038.opus"" type=""audio/ogg; codecs=opus""></audio><a href=""javascript:void(0)"" onclick=""document.getElementById('v01_30038').play()"">えっ……</a>",,"<img class=""itp-kuro"" src=""itp/11/avfc5001_out.webp""/>"
t2200,58,1047,Shahina,I'm only a year younger than you! There's no way I'm gonna be able to catch up that quickly!,I'm only a year younger than you! There's no way I'm<br/>gonna be able to catch up that quickly!,シャヒーナ,あと１年ちょっとで そこまでなれる気がしないよ～！,"<audio id=""v53_30014""><source src=""talk/11/v53_30014.opus"" type=""audio/ogg; codecs=opus""></audio><a href=""javascript:void(0)"" onclick=""document.getElementById('v53_30014').play()"">あと１年ちょっとで<br/>そこまでなれる気がしないよ～！</a>",,
t2200,58,1048,Shahina,"What's your secret? What do you eat to fill out like that, huh?!","What's your secret? What do you eat to fill out like<br/>that, huh?!",シャヒーナ,何食べてたらそんなになるの～！？,"<audio id=""v53_30015""><source src=""talk/11/v53_30015.opus"" type=""audio/ogg; codecs=opus""></audio><a href=""javascript:void(0)"" onclick=""document.getElementById('v53_30015').play()"">何食べてたらそんなになるの～！？</a>",,
t2200,58,1049,Ferry,"...Truth be told, I've been kinda curious, too. I'd love to know for future reference.","...Truth be told, I've been kinda curious, too. I'd love<br/>to know for future reference.",フェリ,……わたしも気になってました。 ぜひ今後の参考にしたいですっ。,"<audio id=""v02_30028""><source src=""talk/11/v02_30028.opus"" type=""audio/ogg; codecs=opus""></audio><a href=""javascript:void(0)"" onclick=""document.getElementById('v02_30028').play()"">……わたしも気になってました。<br/>ぜひ今後の参考にしたいですっ。</a>",,"<img class=""itp-kuro"" src=""itp/11/avfc5003_out.webp""/>"
t2200,58,1050,Agnes,"I, umm, well, I... I don't do anything special.","I, umm, well, I... I don't do anything special.",アニエス,べ、別に普通ですからっ……,"<audio id=""v01_30039""><source src=""talk/11/v01_30039.opus"" type=""audio/ogg; codecs=opus""></audio><a href=""javascript:void(0)"" onclick=""document.getElementById('v01_30039').play()"">べ、別に普通ですからっ……</a>",,"<img class=""itp-kuro"" src=""itp/11/avfc5001_out.webp""/>"
t2200,58,1051,Agnes,F-Feri! Stop staring at me so much! You're scaring me!,F-Feri! Stop staring at me so much! You're<br/>scaring me!,アニエス,フェリちゃんまで、そんなに まじまじ見ないでくださいっ。,"<audio id=""v01_30040""><source src=""talk/11/v01_30040.opus"" type=""audio/ogg; codecs=opus""></audio><a href=""javascript:void(0)"" onclick=""document.getElementById('v01_30040').play()"">フェリちゃんまで、そんなに<br/>まじまじ見ないでくださいっ。</a>",,"<img class=""itp-kuro"" src=""itp/11/avfc5001_out.webp""/>"
t2200,58,1052,Sarah,"Shaheena, please. Cool it down a little.","Shaheena, please. Cool it down a little.",サァラ,もう、シャヒーナもそのくらいにね。,"<audio id=""v52_30011""><source src=""talk/11/v52_30011.opus"" type=""audio/ogg; codecs=opus""></audio><a href=""javascript:void(0)"" onclick=""document.getElementById('v52_30011').play()"">もう、シャヒーナもそのくらいにね。</a>",,
t2200,58,1053,Lisette,"Well, I personally think Ms. Al-Fayed and Ms. Shaheena are very beautiful in their own right.","Well, I personally think Ms. Al-Fayed and Ms.<br/>Shaheena are very beautiful in their own right.",リゼット,ふふ、フェリ様もシャヒーナ様も 十分以上にお綺麗かと思いますが。,"<audio id=""v04_30038""><source src=""talk/11/v04_30038.opus"" type=""audio/ogg; codecs=opus""></audio><a href=""javascript:void(0)"" onclick=""document.getElementById('v04_30038').play()"">ふふ、フェリ様もシャヒーナ様も<br/>十分以上にお綺麗かと思いますが。</a>",,"<img class=""itp-kuro"" src=""itp/11/avfc5005_out.webp""/>"
