gameId,fname,scene,row,engChrName,engSearchText,engHtmlText,jpnChrName,jpnSearchText,jpnHtmlText,opName,pcIconHtml,evoIconHtml
t2200,74,1574,Fazil boss,Would you be able to bring her over to me so I can sit down and try to work something out with her?,Would you be able to bring her over to me so I can sit<br/>down and try to work something out with her?,ファジール元締め,あの子を捕まえてもらい、 私と対話する機会を作ってくれないか？,あの子を捕まえてもらい、<br/>私と対話する機会を作ってくれないか？,,
t2200,74,1575,Van,(He's already explained why he can't ask anyone else to do this job. Should we go ahead and get started?),(He's already explained why he can't ask anyone else<br/>to do this job. Should we go ahead and get started?),ヴァン,（ウチの仕事としても筋が通ってるが、   今すぐ引き受けちまうか？）,（ウチの仕事としても筋が通ってるが、<br/>  今すぐ引き受けちまうか？）,,"<img class=""itp-kuro"" src=""itp/11/avfc0000_out.webp""/>"
t2200,74,1576,Van,"Hate to do this, but can you hold off on gettin' started until just a little later?","Hate to do this, but can you hold off on gettin'<br/>started until just a little later?",ヴァン,悪いが、依頼を始めるタイミングは もう少し待ってもらえるか？,悪いが、依頼を始めるタイミングは<br/>もう少し待ってもらえるか？,,"<img class=""itp-kuro"" src=""itp/11/avfc0000_out.webp""/>"
t2200,74,1577,Fazil boss,That's okay. I know you might have other things to do first. I'll be here whenever you're ready.,That's okay. I know you might have other things to<br/>do first. I'll be here whenever you're ready.,ファジール元締め,おお、何か用事があるなら仕方ない。 待っているからいつでも呼んでくれ。,おお、何か用事があるなら仕方ない。<br/>待っているからいつでも呼んでくれ。,,
t2200,74,1578,Van,We're good to go. Let's hammer out a plan of attack.,We're good to go. Let's hammer out a plan of attack.,ヴァン,ああ、それじゃあ早速 方針を立ててみるとするか。,ああ、それじゃあ早速<br/>方針を立ててみるとするか。,,"<img class=""itp-kuro"" src=""itp/11/avfc0000_out.webp""/>"
t2200,74,1579,Van,"Once we've found her, we'll get in touch with you. Sound good?","Once we've found her, we'll get in touch with you.<br/>Sound good?",ヴァン,結果が出次第、改めて連絡させてもらうぜ。,結果が出次第、改めて連絡させてもらうぜ。,,"<img class=""itp-kuro"" src=""itp/11/avfc0000_out.webp""/>"
t2200,74,1580,Fazil boss,Very much so! Thank you for agreeing to help.,Very much so! Thank you for agreeing to help.,ファジール元締め,ああ、どうかよろしく頼む……！,ああ、どうかよろしく頼む……！,,
t2200,74,1581,Fazil boss,"I'm going to get back to work now. But if you folks need anything, let me know. I'll drop everything to help.","I'm going to get back to work now. But if you folks<br/>need anything, let me know. I'll drop everything<br/>to help.",ファジール元締め,それじゃあ私は仕事に戻らせてもらうよ。 連絡を貰ったら駆け付けるとしよう。,それじゃあ私は仕事に戻らせてもらうよ。<br/>連絡を貰ったら駆け付けるとしよう。,,
t2200,74,1582,Van,"Now, with that settled, first thing we need to do is gather some more information about our little thief.","Now, with that settled, first thing we need to do is<br/>gather some more information about our little thief.",ヴァン,さてと……まずは情報収集だな。,さてと……まずは情報収集だな。,,"<img class=""itp-kuro"" src=""itp/11/avfc0000_out.webp""/>"
t2200,74,1583,Agnes,We should speak to some of the merchants and find out what their experience with her has been like.,We should speak to some of the merchants and find<br/>out what their experience with her has been like.,アニエス,そうですね、まずはバザールの方々に 話を伺わないと。,そうですね、まずはバザールの方々に<br/>話を伺わないと。,,"<img class=""itp-kuro"" src=""itp/11/avfc5001_out.webp""/>"
t2200,74,1584,Van,"Definitely. Might not be the worst idea to check in at the guild and do a little askin' around about her, either.","Definitely. Might not be the worst idea to check in at<br/>the guild and do a little askin' around about<br/>her, either.",ヴァン,ああ、それとギルドの方にも 軽く聞いておくべきかもな。,ああ、それとギルドの方にも<br/>軽く聞いておくべきかもな。,,"<img class=""itp-kuro"" src=""itp/11/avfc0000_out.webp""/>"
t2200,74,1585,Van,"From the sound of things, it wouldn't surprise me if they have at least some idea of what's going on.","From the sound of things, it wouldn't surprise me if<br/>they have at least some idea of what's going on.",ヴァン,元締めもああ言ってたし、 ある程度の事情は遊撃士も把握してそうだ。,元締めもああ言ってたし、<br/>ある程度の事情は遊撃士も把握してそうだ。,,"<img class=""itp-kuro"" src=""itp/11/avfc0000_out.webp""/>"
t2200,74,1586,Ferry,"That's true. If she's been stealing lots, they might know some stuff.","That's true. If she's been stealing lots, they might<br/>know some stuff.",フェリ,確かに…… 何か情報を握ってるかもしれません。,確かに……<br/>何か情報を握ってるかもしれません。,,"<img class=""itp-kuro"" src=""itp/11/avfc5003_out.webp""/>"
t2200,74,1587,Aaron,"In that case, might as well hit up the temple while we're at it.","In that case, might as well hit up the temple while<br/>we're at it.",アーロン,それを言ったら寺院はどうなんだ？,それを言ったら寺院はどうなんだ？,,"<img class=""itp-kuro"" src=""itp/11/avfc0002_out.webp""/>"
t2200,74,1588,Aaron,"I don't know what Tharbad's is like, but you'd think they take in orphans.","I don't know what Tharbad's is like, but you'd think<br/>they take in orphans.",アーロン,サルバッドはどうか知らねえが、 寺院で孤児を保護してるはずだろ。,サルバッドはどうか知らねえが、<br/>寺院で孤児を保護してるはずだろ。,,"<img class=""itp-kuro"" src=""itp/11/avfc0002_out.webp""/>"
t2200,74,1589,Aaron,"They probably go out on patrols looking for 'em, too. If this thief's an orphan, they might know about her.","They probably go out on patrols looking for 'em, too.<br/>If this thief's an orphan, they might know about her.",アーロン,その為の巡回もしてるだろうし、 例のガキが孤児なら何か知ってるかもな。,その為の巡回もしてるだろうし、<br/>例のガキが孤児なら何か知ってるかもな。,,"<img class=""itp-kuro"" src=""itp/11/avfc0002_out.webp""/>"
t2200,74,1590,Van,"Good thinkin'. That's three stops on our tour, then: the bazaar, the guild branch, and the temple.","Good thinkin'. That's three stops on our tour, then:<br/>the bazaar, the guild branch, and the temple.",ヴァン,だな、となるとバザールとギルドと 寺院に聞き込みをしてみるか。,だな、となるとバザールとギルドと<br/>寺院に聞き込みをしてみるか。,,"<img class=""itp-kuro"" src=""itp/11/avfc0000_out.webp""/>"
t2200,74,1591,Van,"That's a good amount of people to talk to, but no need to rush. Just take your time and do it right. Ready to roll?","That's a good amount of people to talk to, but no<br/>need to rush. Just take your time and do it right.<br/>Ready to roll?",ヴァン,結構な人数になっちまうが ぼちぼちやっていくぞ。,結構な人数になっちまうが<br/>ぼちぼちやっていくぞ。,,"<img class=""itp-kuro"" src=""itp/11/avfc0000_out.webp""/>"
t2200,74,1592,Agnes,Okay! Let's see what we can find out!,Okay! Let's see what we can find out!,アニエス,はい、頑張りましょう……！,はい、頑張りましょう……！,,"<img class=""itp-kuro"" src=""itp/11/avfc5001_out.webp""/>"
t2200,75,1593,,Quest Bazaar Burglar started!,Quest Bazaar Burglar started!,,クエスト【バザールのスリ少女】を開始した！,<C1>クエスト【<C2>バザールのスリ少女<C1>】を開始した！,,
t2200,76,1594,Monir,"Oh, I know the girl you must be talking about.","Oh, I know the girl you must be talking about.",モニール,ああ……例のあの子の事ですね？,ああ……例のあの子の事ですね？,,
t2200,76,1595,Monir,She sneaks into my shop all the time.,She sneaks into my shop all the time.,モニール,私の店に盗みにくるので、 よく知っていますよ。,私の店に盗みにくるので、<br/>よく知っていますよ。,,
t2200,76,1596,Ferry,"How often would you say she tries to steal stuff from you, ma'am?","How often would you say she tries to steal stuff from<br/>you, ma'am?",フェリ,その、少女が盗みに来るのは どれくらいの頻度なんですか？,その、少女が盗みに来るのは<br/>どれくらいの頻度なんですか？,,"<img class=""itp-kuro"" src=""itp/11/avfc5003_out.webp""/>"
t2200,76,1597,Aaron,"And how much, too? That'd be good to know.","And how much, too? That'd be good to know.",アーロン,盗んでいく量も気になるな。,盗んでいく量も気になるな。,,"<img class=""itp-kuro"" src=""itp/11/avfc0002_out.webp""/>"
t2200,76,1598,Monir,Let me think... I'd say she comes here about every other day.,Let me think... I'd say she comes here about every<br/>other day.,モニール,ええと、そうですね…… ２日に１回くらいの頻度かしら。,ええと、そうですね……<br/>２日に１回くらいの頻度かしら。,,
t2200,76,1599,Monir,She never takes a lot. She's just a child—she can only carry so much.,She never takes a lot. She's just a child—she can only<br/>carry so much.,モニール,一度に盗む量は少ない方だと思います。 子どもだから持てる量も少ないですしね。,一度に盗む量は少ない方だと思います。<br/>子どもだから持てる量も少ないですしね。,,
t2200,76,1600,Aaron,So you know for a fact that you're dealing with a loner? She's not in any kind of gang or anything like that?,So you know for a fact that you're dealing with<br/>a loner? She's not in any kind of gang or anything<br/>like that?,アーロン,つまり、間違いなくガキの単独犯って訳か。,つまり、間違いなくガキの単独犯って訳か。,,"<img class=""itp-kuro"" src=""itp/11/avfc0002_out.webp""/>"
t2200,76,1601,Monir,"No, I've never seen her working with anybody else. She's always by herself.","No, I've never seen her working with anybody else.<br/>She's always by herself.",モニール,ええ、他の仲間と共謀して…… というのは見た事がないです。,ええ、他の仲間と共謀して……<br/>というのは見た事がないです。,,
t2200,76,1602,Monir,"To be honest, I do feel for her. You hate to see someone so young live like that.","To be honest, I do feel for her. You hate to see<br/>someone so young live like that.",モニール,まだ子どもなのに、いつまで その日暮らしの生活を続けるのか……,まだ子どもなのに、いつまで<br/>その日暮らしの生活を続けるのか……,,
t2200,76,1603,Monir,Hopefully either the police or the temple can take her in soon and give her the help she needs.,Hopefully either the police or the temple can take her<br/>in soon and give her the help she needs.,モニール,早い内に警察か寺院が 保護してくれればいいんですけど。,早い内に警察か寺院が<br/>保護してくれればいいんですけど。,,
t2200,76,1604,Van,"That's what we're trying to make happen, ma'am. Thanks for talking to us. You've been a big help.","That's what we're trying to make happen, ma'am.<br/>Thanks for talking to us. You've been a big help.",ヴァン,ありがとな、参考になったぜ。,ありがとな、参考になったぜ。,,"<img class=""itp-kuro"" src=""itp/11/avfc0000_out.webp""/>"
t2200,76,1605,Agnes,"Phew, I think that's finally all of the places we wanted to visit.","Phew, I think that's finally all of the places we wanted<br/>to visit.",アニエス,ふぅ……必要な場所への聞き込みは これで全部終わりましたね。,ふぅ……必要な場所への聞き込みは<br/>これで全部終わりましたね。,,"<img class=""itp-kuro"" src=""itp/11/avfc5001_out.webp""/>"
t2200,76,1606,Ferry,"Yeah, let's go back to the bazaar and go over everything we heard.","Yeah, let's go back to the bazaar and go over<br/>everything we heard.",フェリ,バザールの方に戻って 情報を整理しましょうか！,バザールの方に戻って<br/>情報を整理しましょうか！,,"<img class=""itp-kuro"" src=""itp/11/avfc5003_out.webp""/>"
t2200,77,1607,Jarrett,"Oh, yeah. I know the girl you're looking for, all right. She's in here constantly.","Oh, yeah. I know the girl you're looking for, all right.<br/>She's in here constantly.",ジャレット,ああ、あの子ならよく知ってるとも。 ウチによく盗みに来るからな。,ああ、あの子ならよく知ってるとも。<br/>ウチによく盗みに来るからな。,,
t2200,77,1608,Jarrett,"Last I saw her was two days ago, I think.","Last I saw her was two days ago, I think.",ジャレット,確か、最近だと２日前だったかな？,確か、最近だと２日前だったかな？,,
t2200,77,1609,Ferry,"Wow, that's really recent!","Wow, that's really recent!",フェリ,２日前ですか！,２日前ですか！,,"<img class=""itp-kuro"" src=""itp/11/avfc5003_out.webp""/>"
t2200,77,1610,Jarrett,She looked desperate. You can tell she's going through a real rough patch. Her clothes are filthy.,She looked desperate. You can tell she's going<br/>through a real rough patch. Her clothes are filthy.,ジャレット,服も小汚いし、随分必死な様子でな…… 生活に困ってる事が一目瞭然なんだ。,服も小汚いし、随分必死な様子でな……<br/>生活に困ってる事が一目瞭然なんだ。,,
t2200,77,1611,Jarrett,"I can't not help a kid who's clearly just trying to... survive, you know?","I can't not help a kid who's clearly just trying to...<br/>survive, you know?",ジャレット,だからつい、余計な世話を 焼きたくなっちまってな。,だからつい、余計な世話を<br/>焼きたくなっちまってな。,,
t2200,77,1612,Jarrett,"So, the trick is, I make some food for her, and she gets to 'steal' it.","So, the trick is, I make some food for her, and she<br/>gets to 'steal' it.",ジャレット,料理を作っておいて、 あえて盗ませてあげたりしてるぞ。,料理を作っておいて、<br/>あえて盗ませてあげたりしてるぞ。,,
t2200,77,1613,Aaron,Awfully generous for someone who's been targeted by her. You don't think she should be apprehended or something?,Awfully generous for someone who's been targeted<br/>by her. You don't think she should be apprehended<br/>or something?,アーロン,随分と気の利いた店じゃねえか。 捕まえてやろうとは思わねぇのか？,随分と気の利いた店じゃねえか。<br/>捕まえてやろうとは思わねぇのか？,,"<img class=""itp-kuro"" src=""itp/11/avfc0002_out.webp""/>"
t2200,77,1614,Jarrett,"Don't get me wrong, it'd be better for everyone if she stopped stealing from my shop!","Don't get me wrong, it'd be better for everyone if she<br/>stopped stealing from my shop!",ジャレット,勿論、スリを止めてくれたらそれが一番さ。,勿論、スリを止めてくれたらそれが一番さ。,,
t2200,77,1615,Jarrett,Last thing I need is word getting around that I'm some kind of easy mark and more organized thieves getting ideas.,Last thing I need is word getting around that I'm<br/>some kind of easy mark and more organized thieves<br/>getting ideas.,ジャレット,他のスリに舐められて、 いいカモだと思われかねないしな。,他のスリに舐められて、<br/>いいカモだと思われかねないしな。,,
t2200,77,1616,Jarrett,"But I don't have the heart to stand there and watch a little girl starve right in front of me, so I try to do what I can.","But I don't have the heart to stand there and watch a<br/>little girl starve right in front of me, so I try to do<br/>what I can.",ジャレット,だけど飢えさせるのも可哀想だし…… 出来る限り助けてやりたいんだ。,だけど飢えさせるのも可哀想だし……<br/>出来る限り助けてやりたいんだ。,,
t2200,77,1617,Jarrett,"Take good care of her when you find her, okay? I trust the bazaar manager will come up with something.","Take good care of her when you find her, okay?<br/>I trust the bazaar manager will come up<br/>with something.",ジャレット,だからこそ元締めの考えに期待してるんだ。 アンタ達もあの子の事をよろしく頼むぜ。,だからこそ元締めの考えに期待してるんだ。<br/>アンタ達もあの子の事をよろしく頼むぜ。,,
t2200,77,1618,Agnes,Of course! We're all on the same team. Thank you for talking to us.,Of course! We're all on the same team. Thank you for<br/>talking to us.,アニエス,はい、出来る限りの事をさせて頂きます。,はい、出来る限りの事をさせて頂きます。,,"<img class=""itp-kuro"" src=""itp/11/avfc5001_out.webp""/>"
t2200,77,1619,Agnes,"Phew, I think that's finally all of the places we wanted to visit.","Phew, I think that's finally all of the places we wanted<br/>to visit.",アニエス,ふぅ……必要な場所への聞き込みは これで全部終わりましたね。,ふぅ……必要な場所への聞き込みは<br/>これで全部終わりましたね。,,"<img class=""itp-kuro"" src=""itp/11/avfc5001_out.webp""/>"
t2200,77,1620,Ferry,"Yeah, let's go back to the bazaar and go over everything we heard.","Yeah, let's go back to the bazaar and go over<br/>everything we heard.",フェリ,バザールの方に戻って 情報を整理しましょうか！,バザールの方に戻って<br/>情報を整理しましょうか！,,"<img class=""itp-kuro"" src=""itp/11/avfc5003_out.webp""/>"
t2200,78,1621,Rasham,"Looking for that infamous little thief, huh? I've definitely heard people talk about her.","Looking for that infamous little thief, huh?<br/>I've definitely heard people talk about her.",ラシャーム,ああ、例のスリの少女か。 ウチには来た事は一度もないよ。,ああ、例のスリの少女か。<br/>ウチには来た事は一度もないよ。,,
t2200,78,1622,Rasham,"Can't say she's come to pay me a visit, though.","Can't say she's come to pay me a visit, though.",ラシャーム,とはいえ、勿論うわさなら聞いた事がある。,とはいえ、勿論うわさなら聞いた事がある。,,
t2200,78,1623,Rasham,"Knowing Fazil, he probably doesn't want to press charges on her, right?","Knowing Fazil, he probably doesn't want to press<br/>charges on her, right?",ラシャーム,元締めは出来る事なら その子を罪に問わないであげたいんだろ？,元締めは出来る事なら<br/>その子を罪に問わないであげたいんだろ？,,
t2200,78,1624,Rasham,"Between you, me, and the post, I think that's going too easy on her.","Between you, me, and the post, I think that's going<br/>too easy on her.",ラシャーム,正直言って、甘すぎると思うけどなぁ……,正直言って、甘すぎると思うけどなぁ……,,
t2200,78,1625,Aaron,"Honestly, I think so, too.","Honestly, I think so, too.",アーロン,それについては同感だな。,それについては同感だな。,,"<img class=""itp-kuro"" src=""itp/11/avfc0002_out.webp""/>"
t2200,78,1626,Rasham,"The way I figure, if there are no consequences for what she's done, then she'll grow up to be completely amoral.","The way I figure, if there are no consequences for<br/>what she's done, then she'll grow up to be<br/>completely amoral.",ラシャーム,ああ、悪い事をしたのにお咎め無しだなんて、 そんなんじゃロクな大人になれないだろ。,ああ、悪い事をしたのにお咎め無しだなんて、<br/>そんなんじゃロクな大人になれないだろ。,,
t2200,78,1627,Rasham,"Not that I'm one to talk. I'm not the best role model, either.","Not that I'm one to talk. I'm not the best role<br/>model, either.",ラシャーム,まあ俺も、人に言えるほど 立派なもんじゃないけどさ……,まあ俺も、人に言えるほど<br/>立派なもんじゃないけどさ……,,
t2200,78,1628,Van,"Well, we still appreciate what you had to share. Thanks, buddy.","Well, we still appreciate what you had to share.<br/>Thanks, buddy.",ヴァン,とりあえず、情報提供助かったぜ。,とりあえず、情報提供助かったぜ。,,"<img class=""itp-kuro"" src=""itp/11/avfc0000_out.webp""/>"
t2200,78,1629,Agnes,"Phew, I think that's finally all of the places we wanted to visit.","Phew, I think that's finally all of the places we wanted<br/>to visit.",アニエス,ふぅ……必要な場所への聞き込みは これで全部終わりましたね。,ふぅ……必要な場所への聞き込みは<br/>これで全部終わりましたね。,,"<img class=""itp-kuro"" src=""itp/11/avfc5001_out.webp""/>"
t2200,78,1630,Ferry,"Yeah, let's go back to the bazaar and go over everything we heard.","Yeah, let's go back to the bazaar and go over<br/>everything we heard.",フェリ,バザールの方に戻って 情報を整理しましょうか！,バザールの方に戻って<br/>情報を整理しましょうか！,,"<img class=""itp-kuro"" src=""itp/11/avfc5003_out.webp""/>"
t2200,79,1631,Granny Valshe,You're asking about that shoplifter?,You're asking about that shoplifter?,バルシェ婆,ああ、スリの女の子ねぇ。,ああ、スリの女の子ねぇ。,,
t2200,79,1632,Granny Valshe,"Yes, I've heard of her. She's never been to my stall, however, so I don't know much about her.","Yes, I've heard of her. She's never been to my stall,<br/>however, so I don't know much about her.",バルシェ婆,噂には聞いてるけど、 ウチには来ていなくて分からないのよ。,噂には聞いてるけど、<br/>ウチには来ていなくて分からないのよ。,,
t2200,79,1633,Granny Valshe,A bracer actually asked me something similar earlier. I wonder what happened to her after that...,A bracer actually asked me something similar earlier.<br/>I wonder what happened to her after that...,バルシェ婆,前に遊撃士の人も話を聞きに来たけど、 あれから一体どうなったのやら……,前に遊撃士の人も話を聞きに来たけど、<br/>あれから一体どうなったのやら……,,
t2200,79,1634,Ferry,You said a bracer talked to you? What did they ask?,You said a bracer talked to you? What did they ask?,フェリ,遊撃士の人が聞き込みを？,遊撃士の人が聞き込みを？,,"<img class=""itp-kuro"" src=""itp/11/avfc5003_out.webp""/>"
t2200,79,1635,Granny Valshe,"It was a while back, but I believe they were investigating how much damage she had caused.","It was a while back, but I believe they were<br/>investigating how much damage she had caused.",バルシェ婆,ええ、結構前の話だけど。 スリ被害の調査をしてると言っていたわ。,ええ、結構前の話だけど。<br/>スリ被害の調査をしてると言っていたわ。,,
t2200,79,1636,Granny Valshe,"Personally, I have a really hard time seeing such a young girl struggling so badly.","Personally, I have a really hard time seeing such a<br/>young girl struggling so badly.",バルシェ婆,私としても、子どもが苦労をしてる 姿を見るのはしのびないからねぇ。,私としても、子どもが苦労をしてる<br/>姿を見るのはしのびないからねぇ。,,
t2200,79,1637,Granny Valshe,"I pray that someone, be it a bracer or whoever, finds her and gets her the help she needs.","I pray that someone, be it a bracer or whoever, finds<br/>her and gets her the help she needs.",バルシェ婆,早い所、遊撃士でも何でも 助けてくれるといいんだけど……,早い所、遊撃士でも何でも<br/>助けてくれるといいんだけど……,,
t2200,79,1638,Agnes,"I absolutely agree, ma'am. Thank you for your time.","I absolutely agree, ma'am. Thank you for your time.",アニエス,そうでしたか…… ありがとうございます。,そうでしたか……<br/>ありがとうございます。,,"<img class=""itp-kuro"" src=""itp/11/avfc5001_out.webp""/>"
t2200,79,1639,Ferry,"(Sounds like the guild has been looking into this, too.)","(Sounds like the guild has been looking into<br/>this, too.)",フェリ,（遊撃士も調査中という事でしょうか？）,（遊撃士も調査中という事でしょうか？）,,"<img class=""itp-kuro"" src=""itp/11/avfc5003_out.webp""/>"
t2200,79,1640,Van,(Sure does. All the more reason for us to go and pay a visit to the local branch and see what we can learn.),(Sure does. All the more reason for us to go and pay a<br/>visit to the local branch and see what we can learn.),ヴァン,（やっぱり遊撃士協会の方にも   探りを入れとく必要がありそうだな。）,（やっぱり遊撃士協会の方にも<br/>  探りを入れとく必要がありそうだな。）,,"<img class=""itp-kuro"" src=""itp/11/avfc0000_out.webp""/>"
